ID,WRITING.TITLE,WRITING.DATE,WRITING.INFO,WRITING.TEXT
eRisk2023-T3_Subject26, b' ' , b'2015-02-20 00:31:40' , reddit post ," b'There is only one possible solution, the crusher is made of nokias\n' "
eRisk2023-T3_Subject26, b' ' , b'2015-02-14 17:17:55' , reddit post ," b'Says the srublord, you dirty monkey\n' "
eRisk2023-T3_Subject26, b' ' , b'2015-01-22 22:15:12' , reddit post ," b""Items dropped by other players are muted and cannot be used by others who pick it up, muted items cant be sold either. The some items aren't muted on drop like gem of true sight and divine rapier. You can also give items which only give regen bonuses to your allies such as ring of health or sage's mask."" "
eRisk2023-T3_Subject26, b' ' , b'2014-12-30 18:16:16' , reddit post ," b'You have to start 2 waves before the reward e.g. for the round 15 reward you need to start at 13, for the round 25 reward you need to start on 23, etc.' "
eRisk2023-T3_Subject26, b' ' , b'2014-06-30 21:28:39' , reddit post ," b""The Dungeon Defenders Collection which is meant to have all dlc doesn't come with Tinkerers Lab or CTF"" "
eRisk2023-T3_Subject26, b' ' , b'2014-05-20 08:17:28' , reddit post ," b'I think the saves are server side on trendy servers on pc, but he is on Xbox live which only has open servers and saves are on the local HDD' "
eRisk2023-T3_Subject26, b' ' , b'2014-05-16 22:59:36' , reddit post ," b'This sounds like a data corruption, it happens when you turn off your console or dashboard while saving. The problem with online is people can physically pull the gear off your character and place it in their own box' "
eRisk2023-T3_Subject26, b' ' , b'2014-04-23 12:38:23' , reddit post , b'You would have to get an item other than rope with a higher item id. I just chose rope as it was close to chlorophyte' 
eRisk2023-T3_Subject26, b'How to get chlorophyte ore and any other item!' , b'2014-04-22 17:13:26' , reddit post , b'I have recently discovered how to change item ids using the bug with piggy banks. If you are unfamiliar with this bug all of your piggy banked items turn into stacked iron pickaxes. The number of pickaxes relate to the items id. Since chlorophyte ore is unobtainable in console editions of terraria. I used this new found knowledge about item ids to do good and obtain chorophyte to start farming it. You must first get a rope and a piggy bank. Put the rope in the piggy bank and reload your world. Check the piggy bank and you should have 965 iron pickaxes (Because ropes item id is 965). Next take away 18 pickaxes from the stack to make it to a stack of 947 pickaxes (947 is the item id of chlorophyte ore). Now reload the world and in your piggy bank and you should have a piece of chlorophyte ore and possibly any other random items. You can do this with any item as long as you have an item with a higher item id. To find all item IDs go to this page http://terraria.gamepedia.com/Item_IDs' 
eRisk2023-T3_Subject26, b' ' , b'2014-04-22 01:48:10' , reddit post ," b""Oh my bad I didn't see it :P"" "
eRisk2023-T3_Subject26, b' ' , b'2014-04-22 01:38:13' , reddit post , b'You may not be able to find iron ore in a world as you could have lead as a replacement which can be used for any crafting recipes that use iron ingots.  It is not possible to get chlorophyte ore in the game at this moment due to a bug so this guide is meant to help people obtain it' 
eRisk2023-T3_Subject26, b' ' , b'2014-04-22 01:33:55' , reddit post ," b""That's probably the problem there seems to be more lag than usual with non host players this can be fixed by just by waiting for it to load and it should be fixed until you reload the world"" "
eRisk2023-T3_Subject26, b' ' , b'2014-04-21 23:20:43' , reddit post , b'Were you host?' 
eRisk2023-T3_Subject26, b' ' , b'2014-04-21 22:20:17' , reddit post , b'Rod of discords ID is 1326 and Death Sickles ID is 1327 so you should do the same thing but use a vertebrae which has an id of 1330' 
eRisk2023-T3_Subject26, b'How to get chlorophyte ore on Terraria 1.2 (Consoles)' , b'2014-04-21 21:08:46' , reddit post , b'[eliminado]' 
eRisk2023-T3_Subject26, b' ' , b'2014-04-20 05:39:47' , reddit post , b'Which console are you playing on and make sure you have defeated plantera as only then will new dungeon mobs spawn' 
eRisk2023-T3_Subject26, b'I have compiled a list of bugs you should look out for on 1.2 console edition' , b'2014-04-19 12:48:53' , reddit post , b'' 
eRisk2023-T3_Subject26, b' ' , b'2014-04-19 02:48:51' , reddit post , b'Yes it has been. When creating a world you have. 50% chance of gettin crimson instead of corruption when creating a world' 
eRisk2023-T3_Subject26, b'Update bug/glitch list' , b'2014-04-18 00:16:08' , reddit post ," b'I hope for this to become a list of bugs related to the recent update and all its new content. Please post any bugs or glitches and state for which platform you were on (Xbox/PS3/PS vita) and I will list them here. Overall you should be cautious when loading up pre-1.2 worlds and characters until a hug fix comes out. Please note that many of these bugs may appear on both consoles\n\nBugs so far:\n\n**Xbox**\n\n-Getting stuck on ""Attention! When this icon is visible the game is saving data.""\n\n-No chests throughout the underground other than in hell, jungles and dungeons\n\n-Items in piggy banks and chests are replaced by random items (e.g. gold watches, iron pickaxes)\n\n-Unable to connect error when starting up your own pre 1.2 world\n\n-Background will flicker between different images on overworld\n\n-Crimson Hearts(shadow orb counter part) will count as two hearts when broken\n\n-When three crimson hearts are broken the eater of worlds will spawn instead of brain of cthulu(can only be spawned by spinal cord)\n\n-Zombies will sometimes go at about three times the speed when coming on screen\n\n-Bonuses from prefixes on some weapons not shown\n\n-More shadow chests than usual\n\n-No chlorophyte in jungles\n\n-Cannot get new hardmode ore counterparts (titanium etc.)\n\n-Little to no hardmode ores in underground ice biomes\n\n-Mechanical worm drops chance too high\n\n-Cant harvest vile mushrooms\n\n-Cant spawn bosses during rain\n\n**Playstation**\n\n-Getting stuck on ""Attention! When this icon is visible the game is saving data.""\n\n-Contents of chests and piggy banks can be replaced by random items. Can be fixed by reloading world\n\n-Lag on multiplayer (unconfirmed)\n\n-Loading pre 1.2 maps with campfires will freeze or bug out world\n\n-Glitches with doors\n\n-Shadow orbs drop no items\n\n-Worlds and items deleted randomly\n\n-Bonuses from prefixes not show\n\n-More shadow chests than usual\n\n-Jungle temple can be entered simply by mining the door before defeating plantera\n\n-Upon entering a world tile data may be wrong causing blocks to be on random places\n\n-Lack of chests underground\n\n-Mechanical worm drops chance too high\n\n-No chlorophyte in jungle\n\nThanks to I_ran_out_idea_s for discovering most of the ps3 glitches\n\nIf you would like to get chlorophyte in your world just follw this guide I wrote:\n\nhttp://www.reddit.com/r/Terraria/comments/23m2q0/how_to_get_chlorophyte_ore_on_terraria_12_consoles/' "
eRisk2023-T3_Subject26, b' ' , b'2014-04-17 13:22:52' , reddit post , b'It has definitely been released for Xbox 360 edition so you may have to wait a few hours for PS3 and vita versions' 
eRisk2023-T3_Subject26, b'Terraria 1.2.3 update released for console!' , b'2014-04-17 12:42:15' , reddit post , b'[eliminado]' 
eRisk2023-T3_Subject26, b'Terraria 1.2.3 update now live!' , b'2014-04-17 12:07:33' , reddit post , b'' 
eRisk2023-T3_Subject26, b' ' , b'2014-04-17 00:34:54' , reddit post , b'Super loot was never added to consoles and it never will be as trendy stopped updates after the last shards dlc was added. Also the only dlc are the 4 parts of lost ethernia shards' 
eRisk2023-T3_Subject26, b'Help getting Team Effort (Xbox)' , b'2014-04-12 17:08:58' , reddit post , b'I want to get a group of four people to get the team effort achievement (complete every campaign mission with 4 players) on Xbox 360. Send me a message if interested. Preferably you should have at least 1 level 70 hero so we can get it done as fast as possible.\nGT iGoD MaNiAcS Zz' 
eRisk2023-T3_Subject26, b' ' , b'2014-04-04 22:59:41' , reddit post , b'Nice add me GT : iGoD MaNiAcS Zz' 
eRisk2023-T3_Subject26, b' ' , b'2014-04-04 22:49:31' , reddit post , b'I assumed Xbox or PS3 because the console version has no ranked playlist and is not moderated and it is riddled with mods.\nProbably 95% of lobbys are illegitimate so people come here and to the forums to find legit players' 
eRisk2023-T3_Subject26, b' ' , b'2014-04-04 19:25:50' , reddit post , b'Xbox or PS3?' 
eRisk2023-T3_Subject26, b' ' , b'2014-04-03 08:48:18' , reddit post ," b""Add me man GT : iGoD MaNiAcS Zz\nI've got a 73 DPS Huntress, 71 Tower Squire, 70 Tower Monk and a 65 Tower Apprentice"" "
eRisk2023-T3_Subject26, b' ' , b'2014-04-02 20:20:18' , reddit post , b'Add me\nGT: iGoD MaNiAcS Zz' 
eRisk2023-T3_Subject26, b' ' , b'2014-04-02 17:19:10' , reddit post ," b""I'll play too! \nI'm usually online on the weekends, but I come on for an hour or two on weekdays.\nMy gt is iGoD MaNiAcS Zz\n\nIf you are going to play solo I would recommend 5 heroes: \nTower Apprentice\nTower Squire\nTower Monk\nDPS Hundreds\nTower Huntress\n\nAlso the best weapons are usually from challenges or boss rewards but the best armor is from chest drops\n\nI would count mass looting as one of the main offenses that contribute to me kicking someone. If I see someone taking all the loot if they aren't even checking the stats I assume they are being selfish because at the end of the wave any items auto sell and the mana is distributed evenly between players.\n\nAlso a word of wisdom to you never mod it will not give you a good impression on other players and it will ruin the game for you fast.\n"" "
