ID,WRITING.TITLE,WRITING.DATE,WRITING.INFO,WRITING.TEXT
eRisk2023-T3_Subject9, b'What does it mean when theres no sexual tension?' , b'2022-03-26 11:00:11' , reddit post ," b""So I matched with this girl on tinder, we've chatted for a week and then finally met up.   \nWe played some pool, had some drinks and had some good fun, at the end of the date I went in for a kiss and she rejected it. She basically told me she had a lot of fun and wanted to meet up again but wasn't sure if she felt the 'sexual tension'. I wake up today still really confused on what this means? My guesses are the following.  \n1. She doesn't want to actually meet up again and just wanted to be polite in the moment. Maybe she thought i didn't look like my pictures in the end?  \n2. She wants to meet up again but use me as a 'friend' that can help her with some of her troubles in the area.\n\n3. She wants to genuinely have another meet before deciding on sth like kissing with me? Its weird to me since I see kissing as something pretty simple and kinda important when you're starting to get to know someone in such a way. I also don't really see why she would reject it if she genuinely found me attractive."" "
eRisk2023-T3_Subject9, b' ' , b'2022-03-24 19:34:33' , reddit post , b'Damn these look spicy. Would also wanna know if theyre also purchaseable' 
eRisk2023-T3_Subject9, b' ' , b'2022-03-20 12:50:47' , reddit post ," b""Not by default no. You're going to need a workaround such as a phone with dual audio or something like ampme where one of the phones connects to each speaker and ampme will be the interpreter"" "
eRisk2023-T3_Subject9, b' ' , b'2022-03-20 10:18:13' , reddit post ," b'flask could work, also django, up to you really.' "
eRisk2023-T3_Subject9, b' ' , b'2022-03-20 09:23:13' , reddit post ," b""So yeah either HMM or GPT2 will work i'm guessing. As far as the humor thing goes, this might be difficult for NLP systems to handle since language games like this are often entirely out of context and have unpredictable structures for models to handle."" "
eRisk2023-T3_Subject9, b' ' , b'2022-03-20 09:07:52' , reddit post ," b""Core disagreement that I have with most feminists is that they believe many of their problems are culturally determined throughout history. Some of this is fair, but I think we can attribute a more significant amount of disproportion due to biological, hormonal, and preferential factors. I don't see any problem with respectfully disagreeing with the claims that modern feminists make."" "
eRisk2023-T3_Subject9, b' ' , b'2022-03-05 21:31:11' , reddit post ," b'this, also consider combining NER with dictionary lookup considering the differences in name detection, also dependent on language. \n\nyou can get full names, person-initials, person titles, last-name-only, and first-name-only.\n\nMy guess is that most NER datasets will handle full-name pretty well, but dictionary lookup will work better for the others.' "
eRisk2023-T3_Subject9, b' ' , b'2022-03-05 21:08:16' , reddit post ," b""  \nIt honestly doesn't have to be very different, some programs also classify linguistics as a MsC whereas most of them will classify them as a MA.\n\nFrom my experience (Amsterdam), both the university's Human language technology and Text mining masters program are tailored around linguistics (taught my linguistics professors) and therefore fall within the humanities which means Master of Arts.   \nThis doesn't really mean that it isn't very technical; you will still learn to distinguish and make choices for selecting appropiate algorithms, and will predominantly be coding regardless of the 'of arts' category.\n\nI will say however, that there is a lot of use of traditional ML work, where you need to employ a lot of linguistics knowledge for feature extraction for example in this MA program."" "
eRisk2023-T3_Subject9, b' ' , b'2022-03-03 15:12:03' , reddit post , b'Pesto?' 
eRisk2023-T3_Subject9, b' ' , b'2022-03-03 15:11:50' , reddit post ," b'Nope, only started today due to brain-fog side.' "
eRisk2023-T3_Subject9, b' ' , b'2022-03-03 14:13:45' , reddit post , b'I am seeing a doctor already. I am asking on a forum to see if this occurred to other people.' 
eRisk2023-T3_Subject9, b' ' , b'2022-03-03 14:12:30' , reddit post , b'Yeah so the toilet cleaner thing was a day 2 possibility when I first noticed. For the green one I made sure that toilet cleaner was not the issue.' 
eRisk2023-T3_Subject9, b' ' , b'2022-03-02 16:22:58' , reddit post ," b""Good luck to them trying to adapt to low-resource languages through presupposedly transfer-learning and adapting systems to languages that have high preference for morphology such as Gaellic.  \n\nI'm guessing LASER, which they mention in their article, is just using both fuzzy gazzeteers (to cover similar words in different languages with slightly different spelling) in combination with word embeddings (to measure vector distance to see how similar they are), to attempt to achieve this. From my point of view this might actually work really nicely for some languages, but what if another language requires different tokenisation pipes, do you then ignore the linguistic properties of that language and adapt them as of the target to improve the identification of the fuzzy gazzeteers? Seems a bit naive imo to think that this will work for most languages."" "
eRisk2023-T3_Subject9, b' ' , b'2022-02-24 15:55:52' , reddit post , b'T levels go down as u age so shbg will bind to more of the dht enzymes that you are already cutting off. Prolly what happened is that over time ur total free dht has gotten much lower due to the binding. Lower the dosage as you age and check hormone levels every once and a while to justify decisions.' 
eRisk2023-T3_Subject9, b' ' , b'2022-02-23 10:45:05' , reddit post , b'in theory it should keep it tho right?' 
eRisk2023-T3_Subject9, b' ' , b'2022-02-20 01:12:35' , reddit post ," b""Ah I see. Yeah I think they're kind of used interchangeably at times but I think a comment from earlier mentioning implicit and explicit acquisition is relevant when they are being distinguished by the author.\n\n  \nLanguage acquisition is implicit or describes the later step of acquiring a language  \nLanguage learning is explicit or describes the initial stages of learning a language.\n\nHere is a good resource that goes more into detail. \n\nRebuschat, P. and Williams, J. (2012). Implicit and explicit knowledge in second language acquisition. Applied Psycholinguistics, 33, 829-856."" "
eRisk2023-T3_Subject9, b' ' , b'2022-02-19 21:32:32' , reddit post ," b""You can acquire your first language, though you are not learning it like you would do for an L2. I can send you some resources later if you're interested."" "
eRisk2023-T3_Subject9, b' ' , b'2022-02-12 20:50:13' , reddit post ," b'There are protest parties tonight from some clubs. I know there is a DnB rave at de Melkweg tonight for example, but tickets to that are sold out I believe.' "
eRisk2023-T3_Subject9, b' ' , b'2022-02-12 20:03:50' , reddit post , b'Ballistic knife papped was also a shoot to revive which was nice.' 
eRisk2023-T3_Subject9, b' ' , b'2022-02-12 19:58:29' , reddit post ," b""I'm more of a grief person personally."" "
eRisk2023-T3_Subject9, b' ' , b'2022-02-12 19:53:05' , reddit post ," b'Look into port forwarding. One of you probably has a NAT type issue and probably needs to open up some ports on their network.  \n\nThese are the ones you typically need for PSN.  \nAdd these ports for TCP 80, 443, 3478, 3479, 3480  \nand these for UDP 3478, 3479' "
eRisk2023-T3_Subject9, b' ' , b'2022-02-05 22:07:18' , reddit post , b'Im still at bo3' 
eRisk2023-T3_Subject9, b' ' , b'2022-02-05 21:35:36' , reddit post ," b""Right, I think I will do more of chest to wall. I've been doing a lot of freestanding practice but my holds are also inconsistent just like OP's. I had to correct a banana HS at one point (always hollow body holds before handstands to correct it) but i'm worried that with back facing wall I will get back into banana mode.\n\nOnly thing that really annoys me is that the setup for chest to wall is much more inconvenient."" "
eRisk2023-T3_Subject9, b' ' , b'2022-02-05 17:28:31' , reddit post ," b""elif all(\\[age greater than equal to 20, age less than equal to 50\\]):\n\nYou can use any() or all() typically when messing with a lot of conditions. In this short example it doesn't really help. But depending on your other if conditions above, you might be able to shorten things up. The already mentioned\n\nelif 20 greater than equal to age less than equal to 50\n\nis the other way to go for this specific example imo."" "
eRisk2023-T3_Subject9, b' ' , b'2022-02-05 17:22:40' , reddit post ," b""Yes, Dominik Sky's youtube channel also gives some insights on how to best use movements like OHP to progress in HSPU as well. You should hold is more close grip than you'd typically do if I remember correctly."" "
eRisk2023-T3_Subject9, b' ' , b'2022-02-05 17:11:49' , reddit post , b'Did you do stomach facing wall or back facing wall?' 
eRisk2023-T3_Subject9, b' ' , b'2022-02-02 17:22:33' , reddit post ," b""100 on Verruckt?Of all maps that is the hardest one to get the round 100 for. Did you use Megas?\n\nIn BO3 atm my highest is 60 on rev, though that was my first play through yesterday and didn't know of any good Strat yet (I also never use mega-gobblegums). My ps4 got stolen shortly after the game came out but started playing again recently and am just trying to get to max prestige lvl 1k atm.I first want to get at least 50 on all maps, and then will go for the 100's on all maps. (prolly saving Nacht last since it will take 18hrs\\~ to get there).\n\nBO2 I got a round 120 on Origins, that was pre-patch though when the map just came out. It was super easy when you had the ice staff.\n\nBO1 I got a 90 on kino."" "
eRisk2023-T3_Subject9, b' ' , b'2022-02-01 15:57:27' , reddit post ," b'Nope was bought with the same account. I have finally figured out why this happens. \n\nSo me and my friend both have a PSN account and have this ps4 set to primary. His account is EU (payment in ps store in euros) and mine is US (payment in ps store dollars). My PS store was empty because it is trying to connect to the EU store, redownloading a US version of the game from my account fixes these issues. Sadly the game dissapeared from my library (the only version of the game that exists in the ps store database atm is zombies chronicles now), so I bought the US zombies chronicles now that it is still on discount  to fix my problems.' "
eRisk2023-T3_Subject9, b' ' , b'2022-02-01 11:31:07' , reddit post , b'Did you ever find a fix?' 
eRisk2023-T3_Subject9, b'Season Pass Inaccessible BO3' , b'2022-02-01 11:29:35' , reddit post ," b""Hey guys, so years ago my ps4 got stolen right after I bought the bo3 season pass and I never got to play any of the DLC for it other than the giant. So recently i've had access to a ps4, bought the zombies chronicles dlc and started playing again. I remembered that I bought the season pass a while ago and decided i'd try and download it. \n\nIts been a few days of trying with no luck. I've restored licenses, cleared cache, rebuilt database.   \nBasically what happens is that when I open up the game (this is a disc version) it doesn't show that any map packs are available for download. How am I supposed to get my season pass back that I never got to enjoy :(? Any help is appreciated. \n\n\\- I have contacted activision 3 days ago, no reply yet.\n\n\\- When I navigate to the store it says the dlc is available for zombies chronicles edition of the game, but I have the og one."" "
eRisk2023-T3_Subject9, b' ' , b'2022-01-30 13:52:06' , reddit post , b'Have same issue? Ever get resolved?' 
eRisk2023-T3_Subject9, b' ' , b'2022-01-29 17:51:04' , reddit post ," b""I did not know this. Might be handy for cleaning code down the line though. \n\nThis wouldn't have solved my problem though since I did actually need to assign \\*c at some point and the if statement wouldn't have returned \\*c when I needed it. But thanks;  you taught me something new :)"" "
eRisk2023-T3_Subject9, b' ' , b'2022-01-29 17:48:54' , reddit post ," b""Yeah exactly. Sometimes I get so blindsighted after a while I wasn't able to trace this seemingly simple overwrite. I added another variable for the last if condition and that solved my problems. Thank you for your help!"" "
eRisk2023-T3_Subject9, b' ' , b'2022-01-29 16:23:05' , reddit post ," b'Ah you mean its first false, then created, then true in the last if? Going to look into that. Would make sense.' "
eRisk2023-T3_Subject9, b' ' , b'2022-01-29 15:54:20' , reddit post , b'Theres a setting for that. Does it still happen if you turn drift correction on for both devices?' 
eRisk2023-T3_Subject9," b""Can't unpack tuples for if conditions?"" ", b'2022-01-29 15:49:49' , reddit post ," b'I am running the following function in a traditional ML pipeline.   \n\n\n    def extract_features(inputfile, language_model, vectorizer = None):\n        prev_token = """"\n        data = []\n        tokens, gold, chapters, sent_id = fe.fileread(inputfile)\n        feature_dict = fe.featuretraindict(tokens,gold,language_model,baseline = False,          w_embedding = False)\n        tokens = feature_dict[\'Tokens\']\n        lemmas = feature_dict[\'Lemmas\']\n        pos_tags = feature_dict[\'POS\']\n        neg_words =  feature_dict[\'Neg_Word\']\n        aff_negs = feature_dict[\'Affixal_Neg\']\n        word_bigrams = feature_dict[\'Word_bigrams\']\n        prev_tokens = feature_dict[\'Prev_Token\']\n        next_tokens = feature_dict[\'Next_Token\']\\\n            \n        golds = gold.tolist()\n        \n        for token,lemma,pos_tag,neg_word,aff_neg,word_bigram,prev_token,next_token,gold in zip(tokens,lemmas,pos_tags,neg_words,aff_negs,word_bigrams,prev_tokens,next_tokens,golds):\n            feature_dict = {""Tokens"": token, \'lemmas\':lemma,\'pos_tags\':pos_tag,\'neg_word\':neg_word,\'aff_neg\': aff_neg,\'prev_token\':prev_token,\'next_token\':next_token}\n            data.append(feature_dict)\n    \n        if not vectorizer:\n            tok_vectors = fe.featuretraindict(tokens,gold,language_model,baseline = False, w_embedding = True)[""Tokens""]\n            vectorizer = create_vectorizer_traditional_features(data)\n        sparse_features = vectorizer.transform(data)\n        combined_vectors = combine_sparse_and_dense_vectors(tok_vectors, sparse_features)\n        if not vectorizer:\n            return combined_vectors, golds, vectorizer\n        elif vectorizer:\n            return combined_vectors, golds\n\nThe relevant lines are the last four. \n\nWhen I am not passing a vectorizer through I want it to return the vectorizer as well that it created.\n\nWhen I am calling it like so:   \n\n\n    training_features, gold_labels, vectorizer = extract_features(trainingfile,language_model, vectorizer = False)\n\nI get the unpacking error.   \n\n\n    ValueError: not enough values to unpack (expected 3, got 2)\n\nMy initial guess is that it is not passing through the if statement correctly. I have tried setting vectorizer to both False and None with little success. Any hints or help would be appreciated.' "
eRisk2023-T3_Subject9, b' ' , b'2022-01-24 20:42:40' , reddit post ," b""Well I omitted some variables for simplicity of posting this question online. They all exist. \n\nBut you're right it appears that I had one too many variables in my function call. Stuch a silly thing to oversee. Tysm!"" "
eRisk2023-T3_Subject9, b'Stumbled by variables being overwritten' , b'2022-01-24 20:25:26' , reddit post ," b""So i've been stumped by the following error.\n\n    TypeError: featuretraindict() got multiple values for argument 'baseline'\n\nBasically I am calling a function with this line of code, where I set baseline as False\n\n    features = featuretraindict(irrelevant_variable, baseline = False)\n\nI then have my function definition as follows, where baseline as a keyw and positional parameters default is also False:\n\n    def featuretraindict(tokens: list, gold: list, word_embedding_model, baseline = False, debug = False) -> dict:\n    \n        if baseline == False:\n            features = {'test': [1,2,3]}\n        else:\n            features = {'bad_test'': [1,2,3,4]}\n        return features\n\nOk now if I call it like this it will return the typeerror. No matter what I call it baseline always seems to go through the else and then return ' bad\\_test'. There are no other occurences of the variable baseline in my code. Can anyone explain to me why this is happening?"" "
eRisk2023-T3_Subject9, b' ' , b'2021-12-29 20:22:32' , reddit post ," b'ah then yeah, trap strat from pretty early on it is.' "
eRisk2023-T3_Subject9, b' ' , b'2021-12-29 19:58:59' , reddit post , b'Damn I remember when nobody used to know names like Figsew or Frenzy back in the BO2 days and the only high-round players people knew were Mato and RelaxingEnd. I used to play a lot of town/farm grief with the guy and its really heartwarming to see how some of these guys are finally getting recognition after years of dedication to the game.' 
eRisk2023-T3_Subject9, b' ' , b'2021-12-29 19:50:19' , reddit post ," b""This was also the case for BO3. Split-screen didn't work immediately on release if I remember correctly."" "
eRisk2023-T3_Subject9, b' ' , b'2021-12-29 19:25:18' , reddit post ," b'Try training at Widows Wine (Bo3) or Flopper (Bo1), really easy spot. For the monkeys you can turn on the traps near upper spawn exit and just run back and forth near bottom spawn door to protect jug and quickrevive. I usually get the rest of my perks from the random machine in (Bo3) or I just get stamin-up and hope the trap does some magic for that in Bo1.   \n\n\nShould be pretty easy once you have the training down :)' "
eRisk2023-T3_Subject9, b' ' , b'2021-12-29 19:19:53' , reddit post ," b'Kinda miss Verruckt on this list. I think a lot of them such as nacht/bus depot are only on here because they take forever, but are otherwise actually really easy maps.' "
eRisk2023-T3_Subject9, b' ' , b'2021-12-29 19:17:31' , reddit post ," b""Wait what. At some point I tried training in a what seemed to be basically impossible spot when I wanted to die on ascension only to realise its totally doable. Like I can't seem to make that map difficult. \n\nWith origins there is atleast the tedious setup and the mud that can get you."" "
eRisk2023-T3_Subject9, b' ' , b'2021-12-29 19:10:01' , reddit post ," b'>What strat did you use on verruckt? I just remember stair camping and like most maps I couldnt get passed 30, the guns fell off too hard and the strats of just camping at the time were too shit.\n\nRestart till jugside spawn and leave door from kitchen to power closed, then just camp kitchen till about round 40-50 (can prolly do to 65 if you use mega gobblegums), after that you will need to use the trap strat and might want to take a down to replace a camping perk like widows wine with stamin-up (because otherwise the traps down you more for some glitchy ass reason)' "
eRisk2023-T3_Subject9, b' ' , b'2021-12-29 17:47:31' , reddit post ," b'Yeah KLM wanted my vaccination certificate, AND my negative PCR test. Flying tomorrow' "
eRisk2023-T3_Subject9, b' ' , b'2021-12-20 01:13:27' , reddit post ," b'Yeah I have had stress related hair loss before from fevers and such. I do feel like I am losing more than normal atm, but I agree that the location and fade of it looks like mpb.\nOnly thing is that a year ago I had no thinning of this sort making it feel like it went extremely quick. Is this normal?' "
eRisk2023-T3_Subject9, b' ' , b'2021-12-19 18:15:07' , reddit post ," b""I have been prescribed ketaconazole shampoo and scalp corticosteroid lotion by my doctor since I have a lot of dandruff. Going to continue this first to rule out other possibilities. Also went through a breakup and a lot of study stress, so that is also a possible cause, but to me would be unlikely due to the location on my scalp.\n\nPersonally don't really want to go the finasteride route,   \nif it is MPB I will probably let it get worse and shave it off when I need to."" "
eRisk2023-T3_Subject9, b' ' , b'2021-12-19 18:08:04' , reddit post , b'Ok' 
eRisk2023-T3_Subject9, b' ' , b'2021-12-19 18:02:19' , reddit post , b'Do you think its mpb?' 
eRisk2023-T3_Subject9, b' ' , b'2021-12-18 22:57:36' , reddit post , b'You can use AUDIO MIDI setup on your Mac as an alternative. But yes not ideal.' 
eRisk2023-T3_Subject9, b' ' , b'2021-12-17 11:29:48' , reddit post ," b'Heeft ook wel een beetje met politisering te maken denk ik, niet zo zeer of t wetenschappelijk is bewezen of niet.   \nHoe je het ook went of keert, mondkapjes kunnen naar mijn idee laten doorschijnen of mensen t met de maatregelen eens zijn of niet.' "
eRisk2023-T3_Subject9, b' ' , b'2021-12-17 11:26:35' , reddit post , b'rip geesteswetenschappen.' 
eRisk2023-T3_Subject9, b' ' , b'2021-12-17 11:21:27' , reddit post ," b'Nevermind, it was the comma lol' "
eRisk2023-T3_Subject9," b'""("" was not closed. What am I missing' ", b'2021-12-17 11:20:55' , reddit post ," b'Hey guys,   \n\n\nFor some strange reason my IDE (VSCode) is telling me that I didn\'t close the brackets of a function despite me doing so. Do any of you guys know what it could be.   \n\n\n    ""("" was not closed Pylance [100, 25]\n\nIt seems to occur here  \n\n\n    def carry_out_evaluation(gold_annotations, systemfile, systemcolumn, systemcolumn2 delimiter=\'\\t\'):\n\nand my IDE is pointing at the first bracket. Its almost like it isn\'t expecting any parameters.   \nAbove my function is another function that just prints precision, recall and f -score for my model. Seems to be indented fine, nothing strange going on as far as I can tell except for that it doesn\'t seem to want any parameters.   \n\n\nAny idea why I am getting this?' "
eRisk2023-T3_Subject9, b' ' , b'2021-12-12 03:21:35' , reddit post ," b""Yeah I should be able to see someone monday for it. I counted a good 30 hairs on my bed today, shower drain is a bit hard to tell since I live with roommates. I think its plausible that it is stress related, judging by how quick its going (or maybe i've just been oblivious to it for a while?) and since i've had that issue before aswell after getting dengue. Though if i remember the last stress related hair loss time correctly i remember that chunks of hair would just stick to my hand when i went through it; I feel like there are less hairs sticking to my hand now in comparison to back then. Though i must also say that my hair and living conditions were also a bit different back then so that could maybe also attribute for a difference."" "
eRisk2023-T3_Subject9, b'Quick balding in a few months?' , b'2021-12-11 23:36:31' , reddit post ," b""I am noticing that I've been going bald fast. This week a friend of mine said that I had a receding hairline, and this kinda shocked me so I've been looking at it and a bit worried about it. But I was a bit relieved that I could still have hair on the back of my head. So then the next day I took a picture of the back of my head and I saw some diffuse thinning. Fast forward literally a day later and I feel like it has gotten significantly worse. I am freaking out.\n\nI wanted to ask you guys whether these changes are symptoms of MPB or maybe some other kind of condition, mainly due to how rapid this is happening to me. I am 24 and have not seen this happen to others in my family. Based on the locations where it has been happening I would guess mpb, but it all came super quick to me.\n\nIn the link below there are a few images, the first one is me with a relatively full head of hair a few months ago. Though it is a bit low resolution. The second picture is me as I am freaking out today. The third one is literally yesterday.\n\nPlease help.\n\n[https://imgur.com/a/qzNWgrX](https://imgur.com/a/qzNWgrX)"" "
eRisk2023-T3_Subject9, b' ' , b'2021-12-06 02:30:08' , reddit post ," b'Can you be more specific? What do you mean with \xe2\x80\x98glasses\xe2\x80\x99, what is the training data, what is the task, what have you tried?' "
eRisk2023-T3_Subject9, b' ' , b'2021-12-06 02:27:40' , reddit post ," b'I mean regardless of whether OP is doing someones homework for money or not, that person that is paying OP will eventually realise he spent extra money and still doesn\xe2\x80\x99t understand anything later in life. I don\xe2\x80\x99t see a problem helping OP here.' "
eRisk2023-T3_Subject9, b' ' , b'2021-12-06 02:13:56' , reddit post ," b'I see the comments are also not confident in the subreddit you linked me to. Also the video there is of bottas\xe2\x80\x99s pov, i think the kimi one i linked earlier is a bit more telling. I will link it again for you. https://youtu.be/8QTwAQa4LX4. Kimi is told to abort the lap and then still flies by, so I can agree its a bit of a 50/50 whether he was still going for hotlap or not. Nevertheless, the traffic should have been out of the way of kimi in this situation.' "
eRisk2023-T3_Subject9, b' ' , b'2021-12-06 02:02:55' , reddit post , b'He had to abort the fast lap since bottas was in the way; see video attached earlier' 
