ID,WRITING.TITLE,WRITING.DATE,WRITING.INFO,WRITING.TEXT
eRisk2023-T3_Subject9, b' ' , b'2021-05-18 11:31:05' , reddit post ," b""I doubt that they will release it tbh. They were asked to provide the raw data for their articles by politicians and all the data from The Netherlands is missing, and the released data is the following [https://data.rivm.nl/covid-19/](https://data.rivm.nl/covid-19/). It really only shows how many people are infected and at what ages, but doesn't account for the total tested at all, so its not true raw data.\n\nAn appropriate raw dataset imo should also include administered tests that did not turn out a positive result, so we can verify how many people are being tested and the provinces that test the most. Additionally it would be nice for them to include their variant testing data as well.\n\nI think they started releasing it due to political pressure, I have helped with the development of a data science project for CBS before and I know that these government institutions are very hesitant to share their data with anyone. I didn't even get access to their dataset when I was developing an API for them and I just had to make it work as universally as possible.\n\nEdit: I hope I'm missing something though and you can help me get the raw data including the negative tests. Its also possible I guess that these are missing because they are not reported to RIVM? Even then, its still weird to me."" "
eRisk2023-T3_Subject9, b' ' , b'2021-05-18 10:15:46' , reddit post ," b""Very strange indeed. I wouldn't trust the rivm numbers too much, they lag behind by about 2 weeks, and it got to the UK (with a higher Indian population) at the end of April. Its possible we will still see the increase. The link you showed shows four cases of the two  Indian variants, both from very recently. \n\nI do really wish the rivm would just start giving everyone access to their raw data. Their shitty and unscientific graphical representation is lacking and so is their transparency.  imo this is undermining peoples trust in the system."" "
eRisk2023-T3_Subject9, b' ' , b'2021-05-17 20:12:54' , reddit post , b'Done' 
eRisk2023-T3_Subject9, b' ' , b'2021-05-17 19:37:19' , reddit post ," b""No you can't. The latter I don't recommend though. For the charge 5 I know that the TL drivers will not fit in the ND and vice versa, see [this](https://www.youtube.com/watch?v=2c-0Koq48bY) video. My guess is that it will be the same for the charge 4. It's really just a lottery.   \nIf you want to be sure you can go to a store where they sell a charge 4 and check the serial numbers on the boxes."" "
eRisk2023-T3_Subject9, b' ' , b'2021-05-17 19:32:58' , reddit post ," b""Yeah recently I've seen like 2 other posts on here with the exact same problem. I'm wondering, did you update the device before this happened? Did it happen after connecting to a pc?  \nI am guessing the following happened, your phone or computer forgot the device and the name changed when trying to reconnect. It sounds like an issue with JBL's  bluetooth drivers in the headphones that listen for sound on the connected device, and that output to DSP. \n\nAll I can come up with is the following.   \n\\-Removing the VA9625 from known devices and after that resetting the headphone with + or - buttons for longer than 5 seconds.\n\nMaybe also see if you can contact JBL or I guess harman support and ask them about it, since you're not the only one experiencing this problem."" "
eRisk2023-T3_Subject9, b' ' , b'2021-05-17 18:59:01' , reddit post ," b""On the box it should give the serial number that helps you determine if its GG or TT (or ND or TL for the charge 5). Nevertheless, it is very likely that you'll just get a random model. There are rumours that black or grey charge's are more likely to be ND, but that's just a rumour.   \n\n\nI got my charge 5 in black from the [JBl.com](https://JBl.com) and I got the ND model from them (in Netherlands), if that helps you."" "
eRisk2023-T3_Subject9, b' ' , b'2021-05-17 18:45:48' , reddit post , b'Was a good read. Gyms in my area will open up Wednesday so I booked an appointment. No masks are necessary inside thankfully.' 
eRisk2023-T3_Subject9, b' ' , b'2021-05-17 14:47:27' , reddit post ," b""Really depends on the use case. For sitting outside with some friends, or for use at my own home the Sonos Move.   \nIf I need something loud that can get the party started I'd definitely take the boombox 2. I feel like its a less fragile device as well, for some reason I'd be afraid of dropping the Sonos if I'd take it anywhere.   \nSound wise I think the bigger drivers on the bb2 help, but its very bass heavy indoors from my experience, even at low volumes. The Sonos would definitely sound a bit more balanced indoors."" "
eRisk2023-T3_Subject9, b' ' , b'2021-05-17 13:09:55' , reddit post ," b""Could be done more efficiently I think if you store the objects in variables first like. \n\nlose = 'you lost the game'\n\nwin = 'you won the game'  \n\n\neven just that will save you so much extra writing, and if you ever score a programming job and your employer asks you to change something, you just need to change one variable instead of changing lines everywhere and maybe missing one."" "
eRisk2023-T3_Subject9, b' ' , b'2021-05-17 13:02:39' , reddit post , b'just make a new set() object and add the card to that when the card is pulled. Then just check whether the card is already in the set or not when you run the next step in the game. You can just use if or elif statements for this.' 
eRisk2023-T3_Subject9, b' ' , b'2021-05-17 12:59:24' , reddit post , b'Yeah as u/hedonit mentioned you can use sort() or sorted to order the list in a particular way :).' 
eRisk2023-T3_Subject9, b' ' , b'2021-05-17 12:47:48' , reddit post ," b'I have a boombox 2 and my dad has a Sonos Move. Both sound great imo, though I find that the boombox 2 has a louder signature, but nevertheless the mids and highs on the move make it so that the sound still has good travel outside.' "
eRisk2023-T3_Subject9, b' ' , b'2021-05-17 09:39:14' , reddit post , b'UE Hyperboom seems like the best choice for this.' 
eRisk2023-T3_Subject9, b' ' , b'2021-05-16 14:41:40' , reddit post ," b'Pretty cool. I wonder, does it shoot automatically or only when you click?' "
eRisk2023-T3_Subject9, b' ' , b'2021-05-16 14:24:25' , reddit post ," b'Sounds good, if you need help understanding the module i can reccomend checking out sentdex on youtube, he had really good nltk tutorials :)' "
eRisk2023-T3_Subject9, b' ' , b'2021-05-16 14:05:29' , reddit post ," b""Yeah so things like this are very structure dependent. If it has a structure that is rare in natural langauge like 'Q:' or '1.' you can simply split on this. Ofc you can also look for other things in the structure like a '/n' etc, but its not as dynamic as using a module.\n\nWith [NLTK.tokenize](https://www.nltk.org/api/nltk.tokenize.html) you can actually define the start and end, so starting with 'q' and ending with '.' for example. Additionally you can use the automated tools like sentence recognition etc which will help you. Do note that an NLTK object is not a string object (if i remember correctly) , so you will need to convert your objects here and there to get them working with the rest of your code."" "
eRisk2023-T3_Subject9, b' ' , b'2021-05-16 13:24:20' , reddit post ," b'What are you unable to figure out?  \nThe pdf should be the input for the module.  \n1. use pdfreader to read the raw file.\n\n2. consider splitting on patterns (like question number) or using a module like NLTK to distinguish between questions.  \n3. Theres a google search api which will let you index through the list, and fetch the link.   \n4. Use beautifulsoup to scrape for the answer, and you can again use NLTK or another NLP module to clean it up.   \n5. Write the results' "
eRisk2023-T3_Subject9, b' ' , b'2021-05-16 13:15:51' , reddit post , b'Yeah you can loop through the tuples and use max() to get the highest value for the 2nd index.' 
eRisk2023-T3_Subject9, b' ' , b'2021-05-16 12:33:52' , reddit post , b'Should work' 
eRisk2023-T3_Subject9, b' ' , b'2021-05-16 12:04:05' , reddit post ," b""As mentioned below just use '.'.join(mylist). \n\nIts basically just converting a list element to a string."" "
eRisk2023-T3_Subject9, b' ' , b'2021-05-16 11:47:47' , reddit post ," b""Like others have said here, cutting carbs won't do much if you're not cutting calories. Eating extra protein might help burn off more calories though since your body burns  off calories  trying to process them.\n\nPersonally, I prefer not cutting carbs because it just makes me feel tired and unmotivated. And long term carb cutting is related to high SHBG levels which reduce your free testosterone.\n\nSaggy skin is more likely to occur if you're losing weight to quickly, not allowing the skin to adapt."" "
eRisk2023-T3_Subject9, b' ' , b'2021-05-16 11:37:24' , reddit post ," b""To add to the previous comments here.  \nI train a lot on rings and notice 0 difference in FL difficulty, for me it didn't really matter. Though I have mostly done FL on rings while training so maybe thats a reason for it.  \nWhen I learned FL my hold started out really short, and then I managed to do pretty long straddle holds that helped me get to my full. My pull routine involved a lot of [L Lever rows](https://www.instagram.com/p/CIAMgq6jkmk/) and weighted pull ups. Dragon flags also helped me a lot, and in the beginning I greased the groove a lot (like just trying once almost every day) which helped my body adapt to the hold a bit better."" "
eRisk2023-T3_Subject9, b' ' , b'2021-05-16 11:27:58' , reddit post ," b""I mean what you're suggesting sounds pretty insane. For me I need to go about 2x a week to maintain, and eat accordingly ofc. Perhaps less is possible, but for long periods of time my performance training 1x a week goes down."" "
eRisk2023-T3_Subject9, b' ' , b'2021-05-16 10:57:51' , reddit post ," b""Interesting, it sounds like a DSP issue to me, though i'm not sure what you can do to fix it."" "
eRisk2023-T3_Subject9, b' ' , b'2021-05-16 10:50:30' , reddit post ," b""u/Puzzleheaded_Math489 So you're ignoring the fact that you need to report side effects in order to do any quantitative or qualitative analysis? I get that its social media, but how are people supposed to come to any reasonable conclusions without being well aware of the potential side effects that may come about. Additionally this kind of judgement makes life a lot harder for data scientists scraping and analysing the social media realm."" "
eRisk2023-T3_Subject9, b' ' , b'2021-05-16 10:31:22' , reddit post , b'Maybe the bluetooth lock is on. Press and hold the play/pause buttons for about 5 seconds and maybe it will work then. I found this on [this](https://lgcommunity.us.com/discussion/12124/lg-rk7-problems) forum post.' 
eRisk2023-T3_Subject9, b' ' , b'2021-05-16 10:23:11' , reddit post ," b""I'm just theorizing, maybe this will work, but you need to do this in a particular order otherwise it will almost certainly fail.\n\n\\-Forget the bluetooth device\n\n\\-Disable bluetooth drivers. If you're a bit techy, do what is suggested [here](https://superuser.com/questions/1168551/turn-on-off-bluetooth-radio-adapter-from-cmd-powershell-in-windows-10)\n\n\\-Turn off the bluetooth speaker\n\n\\-Restart the computer\n\n\\-Enable the drivers again (if they aren't already enabled by turning on)  \n\n\n\\-Turn on the speaker, and pair it to the computer again.  \n\n\nLet me know if it works :)"" "
eRisk2023-T3_Subject9, b' ' , b'2021-05-16 08:52:25' , reddit post ," b'I think its really just a infrastructural thing right now. The director of Pfizer has already said that a third shot will be neccesary after a year. Bill Gates on his youtube channel has mentioned that he hopes mRNA vaccines will be the medicine therapy standard of the future.   \n\n\nIts basically binding governments with big pharma so that they can earn more money. Through leaks from Brazil and Argentina it has become apparent that the types of deals that these companies are making require compensation from the administering govt and not the companies themselves if something goes wrong. Basically every disease will get a mandatory vaxx, and if something goes wrong the taxpayer needs to pay for it.' "
eRisk2023-T3_Subject9, b' ' , b'2021-05-15 22:27:18' , reddit post , b'Ahh i don\xe2\x80\x99t have one of those :(' 
eRisk2023-T3_Subject9, b' ' , b'2021-05-15 22:11:34' , reddit post ," b""Factory reset didn't work?  \n\n\nIs it a JBL Xtreme 1, 2 or 3?"" "
eRisk2023-T3_Subject9, b' ' , b'2021-05-15 22:05:50' , reddit post ," b""I have a boombox 2 and its great, but in terms of filling room or sheer space up I'd say the UE hyperboom does a better job though due do its cubical design. \n\nNevertheless, in most cases I don't really have the option to blast the thing unless I'm throwing a party. I got a small charge 5 as well which I can connect to my bb2 to fill large areas a bit better."" "
eRisk2023-T3_Subject9, b' ' , b'2021-05-15 19:50:01' , reddit post ," b""Mhh, I'm not familiar with your speaker but it sounds like a software problem on the laptop side. What version of windows/linux are you running?"" "
eRisk2023-T3_Subject9, b' ' , b'2021-05-15 17:35:08' , reddit post , b'When not connected to devices' 
eRisk2023-T3_Subject9, b' ' , b'2021-05-15 17:16:36' , reddit post ," b'Yeah it works on my phone fine and also on my android tv but not on my laptop. My laptop is intel based though, im also curious if it will work on arm based macs' "
eRisk2023-T3_Subject9, b'Partyboost not working on MacBook Pro' , b'2021-05-15 16:34:30' , reddit post ," b""For some reason I can not get JBL's PartyBoost mode to work on my MacBook Pro's bluetooth.  \nI have a JBL Charge 5 and a JBL Boombox 2, and pairing the two together works fine when the main is connected to my phone.   \nWhen the speakers are connected to my MacBook Pro however, both the PartyBoost button on the charge 5 and on the boombox 2 stop responding.   \nAre any of you familiar with this issue?"" "
eRisk2023-T3_Subject9, b' ' , b'2021-05-15 16:20:40' , reddit post ," b""I have a charge 5 and can tell you it performs pretty good. The extra tweeter makes it sound a lot more clear compared to the charge 4 imo. If you're doubting between those two, get the 5 for sure. Compared to the Sony SRS XB-33 I would also opt for the charge 5 due to higher frequency ranges."" "
eRisk2023-T3_Subject9, b' ' , b'2021-05-15 16:15:14' , reddit post , b'Literally every speaker I could think of is missing at least one component from this list.  \nJBL Boombox 2: No airplay  \nSonos Move: No aux  \nDiamondboxx M3: No airplay  \n and the list goes on\n\n:(' 
eRisk2023-T3_Subject9, b' ' , b'2021-05-15 12:40:16' , reddit post ," b'Maybe im a little late to the party here, but after a software update the charge 5 sounds a lot better than the 4. You really hear better audio seperation due to the extra tweeter on the 5' "
eRisk2023-T3_Subject9, b' ' , b'2021-05-15 10:44:31' , reddit post ," b'My bb2 and charge 5 are both ND, i actually haven\xe2\x80\x99t heard of any model differences on the bb2. \nI\xe2\x80\x99m pretty happy with the ND as i prefer the build quality on my charge 5 compared to the tl.' "
eRisk2023-T3_Subject9, b' ' , b'2021-05-15 10:41:50' , reddit post ," b'For some odd reason the partyboost button does not seem to work on my macbook pro. It does work on my phone and android tv.\nBut yeah follow the instructions that whatishouldputhere mentioned, once you press the partyboost button a ring should light up around the power button and it should make a sound which is how you know it should be working' "
eRisk2023-T3_Subject9, b' ' , b'2021-05-15 10:38:22' , reddit post , b'For my charge 5 its black and has a small electricity symbol on it' 
eRisk2023-T3_Subject9, b'Does Partyboost work with aux in?' , b'2021-05-11 14:25:45' , reddit post ," b""Was wondering this since the Charge 5 I ordered does not come with an aux in, so I can't use a splitter. It would be nice to aux in on my boombox 2 and partyboost to the charge 5"" "
eRisk2023-T3_Subject9, b' ' , b'2021-05-11 13:37:13' , reddit post , b'Idk why but this made me laugh \xf0\x9f\x98\x82' 
eRisk2023-T3_Subject9, b' ' , b'2021-05-07 08:20:13' , reddit post , b'I also have a boombox 2 and have had the same experience trying to connect to my friends charge 3. Its worth noting btw that if your phone has a dual audio setting that you can use that as a workaround.' 
eRisk2023-T3_Subject9, b' ' , b'2021-05-06 22:52:49' , reddit post ," b""For portability, boombox 2 is great. I have one myself and can strap it onto my bike in case I need to move it around, since I live in The Netherlands that's a great mode of transport for me. Table isn't entirely accurate on it since you're comparing it to the Boombox 1. The new one can reproduce lower frequencies a bit better. \n\nPartyboxes main problem is battery life and portability. If you guys need a speaker for dj'ing, and can drive this thing around. Its great (also because of the car charging stuff). But if you're trying to take it with you on the go, not so much. Also if you can get a cheap partybox100, consider getting 2. This was also one of my considerations at one point, considering the price of a new boombox was similar to buying 2 partybox 100's. \n\nSimilar thing for hyperboom, I have a boombox 2 and was deciding between hyperboom or boombox 2. Hyperboom wins with mids and highs, boombox wins with lows. Additionally, hyperboom wins regarding EQ settings. For the boombox 2 this is not customisable at all."" "
eRisk2023-T3_Subject9," b'JBL and planned obsolescence (Connect+, Partyboost, etc)' ", b'2021-05-06 21:55:32' , reddit post ," b""I was wondering what you guys thought about the situation regarding Connect, Connect+, and the new PartyBoost lineup not being cross compatible.   \nDo you guys think the next generation of bluetooth speakers will have a new service such as perhaps a  PartyBoost+?   \n\n\nI really hope they stick with PartyBoost and don't change to a new technology. If anything else happens it would really seem like planned obsolescence of their next generation.   \nIs there anything we, as a reddit community, could do? Like contact them about our concerns?   \n\n\nCurious to hear your thoughts :)"" "
eRisk2023-T3_Subject9, b' ' , b'2021-05-06 19:08:07' , reddit post , b'For me it feels like a bit more mid loudness' 
eRisk2023-T3_Subject9, b' ' , b'2021-04-25 14:29:45' , reddit post , b'Meh Pfizer hjeeft al aangekondigd dat de derde prik wss een jaar na de tweede gedaan moet worden. Bewijst naar mijn mening dat dit vaccin eigenlijk gewoon een soort griepprik is' 
eRisk2023-T3_Subject9, b' ' , b'2021-04-13 21:44:08' , reddit post ," b'Ah I know the Gorge, classic spot with crazy conditions. Must have quite a large set of balls to throw loops on those waves.\n\nAfter reviewing your routine a bit more, I realized that you do practice overhead tricep extension and the arnold press into curls. I do however think that the position of your arms in both these movements typically isn\xe2\x80\x99t as beneficial for upper chest as overhead press or pikes is, the delt development just doesn\xe2\x80\x99t seem to be targeted in the same way. Don\xe2\x80\x99t take my word for it, but just try them and I think you\xe2\x80\x99ll see what I mean based on how new and heavy these movements will feel in comparison. Also note that this is coming from someone who does calisthenics that looks for the amount of transfer in every exercise. Pikes and ohp will transfer to handstand push up strength, and my experience isn\xe2\x80\x99t neccesarily about promoting aesthetic aspects, but rather exercises that work for functional strength, I guess thats how you can interpret me saying \xe2\x80\x98beneficial\xe2\x80\x99 but do with that as you will.\n\n I like how your routine implements all planes of motion, which is generally the main thing I look at when critiquing these programs, so this is just really nitpicking tbh.' "
eRisk2023-T3_Subject9, b' ' , b'2021-04-13 16:17:28' , reddit post ," b""Awesome that you windsurf, I used to do it almost everyday for about 10 years. Interestingly though I feel like it gave me lower back problems since I did slalom competitions with heavy sails since I was basically 13, and right now I am starting to notice the toll that this had on lumbar spine.\n\nI really like the routine. I think you apply some good principles that will benefit your development.   \nConsider at some point implementing pikes in the routine. Its that upper chest/delt strength that I don't think is being handled enough in this routine. You don't have to add it in now, but consider at some point trading it for a push since you are already so caught up with time."" "
eRisk2023-T3_Subject9, b' ' , b'2021-04-13 15:57:21' , reddit post ," b""I don't know this program but I can say the following:  \n5x5 is just 5x5, no rep range increase should be the goal necessarily, but the movement should remain difficult to accomplish at 5x5. Once it has gotten easy, you move on to a heavier variation, and if you want to do proper step loading, you can have the transition week be a period of light exercise before you move onto heavier weight. If this is the goal, then you should aim for about 3 or 4 weeks of 5x5 and 1 week of rest, and then reset the week after with a heavier variation/load.  \nI'm not sure on your current level, but as a warning, I shall say that I do not recommend this for beginners. I am a firm believer in that beginners should first focus on acquiring basic foundational strength with enough volume (about 10 rep range) before moving on to specific strength training. Mainly because moving into strength rep range too early leaves you at very high risk for injury. I'm assuming that this is the reason why this program starts with this beginner routine, but I just want to stress the importance of having a good foundation first."" "
eRisk2023-T3_Subject9, b' ' , b'2021-04-11 13:51:08' , reddit post ," b'Mind body connections I guess.   \nOne of the first lectures I had when studying communication science was from a professor (Lourens de Vries) who had lived with the Korowai people in Papua New Guinea to study their language system. He explained that instead of counting from one hand to the next, and thus with 10 fingers in total and a 10 word counting system, these people counted from one pinkie from the next. They would start with the hands, go to the forearm, and go around the whole body until they ended up at the number 25 back at their other hand. This was a closed system, and these people never had the need to count to a higher number than that.  \nThese types of counting systems are more common in Papuan languages, there are even differences between men and women in some languages. The Yupna men for example, include the left testicle, the penis, and the right testicle in their number system, and if I remember correctly men can count higher than women in that language.  \nOver time however, it is predicted that more and more of these counting systems disappear. Because when these people are introduced to an open system, they generally adopt this over their own.' "
eRisk2023-T3_Subject9, b' ' , b'2021-04-10 21:51:46' , reddit post ," b""So considering the rock climbing gyms are closed and this is now you're replacement I can only really suggest the following.  \nFirst thing I kind of want to ask you? Why 3 sets? From what I usually hear/read 4 sets or even 5 sets is usually the go to. Maybe consider adding another set in and simplifying the routine a bit towards just a few goals? \n\nWhat I see in this routine is that you right away, want to achieve a lot; BL, FL and Planche. I think you personally, will benefit a lot from simplifying the goals and tailoring a bit more to that. This way you can add more volume to few goals, and I think you will achieve them quicker this way."" "
eRisk2023-T3_Subject9, b' ' , b'2021-04-10 17:04:12' , reddit post ," b""I usually go to a calisthenics park outside, and I agree, the winter sucks. Basically I got a gym membership just to avoid having to do my workout in the snow. Since the gyms are still closed where I live due to COVID, this didn't help much this year. But honestly, once i'm in the park and get my routine going, I don't mind it that much. Rain sucks a lot more than snow, and once you're warm from the workout the cold becomes more bearable."" "
eRisk2023-T3_Subject9, b' ' , b'2021-04-09 14:58:21' , reddit post ," b'I\xe2\x80\x99d replace skull crushers with archers, since the position is more similar to OAPU. I wouldnt do both since both exercises already affect the same plane of movement.\n\nAlso for the dips, just keep dipping. You can also shorten rest time and program them at the end of a workout when a regular dip is too easy for hypertrophy benefits and progress that way.\n\nGood luck :)' "
