ID,WRITING.TITLE,WRITING.DATE,WRITING.INFO,WRITING.TEXT
eRisk2023-T3_Subject26, b' ' , b'2019-12-20 00:36:43' , reddit post ," b'I did my thesis on the Casimir effect, which is a quantum mechanical effect which causes two reflective objects in a field be attracted to one another. During my research I discovered that there is an analogous effect where in any field which allows fields any object which reflects waves in the medium will also attract each other. This included things like ships near each other in the ocean and cereal floating in a bowl. This effect also amplifies what causes Cheerios to attract, at least to my knowledge!' "
eRisk2023-T3_Subject26, b' ' , b'2019-12-09 13:45:39' , reddit post ," b'This doesn\xe2\x80\x99t make much sense as radioactive decay is a quantum effect; alpha radiation is due to the quantum tunneling of helium atoms out of a nucleus, beta decay is due to the weak force (a force described in the standard model which is a quantum field theory) and gamma decay is due to the nucleus dropping from one discrete energy level to a lower discrete energy level (only possible due the quantization of atomic energy levels)' "
eRisk2023-T3_Subject26, b' ' , b'2019-12-09 13:39:53' , reddit post ," b'Bell\xe2\x80\x99s theorem proves that are no local hidden variables in quantum mechanics and that it is a purely probabilistic theory of physics but being probabilistic does not mean it is not predictable, we can still describe all possible solutions/outcomes of quantum states and attribute a probability to each one as it is the laws of physics itself which doesn\xe2\x80\x99t allow a concrete deterministic solution. While this may seem like it is problematic, it really isn\xe2\x80\x99t; quantum mechanics exists and works because it is probabilistic and no physicists with some grasp of QM would dispute the \xe2\x80\x9crandom\xe2\x80\x9d nature of it.' "
eRisk2023-T3_Subject26, b' ' , b'2019-09-05 17:35:23' , reddit post ," b""You are about 2.5kg overweight, which is about 7700 kcal of fat if you go on a deficit of 300 kcal per day you'd be at normal bmi in less than a month. It is surprisingly easy to get to a normal bmi when at a fringe weight by just counting calories; there are many apps that can help with this such as myfitnesspal or just simple pen and paper while reading nutrition labels and counting yourself!"" "
eRisk2023-T3_Subject26, b' ' , b'2019-09-03 13:18:46' , reddit post ," b""You would give yourself a 6 hour period in the day where you can eat as you feel for example 4pm til 10pm and you don't eat at all outside those hours. In those six hours you don't force yourself to eat you just eat when you are feeling hungry, after just a few weeks of intermittent fasting your body feels very little hunger during the fast and one does not tend to over eat during the eating period."" "
eRisk2023-T3_Subject26, b' ' , b'2019-09-03 11:53:02' , reddit post , b'18 hours of fasting and 6 hours of non fasting a day' 
eRisk2023-T3_Subject26, b' ' , b'2019-05-31 04:02:27' , reddit post ," b""This statement doesn't really make much sense at all and is a bit misleading, first I assume you mean the higgs boson as the graviton is not even in the standard model as it is a purely relativistic quantum field theory not including gravity, also why would this theory of gravity interaction not include dark matter? Dark matter by nature interacts basically exclusively via gravity/mass. 3-d dimensional curves are slices of 4-d spaces as 2-d curves are slices of 3-d and 1-d to 2-d, calling them manipulations does not make much sense when the word for it is curve. While it can be nice to try visualize GR with such simple illustrations like the dots but the reality of it is is that there is no reason and space-time curves in the presence of mass in an area of space (or energy as a matter of fact) simply because Einstein's field equations say that the stress-energy tensor is proportional to the ricci tensor. To arrive at GR and have any semblance of the why or reasoning other than just accepting the maths that arise from the postulates of Einstein takes years and years of Physics; most people aren't even equipped with the mathematics to touch GR at a Masters level."" "
eRisk2023-T3_Subject26, b' ' , b'2019-05-21 03:45:02' , reddit post ," b'Fluids include both liquids and gases, in physics a fluid is anything which ""flows"" when interacting with external forces which includes atmospheric gases and the friction/wind resistance they impart.' "
eRisk2023-T3_Subject26, b' ' , b'2019-05-13 13:40:08' , reddit post , b'u/userleansbot' 
eRisk2023-T3_Subject26, b'Test' , b'2019-05-13 13:39:42' , reddit post , b'Test' 
eRisk2023-T3_Subject26, b' ' , b'2019-04-06 14:48:22' , reddit post ," b""It's a crime to not have health insurance as an international only if you work, if you are only studying no insurance is needed"" "
eRisk2023-T3_Subject26, b' ' , b'2019-04-06 00:57:29' , reddit post ," b'W and Z bosons are the mediators of the weak nuclear force and are integrated into the standard model of particle physics. At high enough energies of proton-proton collisions it is predicted in the SM that triplets of these bosons should be theoretically created, this report is just stating that they have fairly certainly detected such an event and so are just confirming predictions of the standard model. Overall not that exciting but an important experiment nonetheless' "
eRisk2023-T3_Subject26, b' ' , b'2019-03-08 00:34:24' , reddit post ," b""It's [Onkruyd](https://www.instagram.com/onkruyd/), have met him in real life and even have a piece of work he gave me, seems like a \nchill dude who just likes to tag the city."" "
eRisk2023-T3_Subject26, b' ' , b'2019-01-07 16:38:04' , reddit post , b'Twas the old system yo' 
eRisk2023-T3_Subject26, b' ' , b'2018-08-18 06:06:07' , reddit post ," b""Well according to EU law one of the main contributing factors to the size of fines given by the EU is [the importance of the rules breached and the impact of the infringement on general and particular interests](https://ec.europa.eu/info/law/law-making-process/applying-eu-law/infringement-procedure_en) and I would say breaking such a fundamental EU law is pretty huge, on top of that Ireland still owes the EU around [44 billion Euro](https://www.irishtimes.com/business/economy/ireland-still-owes-44-5bn-in-bailout-loans-after-paying-off-imf-early-1.3334972) for the 2008/2009 bailout which huge in comparison to Ireland's GNI* of ~190 billion Euro. So all in all this scenario probably will never happen and it is most definitely against Ireland's best interests"" "
eRisk2023-T3_Subject26, b' ' , b'2018-08-07 07:01:17' , reddit post ," b""I'm not sure what you mean by require that mechanism? But if you are talking about the sharpness of the peak, the stronger the tidal force the more concentrated the tidal wave will be on the the axis between the the blackhole and the planet since the potential gradient is so big on the planet the tidal force will be very large which means the wave will be very sharp/noticeable."" "
eRisk2023-T3_Subject26, b' ' , b'2018-08-07 05:07:16' , reddit post ," b'Tidal waves are based on the difference on gravity between the two sides of the planet not on the ends of the wave, if that was the case we wouldnt have tides on earth either.\n' "
eRisk2023-T3_Subject26, b' ' , b'2018-08-07 05:01:54' , reddit post ," b'Depends on the distance to the black hole tidal forces are based on the potential gradient across the diameter of the mass, not on the diameter of the mass, since there was such strong time dilation I assume they were close enough for the gradient across the planet to be very high.' "
eRisk2023-T3_Subject26, b' ' , b'2018-08-03 06:19:28' , reddit post , b'But the point is that while smoking with other forms holds somewhat the same mouth cancer chances plus the lung issues associated. Not saying smoking is healthy but just that it is healthier in some ways than others\n' 
eRisk2023-T3_Subject26, b' ' , b'2018-07-26 22:38:31' , reddit post ," b'Well they actually did put in a pair of wings that you can use to fly in minecraft quite a while ago called elytra in the end game,, they can be used for infinite flight by using fireworks as fuel' "
eRisk2023-T3_Subject26, b' ' , b'2018-07-22 01:19:42' , reddit post ," b""With dota 2 players there are alot of high level players who are young, e.g. suma1l, but the thing with dota is that it is almost ten years old now with concurrent updates also for the last ten years, so even though younger players can learn current skills that are necessary to play dota they lack the 10 year experience of the older players to adapt to multiple per year patches with large meta shifts, compared to cs where mechanics which have changed very gradually over the last ten years and continues to allows younger pros the 1 to 2 year period to learn these mechanics off by yheart and ease them into new updates keeping them upto date/better than the older pros due to their faster learning skills. Also dota is a much less reflex based game and more of a tactic based game, somewhere inbetween starcraft/warcraft 3 and cs/other fps'."" "
eRisk2023-T3_Subject26, b' ' , b'2018-07-22 01:12:09' , reddit post ," b""Not to neglect your argument but maybe it's because quake is not a very 'in'/hip esport to watch so all the players are the 'washed up' past pros who are now in their 30s because they were the young pros in their primes, csgo is much more proactive with much younger players. I'm only saying this because it is scientific fact that people between the ages of 16 and 25 have the best reflexes of their lives, it only declines from there on."" "
eRisk2023-T3_Subject26, b' ' , b'2018-07-04 22:09:09' , reddit post , b'I uhhhhhh.... ' 
eRisk2023-T3_Subject26, b' ' , b'2018-05-07 18:21:40' , reddit post , b'10x0.9=9x1?? Seems aight to me' 
eRisk2023-T3_Subject26, b' ' , b'2018-03-12 18:31:56' , reddit post ," b""If it's winter when the sun sets early and rises late there is not much difference between the look outside at 6pm or am"" "
eRisk2023-T3_Subject26, b' ' , b'2018-03-02 14:54:18' , reddit post ," b""Most RuG courses are set-up like this and most students get away with having a fun fulfilling uni life. I really wouldn't worry about it, although it may seem like alot it is pretty easy to find a balance between fun and study, student life in Gron is most definitely alive and well for good reason."" "
eRisk2023-T3_Subject26, b' ' , b'2018-01-20 20:26:40' , reddit post , b'The people of this subreddit seem to disagree ' 
eRisk2023-T3_Subject26, b' ' , b'2018-01-15 14:45:23' , reddit post ," b""I've been getting refused my 1 and 2 cent coins here in the Netherlands for a while now, cashiers are told not to take them, at least where I live. "" "
eRisk2023-T3_Subject26, b' ' , b'2018-01-04 19:22:28' , reddit post ," b""0.011% is not a 11/1000 chance, it's 1/100 * 11/1000 which is a 11/100000 chance\n\n"" "
eRisk2023-T3_Subject26, b' ' , b'2017-12-22 14:01:00' , reddit post ," b""Yeah, amazon is always happy to help customers, I've had multiple items returned out of warranty when they've broken just by asking nicely"" "
eRisk2023-T3_Subject26, b' ' , b'2017-12-22 05:13:36' , reddit post ," b'Depends when you bought it and what vendor you got it, I bought mine before the lawsuit from amazon and just had to message the amazon support chat, got my rebate in about 5 minutes ' "
eRisk2023-T3_Subject26, b' ' , b'2017-09-01 18:27:19' , reddit post , b'Yo-vig' 
eRisk2023-T3_Subject26, b' ' , b'2017-08-07 01:10:47' , reddit post ," b""That's only on the android app because snapchat uses an older camera api which doesnt give full control of the camera, Google has since released the camera2 API which allows proper recording/photos which snapchat refuses to implement. I'm pretty sure on iOS it is a proper recording and not just a screen cap"" "
eRisk2023-T3_Subject26, b' ' , b'2017-07-31 03:55:36' , reddit post ," b""Nitrous Oxide, laughing gas usually taken with a balloon, gives you a short but strong buzz. It's the same stuff they use to knock you out at the dentists and used to whip cream."" "
eRisk2023-T3_Subject26, b' ' , b'2017-07-27 01:58:59' , reddit post ," b""I think you've confused which axes is which"" "
eRisk2023-T3_Subject26, b' ' , b'2017-07-16 01:14:28' , reddit post ," b""It really isn't something strange in Britain/Ireland, I've been drinking between 6 and 10 cups of tea a day for the past few years"" "
eRisk2023-T3_Subject26, b' ' , b'2017-07-15 12:38:00' , reddit post ," b""[Instant noodles in a plastic pot, just add boiling water and boom you've got yourself a small meal/snack](https://upload.wikimedia.org/wikipedia/commons/thumb/4/45/Chicken_%26_Mushroom_Pot_Noodle.jpg/1200px-Chicken_%26_Mushroom_Pot_Noodle.jpg)"" "
eRisk2023-T3_Subject26, b' ' , b'2017-05-05 14:08:34' , reddit post , b'Rick and Morty' 
eRisk2023-T3_Subject26, b' ' , b'2017-02-27 04:17:27' , reddit post , b'if that 3k is a weird place like people can pull off some weird shit and win or you play against smurfs that either throw the game or win the game.' 
eRisk2023-T3_Subject26, b' ' , b'2017-01-25 15:10:40' , reddit post ," b""In DD1 on pc after wave 9 or higher of an insane survival map you get a chance to get 'super loot' which is loot with much higher stats then that map would usually give. The further into survival you go the better the super loot you will get and the more super loot you'll get"" "
eRisk2023-T3_Subject26, b' ' , b'2017-01-18 13:06:33' , reddit post ," b'In dd1, yes!' "
eRisk2023-T3_Subject26, b' ' , b'2016-12-12 13:08:45' , reddit post ," b""Before when you get a killing spree, double kill etc. your hero's minimap icon would show up by the text, now it is your hero's icon which is used at the top of the screen not the minimap icon"" "
eRisk2023-T3_Subject26, b' ' , b'2016-09-05 19:43:57' , reddit post ," b"">takin a shit and tellin ppl is tmi what im talking about is a natural thing\n\nIs shitting not a natural thing? Damn I've been living life wrong this whole time :/"" "
eRisk2023-T3_Subject26, b' ' , b'2016-08-04 03:09:00' , reddit post ," b'Nice one, really doing the community a solid with the giveaways bud, love to see new people come in wondering about the game' "
eRisk2023-T3_Subject26, b' ' , b'2016-08-02 03:43:13' , reddit post ," b'TP costs 75 mana not 50, other than that spot on' "
eRisk2023-T3_Subject26, b' ' , b'2016-07-30 15:44:52' , reddit post , b'Sorta ruins the whole point of the accept/decline mechanic to sift out afkers.\n\n^^^^^LUL' 
eRisk2023-T3_Subject26, b' ' , b'2016-07-28 02:55:59' , reddit post , b'TI Rigged by Valve confirmed' 
eRisk2023-T3_Subject26, b' ' , b'2016-07-17 05:21:36' , reddit post ," b""If you have a Hulu subscription you can watch it [here](http://www.hulu.com/112263), otherwise I'm honestly not too sure"" "
eRisk2023-T3_Subject26, b' ' , b'2016-07-17 04:33:16' , reddit post ," b""Yeah, the tl;dr of it is some guy finds a time portal which brings you to a date in the past a few years before jfk was assassinated and tells his friend (played by James Franco) about how he tried to stop the assassination and failed and asks Franco to try finish what he started. Pretty strange setting but makes for some interesting scenarios. It's only one season long and generally a decent show"" "
eRisk2023-T3_Subject26, b' ' , b'2016-07-17 03:50:12' , reddit post ," b""For anyone wondering this gif is from 112263, pretty good show if you're looking for one to watch.\n"" "
eRisk2023-T3_Subject26, b' ' , b'2016-07-10 16:47:22' , reddit post , b'http://www.dotabuff.com/players/96563457' 
eRisk2023-T3_Subject26, b' ' , b'2016-07-09 21:55:42' , reddit post ," b""No, if you deal 100 physical damage before reductions (armor) you will receive 100 physical damage before reductions. Deso increases damage after reductions by decreasing armor, you are still receiving and dealing 100 physical damage they are just taking more damage because they have less armor.\n tl;dr they take more damage you take the same damage as you would've without deso (ignoring bonus damage from deso)"" "
eRisk2023-T3_Subject26, b' ' , b'2016-07-03 03:55:45' , reddit post ," b""How do you know, results aren't out 'til August sucka :P"" "
eRisk2023-T3_Subject26, b' ' , b'2016-07-03 03:21:58' , reddit post , b'non-dutch speaker in NL club represent' 
eRisk2023-T3_Subject26, b' ' , b'2016-07-02 13:22:31' , reddit post ," b""Yeah, Ancient is meant to be used for promotional items only while Immortal just means that it is unobtainable from the game after release/ it's exclusive, at least that's how I've interpreted it"" "
eRisk2023-T3_Subject26, b' ' , b'2016-07-02 12:45:52' , reddit post ," b""I'm not sure where you got it being Ancient quality from but I'm pretty sure it is [Immortal Quality](https://imgur.com/dN6hzRN) and not Ancient"" "
eRisk2023-T3_Subject26, b' ' , b'2016-06-26 20:29:58' , reddit post , b'12\n' 
eRisk2023-T3_Subject26, b' ' , b'2016-06-26 15:24:47' , reddit post , b'Slick af' 
eRisk2023-T3_Subject26, b' ' , b'2016-06-25 00:16:56' , reddit post , b'Rekt' 
eRisk2023-T3_Subject26, b' ' , b'2016-06-14 16:47:21' , reddit post , b'> Movement speed slows are always percentage based. The percentage of multiple slow instances fully stack\n\n[Slows do stack fully until you hit 100 ms] (http://dota2.gamepedia.com/Slow)' 
eRisk2023-T3_Subject26, b' ' , b'2016-06-14 15:52:55' , reddit post ," b""Hey That's Pretty Good!"" "
eRisk2023-T3_Subject26, b' ' , b'2016-06-12 15:17:11' , reddit post , b'Phantom Assassin? She can evade 60 attacks with her passive easily then you just have to use phantom strike when you see a spell coming at you. The only problem I see with this challenge that would be difficult unless you were against enemies with choreographed projectile spells like Sven or CK ' 
eRisk2023-T3_Subject26, b' ' , b'2016-06-05 00:23:15' , reddit post ," b'Just realized who you were, used to watch your vids when I played LoL, you make some sound content ' "
eRisk2023-T3_Subject26, b' ' , b'2016-06-05 00:03:18' , reddit post ," b""Haha, same thing happened here, didn't stop the knackers from robbing the Tescos trolleys tho just forced people to donate to charity societies for them coin size metal things"" "
eRisk2023-T3_Subject26, b' ' , b'2016-06-04 18:42:17' , reddit post ," b""I'm from Ireland, I'm pretty sure it is called a Trolley in the UK too. What you linked was a picture of what I'd call a Tram not a Trolley"" "
eRisk2023-T3_Subject26, b' ' , b'2016-06-04 18:30:53' , reddit post , b'[Trolley](http://www.global-b2b-network.com/direct/dbimage/50292200/Shopping_Trolley.jpg)' 
eRisk2023-T3_Subject26, b' ' , b'2016-05-30 13:45:47' , reddit post , b'I have been enlightened\n>New Meta' 
eRisk2023-T3_Subject26, b' ' , b'2016-05-30 13:42:35' , reddit post , b'But how else am I supposed to steal my carries stacks fast enough for them to not notice? ^^/s' 
eRisk2023-T3_Subject26, b' ' , b'2016-05-30 13:39:59' , reddit post ," b""Wait you're telling me you don't steal your carries stacks with your ulti? No wonder I have been getting yelled at in indistinguishable Russian swears ._."" "
eRisk2023-T3_Subject26, b' ' , b'2016-05-21 15:02:25' , reddit post ," b'These keys are usually bought at a lower price in poorer countries like Russia or China, where the keys are sold at a subsidized price because of the lower disposable income. These keys are then sold at low profit margin to richer western countries for a lower price than retail.' "
eRisk2023-T3_Subject26, b' ' , b'2016-05-19 19:48:27' , reddit post ," b'We know that the universe is expanding, and the rate at which it is expanding is increasing, we do not know for sure but the prevailing theory is of dark energy. We know that it is accelerating because the second derivative of the cosmic scale factor is positive. This dark energy has negative pressure and causes all matter to be pushed apart. We still are not 100% sure of how it works. As for your analogy with the ball, the ball is going fastest when thrown upwards, once the ball is out of your hand the only forces acting on the ball are downwards. When the ball hits its max height it is at its slowest, 0 m/s, then begins to accelerate downwards due to gravity until it reaches back to where you threw it.' "
eRisk2023-T3_Subject26, b'When your hook game is weak but griefing is on point' , b'2016-05-14 21:59:07' , reddit post , b'' 
eRisk2023-T3_Subject26, b' ' , b'2016-04-02 06:05:04' , reddit post ," b""I don't know whether to trust this guide or not, this seems like your usual wacky guide that somehow works, but its April 1st. Why must you do this to me (sad emoticon)"" "
eRisk2023-T3_Subject26, b' ' , b'2016-03-11 15:31:13' , reddit post ," b""Yes but that 70% is the less than 1% of the Muslim community, by saying that Middle Eastern Muslims are not ok and that they are uneducated swathes is outright racist. You shouldn't discriminate against a social group based on a minority of that social group"" "
eRisk2023-T3_Subject26, b' ' , b'2016-03-11 15:23:34' , reddit post ," b'I know plenty of people from the Middle East who are good people and very few have negatively impacted society, assuming all muslims from Middle East are not fine is stereotyping and not wanting them in your country is discriminating, you are being blatantly racist by making those statements ' "
eRisk2023-T3_Subject26, b' ' , b'2015-12-01 21:56:30' , reddit post ," b""I hate to break it to you but there is no mindset that will instantly change you from a 2k to 3.2k+, if you have a 27.27% wr in 3.5k mmr there is no way you are really 3k. Best advice is just to slowly improve on your main, it may not seem like you are improving but if you compare your mmrs between a long period of time you will see an increase in skill even if it is only a few 100. The only way to make this go by faster is watching and analyzing your matches and watching informative youtubers, but since you said you do not have much time I assume you will have to take the slow crawl. I'm sorry but this is how most people do it too :("" "
eRisk2023-T3_Subject26, b' ' , b'2015-11-02 08:20:46' , reddit post ," b'Mek/Greaves heal do not stack,when you pop a mek heal everyone gets affected by a debuff which makes them ignore any other mek heals for the duration of the original mek cd' "
eRisk2023-T3_Subject26, b' ' , b'2015-10-30 21:24:15' , reddit post ," b'It is the old [Tizona](http://terraria.gamepedia.com/Tizona) skin from the console edition, before the 1.2 update it was just a reskin of the excaliber' "
eRisk2023-T3_Subject26," b'Just finished my first ever Arena with 12 wins, this is what I pulled' ", b'2015-09-02 20:39:28' , reddit post , b'http://puu.sh/jXE0d/dc923f770d.jpg' 
eRisk2023-T3_Subject26," b'Just finished my first arena with 12 wins, this is what I pulled' ", b'2015-09-02 20:28:12' , reddit post , b'' 
eRisk2023-T3_Subject26, b' ' , b'2015-08-07 01:58:17' , reddit post , b'3597' 
eRisk2023-T3_Subject26, b' ' , b'2015-08-04 19:31:54' , reddit post , b'IIRC only if you buy the pennant for the team you are watching\n\n' 
eRisk2023-T3_Subject26, b' ' , b'2015-07-02 22:03:00' , reddit post , b'T' 
eRisk2023-T3_Subject26, b' ' , b'2015-07-02 20:19:50' , reddit post , b'X' 
eRisk2023-T3_Subject26, b' ' , b'2015-05-26 20:46:41' , reddit post ," b'Still here, pressed without thinking :(' "
eRisk2023-T3_Subject26, b' ' , b'2015-05-25 21:09:18' , reddit post ," b'Armlet is a great item for ck, along with the bonuses ck gets with the toggling his illusions also get the 25 strength which is huge! CK with 2-4 illusions with an armlet on will do alot more dps, from about 50 dps to 400 dps (They do 100% of cks dmg!) and they get pretty tanky from it too as they take relatively low damage for illusions (200%). Just make sure to activate it before using Phantasm. If you really do not like armlet toggling you can probably still do well without one but you just wont be playing to cks best potential during the mid game.' "
eRisk2023-T3_Subject26," b""Why does mango have a stack count if it doesn't stack?"" ", b'2015-05-02 03:31:17' , reddit post ," b'Literally Unplayable, Please Fix Volvo' "
eRisk2023-T3_Subject26, b' ' , b'2015-04-30 21:17:33' , reddit post , b'Oh :(' 
eRisk2023-T3_Subject26, b' ' , b'2015-04-27 17:29:42' , reddit post ," b'Haha, lucky headshots ;P\n' "
eRisk2023-T3_Subject26, b' ' , b'2015-04-16 22:05:17' , reddit post ," b'Yes, the gamespy servers were taken down. Gamespy hosted both the PS3 and non-steam servers. Only Xbox and steam servers are up now' "
eRisk2023-T3_Subject26, b'How could I of won this game?' , b'2015-04-01 19:50:14' , reddit post ," b""http://www.dotabuff.com/matches/1366558440\n\n(I was windranger)\n\nI played this game where my team was extremely toxic only me and void were non-abusive, everyone kept yelling at each other for feeding, I felt I played mid well enough trying to harass mid, pulling off ganks but none the less the other lanes were feeding even after ganking them successfully, then invoker and axe started hunting chen in jungle where he also fed. Chen demanded he stay in jungle and that no one take his farm, we then got into a stand of mid for a good 10 minutes, my team kept going in one by one slowly feeding I wanted to push other lanes but my team kept complaining about how I should be there to help. At that point I was still doing well, I had lowest deaths and highest kill participation on my team, but when I tried to help fight my team I wouldn't be able to fight off the enemies fed invoker and axe, eventually it was us stuck in our base while they picked us off like flies and tried to wreck us by fountain. I just want to know how I could of helped to win."" "
eRisk2023-T3_Subject26, b' ' , b'2015-02-20 19:12:44' , reddit post , b'It feels like shrek is already here!\n' 
