ID,WRITING.TITLE,WRITING.DATE,WRITING.INFO,WRITING.TEXT
eRisk2023-T3_Subject9, b' ' , b'2022-10-18 07:05:27' , reddit post ," b'Function words are everything for this task, not the content words themselves as much.' "
eRisk2023-T3_Subject9, b' ' , b'2022-10-15 15:47:41' , reddit post ," b""I know some companies use existing modules for this such as FlairNLP, if you want an existing framework you can test this, but i'm not familiar enough to tell to what extent it will help with your use-case/out of domain data.\n\n  \nMaybe look into past work on the CoNLL 2003 task, which was NER. The task still has seen a lot of work over the years and model performance is summarized on the graph linked below. It should give you an overview of the SOTA approaches.\n\n[https://paperswithcode.com/sota/named-entity-recognition-ner-on-conll-2003](https://paperswithcode.com/sota/named-entity-recognition-ner-on-conll-2003)"" "
eRisk2023-T3_Subject9, b' ' , b'2022-10-15 14:45:16' , reddit post ," b""You are basically going to perform a Named Entity Recognition with your custom defined set of entities (quantity, and texture).\n\nThe first part comes with getting the entities, since you have a custom set, you're going to need to label some data to train a model, do you have access to such resources?\n\nIf I were you I would advice training a CRF model based on such labeled data, encoding it at setence level and adding some features to these sentence level encodings. For your particular case Part of Speech is extremely important since packages such as Spacy will already mark NUM which will help indicate when it is quantity. On the other hand, textures will should exclusively be proper nouns.\n\nI would also advise to use a pre-trained embedding model since your system will benefit of the additional vocabulary knowledge (especially with smaller training data sets)"" "
eRisk2023-T3_Subject9, b' ' , b'2022-10-15 11:59:12' , reddit post , b'Can you imagine changing the name of your child to inject a script into the government database? lol' 
eRisk2023-T3_Subject9, b' ' , b'2022-10-15 08:36:57' , reddit post ," b'USA en vrije wereld? Vgm mis je even dat de VS een oorlogsmacht is die een groot aantal landen uitbuit voor grondstoffen en continu met militaire macht dreigt en er ook tot in staat blijkt te zijn om dat te benuttigen,' "
eRisk2023-T3_Subject9, b' ' , b'2022-10-14 20:40:14' , reddit post ," b'You got to look for something called \'\'Societeiten"" often those are just venues up for rental.   \nStudent Association SSRA is right next to the melkweg and is a building with max cap of 400 peoples. They are able to rent out the location for a reasonable price on the weekends, just give em a call.\n\n[https://www.ssra.nl/societeit/verhuur/](https://www.ssra.nl/societeit/verhuur/)' "
eRisk2023-T3_Subject9, b' ' , b'2022-10-14 18:40:44' , reddit post , b'Hij veegt zn tranen weg met bankbiljetten' 
eRisk2023-T3_Subject9, b' ' , b'2022-10-14 18:36:01' , reddit post , b'Hans Niemann?' 
eRisk2023-T3_Subject9, b' ' , b'2022-10-10 16:41:40' , reddit post ," b""I'm not exactly sure what task you are trying to use this for, but I don't see how or why you would want to implement something like this into embeddings.\n\nSo lets say you are doing sentiment analysis, You can use existing taggers to identify 'very' as a modifier and heuristically modify its significance from there for proper nouns that use these adjectives or modifiers. Maybe identify similar words by clustering adjectives from the glove embeddings."" "
eRisk2023-T3_Subject9, b' ' , b'2022-10-05 20:04:05' , reddit post ," b'Het behalen van die doelstellingen, zoals geopperd door de VN en WEF, zal leiden tot een communistische wereldorde. Vgm bedoelen ze het zo.' "
eRisk2023-T3_Subject9, b' ' , b'2022-10-05 19:57:02' , reddit post ," b'Surveys don\'t reflect the marketplace. More and more online dating and the means through which competition manifests plays an important role that is not taken into account here. \n\nRule #1 of agenda setting theory: ""the agenda does not tell you what to think, but it tells you what to think about"".\n\nIf dating apps tell you that looks are important, than your selection process will become more oriented around this.' "
eRisk2023-T3_Subject9, b' ' , b'2022-09-30 17:55:21' , reddit post ," b'Wait, you guys are getting paid??' "
eRisk2023-T3_Subject9, b' ' , b'2022-09-28 19:51:38' , reddit post ," b'How do you do this similarity calculation now? I\'m not exactly sure what your current approach is. From what I am reading here you are just comparing vector similarity of the texts right? I think it might be a bit slow processing wise.\n\nIf I am understanding it correctly,\n\nThe user prompt is something like \'I want seconds"" and the prompt should return pages that contain something semantically similar?\n\nI would look into NLP tasks such as Semantic Role Labeling. This is often used for tasks such as question answering and text summarization. Matching predicate frames and argument roles with those of the target.' "
eRisk2023-T3_Subject9, b' ' , b'2022-09-24 11:05:44' , reddit post ," b'Yeah thats true, imo theres just a different distribution of day-to-day  costs for men and women, I eat approx 3x the amount on food in comparison to my gf to eat at maintenance. Granted, she spends more money on other things.\n\nYou also have to decide what outliers of these distributions are? I for example spend money on hair loss medication, I know there are also a lot of men that spend money on beard growth supplements etc, which are costs that women will not have. These costs could match, or outweigh the costs women make on beauty products? \n\nThe most fair approach imo is therefore to just split equally or build a relationship of trust around money, sometimes I will cover it, sometimes my gf will, thats just the most fair way of doing things imo. Though with food I do tend to cover considering its quite a lot lol.' "
eRisk2023-T3_Subject9, b' ' , b'2022-09-24 10:09:33' , reddit post ," b""To prepare? You shouldn't have to?"" "
eRisk2023-T3_Subject9, b' ' , b'2022-09-17 20:49:42' , reddit post ," b""Yeah its a pathing issue. Go to directory of where you are executing the py file and provide the path to the file you are trying to read from there, can honestly not help you there much further :l.\n\nAlso useFile.close() at the end, otherwise you don't properly close your file after opening. Or better, use a context manager\n\n    with open('file.txt') as File: # 'r' is default so can be omitted ;)\n        F = File.readlines()\n        print(F)\n\nThis way, after the indent, the file closes automatically"" "
eRisk2023-T3_Subject9, b' ' , b'2022-09-17 17:48:06' , reddit post ," b""Shes not your ex though? She said she wasn't looking for something serious before right?"" "
eRisk2023-T3_Subject9, b' ' , b'2022-09-17 16:52:19' , reddit post , b'The restaurant? Foods hella good there though' 
eRisk2023-T3_Subject9, b' ' , b'2022-09-17 16:32:10' , reddit post ," b'haha i just helped my gf move out today.   \nYeah they ask for a lot of bs fees, you can literally open the door at change= west without a pass, undersell you 2sq/m on a room.   \nTheres the two BOOS episodes you can check out' "
eRisk2023-T3_Subject9, b' ' , b'2022-09-16 20:43:24' , reddit post ," b'Tbh im not someone doing omad, i was considering trying it recently though and just did a trial yesterday to see whether it was worth trying for me. in my circumstances i would need to eat ~3k calories maintenance which i would guess is a bit more than this? \n\nI mean how much you should eat entirely depends on your weight, dietary/fitness goals, metabolism and bweight. So i honestly dont know if you should eat more :/' "
eRisk2023-T3_Subject9, b' ' , b'2022-09-16 19:50:04' , reddit post , b'How many kcal is that? That gets you through the day?' 
eRisk2023-T3_Subject9, b' ' , b'2022-09-10 10:48:28' , reddit post ," b'""waste"", what makes you use that word? Yes sometimes you can use expert level advice to get to your goal quicker, but everyone has a different amount of time to get there. And with time, eventually you will learn more along the way.  \n\n\nThings like handstand and planche movements are combinations of technique and skill, if you train strength in the right places then technique and muscle memory is all that you need, and as long as you are training and eating you are progressing in at least one of these areas, so there is no \'\'waste\'\' imo.' "
eRisk2023-T3_Subject9, b' ' , b'2022-09-10 10:35:11' , reddit post ," b""Still solid improvement imo. Don't really know what to tell you but hair isn't really a concern anymore."" "
eRisk2023-T3_Subject9, b' ' , b'2022-09-10 10:33:03' , reddit post ," b""Did for me. Only occurs in younger individuals due to role for DHT in brain development and yes it influences neurosteroids, where did you read it didn't?"" "
eRisk2023-T3_Subject9, b' ' , b'2022-09-03 15:26:00' , reddit post ," b""There are quite a bit of attempts done with emotion detection. Imo the hardest part for a good system is defining a set of emotions that you can deem ''detectable'' in journal entries. This is very important because my guess is that inter-annotator agreement for these tasks is typically very low, so humans already find it hard to agree on what emotion a text is manifesting.   \n\n\nspacytextblob is maybe an interesting library to look at? It will return some polarity and subjectivity scores, and maybe you can add some emotion thresholds to this.\n\nText2emotion is another one.  \n\n\n Maybe look at some of these libraries and see if you can train with your own data (since you want to focus on journal entries). Otherwise training from scratch with a pre-trained embedding model for vocabulary migth be the more fun option, though a lot more work to get it going nicely."" "
eRisk2023-T3_Subject9, b' ' , b'2022-09-03 13:12:32' , reddit post , b'postnatal abortion' 
eRisk2023-T3_Subject9, b' ' , b'2022-09-03 11:49:15' , reddit post ," b""Use a clustering algorithm like K-means and maybe select the spans or the words you're looking for with some heuristics and dependency parsing?"" "
eRisk2023-T3_Subject9, b' ' , b'2022-08-27 15:33:06' , reddit post ," b'Hahah interesting observation, I also noticed in my bisexual friend who was dating a guy that he found the things attractive that hes insecure about in himself, and I think the other dude was the same way. Its interesting how those dynamics work.' "
eRisk2023-T3_Subject9, b' ' , b'2022-08-27 14:05:44' , reddit post , b'Ban is lifted in ADA sports as far as im aware.' 
eRisk2023-T3_Subject9, b' ' , b'2022-08-27 14:03:14' , reddit post ," b'15 % higher e levels so in males: 35ng/dl becomes 40ng/dl. But also 13-15% increase in T which takes over the role of DHT though as you mentioned is less potent, so less aromatase inhibitory. Still the question of what amount of that is actually free, I found some literature disagreeing on that, but if you have low SHBG my guess is that there is still an increase in circulating T levels. \n\nAlso if we look at real world examples, male pseudohermaphrodites typically appear prebubescent, but seem more muscular than avg imo, theres that one old famous image with the three boys. Do with that interpretation as you will.' "
eRisk2023-T3_Subject9, b' ' , b'2022-08-20 21:21:41' , reddit post ," b'or take it 3x a week. Thats what im doing, literature says its 85% effective and I have good results so far.' "
eRisk2023-T3_Subject9, b' ' , b'2022-08-15 17:37:15' , reddit post , b'Yeah i got mine replaced after contacting jbl in the end thankfully' 
eRisk2023-T3_Subject9, b' ' , b'2022-08-06 10:10:17' , reddit post , b'Had some cognitive sides on 1mg a day and reduced to 1mg every 3 days which got rid of it' 
eRisk2023-T3_Subject9, b' ' , b'2022-08-06 10:09:45' , reddit post ," b'Not that i noticed it no, i think there were two periods in these 7 months where there was a bit more of a shed, one a little after a month i think, and the other one more recently' "
eRisk2023-T3_Subject9, b' ' , b'2022-08-06 01:42:55' , reddit post ," b'Right, i would say its almost nw2 now, but i dont want to be too optimistic' "
eRisk2023-T3_Subject9, b' ' , b'2022-08-06 01:29:16' , reddit post , b'I dont think i\xe2\x80\x99ve ever had the best hairline so i dont worry about it too much. There is some slight progress in that department but not as much as on the vertex area since the shit has had some time to die off before i noticed i had mpb \xf0\x9f\x98\x85' 
eRisk2023-T3_Subject9, b' ' , b'2022-08-06 01:22:49' , reddit post , b'I think it was about two weeks after starting fin that i noticed my hairs werent falling out as much.\n\nI think i had one or two shedding phases while on it but they werent very obvious or impactful.' 
eRisk2023-T3_Subject9, b' ' , b'2022-08-06 00:53:39' , reddit post ," b'Yeah i see what you mean with the brittle feel. Havent really thought of it actually, but it feels a lot thinner after use and makes my hair a lot lighter. theres like not much consistency in it after if you know what I mean. But as long as it contributes to less dht on scalp and acts as an antifungal/dandruff agent im fine with it.' "
eRisk2023-T3_Subject9, b' ' , b'2022-08-05 22:52:56' , reddit post , b'You\xe2\x80\x99d say theres no progress? I can definately tell its different' 
eRisk2023-T3_Subject9, b' ' , b'2022-08-05 13:43:57' , reddit post ," b'MPB is caused by excess DHT making it to the scalp which manifests as a thick kinda substance that clogs your hair sacks basically. Your blood supply then is not able to give these sacks the oxygen they need to grow, and your hairs will diffuse over time and fall out due to hypoxia.\n\nFinasteride tackles the problem by basically reducing total DHT by inhibiting the enzyme responsible for testosterone to DHT derivation in your body, therefore less thick hormone manifest gets in these sacks.\n\nMinoxidil tackles the problem of hypoxia specifically, basically forcing your body to work a bit harder to send more oxygen to the scalp.\n\nTo answer your question. Combination typically provides best results, however both can work on their own, just in different ways.' "
eRisk2023-T3_Subject9, b' ' , b'2022-08-05 12:46:45' , reddit post ," b'Hey guys, thought id share my progress here. Id like to say i was nw3v and luckily seeing the vertex go away :).  My regiment is fin 3x a week and ketaconazole 1x a week.' "
eRisk2023-T3_Subject9, b'Finasteride progress - February to Aug (7mo)' , b'2022-08-05 12:43:12' , reddit post , b'' 
eRisk2023-T3_Subject9, b' ' , b'2022-07-23 07:55:11' , reddit post ," b""I've met quite a few women that don't know this."" "
eRisk2023-T3_Subject9, b' ' , b'2022-07-23 07:51:43' , reddit post ," b'That women enjoy sex, i thought the moaning was because it hurt for the longest time (till I was like 14-15?). I had no idea why they wanted to put up with it.' "
eRisk2023-T3_Subject9, b' ' , b'2022-07-22 18:32:17' , reddit post ," b'Its the "";"" no?' "
eRisk2023-T3_Subject9, b' ' , b'2022-07-16 15:45:33' , reddit post ," b""I'm in the same boat. Just keep going as long as its fun for both of you and be open about your feelings and intentions to eachother."" "
eRisk2023-T3_Subject9, b' ' , b'2022-07-15 13:23:06' , reddit post , b'Ronnie en Tonnie' 
eRisk2023-T3_Subject9, b' ' , b'2022-07-10 15:22:47' , reddit post ," b""Yes its relevant if you're having sex **in a state where such a law applies.** \n\nLets not argue with strawman fallacies here, stick to the content of my posts please and be civil. I am not treating you with any kind of disrespect either."" "
eRisk2023-T3_Subject9, b' ' , b'2022-07-10 15:15:17' , reddit post , b'Not if they are doing so protected and live in a state where she can choose?' 
eRisk2023-T3_Subject9, b' ' , b'2022-07-10 14:55:57' , reddit post ," b""Yeah but OP is pro abortion on individual level as well right? Like the way I interpreted it is as if your friend has a situation like this, then OP agrees with her right to choose, though potentially overruling these laws at national level sets a precedent, raises another issue of state individualism which OP might disagree with (like i don't exactly know the political landscape here but i'm sure OP has some reason for his political views right?). Like i'm sure there are manners in which they could talk about this and compromise in some form. \n\nClearly by all the dislikes I am getting people don't see eye to eye with me on this but imo it wouldn't be that big of a deal. \n\nI had many moments in a past relationship where I had vastly different political views than my SO and we saw past it, really cherishing other, more important aspects that we saw eye to eye on and enjoyed in the relationship."" "
eRisk2023-T3_Subject9, b' ' , b'2022-07-10 14:43:37' , reddit post ," b"">ch, with economy and wealth that you think that\xe2\x80\x99s just\xe2\x80\xa6possible for all women? That\xe2\x80\x99s not even a mild issue that\xe2\x80\x99s a big issue, and if those women who cannot even pay to move out of state get pregnant, well then there\xe2\x80\x99s your real problem.\n\nlmao why are you guessing my political view on this front. I am pro-abortion myself (and not american) wtf. \n\nAs I said before, this is not neccesarily relevant for this relationship right? Like i literally said, 'unless they're planning to move somewhere' so my point still stands. \n\nTo elaborate and reason a bit with you here; you're absolutely correct, IF they were moving or living in a state where this is an issue, it would affect them. ELSE: not neccesarily relevant"" "
eRisk2023-T3_Subject9, b' ' , b'2022-07-10 14:35:36' , reddit post ," b""\\^ this is a dating advice sub and nothing you just commented had anything to do with the actual question at hand here, namely whether this influences their compatability as a 'couple'. Do you guys expect to see eye to eye on everything politically with a so? I'm not going to politically engage in this  since I don't even disagree at that front."" "
eRisk2023-T3_Subject9, b' ' , b'2022-07-10 14:30:27' , reddit post ," b""Then don't move to that state? I mean look i'm pro abortion myself, but for relationship compatability its not the biggest deal unless you two are planning to move somewhere where this is an issue."" "
eRisk2023-T3_Subject9, b' ' , b'2022-07-10 14:27:22' , reddit post ," b""This is a dating advice sub, for dating.... Why is it always on reddit that the moment something political gets mentioned, everything else is irrelevant and out the window. Lets note that i''m not advocating for or against any political view here myself (im also not american). Lets zoom out for a second and go over where they agree and disagree. \n\nAGREE:  \nOP: **But on a actual abortion issue I said a woman should have the choice**\n\nHER: **She went off on me stating women have full body autonomy**\n\nDISAGREE:\n\nOP: **she didn\xe2\x80\x99t like that I think the states should decide individually.**\n\nThere."" "
eRisk2023-T3_Subject9, b' ' , b'2022-07-10 14:09:44' , reddit post ," b'Isnt it irrelevant for this relationship though? Like lets be honest to ourselves and look at the essence here. They both agree that a woman should have the choice over their body, which is the only aspect that actually IS relevant in this relationship' "
eRisk2023-T3_Subject9, b' ' , b'2022-07-10 13:31:18' , reddit post ," b""Bruh something so small (you basically have the same view) and she broke up with you? Shes either clinically insane or doesn't care (maybe using it as an excuse for sth else?). Dodge the bullet and move on"" "
eRisk2023-T3_Subject9, b' ' , b'2022-07-10 11:56:36' , reddit post ," b'maybe like this, wrote this on the fly with no testing so be wary of mistakes, but just an idea.\n\n    import spacy # You want some NLP modules for detecting what is a word\n    \n    def compare_vocab(userinp):\n        nlp = spacy.load(\'en_core_web_sm\') # Loading the vocab\n        wordlist = set() # Put all the words in here\n        doc_objects = nlp(userinp)\n        vocab = {d.text for d in doc_objects} # Set with vocabulary as strings\n        to_annotate = {d for d in doc_objects if d in wordlist} # This you might look at to further optimise for speed (maybe compare with vector reps instead)\n        return to_annotate\n    \n    if __name__ == \'__main__\':\n        \'\'\'\'So here you can try and call it with a live-run which you can perhaps better do in the frontend, otherwise maybe mess with some while loops?\'\'\'\n        userinp = input(""Type input here"")\n        compare_vocab(userinp)' "
eRisk2023-T3_Subject9, b' ' , b'2022-07-10 11:24:04' , reddit post , b'Yes secret society is the way to go' 
eRisk2023-T3_Subject9, b' ' , b'2022-07-10 08:45:29' , reddit post ," b""    ~/Library/Group Containers/group.com.apple.notes/\n\n\\^Should be in this directory (according to old stackexchange [post](https://apple.stackexchange.com/questions/111633/where-do-my-notes-written-in-the-notes-application-on-my-mac-get-saved) related to el capitan) . Not sure what exactly you're trying to do with icloud implementation, but I guess its built-in auto updating should be enough."" "
eRisk2023-T3_Subject9, b' ' , b'2022-07-10 08:35:27' , reddit post ," b'Yeah you could do that.\n\n    def function1(file1, file2=False): \r\n    if not file2:\r\n        return file1\r\n    else:\r\n        return file1, file2' "
eRisk2023-T3_Subject9, b' ' , b'2022-07-10 08:30:22' , reddit post ," b'So the string ""a"" is truthy. You are basically checking whether ""a"" is True, and any non-empty string will be True, so it will always go in adding mode.  \n\n\nYour if statements should look more like  \n\n\n    if Addition_or_subtraction.lower().startswith(\'a\'):\n    elif Addition_or_subtraction.lower().startswith(\'s\')' "
eRisk2023-T3_Subject9, b' ' , b'2022-07-03 02:25:00' , reddit post , b'Should be 85% as effective in comparison to 1mg a day and will significantly reduce chance of sides. I had pretty severe brain fog on 1mg a day but do not have it with this lower dose.' 
eRisk2023-T3_Subject9, b' ' , b'2022-07-02 21:35:37' , reddit post , b'1mg 3x a week' 
eRisk2023-T3_Subject9, b' ' , b'2022-07-02 20:17:38' , reddit post ," b""What happened to the discussion that has been going on in this subs top post of all time. Isn't eating 5 apples every day the secret cure?"" "
eRisk2023-T3_Subject9, b' ' , b'2022-07-02 18:56:59' , reddit post ," b""Yeah, when I left my ex I also immediately shed quite a bit of fat. I think in general women and men eat differently and need to eat differently to attain a certain standard for body composition. Imo because women get away with eating a lot of shit food because they have better fat distribution than men; like it adding up to the buttocks or breasts, whereas in guys it  more typically adds to the face and stomach.  (Also unrelated: Another difference I think is variation? Might just be me but its not strange for me to eat the same dinner 5x a week, just because i like keeping things simple and because I can easily make a lot of it. for women I think because portions are typically smaller, they prefer more varied foods throughout the week.)\n\nYou gotta find someone thats supportive of your ambitions and doesn't hold you back while also compromising where you can. I mean you can basically eat a lot of 'healthy' junk and stay within calorie goals. Like 300kcal ice-cream exists and there is Greg Doucettes anabolic cookbook which makes for some good options."" "
eRisk2023-T3_Subject9, b' ' , b'2022-07-02 17:51:35' , reddit post ," b""Imo you're taking the wrong angle. He is confessing feeling to his ex, its not like they were going to end up dating again or it wouldn't be his ex. I think OP's goal with this post was to emotionally relieve himself, and help him direct a clear path forward, to which i'd argue, sound advice."" "
eRisk2023-T3_Subject9, b' ' , b'2022-07-02 15:37:51' , reddit post ," b""Only on fin since february, made up a lot of ground on my crown area. Completely filled up with hair now, and i'm so stoked to see whats to come :D"" "
eRisk2023-T3_Subject9, b' ' , b'2022-06-26 00:28:39' , reddit post ," b""My last relationship lasted two and a half years and I haven't had any pictures of me and her on social media. Granted she posted some after about a year or so, but for me its just not something I do since i'm quite private about my affectionate side in general. Has nothing to do with loyalty or cheating or such and shouldn't be a red flag in my opinion."" "
eRisk2023-T3_Subject9, b' ' , b'2022-06-25 11:43:54' , reddit post ," b""Gotta disagree with #4, some people don't want to bombard social media with that shit. People will know and figure it out with time usually, as a relatively quiet individual myself, i don't feel the need to share it with everyone."" "
eRisk2023-T3_Subject9, b' ' , b'2022-06-12 20:29:15' , reddit post , b'beast' 
eRisk2023-T3_Subject9, b' ' , b'2022-06-12 18:57:26' , reddit post ," b'Right, realised this just now' "
eRisk2023-T3_Subject9, b' ' , b'2022-06-12 18:47:26' , reddit post , b'There is a 710 now!' 
eRisk2023-T3_Subject9, b' ' , b'2022-06-12 18:45:21' , reddit post , b'Only thing comparable is soundboks 2' 
eRisk2023-T3_Subject9, b' ' , b'2022-06-10 19:43:31' , reddit post ," b'Imo its always going to be a mixed bag. You can\xe2\x80\x99t have everything at once. Also you\xe2\x80\x99re not going to lose progress from push in a week, you need atleast two weeks of not training to start getting noticeable performance drops.\nIf you also have a push goal, just focus that week on doing things like greasing the groove with handstands for example and improving the neurological pathways for those exercises, you will still progress.' "
