ID,WRITING.TITLE.Element:Text,WRITING.DATE,WRITING.INFO,WRITING.TEXT.Element:Text
eRisk2022-T3_Subject5,, 2021-11-21 21:08:25 , reddit post , I’m my experience they have. I’ve owned both the patent leather and suede boots and both stretched enough to be comfortable over time. 
eRisk2022-T3_Subject5,, 2021-11-21 07:49:15 , reddit post ," So different from other people here, I’d say go for the 6. I’m also a 6.5 and I always size down because I have narrow feet. The boots are always a bit uncomfortable on my toes the first few times I wear them, but stretch out nicely. When I try to wear 7s I find my feet slide too much to feel secure even with thick socks. "
eRisk2022-T3_Subject5,, 2021-11-20 01:38:03 , reddit post , Did you put onion in it too? It looks like onion slices on the baking sheet image. 
eRisk2022-T3_Subject5,, 2021-11-17 21:39:20 , reddit post , I’d cook down juice until it’s syrupy then add it to a sherbet base. I’ve done a similar thing with Concord grape juice and it turned out really well. I use 125 g of cooked-down juice in 385 g of base. 
eRisk2022-T3_Subject5,, 2021-11-08 04:23:57 , reddit post , She’s Not There by Jennifer Boylan is a good non-fiction read 
eRisk2022-T3_Subject5,, 2021-11-07 22:12:57 , reddit post , Have you tried a ballet bun secured with bobby pins? That’s what works for me with high impact movement. I do a high ponytail then twist it into a really tight ballet bun. I secure the bun with lots of bobby pins stabbed around the circumference of the bun. It holds when I do acrobatics and aerials now and when I used to do gymnastics. 
eRisk2022-T3_Subject5,, 2021-11-05 02:16:11 , reddit post , I definitely think a BHS step out is much easier than a two foot BHS or a round off. The landing is just so much nicer. Between 2 foot BHS and round off I found round off easier. 
eRisk2022-T3_Subject5,, 2021-11-05 01:26:59 , reddit post ," I’ve tried a couple of different things. One year I did a acorn squash stuffed with lentils, squash, and veggies. I’ve also done rosemary cannollini bean fritters (these were a big hit). "
eRisk2022-T3_Subject5,, 2021-10-29 22:55:56 , reddit post ," When adding melted chocolate you want to do it slowly, while running the machine so you end up with little stratiacelli flecks instead of seizing. I also prefer to thin it with coconut oil. "
eRisk2022-T3_Subject5,, 2021-10-23 06:54:21 , reddit post , Rosemary with sea salt dark chocolate 
eRisk2022-T3_Subject5,, 2021-10-23 06:52:51 , reddit post , Salted caramel ice cream with an apple butter swirl? 
eRisk2022-T3_Subject5,, 2021-10-22 18:10:42 , reddit post , Trader Joe’s Thai Chili and Morningstar Black Bean 
eRisk2022-T3_Subject5,, 2021-10-22 02:28:59 , reddit post ," I’m in the US and did gymnastics through college and never heard anyone call them pit boogers until Gymcastic. No one even talked about it. It’s like chalk, just kind of expected. "
eRisk2022-T3_Subject5,, 2021-10-20 23:11:51 , reddit post ," Tacos. I’ve made really good vegetarian tacos, but it’s just not the same as the ones I ate growing up. "
eRisk2022-T3_Subject5,, 2021-10-16 17:36:16 , reddit post , It looks like a [Zhang](https://balancebeamsituation.com/stoop-over-zhang/?amp=1) 
eRisk2022-T3_Subject5,, 2021-10-13 07:04:24 , reddit post ," October 18-19 Qualifications

October 21 WAG All Around Finals

October 23 WAG Vault, Uneven Bars

October 24 WAG Beam, Floor "
eRisk2022-T3_Subject5,, 2021-10-13 06:58:14 , reddit post , There’s only a closed hip form in the code of points. It’s a B. 
eRisk2022-T3_Subject5,, 2021-10-12 07:23:45 , reddit post ," I fry up some onions in butter then add drained sauerkraut, 1-2 allspice berries, 1 clove, 1 bay leaf, fresh ground black pepper, lightly crushed caraway seeds, a pinch of sugar, and a little bit (~1/4-1/2 c) veggie broth. Braise on low until the liquid is gone (~10 minutes). I either top with potato noodles or serve as a side dish to German potato salad or linsen mit spätzle. "
eRisk2022-T3_Subject5,, 2021-10-10 18:07:06 , reddit post , I use 2 gram lecithin for ~900 g of base. I use the same brand of lecithin as you. 
eRisk2022-T3_Subject5,, 2021-10-10 08:13:20 , reddit post ," I think it’s less that I wasn’t ready for certain books so much as the way they were taught. I feel like I’m school we were expected to over-analyze books to the point that they weren’t enjoyable or useful anymore. I went through a period my freshman year of college (engineering major, so no English classes involved) where I read classic books as part of a personal desire to read more complex  literary novels and it was much more enjoyable. Also, I surprisingly got a lot more out of the books when I wasn’t forced to dissect them ad nauseam. "
eRisk2022-T3_Subject5,, 2021-10-05 19:15:57 , reddit post , Oryx and Crake trilogy by Margaret Atwood 
eRisk2022-T3_Subject5,, 2021-09-21 16:47:18 , reddit post , It’s definitely person to person so I thought I’d offer! We have several lesbian women at my studio. Pole and circus in general tend to have more queer people in the community. 
eRisk2022-T3_Subject5,, 2021-09-21 16:24:26 , reddit post ," If you’re interested in pole dance and aerial arts it’s a great way to build up your upper body, specifically shoulders and lats. "
eRisk2022-T3_Subject5,, 2021-09-18 02:12:51 , reddit post ," 1. I just freeze it all at once. Repeated freeze thaw cycles don’t seem to hurt it since it’s liquid.  Just make sure you give it a good stir before you use it.

2. Depends on the recipe, but usually about 125 grams for 500 grams of ice cream total (about a pint). So I’ll use ~125 g fruit purée and ~375 g ice cream or sherbet base.

3. Yes, I personally don’t like frozen banana chunks. Also it won’t churn well with chunks. If you want to add mix ins it’s better to stir them in after you churn. If you want to use the banana chunks as a mix in I’d make an extra that you can add in at the end. So basically make double the roasted banana: half to steep in the base and discard, half to use as a mix-in at the end. You can also purée the banana and add it to the base, but the extra starches can change the ice cream texture. I’ve personally never tried that, but there are plenty of recipes that use the purée method. "
eRisk2022-T3_Subject5,, 2021-09-17 23:59:32 , reddit post ," I make simple cooked fruit purées with in season fruits then freeze them to use in ice cream throughout the year. My basic method is to peel/chop/mash the fruit, simmer about 10 minutes on the stove, purée, then strain out the seeds and pulp.

For all fruits except banana I add the purée at the time of churning. Just whisk it into your base right before you churn. For banana I like to do the steep overnight method: cook the base, add banana chunks to cooked base and refrigerate overnight. The next morning strain out the banana chunks and churn the ice cream. "
eRisk2022-T3_Subject5,, 2021-09-10 08:02:58 , reddit post , Morningstar black bean patties 
eRisk2022-T3_Subject5,, 2021-09-04 19:20:24 , reddit post ," This looks really neat! I’ve always wanted to try a Dutch oven for bread baking, but never got around to buying one. "
eRisk2022-T3_Subject5,, 2021-09-02 03:03:16 , reddit post ," I mean you can, but liability waivers don’t always hold up in court. I personally wouldn’t feel comfortable. Have you considered seeing if you could do private lessons at off hours when there’s no one else in the gym? "
eRisk2022-T3_Subject5,, 2021-09-01 22:48:42 , reddit post ," Seconding what the other poster said. As a former gymnastics coach and current aerial arts instructor I would never agree to spot in a backyard. In addition to the obvious safety and equipment concerns, you also have insurance concerns. Gyms will have liability insurance that protects covers their employees in case you get injured while learning from them in the gym. That’s not going to cover backyard coaching. "
eRisk2022-T3_Subject5,, 2021-08-30 06:25:49 , reddit post ," Powder pb is not a good solution. I’ve tried that before and it was bad.

I’ve made great peanut butter ice cream by adding 80 g (~5 Tbspoon) of peanut butter to 1 pint of ice cream base. "
eRisk2022-T3_Subject5,, 2021-08-29 23:18:46 , reddit post ," Does the studio actually penalize other students who are late? If they’re unevenly enforcing the rule, and you’ve been affected by that, then feel free to complain to the management about it, but if anyone who’s late still gets let in, or you’ve never been locked out for being late, it’s not really your place to complain.

As an instructor, yes I prefer my students to be on time, but I’d be really bothered if a student tried to complain about other student’s tardiness on my behalf. It’s really none of their business. Shit happens, as long as you aren’t disruptive when you come in and you take a few extra minutes to fully warm up in it’s not a big deal.

The monopolizing teacher time is tricky. I feel like you can try to talk to your instructor about this, but the chances that they can do anything about it are minimal. Part of this is that the instructor needs to set expectations about when is appropriate to ask for feedback (i.e. if I’m watching or spotting someone else, don’t interrupt me. If a student does interrupt I usually say something like “I’m watching X right now. I’ll help you next.” To highlight that they need to wait.) Also sometimes the instructor knows the student is annoying to others, but can’t really do anything about it since they aren’t doing anything unsafe. As for asking other advanced students to teach her, unless she asks you, it’s not your problem. Either the instructor will address it if it bothers them, or the students she’s asking can bring it up with the instructor. "
eRisk2022-T3_Subject5,, 2021-08-25 20:10:17 , reddit post ," You can half recipes, as long as the amount isn’t too small. I have the 1.5 qt freezer bowl Cuisinart ice cream maker and I regularly make 1 pint amounts. It churns fine, the churn time is about the same as churning a full batch, maybe 5 min less? Just keep an eye on it and you’ll be fine. "
eRisk2022-T3_Subject5,, 2021-08-25 02:29:05 , reddit post , But Simone was in the team this year? And she’s not doing NCAA. 
eRisk2022-T3_Subject5,, 2021-08-24 22:20:47 , reddit post , I mean it’s better than than the random front tuck before a tumbling pass 
eRisk2022-T3_Subject5,, 2021-08-24 07:39:16 , reddit post ," I vote for Kohei, his winning streak is phenomenal. However, the one thing that the MAG contenders don’t seem have that Simone does is innovation of new skills. Simone really pushed the boundaries of WAG with 4 named skills (plus the unnamed yurchenko double pike). As far as I’m aware Kohei didn’t create any new skills and Scherbo only has one. "
eRisk2022-T3_Subject5,, 2021-08-21 01:40:06 , reddit post ," I had oral surgery earlier this year. Other than soups here’s some of what I ate.

Dal or other red lentil dishes cook down really mushy

Baked sweet potatoes mashed with butter

Applesauce

Pudding

Nutrition shakes (Boost, Ensure, etc) honestly these were the best for me when I was on the go. Super portable and a good balance of protein and nutrients "
eRisk2022-T3_Subject5,, 2021-08-19 16:17:39 , reddit post ," Agreed. I’ve made good grape ice cream by buying good Concord grape juice, cooking it down to make a syrup, and adding that to my base. "
eRisk2022-T3_Subject5,, 2021-08-17 18:20:18 , reddit post ," Nothing super hard for me, I pretty much maxed out at E skills.


Vault- Yurchenko layout 1/2 (4.2)

Bars- double front dismount (E)

Beam- back layout 2 feet (E)

Floor- triple full (E) I trained more E skills (double front, double Arabian, full twisting double back) on tumble track too, but the 3/1 was the only skill that made it to the real floor


I also trained more unusual bars skills that aren’t necessarily hard, but were more uncommon like a Khorkina release and a toe-on front dismount. "
eRisk2022-T3_Subject5,, 2021-08-11 07:56:45 , reddit post ," The 100 year old man who climbed out the window and disappeared

The protagonist isn’t female, but he is elderly and the novel is lighthearted. "
eRisk2022-T3_Subject5,, 2021-08-11 07:17:05 , reddit post ," Either a mount bonus on beam and bars, maybe for C+? Or a requirement that the mount be counted as one of the 8 D value skills.

Get rid of the E cap on bars transitions.

Allow controlled lunges on floor.

Upgrade forward tumbling passes. Downgrade Silvias.

Double the vault deductions instead of continuing to lower the start values. I’m not sure if this is the best way to fix the vault E score problems, since you’d still have the problem of not enough differentiation between scores, but it seems more reasonable than lowering the D score every quad. "
eRisk2022-T3_Subject5,, 2021-08-09 04:00:16 , reddit post ," I’d recommend looking for local pole dance, aerial, or circus schools. All three should offer flexibility classes. Eventually you can move on to contortion classes which work on tricks at the more extreme ranges of flexibility. You can also look for flow arts (fire dancing, poi, hoop dancing) which are similar to the apparatus manipulation in rhythmic gymnastics. I’ve never seen flow arts classes in my area, it seems to be a more community-based thing with jams advertised on Facebook groups or through word of mouth in the circus community. Your local circus schools might be able to direct you to some good resources if you’re interested in that.

Also as a former gymnast turned pole dancer I totally recommend trying pole. "
eRisk2022-T3_Subject5,, 2021-08-06 07:27:31 , reddit post , Do you have Whole Foods near you? Mine has a bunch of veggie options. 
eRisk2022-T3_Subject5,, 2021-08-06 07:25:59 , reddit post , Their Thai Chili burgers are excellent 
eRisk2022-T3_Subject5,, 2021-08-06 00:19:01 , reddit post ," I love barbecue chickpeas. Simply sautée some onion, toss in a can of chickpeas and some watered down BBQ sauce and cook until the glaze is thick. My omni boyfriend loves it too.

Tempeh is also a great meat substitute. It has a nice mild nutty flavor and good texture. I’ve marinated it to make “bacon” (doesn’t really taste like bacon, but has a similar smokiness). Barbecue marinated tempeh is also good. I really like to cook it in Asian recipes in place of meat. It goes great with sweet and sour.

Another good substitute is lentils. I make a red lentil cacciatore and a green lentil fesenjoon.

Barbecue cauliflower is also a classic. I do it the lazy way where you just steam the cauliflower in the microwave and dip it in the sauce.

For Mexican style dishes I usually use beans as a substitute. I made great tacos the other day with red onion, broad beans, spices, lime, and cilantro. Black beans and pinto beans are of course the classic go-tos. "
eRisk2022-T3_Subject5,, 2021-08-03 23:39:24 , reddit post ," I’m not a huge fan of tofu as a chicken replacement. It’s too bland and squishy. I use either tempeh, chickpeas, or lentils depending on the recipe. "
eRisk2022-T3_Subject5,, 2021-07-31 00:06:55 , reddit post , I think it’s called a Wenson 
eRisk2022-T3_Subject5,, 2021-07-31 00:00:57 , reddit post , Her second pass was just gorgeous! 
eRisk2022-T3_Subject5,, 2021-07-30 01:14:58 , reddit post , So I could do a press from my feet but not from stalder. It’s not really necessary to have bc when you do a straddle cast on bars you use momentum to get up and the only other time people use press handstands is for beam mounts and there’s plenty of other options. 
eRisk2022-T3_Subject5,, 2021-07-29 21:16:41 , reddit post ," In my personal experience, pretty far. I didn’t have natural talent but made it to NCAA as a walk-on (not at a top school obviously). I couldn’t climb a rope without legs until I was 13, didn’t get my press handstand until I was 21. My flexibility wasn’t great, but I worked really hard at it and eventually achieved moderate oversplits on both sides. It’s really about the effort you put into it. Of course, I could never have made it to elite or even a good NCAA team. At that level you need talent and hard work, but level 10/mediocre college team? Totally achievable. "
eRisk2022-T3_Subject5,, 2021-07-08 04:38:33 , reddit post , This is great😂 
eRisk2022-T3_Subject5, Toes on pointe heels? , 2021-07-06 22:21:07 , reddit post ," Has anyone here ordered from toes on pointe? How is the quality and fit? I love that they let you customize your style and material, but I don’t want to order without knowing more since they’re pretty pricey. "
eRisk2022-T3_Subject5,, 2021-07-02 03:13:49 , reddit post , Ah all my gyms were in the Southwest. I wonder if it’s regional 
eRisk2022-T3_Subject5,, 2021-07-02 02:32:03 , reddit post ," Yeah I agree, line-ups aren’t abnormal. It just seems like an easy way to get everyone to pay attention to any last minute remarks at the end of practice. Most of the gyms I went to did that, but the chant is odd. One of the gyms I went to required you hug the coaches before you left which didn’t bother me bother me at the time, but looking back it seems not okay. "
eRisk2022-T3_Subject5,, 2021-07-02 02:27:12 , reddit post ," Interesting, what area of the country were you in? I moved a lot as a kid, so I went to 6 different gyms and only 1 of them didn’t do line-ups. Some of them only did it at the beginning and not at the end, but most of them did it at least once. "
eRisk2022-T3_Subject5,, 2021-06-28 01:04:38 , reddit post , I honestly have no idea. I saw these results on gymter.net 
eRisk2022-T3_Subject5,, 2021-06-27 16:22:38 , reddit post ," WAG: Vault-Jade Carey, Bars-Fan Yilin, Beam-Ashikawa Urara, Floor-Vanessa Ferrari

MAG: Floor-Rayderley Zapata, Pommel Horse-Kameyama Kohei, Rings-Eleftherios Petrounias, Vault-Shin Jea-hwan, Parallel Bars-You Hao, High Bar-Epke Zonderland "
eRisk2022-T3_Subject5,, 2021-06-26 07:52:09 , reddit post , Check out balance beam situation or the gymternet. They both live blogged the meet. 
eRisk2022-T3_Subject5,, 2021-06-13 18:51:34 , reddit post , In gymnastics usually you jump off your non-dominant leg for a regular split leap so you hit your dominant split. So it would have the same problem for connecting to an aerial as a switch leap. 
eRisk2022-T3_Subject5,, 2021-06-08 22:09:54 , reddit post ," China and Russia have 4+2 for both WAG and MAG, or at least China will after the Apparatus World Cup Series concludes. Russia’s +2 are both non-nominative, so they aren’t tied to a specific athlete. I think Japan MAG could possibly get a second +1 after Doha, but I haven’t kept up with the rankings/tie breaking procedures very well. "
eRisk2022-T3_Subject5,, 2021-06-02 21:48:15 , reddit post , The Maruchan soy sauce flavor where I live (USA) is not vegetarian. It contains beef broth/flavoring. 
eRisk2022-T3_Subject5,, 2021-06-01 19:57:33 , reddit post , The Ghost Bride by Yangsze Choo 
eRisk2022-T3_Subject5,, 2021-05-31 03:59:31 , reddit post , I competed in college and loved it and I still think NCAA is boring to watch. It’s really only fun when you’re doing it IMO. I’m glad it has a fan base though because I want gymnasts to have the opportunity to participate in college gymnastics. 
eRisk2022-T3_Subject5,, 2021-05-31 03:53:53 , reddit post , I totally agree on the leotard thing. It always makes me a bit uncomfortable the way unitards are pushed. There’s nothing wrong with preferring a leotard. 
eRisk2022-T3_Subject5,, 2021-05-27 03:20:24 , reddit post ," I like the Dr. Praeger’s California Veggie Burger. I just tried the new cauliflower ones tonight and they’re decent too.

I also like the Morningstar Spicy Black Bean Burger, Trader Joe’s Thai Chili Burger, and Hilary’s World’s Best Veggie Burger

None of these taste like fake meat, they all taste like veggies, beans, grains. "
eRisk2022-T3_Subject5,, 2021-05-21 08:12:27 , reddit post , Love China Mievelle (not sure I’d define him as sci-fi though) and Ted Chiang. I definitely second those recommendations! 
eRisk2022-T3_Subject5,, 2021-05-15 05:40:09 , reddit post ," I still like pricier store ice cream like Talenti, Jeni’s, or McConnell’s. I just can’t justify paying for it anymore unless it’s a flavor that takes too much work. "
eRisk2022-T3_Subject5,, 2021-05-14 06:41:23 , reddit post , Glycerin is more for body grip than hand grip. It’s super good if you have dry skin. 
eRisk2022-T3_Subject5,, 2021-05-11 08:15:50 , reddit post , Look for circus schools instead of gymnastics gyms! They’re more likely to offer adult trampoline classes than gymnastics gyms. 
eRisk2022-T3_Subject5,, 2021-04-29 20:12:18 , reddit post ," I haven’t tried it, so I’m not 100% sure if it’s good, but bodyandpole online has classes from Roz the Diva. She’s excellent for plus size poling. "
eRisk2022-T3_Subject5,, 2021-04-15 22:29:34 , reddit post ," As a non-religious person who did gymnastics in Texas, yes. You just kind of stand there. Thankfully my college team wasn’t religious. "
eRisk2022-T3_Subject5,, 2021-03-16 07:08:06 , reddit post , Everything I’ve made from this website turns out wonderful. https://www.vegrecipesofindia.com/paneer-tikka-masala-recipe/#wprm-recipe-container-139656 
eRisk2022-T3_Subject5, Short Story Collections like Ted Chiang , 2021-03-06 06:04:49 , reddit post , I just finished Stories of Your Life and Others and Exhalation by Ted Chiang. I’m interested in reading other short story collections that have a similar feel. 
eRisk2022-T3_Subject5,, 2021-02-25 06:33:52 , reddit post , I was so sad to learn this. My mom had always used it growing up and I wanted to make cornbread that reminded me of childhood:( 
eRisk2022-T3_Subject5,, 2021-02-11 01:48:56 , reddit post , McCarthy’s writing style drives me insane. I have to force myself to finish his books. 
eRisk2022-T3_Subject5,, 2021-02-11 01:46:42 , reddit post , Same. I feel like the writing wasn’t great and the story wasn’t good enough to make up for the poor writing. 
eRisk2022-T3_Subject5,, 2021-01-05 18:45:59 , reddit post ," Bail

Bail 1.5

Straddle Back

Bhardwaj

Ezhova

Zuchold-Schleudern "
eRisk2022-T3_Subject5,, 2020-10-03 01:56:48 , reddit post , I love her hop full too! I wish gymnasts still did those 
eRisk2022-T3_Subject5,, 2020-10-03 00:58:38 , reddit post , Would you mind sharing the recipes for all of the dishes? 
eRisk2022-T3_Subject5,, 2020-08-18 01:34:23 , reddit post ," The matching leos was definitely Kurt Thomas. I trained with several people who left that gym. And no, it’s not common practice at all. "
eRisk2022-T3_Subject5,, 2020-08-14 05:57:50 , reddit post ," I’m not surprised about Marcus at all. It’s really disappointing because he used to be a good coach before he moved to Texas Dreams (at least in my experience, I can’t speak for anyone else). I actually moved to the gym he was at before Texas Dreams to get away from a verbally and emotionally abusive coach. I remember being surprised that he actually let people rest injuries at that gym. It was just such a different experience for me. Unfortunately, that gym shut down, so he moved to Texas Dreams. I went to Texas Dreams for the first month he was there and he just changed. Way more yelling and excessively tough conditioning/practice assignments. It’s like he was trying to prove something to the Texas Dreams coaches. It sounds like he’s just gotten worse since then. "
eRisk2022-T3_Subject5,, 2020-08-07 06:08:34 , reddit post , I thought it was the yurchenko double back that Martha nixed. 
eRisk2022-T3_Subject5,, 2020-08-07 00:07:19 , reddit post ," Top two:
Trader Joe’s Thai Sweet Chili Burger

Morningstar Spicy Black Bean Burger

Also good:
Dr. Praeger’s California Veggie Burger

Hilary’s World’s Best Veggie Burger "
eRisk2022-T3_Subject5,, 2020-07-20 19:32:57 , reddit post , Lye is definitely the secret. The first couple of times I made pretzels I tried the baking soda bath and I could never get them dark enough. With the lye bath they turn out perfectly browned and chewy. 
eRisk2022-T3_Subject5,, 2020-07-17 22:40:00 , reddit post , Cleo is okay. It fits true to size and it’s cheap for a pole wear brand. I don’t love their materials though. I feel like the shorts are too thin. I feel a bit too exposed in their stuff because of it. A lot of the nicer polewear brands either double line the shorts or use a thicker material. 
eRisk2022-T3_Subject5,, 2020-06-07 03:06:21 , reddit post , Leggings are good for hoop 
eRisk2022-T3_Subject5,, 2020-05-17 20:54:15 , reddit post ," I use my regular base plus 2.5 g (~1/2 tsp) of cake batter extract and 2.5 g vanilla extract per pint. The cake batter extract I use is from Baker flavors, so I’m not sure how the potency compares. You could start with 1 g and taste as you go. After churning I stir in sprinkles. Sometimes I’ll add a buttercream swirl if I’m feeling extra fancy. For the buttercream swirl I replace some of the sugar with glucose syrup so it stays a softer. "
eRisk2022-T3_Subject5,, 2020-05-09 15:12:36 , reddit post , Shaylah Scott at Illinois is 5’9” 
eRisk2022-T3_Subject5,, 2020-04-25 19:53:04 , reddit post , That could work if you use extra water. I don’t use any water in my base. I find the fruit purée has enough water on it’s own. 
eRisk2022-T3_Subject5,, 2020-04-25 17:48:08 , reddit post ," I’d be worried about it having a salty flavor, but I’ve also never done a veggie sorbet. "
