ID,WRITING.TITLE.Element:Text,WRITING.DATE,WRITING.INFO,WRITING.TEXT.Element:Text
eRisk2022-T3_Subject5,, 2018-06-20 20:55:16 , reddit post ," Nike Pro 3” or Lululemon Wundershort 2”

With the Nike pros be careful of color. White and yellow are NOT squat proof. The lululemon shorts are a bit thicker so all of the colors are squat proof. I own I white pair that’s totally opaque :). As for which I’d recommend overall, it depends what fit you prefer. The lululemon shorts have more compression, which can get a bit annoying at times, but they’re also less likely to ride up your butt.  "
eRisk2022-T3_Subject5,, 2018-06-19 17:02:48 , reddit post , Cobbler!  
eRisk2022-T3_Subject5,, 2018-06-19 16:56:55 , reddit post ," Lifting is definitely not necessary for pole. The best strength building for pole is more pole. Does your studio offer pole conditioning classes? Those can be helpful. If you have a pole at home you can practice pole crunches and pole climbs to build more strength (deadlifts, no legs climb, circus climb too if you’re advanced). Pilates could be good for core. Also anything gymnastics based would be good. "
eRisk2022-T3_Subject5,, 2018-06-14 15:37:24 , reddit post ," I like solid colored bottoms, cut in cheeky bikini style. Brazilian style are fine too. Full crotch coverage is a must. I really like the scrunch butt style; it’s more flattering than a flat back and I find it is less likely to give me a wedgie. My biggest complaint is sizing. I have narrow hips, but my butt is normal sized, so I find that while shorts fit in the butt, they tend to be a loose around the hips which is uncomfortable. Also some brands don’t even sell an XS size.

For tops my biggest concern is whether my nipples show. I want padding (not like crazy push-up padding, but just enough to prevent exposure) like in swimsuits. Just double lining is not enough. I don’t like things around my neck, so high neck tops are out (but they are really cute). I usually work out in a sports bra or a bra style top. "
eRisk2022-T3_Subject5,, 2018-06-13 14:25:41 , reddit post , Looks like the work of [Vyacheslav Mishchenko](http://minicanvas.vmishchenko.com). 
eRisk2022-T3_Subject5,, 2018-06-08 16:49:32 , reddit post , I liked Carrion Comfort 
eRisk2022-T3_Subject5,, 2018-06-05 02:09:04 , reddit post , Neverwhere by Neil Gaiman 
eRisk2022-T3_Subject5,, 2018-06-04 21:30:31 , reddit post ," Pesto

Lutenica (it’s a spicy veggie relish)

[This Indian sandwich recipe](http://foodviva.com/snacks-recipes/veg-masala-toast-sandwich/) (a bit involved but good!)

Edamame/carrots/avocado/other veggies "
eRisk2022-T3_Subject5,, 2018-06-04 21:16:07 , reddit post ," I like Tite Grip but I find that my hands are so sweaty that I sweat through that too. It works the best of anything I’ve tried, just have to reapply every ten min or so. "
eRisk2022-T3_Subject5,, 2018-06-03 18:34:17 , reddit post , What did you make the succulents out of? 
eRisk2022-T3_Subject5,, 2018-06-01 18:31:10 , reddit post , Recipe? That sounds wonderful! 
eRisk2022-T3_Subject5,, 2018-05-24 06:29:56 , reddit post , I can pm you a video if you can’t find it. 
eRisk2022-T3_Subject5,, 2018-05-24 00:41:20 , reddit post ," I think standard grip (also called true grip or split grip) is the best for learning. In twisted grip you just kind of hang off your shoulder, so you don’t really build strength as well. Standard grip is also more secure feeling than cup grip.

As a side note, it is possible to handspring into an elbow ayesha. I like elbow grip ayesha, but the balance and body positioning feels different than standard/twisted/cup grip ayesha. The other three feel pretty much the same in terms of body angle.

There’s also football grip but that one is a lot different. "
eRisk2022-T3_Subject5,, 2018-05-16 21:50:11 , reddit post ," If you don’t like Quest bars some other ones with similar nutritional content are No Cow bars, Combat Crunch, Oh Yeah One bars, Nugo Slim, and FitJoy. I’m not a big fan of Fin Joy/Quest/Oh Yeah (too sweet and artificial. I LOVE the Nugo Slim Raspberry flavor and the cinnamon Combat Crunch is really good too. I really like the No Cow bars, they’re very different than the typical protein bar. "
eRisk2022-T3_Subject5,, 2018-05-14 22:07:22 , reddit post , Yes this is a cartwheel. Try not to tap your foot on the pole when you flip though! As for 1-10 scales I’m really bad at those...I found it to be a not so hard skill. Easier than a true grip deadlift. 
eRisk2022-T3_Subject5,, 2018-05-09 06:50:04 , reddit post , Yep! Still together. 
eRisk2022-T3_Subject5,, 2018-05-08 23:17:20 , reddit post ," I mean for uncontrollable bleeding (granted from my leg, not from my ass) I had my boyfriend carry me into the hospital. It was only two blocks away and we were broke college students so he walked. "
eRisk2022-T3_Subject5,, 2018-05-08 06:46:24 , reddit post ," No cow (Amazon, Vitamin Shoppe, GNC)

Square (Whole Foods, PCC, Vitamin Shoppe, Square Organics website)

Nugo Slim (Whole Foods, PCC, Nugo website)

Lenny and Larry’s (Vitamin Shoppe, GNC, also at a lot of grocery stores and gas stations) "
eRisk2022-T3_Subject5,, 2018-04-14 07:18:36 , reddit post , Soups are good 
eRisk2022-T3_Subject5,, 2018-04-14 07:15:40 , reddit post , The Bell Jar 
eRisk2022-T3_Subject5,, 2018-04-03 16:08:18 , reddit post , Godsmack and Opeth are good for workout 
eRisk2022-T3_Subject5,, 2018-03-27 01:24:50 , reddit post , Anorexia isn’t a choice. It’s a mental illness. Saying someone can choose to be anorexic is like  people choose to be depressed or choose to have cancer. 
eRisk2022-T3_Subject5,, 2018-03-18 20:52:20 , reddit post , How’s the texture of TVP? I have some but I’m scared to use it because I have a strong dislike of certain textures. I don’t like tofu or things with meaty textures. 
eRisk2022-T3_Subject5,, 2018-03-03 16:47:15 , reddit post ," Quest Nutrition: Salted Caramel, Banana, Strawberry, Vanilla or Peanut Butter

Eat the Bear: Cinnamon Bun

Optimum Nutrition: Key Lime Pie

Jay Robb: Piña Colada
 "
eRisk2022-T3_Subject5,, 2018-02-28 23:07:21 , reddit post ," Oh that’s a tough one...I think that some of these people are genuine and some aren’t. Eating disorders are complex since they’re caused by a mix of genetics and environmental factors, so everyone has different things that work for them. I think it’s possible that some of these people made the choice to go vegan for the wrong reasons then later managed to recover in spite of initial choosing it as a socially acceptable way to restrict. I also tend to think that even if someone is only partially recovered, it’s better than nothing. I’m also hesitant to write it off as not true recovery because I did some unorthodox things to recover myself. I actually found it helpful to weigh myself during weight restoration, since my during my ED I wasn’t actively trying to lose weight and I don’t have issues with body dysmorphia. However, I would never recommend that to someone else because it could be really harmful. I guess that’s what bothers me about the whole vegan diet cures ED thing...sure it may work for a few people, but the majority of ED sufferers will be harmed by that type of restriction. "
eRisk2022-T3_Subject5,, 2018-02-28 21:19:48 , reddit post ," I used to feel really guilty about this. I still do sometimes, but I recognize that it’s not a good idea for me to be vegan. I have an eating disorder history, and while vegetarianism is fine for me, veganism is too restrictive for me and ends up leading to an increase in ED thoughts and symptoms.

I do what I can while protecting my own health. For example, I actually prefer soy milk and almond milk to cows milk, so that’s what I drink. I eat vegan protein bars because I like them just as much as normal ones, so I don’t feel like I’m depriving myself. "
eRisk2022-T3_Subject5,, 2018-02-21 16:47:27 , reddit post ," I went to get water, so I was gone about a minute. I left my stuff at the rack and my weights were on the bar, but when I came back to guys were unracking my weight. Due the proximity of the water fountain to the weight rack they must’ve rushed in as soon as I turned my back. They acted really offended when I told them I was using it, and they just left my weights on the floor. "
eRisk2022-T3_Subject5,, 2018-02-20 16:08:06 , reddit post , Okay then any of these will be a good choice! I don’t like any of the burgers with a meaty flavor or texture. The Amy’s and Morningstar Black Bean ones only mimic meat in the sense that you can cook them on the grill like a real burger without them falling apart. 
eRisk2022-T3_Subject5,, 2018-02-20 00:21:34 , reddit post ," Trader Joe’s Thai Chili veggie burger

Morningstar Spicy Black Bean Burger

Amy’s All American Veggie Burger

The Morningstar and Amy’s burgers have a heartier texture and can hold up to grilling. The Trader Joe’s one’s don’t really mimic a meat burger, but they’re super good! My nonv-vegetarian boyfriend loves them, and even his mother (who hates all vegetarian burgers on principle) agreed they were good. "
eRisk2022-T3_Subject5,, 2018-02-16 22:46:48 , reddit post ," Deceptively hard: Ayesha, Fonji (way easier than I expected)

Deceptively easy: Cupid...my nemesis move "
eRisk2022-T3_Subject5,, 2018-02-15 21:14:05 , reddit post ," No need to stir. I weigh portions because 29 grams always ends up being less than the two tablespoons. I typically pre portion mine and roll it into balls, so I can just grab a cookie dough ball as a quick snack. "
eRisk2022-T3_Subject5,, 2018-02-15 20:22:48 , reddit post ," Seconding this, but I don’t size up. I especially wouldn’t for aerial, since you want your clothes to be tight. "
eRisk2022-T3_Subject5,, 2018-02-13 05:56:12 , reddit post ," PSO! https://www.polesportorg.com

They have a bunch of levels ranging from level 1 (no inverts) to professional. There’s also different categories depending on what kind of style you prefer for your routine. Competitions are all over the US, plus one in Canada and one in Europe, so you can hopefully find one close to you!

Edit: Tips

1. Relax! Remember that you’re doing this for fun, so don’t take it too seriously and stress yourself out.

2. Start early. I like much prefer to have time to run my full piece and get endurance up in the weeks immediately prior to competition/showcase rather than finishing it last minute. You’ll feel more comfortable if you’ve done it a million times before you get on the stage.

3. You don’t have to do every trick you know. Pick ones that you like, go well with the music, and make interesting combos. I had to take one of my favorite combos out of my last routine because it just wasn’t flowing with the music and that’s okay, my routine was better for it.

4. Pick a song you really like AND feel like you can dance to. There’s songs I enjoy and then there’s the songs I enjoy that are pole-able. Pick one that fits your dance style.

5. Get other people to critique your routine, especially if there’s people at your studio who’ve competed or judged before. Outside perspective helps a lot.

6. Film your run throughs, even if it’s just free styling to your song. It helps to know if that move you think looks really cool in your head is actually super awkward. "
eRisk2022-T3_Subject5,, 2018-02-11 22:23:49 , reddit post ," I think so, given that I usually wear a 6 1/2 in street shoes and the 6 is a little too small. "
eRisk2022-T3_Subject5,, 2018-02-11 20:02:54 , reddit post ," My first pair was open toe regular heels. They fit fairly well. My toes were super close to the edge but not hanging over.

I’m looking into getting open toe boots because I really like the look of boots plus the ankle support is way better. "
eRisk2022-T3_Subject5,, 2018-02-11 19:38:58 , reddit post ," My advice is to order from somewhere that does free shipping/returns. There’s a lot of options on Amazon with this option. I’m also a 6 1/2 and I sized down for my first pair. For my second pair I got boots, and thank god for free returns! The 7s were too big, to the point where they felt unsafe, but the 6s were so tight that they hurt my toes. I went with the 6 (and after 3 months they’re still way too small :( ), so I definitely recommend trying sizes. I also recommend the open toe heels over boots for 1/2 size people. There’s more flexibility in sizing. "
eRisk2022-T3_Subject5,, 2018-02-09 20:57:06 , reddit post ," The Expanse by James S A Corey

Grey characters, fantastic world building, multiple POVs, long, will actually probably be finished! Not “supernatural” in the usual sense but there’s some stuff that is pretty equivalent (don’t want to give anything away). "
eRisk2022-T3_Subject5,, 2018-02-08 23:36:55 , reddit post , Where??? 
eRisk2022-T3_Subject5,, 2018-02-05 23:31:37 , reddit post , Yep it’s jello here. 
eRisk2022-T3_Subject5,, 2018-02-05 23:30:51 , reddit post ," Yeah I mean American Jelly/Jam. Most are made with pectin, so veggie friendly! "
eRisk2022-T3_Subject5,, 2018-02-05 18:05:20 , reddit post , I like the Quest Unflavored. It’s not milky which I find tends to be a problem with a lot of other brands. 
eRisk2022-T3_Subject5,, 2018-02-05 18:03:53 , reddit post ," So the brand of soy milk I use has 11 g of protein per cup. I have a glass with breakfast which is pb and fruit. I snack on trail mix (little bit of protein in the nuts and seeds) and protein bars. I get over 30 grams of protein at my night snack by mixing 8oz of soymilk with 1 scoop of protein powder (mine have 21-25g per scoop). I also like to have nuts/seeds and a little bit of ice cream for another 3-4g protein. Between the milk, protein shake, nuts, and protein bar I don’t really have to cram my regular meals with protein unless I want to.

Bars I like: No cow (20-22g protein)

PowerCrunch (13-14 g)

Square (10-12 g)

Simply Protein (15-16g)

Nugo Slim (16-18g)

Kind Strong (10 g)

Protein Powders:
Quest Nutrition(salted caramel is my favorite, but I like all the flavors except chocolate)

Eat the bear (cinnamon bun)

Jay Robb (anything but strawberry or chocolate... they suck)

Optimum Nutrition (key lime pie rocks!)

Soy milk: Eden Soy Organic Original Soy Milk Extra (it’s fortified with extra vitamins) "
eRisk2022-T3_Subject5,, 2018-02-05 17:46:35 , reddit post ," Peanut butter (or other nut/seed butter) and jelly or honey

Avocado, could also add hummus and veggies to up the calories more

Pesto and veggies "
eRisk2022-T3_Subject5,, 2018-02-03 20:32:51 , reddit post ," In a serious relationship with a meat eater. It’s totally fine. When we cook together we do vegetarian dishes and when we go out to eat he asks if I want to share before ordering. If I want to share dishes he’ll order vegetarian, if not he’ll pick whatever. It’s no big deal.  "
eRisk2022-T3_Subject5,, 2018-02-03 01:31:56 , reddit post , Thanks for this! I’m only 5’1” so this is definitely the kind of setup I need! 
eRisk2022-T3_Subject5,, 2018-02-02 23:05:41 , reddit post , I am quite small so that’s probably the problem. It’s too bad bc I feel like glute bridges target my glutes more than hip thrusts. 
eRisk2022-T3_Subject5,, 2018-02-02 22:41:31 , reddit post ," Dedicated cardio. I hate it, and it’s boring. I ride a bike to work, admittedly at a slow pace, but I find that enjoyable and that’s enough cardio for me. I can’t stand HIIT or anything on the cardio machines and I despise running. I’d rather spend my workout time doing something I enjoy. "
eRisk2022-T3_Subject5,, 2018-02-02 22:26:21 , reddit post , How do you use a normal barbell for glute bridges? I can only get up to 110lbs (highest fixed weight barbell) bc if I use regular plates/barbell the bar is too high off the ground for me to get much out of the exercise. 
eRisk2022-T3_Subject5,, 2018-02-01 02:01:27 , reddit post , You could use powered peanut butter. It has more protein too. 
eRisk2022-T3_Subject5,, 2018-01-31 02:43:21 , reddit post , Numi dry desert lime tea 
eRisk2022-T3_Subject5,, 2018-01-28 19:57:01 , reddit post , @isis_diamond is awesome! 
eRisk2022-T3_Subject5,, 2018-01-28 04:25:48 , reddit post ," Not sure if it’s what you’re looking for, but I would suggest pole fitness or aerial arts. Technically it’s body weight training, but it’s not the same thing as doing pull-ups and push-ups. "
eRisk2022-T3_Subject5,, 2018-01-27 05:59:13 , reddit post ," Yes, I was a gymnast from the time I was 6 until I was 19. I had to quit midway through college due to illness. I was a bit for lost for awhile. I’d grown up in the sport and didn’t know what to do with myself anymore. After I got better I started yoga (a very handstand and arm balance heavy yoga lol) and then started pole dancing when I was twenty. Pole let me get back into the world of acrobatics and I absolutely love it. Still, it took me over a year to be able to say “I’m a pole dancer” instead of “I’m a gymnast.” It had nothing to do with the stigma of pole. I had no problem telling people I poled and posted it all over Instagram, but it took me forever to get over the identity of gymnast. Now I’m identifying more as a pole dancer and I’ve started circus partner acro and contortion, but I still sometimes miss being a gymnast (although being able to flip off the pole and do handstands on a person makes me miss it less). "
eRisk2022-T3_Subject5,, 2018-01-24 21:48:59 , reddit post ," Brand: Nuts N More, tie between birthday cake flavor and Chocolate Maple Pretzel (but I honestly adore all the flavors)

For non-Protein pb I really like the cinnamon raisin PB and Co

For plain pb I like Trader Joe’s crunchy

Best way to eat: on fruit

If I couldn’t have pb I’d eat pumpkin seed butter "
eRisk2022-T3_Subject5,, 2018-01-10 21:25:23 , reddit post ," I like Quest(100-110cals, 21-23g protein depending on flavor). Mix with unsweetened almond milk. It adds ~30 cal but definitely worth the improvement in taste vs mixing with water. Quest protein mixes up thicker, so it’s more shake like. "
eRisk2022-T3_Subject5,, 2018-01-05 18:57:09 , reddit post ," Facial expression and audience engagement go a long way. You can have great moves but if you look bored, self conscious, or like you’re concentrating it’s not sexy. As for style, I don’t find a specific style more sexy, just do what feels right to you. Whether it’s Russian exotic or twerking, it always looks better if you enjoy the style and get into the movement. For people to follow, I actually mostly follow people from my studio (instructors and students that I admire), so I don’t really feel comfortable linking that here bc privacy. For more famous people I like Olga Koda and Quan Bui. "
eRisk2022-T3_Subject5,, 2018-01-05 17:57:53 , reddit post ," Amy’s All-American Veggie Burger

Trader Joe’s Thai Chili Burger

Dr. Praegers, any flavor (I like California Veggie)

Trader Joe’s Quinoa Cowboy Burger

Morningstar Black Bean Burger "
eRisk2022-T3_Subject5,, 2018-01-05 17:55:38 , reddit post , Also the Trader Joe’s Thai Chili Burger 
eRisk2022-T3_Subject5,, 2018-01-03 17:09:29 , reddit post ," Jay Robb Vanilla

Quest Vanilla Milkshake "
eRisk2022-T3_Subject5,, 2018-01-02 16:29:02 , reddit post , 11/22/63! It’s my favorite 
eRisk2022-T3_Subject5,, 2017-12-22 21:28:05 , reddit post ," I don’t have one but my boyfriend does. He trained for around a 6 months I think. To start you’ll definitely want to up the number of regular pull-ups you can do, aim for 10+. You’ll also want to start working weighted pull-ups. He said he had to get to the point where he could do 3 pull-ups with an extra 110lbs before he got a one arm (he weighs 160 so ~ 2/3 body weight). You’ll also want to start training negatives: pull-up 2 arms, take one arm off and lower down as slow as possible.

Good luck! Side note: weighted pull-ups by themselves aren’t enough, you definitely need to work the one arm negatives. I can do weighted pull-ups with 1/2 my body weight but can’t do a one arm pull-up. "
eRisk2022-T3_Subject5,, 2017-12-22 07:10:19 , reddit post , Oh god my cat is like this. She’ll only eat Purina and they changed the recipe within the last year to add in some squishy lighter kibble with the original hard pieces and now she only eats half her food. She goes completely avoids the newer stuff. 
eRisk2022-T3_Subject5,, 2017-12-21 16:08:15 , reddit post ," I’m not sure, I just sprinkle it on like salt/pepper until it tastes good. "
eRisk2022-T3_Subject5,, 2017-12-21 07:01:18 , reddit post ," Black beans and broccoli

Garam Masala Powder

Butter and salt "
eRisk2022-T3_Subject5,, 2017-12-20 22:35:51 , reddit post ," Mint is pretty similar in macros (5f,17c,18p) and is the best of the vegan ones imo. "
eRisk2022-T3_Subject5,, 2017-12-20 21:18:20 , reddit post ," I tried the chips...wasn’t a fan, but I really like the bars. If you want chips try [Protes](https://eatprotes.com). The zesty nacho and bbq flavors are my favorite. "
eRisk2022-T3_Subject5,, 2017-12-20 21:16:48 , reddit post ," The mint, coconut, and crunchy pb ones are all vegan and have 16-18 grams of protein! I really like the mint one (and miss the raspberry, it used to be my favorite). "
eRisk2022-T3_Subject5,, 2017-12-09 00:24:27 , reddit post , Thanks! It looks really good. 
eRisk2022-T3_Subject5,, 2017-12-08 18:56:48 , reddit post , Is that just mashed sweet potato with onions? Any spices? 
eRisk2022-T3_Subject5, Substitute for seitan in meatloaf recipe? , 2017-12-06 21:41:12 , reddit post ," I make a vegetarian meatloaf that I absolutely love. It’s very simple, just ground seitan, sautéed onions and garlic, tomato sauce, egg, and spices. However my stomach can’t handle seitan very well. Every time I eat it I get massively bloated...like six months pregnant. I was wondering what the best replacement would be in this type of recipe? "
eRisk2022-T3_Subject5,, 2017-12-02 21:04:26 , reddit post , Oh that sounds wonderful! I used to love the ikea meatballs. 
eRisk2022-T3_Subject5, Best meatless meatballs? , 2017-12-02 20:10:59 , reddit post ," I’m looking for a meatball alternative that tastes good, has good texture (but NOT meaty texture), and is reasonably high in protein. I’ve tried making my own, but most of the recipes I find are too low in protein. For store brands I’ve tried the Whole Foods 365 brand but they tasted too much like real meat.

I’ve seen Nate’s, Gardein, and Trader Joe’s brands at my stores. Has anyone tried these? I’m also open to looking for other brands or making homemade. "
eRisk2022-T3_Subject5,, 2017-12-01 21:04:56 , reddit post , Honestly I still wear shorts without shaving. 
eRisk2022-T3_Subject5,, 2017-11-20 22:09:40 , reddit post ," Seconding Orgain. It doesn’t have the gross earthy after taste that Vega, Sunwarrior, and Garden of Life have. "
eRisk2022-T3_Subject5,, 2017-11-12 18:15:32 , reddit post , Quest Nutrition and Protes also make really good protein chips. 
eRisk2022-T3_Subject5,, 2017-11-03 19:13:58 , reddit post , I like clear straps bc they feel tighter on my foot. Leather stretches out more in my experience. I prefer the clear straps because they give me a more secure fit. 
eRisk2022-T3_Subject5,, 2017-10-31 19:43:23 , reddit post ," I’ve never been big into cardio, but I have traded weightlifting for acrobatics/calisthenics. I did gymnastics for 13 years, quit midway through college due to life shit. I picked up weightlifting a few months after I quit with some yoga on the side to keep up with my flexibility and handstand strength. About a year and a half ago I found pole dancing which totally satisfies my acrobatic side, so I’ve lowered the amount of time I lift so I can pole more. I also recently started partner acrobatics, so I dropped another day of lifting to accommodate that.

Pros: acrobatics and pole is way more fun imo, learning new tricks is a lot more satisfying than increasing weight. Plus, I can compete at pole and actually enjoy it.

Cons: my butt is no longer getting bigger. When I was weightlifting more my butt grew a lot, but now I’ve just been maintaining it. "
eRisk2022-T3_Subject5,, 2017-10-21 18:09:40 , reddit post , This is me every year. Even before I was vegetarian I didn’t like turkey. 
eRisk2022-T3_Subject5,, 2017-10-19 18:53:58 , reddit post , I use bulk supplaments BCAA (not sure if it’s available in UK). It’s unflavored so I mix it with water and stur flavor drops. 
eRisk2022-T3_Subject5,, 2017-10-17 18:43:04 , reddit post ," His Dark Materials trilogy, specifically the last book "
eRisk2022-T3_Subject5,, 2017-10-10 01:26:51 , reddit post , Either complete inversion into a caterpillar climb or a shoulder mount flip to your feet (like rolling over your shoulder so you end up on the other side of the poll). 
eRisk2022-T3_Subject5,, 2017-10-10 01:09:48 , reddit post , Shoulder mount from sitting 
eRisk2022-T3_Subject5,, 2017-10-08 01:35:35 , reddit post , I just got it! 
eRisk2022-T3_Subject5,, 2017-10-06 17:40:04 , reddit post , I really liked the Maximum Ride series at her age. It kinda goes downhill after the first three books. But the first three are fantastic. 
eRisk2022-T3_Subject5,, 2017-10-03 23:05:06 , reddit post ," Nut butter+fruit with soy milk

Some of my favorite combos:

Apple/pb

Blueberries/almond butter

Mango/sunflower seed butter

Peaches/cinnamon raisin pb

I get bored of the same taste but I like the convenience of this breakfast, so I just vary the fruit/nut butter choice each day. I eat it on the go so I chop the fruit and coat in lemon juice the night before. For the soy milk I use a reusable bottle, but you can buy the single serving ones too. It’s a good low volume-high nutrient density breakfast. Plus the soy milk I buy has 11g of protein per cup. "
eRisk2022-T3_Subject5,, 2017-10-03 20:31:51 , reddit post , Like 9 or 10. 
