ID,WRITING.TITLE,WRITING.DATE,WRITING.INFO,WRITING.TEXT
eRisk2023-T3_Subject26, b' ' , b'2022-09-11 12:01:28' , reddit post , b'Anti matter does not have negative mass nor negative energy. \n\nAnti-matter is a consequence of conserved quantum numbers and relativistic quantum vacuum energies. The idea is generally credited to insights by Dirac.' 
eRisk2023-T3_Subject26, b' ' , b'2022-08-11 18:37:33' , reddit post ," b'The expansion of space into itself was mathematically described in Einstein\xe2\x80\x99s Theory of General Relativity and experimentally shown by Hubble\xe2\x80\x99s discovery of Hubble\xe2\x80\x99s Law/expansion. \n\nYou are conflating ideas of inflaton theory, which discusses very early universe rapid expansion/pre Big Bang multi-bubble universes spawning from a hypothetical inflaton field. The inflaton field is complete conjecture and is unproven, not the expansion of space into itself.' "
eRisk2023-T3_Subject26, b' ' , b'2022-07-12 00:22:57' , reddit post ," b'I have only glanced through the paper so I may be missing parts. It means that the entire \xe2\x80\x9cpassage\xe2\x80\x9d processing portion of the model is trained separately on its own task. Once this is trained the passage model is frozen and the rest of the architecture is trained without changing the passage encoder (but still generating and using its outputs for each input). The opposite of freezing the passage encoder would be try to train both the passage and question models at the same time, this CAN create a more adaptable model but comes at the cost of \xe2\x80\x9cmuddying\xe2\x80\x9d the training process where both the passage and question portion are changing their representations to better fit one another rather than just the question model training itself to work well using a preexisting predictable function which creates decent passage representations' "
eRisk2023-T3_Subject26, b' ' , b'2022-07-11 22:37:46' , reddit post , b'Freezing means not updating the weights of that portion of the model during training/not training a portion of the model' 
eRisk2023-T3_Subject26, b' ' , b'2022-06-28 13:38:36' , reddit post ," b'Cartesian coordinates? (x,y,z relative to an arbitrary origin of your choice 0,0,0) or more similar to longitude,latitude radial/spherical coordinates (r,theta,phi with r being distance theta and phi being angular measurements similar to lat-long)' "
eRisk2023-T3_Subject26, b' ' , b'2022-06-04 19:17:41' , reddit post ," b'Any calorie intake is turned into fat if unused whether it be a carb, fat or protein. Yes it takes ~2g of sugar/carbs for 1g of bodyweight fat, otherwise you\xe2\x80\x99d be breaking conservation of energy by transforming 4 calories into 9. Mass is not conserved in partial chemical reactions, the calories in the sugar get condensed into fats while the excess mass is shed in the form of energetically neutral by-products and excess heat.' "
eRisk2023-T3_Subject26, b' ' , b'2022-04-25 13:20:09' , reddit post ," b'I\xe2\x80\x99ve always titled the graph as a log-log, linear-log or log-linear graph (depending on which axes you transform) and denoting the correct axes as having a log scale (i.e. [variable] (log10 scale))' "
eRisk2023-T3_Subject26, b' ' , b'2021-12-16 08:47:35' , reddit post ," b'You are correct, on their home page https://tilda.tcd.ie/ it says \xe2\x80\x9cThe Irish LongituDinal Study on Ageing (TILDA)\xe2\x80\x9d' "
eRisk2023-T3_Subject26, b' ' , b'2021-12-11 14:51:04' , reddit post ," b'He has multiple sets of used mediums (used during free practice) to use in the race, not just the ones he flat spotted' "
eRisk2023-T3_Subject26, b' ' , b'2021-11-26 17:30:09' , reddit post , b'It\xe2\x80\x99s an app called WOMBO Dream' 
eRisk2023-T3_Subject26, b' ' , b'2021-11-19 10:00:04' , reddit post ," b'The determinant of a matrix is a common operation in linear algebra, Pearson product correlation coefficient is also know as the pearson r value. I would assume you must find the determinant of your matrix to find this value. The closer a determinant of a coefficient matrix is to 1, the less correlated the variables are (the determinant is equal to 1 only if all correlations are 0, corresponding to all diagonal entries of the matrix being equal to 1 aka only correlated with themselves). I would suggest you look into the mathematical definition of a determinant and the ways people have interpreted this particular determinant within statistics to get a better interpretation yourself' "
eRisk2023-T3_Subject26, b' ' , b'2021-10-23 02:36:55' , reddit post ," b'Anything floating on the surface of water being pushed around by waves faster than the wave itself would be considered negative wave drag, the interesting fact here is that the combination of ducklings lining up correctly and the mother moving is an energy efficient way to use waves generated by forward motion to help the baby ducks out.' "
eRisk2023-T3_Subject26, b' ' , b'2021-10-23 01:03:34' , reddit post ," b'No problem! One clarifying thing though, according to the source paper they are feeling a negative total drag, their mother is effectively dragging them along in her wake as long as they are in the correct positions in a line. The ducklings are actively thrusted forward by the total drag force, all they have to do is get to speed with their mother and then they would naturally find themselves at an equilibrium with their mothers+siblings motion(they would need to course correct to not fall out of the wake though). If they were rougher/less hydrophobic the viscous force could dominate but this is not the case.' "
eRisk2023-T3_Subject26, b' ' , b'2021-10-23 00:05:39' , reddit post ," b'There are two main components of drag for vessels on a liquid: wave drag and viscous drag; viscous drag is the drag one would think of in aerodynamics, the act of the trying to push through the viscosity of a fluid. Wave drag is the force felt by \xe2\x80\x9criding the waves\xe2\x80\x9d of the liquid, the force that allows surfers to surf along with a wave. Ducks minimize viscous drag by having hydrophobic feathers and ducklings can naturally be propelled towards their mother by \xe2\x80\x9criding\xe2\x80\x9d the wake of her motion on top of the water. In still water total drag would be in the opposite direction of motion but the mother is supplying a wake which allows the ducklings to get in a formation where each are \xe2\x80\x9criding\xe2\x80\x9d the wave and passing it back to their siblings to ride too, propelling them all forward, this would be an example of \xe2\x80\x9cnegative\xe2\x80\x9d total drag aka >100% drag reduction.' "
eRisk2023-T3_Subject26, b' ' , b'2021-10-22 23:21:45' , reddit post ," b'It actually is negative drag, the ducklings ride down the trough of the wave produced by the mother duck. From the abstract of the source paper:\n\xe2\x80\x9cWhen a duckling swims at the \xe2\x80\x98sweet point\xe2\x80\x99 behind its mother, a destructive wave interference phenomenon occurs and the wave drag of the duckling turns positive, pushing the duckling forward.\xe2\x80\x9d' "
eRisk2023-T3_Subject26, b' ' , b'2021-10-06 08:29:36' , reddit post ," b'I see what you mean and but leads me to asking: If the system is dominantly interacting with the frequencies of the wind which cause resonance, would this not be called resonance? For example if I had the classic driven harmonic oscillator but with multiple different frequency driving forces, one being near the resonant frequency, we would see the system dominantly interacting with the resonant force; the existence of the other driving forces would not suggest this is not an example of resonance, using your semantic argument I feel like we would need to call this another phenomenon completely even though the qualities and principles are near identical to resonance.' "
eRisk2023-T3_Subject26, b' ' , b'2021-10-05 22:57:48' , reddit post ," b'From the paper you linked: \n\n\xe2\x80\x9cCould this be called a resonant phenomenon? It would appear not to contradict the qualitative definition of resonance quoted earlier, if we now identify the source of the periodic impulses as self-induced, the wind supplying the power, and the motion supplying the power-tapping mechanism. If one wishes to argue, however, that it was a case of externally forced linear resonance, the mathematical distinction between Eqs. (1) and (3) is quite clear, self-excited systems differing strongly enough from ordinary linear resonant ones. The texts we have consulted have not gone this far in explanation.\xe2\x80\x9d\n\nThey agree that flutter wrt Tacoma is a qualitative resonance effect, all they are saying is that textbooks tend to give a more basic reasoning related to driven harmonic resonance rather than the true but more complicated explanation, which requires looking into the fluid dynamics of the entire system. This is a critique of over simplification not a misclassification of resonance?' "
eRisk2023-T3_Subject26, b' ' , b'2021-10-05 22:35:52' , reddit post , b'Yeah I saw this pop up in another thread too; I was very confused as the narrative in the comments seemed to suggest that flutter is not a resonance phenomenon for some reason.' 
eRisk2023-T3_Subject26, b' ' , b'2021-10-05 21:28:28' , reddit post ," b'Is aerostatic flutter not an example of resonance? As far as I understand, it is when the driving force due to a fluid flow resonates/couples with the natural frequency of an elastic solid object in said fluid.' "
eRisk2023-T3_Subject26, b' ' , b'2021-06-23 10:40:42' , reddit post ," b'All the Manolis Kellis episodes by far, something about his positivity and poetic view of the world has really given me a fresh joyful perspective of life. Always lifts my mood when I\xe2\x80\x99m down' "
eRisk2023-T3_Subject26, b' ' , b'2021-05-31 11:23:49' , reddit post , b'Fiber adds bulk/structure to your poop and also allows the stool to absorb adequate liquid. It isn\xe2\x80\x99t poop-optimal if you are well hydrated without the fiber to hold water within your stool.' 
eRisk2023-T3_Subject26, b' ' , b'2021-03-11 16:45:48' , reddit post ," b'When I say \xe2\x80\x9csnapshot in time\xe2\x80\x9d I mean there are actually an infinite number of steps in between the two semi-stable spinning states you are thinking about, each of these steps/states have the same angular momentum and energy. Now as to why we see near instant switching between two states: even though they look stable they are actually unstable points, it just takes a long time for the switch to build up. Since the nut is not spinning on a major/minor axis, little rotations not in the main rotation axis affects the main rotation: stealing some angular momentum and energy (this is allowed because we are not on a major/minor axis therefore there are states nearby with the same total angular momentum and energy), the more angular momentum that gets stolen the quicker the stealing happens, once half way through the switching  the balance shifts and the stealing becomes giving until there is no more angular momentum in the non main spinning axes. It\xe2\x80\x99s all a very dynamic process, the motion from the last step affecting the motion in the next step while spinning in multiple axes all coming together whilst conserving angular momentum.\n\nA slightly different but analogous example is imagine a simple pendulum attached to a point with a solid rod. If the pendulum is balanced upside down perfectly it will stay there forever without starting to swing. Now if a single spec of dust hits the pendulum imparting a tiny amount of force; the pendulum will seem to stay in place but actually is slightly unbalanced, overtime it will get pulled more and more downward, quicker and quicker until it begins to visibly swing. It will swing down and around and right back up to the seemingly stable upside down state; gravity slowly but exponentially amplified the instability created by the dust and switches the pendulum from one semi-stable state to the next. In the spinning nut example the two pendulum states are the two semi-stable spinning states and the gravity that caused the state switching is a complicated interplay between the possible spinning axes of the nut and conservation of angular momentum + energy. Not super ELI5 but hope this helps clears stuff up' "
eRisk2023-T3_Subject26, b' ' , b'2021-03-11 15:49:25' , reddit post ," b'It\xe2\x80\x99s because there is a smooth \xe2\x80\x9cline\xe2\x80\x9d of orientations with the same angular momentum and kinetic energy, so at every snapshot in time during the flip these two quantities are conserved. Also a small note while rpm and angular momentum are related they aren\xe2\x80\x99t the same, for example imagine two near identical spinning fly wheels that are made of different density materials say wood and steel: the steel wheel has more angular momentum than the wood because there is more mass spinning even though the angular speed is the same. This can intuitively be understood because we all know the steel wheel carries more \xe2\x80\x9coomph\xe2\x80\x9d and would be harder to slow than the wooden one; That\xe2\x80\x99s what angular momentum is, how much \xe2\x80\x9coomph\xe2\x80\x9d is caused by the spinning movement of an object. In general the properties that define angular momentum are the geometry of the object, how the mass is distributed within the object and how it is spinning.' "
eRisk2023-T3_Subject26, b' ' , b'2020-10-24 03:01:17' , reddit post ," b'Yes you can but then in order to simulate for the same total time you must compute for more time steps and thus more compute time. Say you are working with a step size of 0.001 seconds for a total of one second with rk4, in order to get similar error with Euler you would need to simulate with a step size of 0.000000000001 seconds, this is 1000 steps for rk4 compared to 100000000000 steps for Euler; assuming identical runtime per step Euler would take a billion times longer than rk4 for the same deviation' "
eRisk2023-T3_Subject26, b' ' , b'2020-10-24 01:52:51' , reddit post ," b'\xe2\x80\x9cNot generally symplectic\xe2\x80\x9d means doesn\xe2\x80\x99t usually tend to conserve energy, but since the accumulated error is O(dt^4) instead of O(dt) the error term for small time steps (dt) ends up being order of magnitudes smaller. This results in the apparent energy loss taking much longer to accrue using rk4 over Euler method; when working with smaller total steps and steps sizes the energy loss can be a negligible amount in rk4 compared to Euler' "
eRisk2023-T3_Subject26, b' ' , b'2020-07-23 00:18:06' , reddit post ," b'Quantum=divided into discrete sizes, not very tiny in comparison.' "
eRisk2023-T3_Subject26, b' ' , b'2020-07-01 11:33:51' , reddit post ," b'Would it not be possible to detect analogous/equivalent phenomena like the unruh effect? As far as I understand it hawking radiation is an effect due to event horizons and not just real black holes, but i have no idea what energy scales we are talking about when it comes to GR/event horizons as it is not my area of expertise.' "
eRisk2023-T3_Subject26, b' ' , b'2020-05-04 22:40:02' , reddit post , b'How do you lose a 100m sprint if you were winning/in the lead for the first 99m?' 
eRisk2023-T3_Subject26, b' ' , b'2020-04-12 22:15:02' , reddit post ," b'Information can\xe2\x80\x99t be transferred via entanglement *alone*. While semantic, entangled particles when measured do carry information about the state of their entangled partners and the information they hold can be transported to other locations in space but no faster than the speed of light keeping locality.' "
eRisk2023-T3_Subject26, b' ' , b'2020-03-26 13:58:29' , reddit post ," b'> But I think that other, surrounding areas of the flag will have had similar amounts of force acting on them, so they all moved together. It was only the bottom-right corner of the flag that moved. \n\nWhile yes they will feel similar forces, they will not all feel forces in the same direction, the forces will be radial outwards from the astronaut, so the effective turning forces will not be evenly distributed. This difference in turning forces will cause the dragging I mentioned and also dissipate energy in the form compression of the material, ripples in the fabric and heat formation.\n\n> Do you know how I could do this for, say, the bottom-right corner of the flag? \n\nWell, the thing about moments of inertia is they are dependant on the total geometry of the object in question. You are on the right track by thinking of just one segment but what moments of inertia allow us to do is take into consideration all these minute pieces of fabric and how they interact with one another, the moment of inertia is defined by summing distribution of all infinitesimal pieces of mass so one can consider all of the object instead of just a corner. (Although intuitively I see where you are coming from, rotational dynamics can be unintuitive and your calculation/model is very very simplistic and runs the risk of being a very bad estimation of the total motion) Using the moment of inertia and the force ""profile"" on the flag one can determine how the flag shall move as a whole.\n\n> To be honest, I just want to be able to say that it\'s at least possible that static force moved the flag. \n\nOh, there most definitely was a contribution from the static force, the reality is our models are just that, models, all of the possible reasons for the motion described in your source contributed something to the motion of the flag, not just 1 singular thing. But the thing about physics and analyzing phenomena is that most of these contributions can be seen as negligible compared to one or two of the main driving forces in play, physicists often use their intuition and ""back of the envelope"" calculations to try to determine what could have realistically been the main cause (Although in this case maybe they did run many different scenarios computationally to determine the conditions required for each scenario). In your source they say ""not likely"", this doesn\'t mean that there was no static force or that the static force did not cause the motion but that the circumstances in which the static forces were the main contribution (having a 10kV potential difference between the hand and flag for example) is unlikely compared to other options.' "
eRisk2023-T3_Subject26, b' ' , b'2020-03-25 15:23:47' , reddit post ," b'A few things about your general calculations/concepts that I feel would need working on in order to make a full model that I got by skimming your post:\n\n>it\'s just necessary (I think) to divide this impulse by the mass of the small flag section to find the velocity in meters per second that the flag section would end up with.\n\nThis ignores the fact that the flag is one large solid object, while yes if it was just this small segment taking the entire force it would end with a velocity similar to what you calculated given your assumptions we must take into consideration that the flag segment\'s motion is being dampened and impeded by the fact that it is ""dragging"" the rest of the flag with it. In order to get a full model of the motion one would need to take into account the dynamics of the flag as a whole, this impulse would propagate and dissipate throughout the entire flag and not just the singular segment which gives much different final velocities/dynamic profile of what\'s going on.\n\nA better simplistic model one could try using is assuming the flag is a rigid cuboid which can only rotate about the flag pole axis. One can then say that the flag acts as a rigid rod with some spring/restoring force which tries to pull the flag back to its natural resting position (not sure how one would find such a constant simply other than through empirical testing or more advanced 3d simulations of the flag) and the electromagnetic force felt at every segment of the flag. While I do like your idea use of impulses, when it comes to more complicated dynamic systems like this one would probably have to use green\'s functions to calculate the motion after applying the impulses, it\'s probably easier to calculate the total energy that the electric force applies and convert it all to rotational energy in this model. By doing this one can calculate the rotational velocity of the flag for any given moment in time (the full dynamics of this simple flag system).\n\n>In the moon\'s gravity 249 grams would be 41.17 grams.\n\nMass is a body\'s tendency to resist motion, this is irrelevant of what planet you are on, the only thing that changes on different planets is the gravitational acceleration felt not the mass of the object so a flag which is 249 grams on earth is 249 grams on the moon and 249 grams on Jupiter etc. as the flag is still made of the same amount of ""stuff"" which is what gives it its mass, things in space don\'t lose their mass because there is no gravitational body around, they will still be ""resistant"" to other types of forces which is what mass is. If one was to use the primitive model I described above you would need to calculate the flags moment of inertia which is the rotational analogue to mass, an object\'s ""resistance"" to rotation/torques.\n\n​\n\nBut overall I find it unlikely that the static electricity is the cause and the other options outlined in the journal you linked are more likely just due to one fact: the energy that an electric field can exchange at such distances and at such a scale is minuscule compared to the energy it takes to make a 250g flag swing as shown in the video, at least that\'s what my intuition from working in physics for many years is telling me without doing the calculations explicitly.' "
eRisk2023-T3_Subject26, b' ' , b'2020-03-03 13:39:31' , reddit post ," b""But it's still illegal"" "
eRisk2023-T3_Subject26, b' ' , b'2020-02-24 00:36:53' , reddit post ," b'Since deaf people don\'t hear words that are associated with hearing that can also have contextual means like how loud can both mean large sounds or just as ""sensory overloading"" they had to make sure that when they used these words to describe schizoid hallucinations they didn\'t mean the words in an auditory sense but in the ""contextual"" sense, this was to be sure that they do hallucinate with sign even if they are using words that we associate with hearing.' "
eRisk2023-T3_Subject26, b' ' , b'2020-01-24 01:41:52' , reddit post ," b'Not 100% sure as I haven\'t read into OP\'s blog post to find out the exact mathematics being used behind this but I\'m assuming it\'s because the particle is contained by the gravitational potential. If the simulation is using newton\'s classical potential I think the wave function would evolve similarly to the harmonic oscillator along with some sort of reflection due to the ""bouncing"" causing the interference causing the waveform to deform when it bounces. In order for the wave form to disperse to the right it would be gaining energy which can happen according to heisenberg\'s uncertainty principle, which means that there should be dispersion to the right but I believe this dispersion follows some sort of exponential decay making it hard to notice.' "
eRisk2023-T3_Subject26, b' ' , b'2019-12-21 23:32:02' , reddit post ," b'I\xe2\x80\x99ve seen it many times during my research, don\xe2\x80\x99t have a source right now but the analogous effect is still called the Casimir force. The only reason it is \xe2\x80\x98analogous\xe2\x80\x99 is because the theory was made for quantum field theory but is applicable to any field which supports random fluctuations including bodies of water or bowls of milk.' "
eRisk2023-T3_Subject26, b' ' , b'2019-12-20 14:47:26' , reddit post ," b'Hey, well it depends on what you mean by valuable; for analytic skills the higher level mathematics courses like tensor calculus, variational calculus, group theory, dynamical systems and chaos theory are the most useful subjects as they give me the framework needed to do higher level physics. In terms of valuable as in actually learning about nature and natural science I\xe2\x80\x99d say quantum field theory, thermodynamics + statistical physics, advanced classical mechanics, and symmetries of physics have been my favorites (although it is a bitch doing them the satisfaction and knowledge I gained from them was well worth the grueling journey). With respect to my thesis all I really needed was relativistic quantum mechanics, chaos theory and imperative programming. For my career I can\xe2\x80\x99t say that any course in particular holds much value, maybe solid state physics, and nanotechnology as for my graduates degree I have pivoted towards industry as I am doing MSc Physics, Business and Policy so none of my high level theoretical physics courses really apply to such a masters. I hope this was what you were looking for with your question!' "
eRisk2023-T3_Subject26, b' ' , b'2019-12-20 04:39:23' , reddit post ," b'Well the Casimir effect is due to the fact that the \xe2\x80\x98vacuum energy\xe2\x80\x99 between two reflective surfaces is less than between them and infinity/far away. You can think about this via the fact that the harmonics/natural frequencies between two surfaces (the ships) is less than the the number of harmonics between them and open sea. as there are an infinite number of harmonics(all waves are non-destructive). These harmonic waves push the ships, as waves do, but because there are more waves outside the ships than between the ships the ships feel a pressure pushing them together. I hope this explanation works for you but if not don\xe2\x80\x99t be afraid to ask!' "
