ID,WRITING.TITLE,WRITING.DATE,WRITING.INFO,WRITING.TEXT
eRisk2023-T3_Subject9, b' ' , b'2021-07-20 21:28:19' , reddit post ," b'Heb je iemand uberhaubt plots dood zien vallen in een bosje? Ik denk dat je te veel aan het doemsdenken bent, ipp is het ziektebeeld niet heel ernstig voor gevaccineerden, en covid-19 wordt steeds beter behandelbaar. Overigens moet je je voorstellen dat in een grotendeels gevaccineerde populatie, de kans groter is dat een virus als deze muteert zodat het sneller verspreid om te kunnen overleven. Zo vergroot het namelijk de kans dat het terecht komt bij een niet gevaccineerd persoon en zelf kan overleven. Dit zien we nu ook met de deltavariant, de ziekenhuisopnames blijven laag (in engeland ook; die hebben al wat langer met deltav te maken) maar de besmettingen stijgen. \n\nBesmettingen is niets om je zorgen over te maken zolang de ziekenhuisopnames niet stijgen, en er blijkt nu nog geen enkele indicatie dat er proportioneel meer mensen worden opgenomen.' "
eRisk2023-T3_Subject9, b' ' , b'2021-07-19 18:46:22' , reddit post , b'Mid and high clarity imo.' 
eRisk2023-T3_Subject9, b' ' , b'2021-07-19 00:44:12' , reddit post ," b'This, my charge 5 sounded much better after update' "
eRisk2023-T3_Subject9, b' ' , b'2021-07-19 00:25:47' , reddit post ," b""This statistic always confuses me. This is an 84% of the people who testes positive for covid from july 1st according to the article. This 84% primarily consists of younger groups, which makes sense because those are the groups that aren't completely vaccinated yet. Considering that the young population has less chance of hospitalization and long covid than their older counterparts it doesn't seem that problematic to me.\n\nI do think that lack of symptoms in vaccinated individuals can suggest that these are people that are less likely to go out of their way to get tested. Also because it is not neccesary for these groups due to the testing voor toegang policy. So the N for unvaccinated is far higher than the N for the vaccinated group, which can lead to sample problems and skewed representation. I do say this out of personal experience, as I know at least 5 vaccinated friends that have gotten covid in the past weeks. Some of which got really sick, but others who only noticed because they got tested because of 'contactonderzoek'"" "
eRisk2023-T3_Subject9, b' ' , b'2021-07-17 09:31:42' , reddit post ," b'In the netherlands they always asked me which one I wanted it to go into, and it also goes in the throat' "
eRisk2023-T3_Subject9, b' ' , b'2021-07-16 23:19:58' , reddit post ," b'So I have tested with a PCR test last week which is the first time that I have been tested since I was vaccinated at the end of may. I now have these strange allergies in my nose, its kind of like a cold, but my nose is not really clogged or anything, I basically just sneeze from time to time and my nose is constantly itching. The reason why I am drawing the relation to my PCR test is also because the symptoms are only in my left nostril, where I had the stick go in.   \nHas anyone else had this? Or is there any explanation as to why this is happening to me?' "
eRisk2023-T3_Subject9, b' ' , b'2021-07-16 22:15:24' , reddit post ," b'Ten eerste, vraag dit soort dingen aan de huisarts en niet op reddit. Desalniettemin ga ik mijn best doen om een antwoord te geven.\n\nIk gok dat je zieker wordt als je al verkouden bent, je immuun systeem moet namelijk tegen meer dingen vechten op dat moment. Ook mensen die ik ken die kort na vaccinatie corona kregen zijn er behoorlijk ziek van geworden, het kost je lichaam meer moeite. Staat er trouwens niet op het vaccinatieformulier dat je niet mag komen als je klachten hebt?\n\nOverigens als je de symptomen van vaccinatie wil verminderen, kan je paracetamol nemen voor je prik. Je wordt namelijk ziek omdat je immuun systeem hardt aan het werk gaat, als je jouw immuunsysteem van tevoren onderdrukt met paracetamol, heb je dus een minder heftige reactie. Noteer hier wel bij dat er een kans is dat dit de effectiviteit van het vaccin misschien wel kan beperken.' "
eRisk2023-T3_Subject9, b' ' , b'2021-07-16 15:38:24' , reddit post ," b""Ah nee met Cura\xc3\xa7ao begrijp ik wel hoe het zit hoor, je mag je DCC gewoon niet gebruiken ongeacht hoe je het print/QR code genereerd, je hebt zo'n testbewijs nodig. Die QR codes kunnen ze daar trouwens ook niet scannen, die app is daar nog niet voor ontwikkeld, zie: [https://antilliaansdagblad.com/nieuws-menu/23927-eilanden-geen-lid-coronacheck](https://antilliaansdagblad.com/nieuws-menu/23927-eilanden-geen-lid-coronacheck)\n\nMhh, misschien heb je gelijk met die kaart. Ik zie dat Frankrijk idd anders gekleurd is."" "
eRisk2023-T3_Subject9, b' ' , b'2021-07-16 12:08:23' , reddit post ," b""Ja klopt, het komt er natuurlijk op neer dat Europa dingen met die codes doet, maar ze zijn nergens aan verplicht. Deze dingen gebeuren uit belang voor onderhoud van politieke relaties tussen de landen.\n\nVoor het laatste was er toevallig gisteren een persconferentie in Cura\xc3\xa7ao, die attendeerde dat Nederland nu op code rood staat. (Is nu in alleen papiaments te lezen, de nederlandse vertaling moet nog gepubliceerd worden).\n\n[https://gobiernu.cw/corona-virus-nieuws/djaweps-15-di-yuli-2021-anunsionan-konferensha-di-prensa-covid-19/](https://gobiernu.cw/corona-virus-nieuws/djaweps-15-di-yuli-2021-anunsionan-konferensha-di-prensa-covid-19/)\n\nOm het plaatje rond te maken, neemt de CDC deze europese kaart over. Het europese gedeelte op deze wereldwijde kaart is precies hetzelfde als dat van 'onze kaart'. [https://www.cdc.gov/coronavirus/2019-ncov/travelers/map-and-travel-notices.html](https://www.cdc.gov/coronavirus/2019-ncov/travelers/map-and-travel-notices.html) . Het enige verschil is dat hier internationaal beleid op gebaseerd wordt.\n\nEdit: Cura\xc3\xa7aose artikel net vertaald; [https://gobiernu.cw/corona-virus-nieuws/djaweps-15-di-yuli-2021-anunsionan-konferensha-di-prensa-covid-19/](https://gobiernu.cw/corona-virus-nieuws/djaweps-15-di-yuli-2021-anunsionan-konferensha-di-prensa-covid-19/) .\n\nOverigens vraag naar jou. Weet jij welke niet europese landen de EDCC erkennen? Ik probeer dit al een tijdje te achterhalen maar dit lukt mij niet zo goed. Volgens mij zijn er namelijk een hele hoop, waaronder dus Cura\xc3\xa7ao waar mijn familie zit, die er nog niks mee kunnen."" "
eRisk2023-T3_Subject9, b' ' , b'2021-07-16 09:38:12' , reddit post , b'This does somewhat happen regardless already since the map is updated biweekly' 
eRisk2023-T3_Subject9, b' ' , b'2021-07-16 09:35:52' , reddit post ," b'Europees ook niet, het is aan ieder europees land individueel te bepalen wat ze met de codes doen.\nInternationaal wordt er in dezelfde zin naar de kleurcodes gekeken, deze worden zelfs meestal klakkeloos overgenomen; dat scheelt werk en moeite, en beleid wordt daar op bepaald net als in de EU.' "
eRisk2023-T3_Subject9, b' ' , b'2021-07-15 20:00:05' , reddit post ," b'Eethuis de Jordaan, on the Rozengracht hands down my favourite.' "
eRisk2023-T3_Subject9, b' ' , b'2021-07-15 17:47:57' , reddit post ," b'EDCC is europees, niet internationaal. Voor mensen als ik die vooral buiten europa reizen is dit dus vooralsnog nuttelops' "
eRisk2023-T3_Subject9, b' ' , b'2021-07-15 15:33:29' , reddit post ," b""We gaan er in de huidige modellen van uit dat een positieve PCR test een besmetting meet. Enige probleem hiermee is dat een PCR test niet actief virus kan meten, maar slechts aantoont of er genetische deeltjes van het virus aanwezig zijn in de neus/keel. Je zou dus ook met dode virusdeeltjes in je neus/keelholtes positief moeten testen via PCR. Dit is overigens ook de reden dat sommige landen (vooral zuid amerika nu vgm), je ook met antigeen tests laten reizen als je positief blijft testen op corona. \n\nHet logistieke probleem hier met gevaccineerden is dat aanwezige deeltjes niet per se betekenen dat de persoon ziek wordt, of uberhaubt andere mensen kan besmetten met deze deeltjes. Dit probleem versterkt zich met gevaccineerden, omdat we er vanuit gaan dat je immuunsysteem deze deeltjes in de meeste gevallen direct kan doden (dit bedoelde ik met ziekteverloop, alhoewel het miss niet echt ziekte te noemen is). De aanwezigheid van de deeltjes (positieve pcrtests) betekent dus langzaam steeds minder voor degene die gevaccineerd zijn. Het onderzoek hierin moet nog uitgebreid worden, maar je kan er wel degelijk vanuit gaan dat een positieve besmetting van een gevaccineerd individueel anders opweegt tegenover besmetting van een niet gevaccineerde. Het gevaar in de eerste instantie was overigens ziekenhuisopnames en niet besmetting; besmetting zal je namelijk altijd blijven zien. \n\nIn mijn eerste comment wou ik de suggestie doen om een variabele als ziekenhuisopnames mee te nemen, om te controleren op ratio gevaccineerden/niet gevaccineerden. Je moet namelijk 'iets' doen om deze PCRtesten nog enigzins te 'controleren'. Ik las wel een goed tegenargument, namelijk dat de IC cijfers 2 weken achterlopen. Daar ben ik het wel mee eens. Een alternatief is dan om vaccinatiegraad mee te nemen en wat statistische trucjes toe te passen."" "
eRisk2023-T3_Subject9, b' ' , b'2021-07-15 14:56:53' , reddit post ," b'Om de cijfers dan uberhaubt te kunnen controleren moet je dan ook vaccinatiepercentage meenemen. Het ziekteverloop en het besmettingsgevaar is namelijk anders voor gevaccineerden. Ziekenhuiscijfers zijn daareentegen de enige constante factor, dit werdt tijdens het debat gisteren ook al geopperd door pvda.' "
eRisk2023-T3_Subject9, b' ' , b'2021-07-15 14:48:36' , reddit post , b'Ik vind het jammer dat ze deze codes baseren op besmettingen ipv ziekenhuisopnames' 
eRisk2023-T3_Subject9, b' ' , b'2021-07-14 11:31:51' , reddit post ," b'You need to get the travel test, it should come with a travel certificate' "
eRisk2023-T3_Subject9, b' ' , b'2021-07-09 19:09:19' , reddit post ," b'Yeah we\xe2\x80\x99re students so we can still request them for free, she also made me request them on my name since she reached the limit lol' "
eRisk2023-T3_Subject9, b' ' , b'2021-07-09 11:23:02' , reddit post ," b'For me its more of a thing where the outcome doesnt really change regardless of test frequency. I tested this morning but regardless of whether its positive or negative I will still be in quarantine. As someone who has been fully vaccinated since late may, I should also not have to worry about getting hospitalised or exteme symptoms. But since my behaviour won\xe2\x80\x99t change regardless of result (unless im testing to get out of quarantine), it doesn\xe2\x80\x99t matter either way for me personally.' "
eRisk2023-T3_Subject9, b' ' , b'2021-07-09 10:50:32' , reddit post ," b'Yeah we\xe2\x80\x99re in quarantine, and the sister lives downstairs and has her own fridge and stuff, so I usually drop food outside her door but thats it' "
eRisk2023-T3_Subject9, b'How do i tell my girlfriend she is too worried of getting covid' , b'2021-07-09 10:38:24' , reddit post ," b'My girlfriend has been sticking selftests up her nose first thing in the morning everyday for the past week, and has managed to get tested at the ggd 3 times already in one week (even though thats technically not allowed). The result was negative everytime. \nShe is convinced she has it since she has a sore throat and since her sister who lives downstairs tested positive and has been coughing all night. \nHow do I tell her to calm down? Is there a chance she is eventually going to get a false positive and believe its real because of confirmation bias?' "
eRisk2023-T3_Subject9, b' ' , b'2021-07-09 07:31:28' , reddit post , b'Gemiddelde griepprik haalt idd op een goede dag de 30% dus de 70% is niks om je over zorgen te maken' 
eRisk2023-T3_Subject9, b' ' , b'2021-07-07 17:10:59' , reddit post ," b'I dont think there are replacable parts for within m1 chips, so nothing will prolly change other than screen repairs etc' "
eRisk2023-T3_Subject9, b' ' , b'2021-07-07 12:01:22' , reddit post ," b'Netherlands, yeah its strange considering a large part of those that got infected were vaccinated. Even two people who were there who have been vaccinated for months prior got covid after this party.' "
eRisk2023-T3_Subject9, b' ' , b'2021-07-07 00:42:18' , reddit post ," b'Dependent on whether it is the first language or not it can be identified diffferently, or not identified at all. Stress is really part of phonemic awareness, which is dependent on first language.' "
eRisk2023-T3_Subject9, b' ' , b'2021-07-07 00:39:49' , reddit post , b'Very simple. Path of least resistance law applies here. It is much easier to speak a common language instead of a foreign one.' 
eRisk2023-T3_Subject9, b' ' , b'2021-07-07 00:36:30' , reddit post ," b""I got two fines for this as well. Everytime I place trash i make sure that nothing has my name on it now. In my area (jordaan) the cardboard dispensers are almost always full, and they even removed a few of them making the problem worse. I'm pretty sure that for one of the fines someone took out a box with my name on it, but I can't prove this since I don't have pictures or anything. Though I have added a 'bezwaar' and they still haven't replied (after 8 months?!)"" "
eRisk2023-T3_Subject9, b' ' , b'2021-07-05 21:33:48' , reddit post ," b'Was fun, was a full on party, completely back to normal again here. But afterwards approx 60 people there got covid, so idk for how long this is gonna last' "
eRisk2023-T3_Subject9, b' ' , b'2021-07-05 16:00:59' , reddit post , b'Is toch te verwachten? Het aantal besmettingen zou ipp niet moeten uitmaken zolang vaccinatie er voor zorgt dat mensen niet op de IC belanden.' 
eRisk2023-T3_Subject9, b' ' , b'2021-07-04 15:36:44' , reddit post ," b'HD should also be possible to run off externally, but has slower read/write speeds.' "
eRisk2023-T3_Subject9, b' ' , b'2021-07-04 15:31:45' , reddit post ," b""There is potential though. I managed to get Minecraft to run natively through apple silicon, and I'm getting a consistent 100fps on highest settings in 4k resolution. This is about a 40% increase from rosetta 2 (50-60fps), which most Mac games are running on atm, which is insane."" "
eRisk2023-T3_Subject9, b' ' , b'2021-07-04 15:29:43' , reddit post , b'Install the games on external ssd. Getting the 16gb ram upgrade probably more relevant tbh' 
eRisk2023-T3_Subject9, b' ' , b'2021-07-04 15:27:31' , reddit post ," b""Isn't this probably due to the dependencies for their game engine? Not a game dev, but I can imagine that's not easy to change."" "
eRisk2023-T3_Subject9, b' ' , b'2021-07-03 20:58:30' , reddit post ," b""If ikea made one you'd still need to build it yourself for the full ikea experience"" "
eRisk2023-T3_Subject9, b'Vaccine passport situation?' , b'2021-07-02 20:28:50' , reddit post ," b'Bon dia,   \n\n\nI am going to visit my family in Cura\xc3\xa7ao again this month and I was wondering whether I am good to go with the vaccine passport. Or do I still need to get a PCR test to visit?' "
eRisk2023-T3_Subject9, b' ' , b'2021-07-02 18:14:22' , reddit post ," b""yeah it sucks, I have tested it on ARM computers to see if it checks for the chip architecture or not; this didn't work. Now I am pretty confident that it checks for the operating system of the device. I have a BenQ beamer that runs on android for which the feature works, I also think that running iOS or Android through a virtual machine on your computer is a workaround. I just hope that they update this generation of speakers so it can work on any OS. The Boombox 2 got an update that lets me PartyBoost it through aux from the computer, so maybe there is hope."" "
eRisk2023-T3_Subject9, b' ' , b'2021-07-02 12:56:34' , reddit post ," b'Considering English is a right headed language, as in the main object is always to the right of a compound, i would say chicken curry. Curry chicken just feels weird to me as I identify the dish to be a curry and not a chicken.' "
eRisk2023-T3_Subject9, b' ' , b'2021-07-01 07:50:09' , reddit post ," b'I remember having a cd with snow leopard on it to boot my computers with. Heck, i think i still have that thing laying around somewhere' "
eRisk2023-T3_Subject9, b' ' , b'2021-07-01 07:36:47' , reddit post ," b'Gotta love snow leopard, the good ol\xe2\x80\x99 times where apple didnt find the need to hide library folders. I feel like user customizability in terms of modding was easier back then.' "
eRisk2023-T3_Subject9, b' ' , b'2021-06-29 23:36:22' , reddit post ," b'For coding your 10 does benefit from a sideways monitor tho, i\xe2\x80\x99d give this higher score' "
eRisk2023-T3_Subject9, b' ' , b'2021-06-29 23:14:41' , reddit post , b'dropmix / pick short parts of breakdowns to mix into.' 
eRisk2023-T3_Subject9, b' ' , b'2021-06-29 21:06:00' , reddit post ," b'vesa mount the monitor, consider moving the plant in front of the vesa arm to get that floating effect. Maybe consider getting a shelf or sth to put the books in? Or if you want less clutter on the table you need to add some furniture to use the vertical space so you can hide things without using up the table space.' "
eRisk2023-T3_Subject9, b' ' , b'2021-06-29 10:56:23' , reddit post ," b'Thats unfortunate, that confirms that its too busy for them too handle atm. On the first day i tried continuously, about 200 attempts or so and got through everything after about 4 hours of release. I either got through the digid and then it crashed when trying to confirm my details, or i didnt get through at all like you are experiencing.\nIts really dumb of the govt to not upscale their servers enough to be able to handle this kind of thing, Ddossing or high request loads should really be expected with these kinds of mass rollouts. So many of my friends in IT have facepalmed at how dumb they were trying to roll it out like this. The only thing i can suggest is to keep trying.' "
eRisk2023-T3_Subject9, b' ' , b'2021-06-29 08:33:10' , reddit post , b'Clear cache on phone and try again' 
eRisk2023-T3_Subject9, b' ' , b'2021-06-29 00:00:01' , reddit post ," b'I swear to god everytime i bet 100 because i feel confident a team is going to win they end up losing. Same happened with netherlands, i have yet to bet 100 and win. I bet 100 on germany to win tomorrow so I guess they will lose next.' "
eRisk2023-T3_Subject9, b' ' , b'2021-06-28 11:01:32' , reddit post , b'According to [nu.nl](https://nu.nl) de jonge said that it should be fixed in the coming weekend.' 
eRisk2023-T3_Subject9, b' ' , b'2021-06-28 10:14:43' , reddit post , b'With the s2 mk3 and the s3 there are already holes for screws there' 
eRisk2023-T3_Subject9, b' ' , b'2021-06-25 08:46:53' , reddit post ," b'They could easily implement it if they wanted to, and i think this might happen for international travel, but as of now (maybe due to some medical privacy legal constraints) its not possible.' "
eRisk2023-T3_Subject9, b' ' , b'2021-06-25 08:27:56' , reddit post ," b'The app works as simple as this, if you got the shots it will make a qr code for you. Perhaps international requirements will check for when you got vaccinated as well, but so far in the netherlands this does not matter yet.' "
eRisk2023-T3_Subject9, b' ' , b'2021-06-24 21:22:47' , reddit post ," b""So far, yes. But since the whole EU will be using this system 'digital green certificate' and since the EU's blockchain is basically encrypting the data for border control for instance it won't take long for it to be picked up more internationally i'm guessing."" "
eRisk2023-T3_Subject9, b' ' , b'2021-06-23 10:18:22' , reddit post , b'Pfizer en Moderna: Myocarditis grootste zorgen (meer kans dan trombocytopenie met Janssen en AstraZeneca) \\~ Meer bijwerkingen voor jonge mannen   \n\n\nJanssen en AstraZeneca = Zeldzame vorm van trombocytopenie grootste zorgen \\~ Meer bijwerkingen voor jonge vrouwen.\n\nDesalniettemin blijft de kans op deze bijwerkingen zeer klein.' 
eRisk2023-T3_Subject9, b' ' , b'2021-06-20 11:21:25' , reddit post ," b'Consider the reloop stand hub, its a stand for your laptop that is also a convenient powered hub' "
eRisk2023-T3_Subject9, b' ' , b'2021-06-19 09:50:54' , reddit post ," b'According to independent, England was one of the favourites. https://www.independent.co.uk/sport/euro-2020-odds-favourite-winner-2021-b1865401.html?amp' "
eRisk2023-T3_Subject9, b' ' , b'2021-06-18 21:29:36' , reddit post ," b'My setup is similar to the anker one mentioned above, though now that im running out of porta i\xe2\x80\x99m looking into the reloop stand hub. That thing looks pretty nifty for its price' "
eRisk2023-T3_Subject9, b' ' , b'2021-06-18 21:26:21' , reddit post ," b'I have heard problems before, but from my experience have had no issues with my s3.' "
eRisk2023-T3_Subject9, b' ' , b'2021-06-18 21:02:19' , reddit post ," b'Yeah it will depend on whether the RIVM database (which stores your vaccination details) and the app connection will be good enough. Hopefully they estimate the increase in users and have it running properly on time, but they still need to make predictions and would need to be overly cautious. I would bring some extra info just in case.' "
eRisk2023-T3_Subject9, b' ' , b'2021-06-11 14:55:21' , reddit post , b'Was u bij de GGD gevaccineerd?' 
eRisk2023-T3_Subject9, b' ' , b'2021-06-11 14:55:03' , reddit post ," b""Ah ja ik ben ook 'als zorgmedewerker' gevaccineerd. Ik heb het idee dat het dan langer duurt voordat het erin staat."" "
eRisk2023-T3_Subject9, b'Gevaccineerd maar niet in RIVM database?' , b'2021-06-11 14:17:22' , reddit post ," b'Ik ben 22 mei gevaccineerd met het Janssen vaccin. Om uiteindelijk via de coronacheck app een QR code te krijgen moet deze vaccinatie in het database van RIVM staan. Ik heb daar gekeken, maar hij staat er nog steeds niet in.Ik was bij het AMC gevaccineerd, het AMC zegt dat ik RIVM moet bellen en het RIVM zegt dat ik bij AMC moet zijn.\n\nNu is mijn vraag, hoe lang duurde het voor jullie om de vaccinatie geregistreerd te krijgen in de RIVM database? Dit kan je overigens checken bij [mijn.rivm.nl/vaccinaties](https://mijn.rivm.nl/vaccinaties)  \n\n\nUpdate: Vandaag, in de ochtend van 18 juni, staat hij eindelijk in de database' "
eRisk2023-T3_Subject9, b' ' , b'2021-06-09 10:07:00' , reddit post ," b'Many different things, mostly electronic; hard techno as well. I like some of Reinier Zonneveld\xe2\x80\x99s tracks.' "
eRisk2023-T3_Subject9, b' ' , b'2021-06-09 09:49:39' , reddit post ," b'Strange, mine definately still makes room shake on latest update. Got louder if anything' "
eRisk2023-T3_Subject9, b' ' , b'2021-06-04 09:02:25' , reddit post ," b'Bb2 got an update a while back and it has a more clear sound now imo. Nevertheless the passive radiators still make my house rumble whenever i turn it on. I\xe2\x80\x99d say its more ideal for outdoor use. Main reason why I bought it over the hyperboom was the lower frequency reproduction, and with the water resistance rating and the overall rugged design it would last me quite a while (i replaced a bluetooth speaker that probably lasted me 8 to 9 years; that still worked!).\nHyperboom has a wider soundstage due to its square design and is feature packed; has more port options eq options etc. is less wide so its easier to fit in a room somewhere. Just doesnt have the ipx 7 rating.\nBoth speakers have pairing options though JBL, as you may know, only lets you pair to the partyboost generation speakers. The pairing protocol for JBL does have a lot better range though.\n\nYou can watch a binaural video from oluv\xe2\x80\x99s gadgets comparing the two, gives you a decent impression of the audio. The update on the jbl accentuated the mids a bit, so the range is a bit better now.' "
eRisk2023-T3_Subject9, b' ' , b'2021-06-04 07:59:43' , reddit post ," b'I\xe2\x80\x99m also confused, the sony bluetooth speakers sound very distorted to me compared to the JBL. You sure you didnt buy a fake one?' "
eRisk2023-T3_Subject9, b' ' , b'2021-06-03 21:19:28' , reddit post ," b""Yeah unfortunately the media here says that its not allowed while the official government site says its advice; so i'd go with the latter."" "
eRisk2023-T3_Subject9, b' ' , b'2021-06-03 16:47:37' , reddit post ," b""I often watch other DJ sets to find what i'm looking for. I rarely buy tracks as most of the time i can find good/decent quality tracks on soulseek. Sometimes if they are not there, I consider buying it through iTunes."" "
eRisk2023-T3_Subject9, b' ' , b'2021-06-02 11:44:35' , reddit post ," b'Yep i have a similar issue with the bb2, I use it as a speaker for my DJ gear, i need to get a strong enough input running for it to get sound coming out of it. Try upping the input noise, and turning down the volume on the speaker with + or - , that should be a solution, but beware that it sometimes takes a sec for the dsp to realise that audio is coming in, so short sounds or notification messages may not come up if there is no constant background signal running.' "
eRisk2023-T3_Subject9, b' ' , b'2021-06-02 11:31:14' , reddit post ," b'Try making sure the speaker is paired to only one device at a time, it might be that multiple devices are confusing the bluetooth module in the speaker.' "
