ID,WRITING.TITLE.Element:Text,WRITING.DATE,WRITING.INFO,WRITING.TEXT.Element:Text
eRisk2022-T3_Subject5,, 2020-01-03 22:30:56 , reddit post ," I also am a vegetarian with an anorexia history. When I went vegetarian I was about 4 years into my ED, hovering in the semi-recovered stage.

Growing up I never really liked meat. I was the child who would eat 3-4 bites of her steak and be done, and only if it was a non-juicy over cooked lump. The only meat dishes I enjoyed were things like tacos and meatballs, where there’s more flavor from the seasoning than the meat. I went vegetarian in college for a couple reasons:

1. I realized it was an option. As silly as it sounds, I never knew it was something you could do for non-religious reasons. I grew up in the South and it just wasn’t a thing at the time. In college I met vegetarians (both religious and not), so I figured I’d try it.

2. I didn’t really like meat. I think it’s gross to cook, most of it didn’t taste great, and the meat stuff in the college dining hall was just gross.

3. I like animals and don’t like killing for no reason. Hunting and fishing for fun have always bothered me. As a kid I used to cry l when I saw the taxidermy hunting trophies.

4.(This is the not so good reason) Purging meat was gross. This wasn’t my only reason. Purging cheese was gross too, but I didn’t give that up. But if I’m being honest, this was part of the reason I went veggie. So, while it was a mostly ED free choice to go vegetarian, it wasn’t entirely. Not that I think that means I shouldn’t have done it. I just think it’s important to be careful. Make sure you’ll still be in recovery if you switch and that this isn’t just a choice to perpetuate your disorder.

I encourage you to honestly evaluate your reasons for going vegetarian. Only you can answer if it’s because of your eating disorder. Even if it’s not part of your eating disorder it’s important to check that it won’t make your disorder worse. For example, I tried to go vegan (for honest animal rights reasons), but I found myself obsessing and feeling guilty over food and it started to trigger ED behaviors. So, my balance is vegetarian is fine for me, but vegan is too far, at least for my current state of recovery. Protecting your health is important. It doesn’t make you a bad person if you can’t go vegetarian or vegan or whatever because it would hurt your mental health. It’s like sometimes having to take a pill with gelatin in it because you need the medication.

Sorry for the long ramble! I got interrupted a few times while typing this. I hope everything works out for you! "
eRisk2022-T3_Subject5,, 2020-01-02 08:12:14 , reddit post ," Veggie Burgers/Meat Subs:

-Morningstar Spicy Black Bean Burger

-Trader Joe’s Thai Chili Veggie Burger

-Amy’s All American Veggie Burger

-Hilary’s World’s Nest Veggie Burger (this one is really good, but doesn’t really have any protein)

-Amy’s Veggie Meatballs

-Field Roast Apple Maple Breakfast Sausage

Other protein sources:

-Tempeh: I slice it super thin and marinate it (BBQ, SweetandSour, Liquid smoke and other spices for “bacon”, etc) it absorbs flavors super well. I either pan fry it or broil it, so it gets nice and crispy. I like it better than tofu because it has a way better texture.

-Chickpeas (these go with anything really)

-Lentils (for simple you can just boil then mix in oil and whatever seasoning you like)

-Beans (can be used as a meat sub in chili/stews/soups, black beans with some garlic and cumin are good in tacos)

-Edamame (good lazy meal, microwave and toss with sweet chili sauce or use in Asian inspired pasta dishes)

If you like to cook I really recommend trying Ethiopian and Indian dishes. "
eRisk2022-T3_Subject5,, 2020-01-02 07:59:32 , reddit post , I do this too! It’s even better with sunflower seed butter. 
eRisk2022-T3_Subject5,, 2020-01-01 08:31:09 , reddit post ," It really depends on how far you’re moving and how much stuff you have. My partner and I moved and packed our whole 1 bedroom apartment in a day, but we were only moving a few minutes away from our old place. Our packing consisted of just tossing things in the same 4 boxes, driving them to the new place, and unloading them on the floor. No one helped us. It took all day (and our new place was an unorganized mess)  but wasn’t too bad.

When we moved cross country we packed in about 3 days, but we only spent a couple hours each night. It took about 2 hours to load the truck. Realistically we could’ve done it in a day. Especially since we had help on moving day from his parents. "
eRisk2022-T3_Subject5,, 2020-01-01 01:46:19 , reddit post ," I don’t think Chuso is overrated at all. Regardless of whether she’s going to win a medal or not, she’s still a top vaulter and she’s been able to keep her career going for years. It’s really impressive. "
eRisk2022-T3_Subject5,, 2019-12-31 23:50:29 , reddit post ," I make small batches, only a pint at a time. I only buy a pint of cream each time and make 4-6 batches (depends if I’m doing sherbet or traditional ice cream) that I leave in the freezer for me and my SO. They store well if you use a good stabilizer. We usually have between 4-8 pints in the freezer at a time. "
eRisk2022-T3_Subject5,, 2019-12-29 02:40:01 , reddit post , Me too! I think this is the year though 
eRisk2022-T3_Subject5,, 2019-12-21 17:39:23 , reddit post ," Exactly. He clearly had no idea how to coach the skill, and shouldn’t have let me do it. "
eRisk2022-T3_Subject5,, 2019-12-21 01:43:05 , reddit post , I know! Looking back I’m glad nothing happened. I had no fear at that age. 
eRisk2022-T3_Subject5,, 2019-12-20 23:50:44 , reddit post ," 9 or 10 years old: I had a trampoline in my backyard. I decided it would be a great idea to learn double fronts. I tried a bunch, all barely clearing my head and landing on my back. I finally landed on my head one day (thankfully no injury) and it scared me out of trying it on the trampoline for good.

Another incident was around old level 5 (today’s level 4). My sister was a cheerleader. Her practices ended an hour later than mine, so I’d go to the cheer open gym to practice tumbling while I waited. I asked the open gym coach to spot me on a double back. He said I’d be fine and just go for it, no spot... This was on a tumble track on a mat stack. So I did it. It was terrifying, kept landing on all fours, not rotating anywhere near fast enough. Next week at practice I told my coach I did double backs at the cheer gym. He was horrified haha. "
eRisk2022-T3_Subject5,, 2019-12-19 23:38:00 , reddit post , Try different brands if you can. I find different soy mills and almond milks have different consistencies and flavors. 
eRisk2022-T3_Subject5,, 2019-12-18 21:17:59 , reddit post ," Does your girlfriend have a recipe for vegan Mac and Cheese she’s willing to share? I LOVE box Macandcheese, but hate the homemade roux based stuff (I know it’s weird). I’d love to have a homemade recipe if actually enjoy eating. "
eRisk2022-T3_Subject5,, 2019-12-18 20:10:28 , reddit post , It totally depends how you use the tofu. Tofu in something it’s traditionally in is fine. I was once served a block of un-marinated oven baked tofu with sauce poured on top as the vegetarian option (main dish was meatloaf). It was gross and weird. 
eRisk2022-T3_Subject5,, 2019-12-13 00:21:29 , reddit post ," Yeah, I’m wondering if OP was thinking of the Biles 2 (DV 1) which would make more sense for comparing to the full turn series with connection value. "
eRisk2022-T3_Subject5,, 2019-12-12 22:43:46 , reddit post ," Assuming full credit: D + B + D + B, skill value: .4 + .2 + .4 + .2 = 1.2, CV: .1 + .1 + .1 = .3

Total: 1.5

But, only the top 8 skill values count toward the D score. Based on her other routine elements, the 2 B value turns don’t count.

Adjusted total: 1.1

The Biles 1 is a G, so it’s worth .7 on its own. So, yes, that turn combo of four skills has more value than a single Biles 1. "
eRisk2022-T3_Subject5,, 2019-12-10 01:52:47 , reddit post ," Agreed, the whole thing is a bit weird sounding. I just can’t imagine a school letting a parent randomly walk into classes. I was thinking the girl had maybe asked mom for tampons (if she’s an athlete it might feel more mentally comfortable to not have a visible pad). Or dad is clueless and doesn’t know the difference. "
eRisk2022-T3_Subject5,, 2019-12-10 01:35:22 , reddit post ," I put in a tampon alone for my first period. I just read the instructions and it went in fine. Granted, I was also a gymnast so pads weren’t exactly an option. "
eRisk2022-T3_Subject5,, 2019-12-09 16:43:19 , reddit post , Are you avoiding sugar? Sugar would lower the freezing point so it stays soft. You can use something like dextrose (more freezing point depression than sucrose) if you want to minimize the amount. 
eRisk2022-T3_Subject5,, 2019-12-09 16:15:21 , reddit post ," I wonder if they could take the spots away from the all-around world cup series? It wouldn’t be fair to countries who were planning to qualify that way, but it hasn’t started yet so no one would be losing a named spot. "
eRisk2022-T3_Subject5,, 2019-12-08 22:44:54 , reddit post , [Underbelly Blog](https://under-belly.org/category/ice-cream/) there’s a whole section on emulsifiers and stablizers. 
eRisk2022-T3_Subject5,, 2019-12-05 05:27:23 , reddit post ," Seconding Earth Balance as a butter substitute! I’m not dairy free, but I buy it anyways because it tastes better than butter imo and is easier to spread. I like the whipped version. "
eRisk2022-T3_Subject5,, 2019-12-03 01:55:05 , reddit post ," I am admittedly terrible about remembering baking times. I usually put a timer for 10 min, check to see how it’s doing then check in 5 min increments after that until it’s nearly done. How long that takes is dependent on the thickness of your slices and how browned you like it. The broiler is a part of the oven, usually at the top that gets really hot and directly heats food. To use it you move your oven rack to the highest position then press the broiler button on the oven. Watch it carefully when you’re broiling because it can start to burn pretty fast. "
eRisk2022-T3_Subject5,, 2019-12-03 00:40:00 , reddit post ," I cut it super thin, thinner than 1/4” slices. I then marinate it over night. Some good marinades are bbq sauce, soy sauce and liquid smoke, or orange sauce. I then either pan fry it with olive oil or bake it at 350 °F. When baking I stick it under the broiler for 2-3 min to crisp it. "
eRisk2022-T3_Subject5,, 2019-12-02 23:11:59 , reddit post ," Hmm I guess I could see that. My dismount on beam was a right round off to left 2/1, however, and I never noticed a problem. Ideally I think you should land a round-off centered with backwards/vertical moment like you would for a basic BHS or back tuck. "
eRisk2022-T3_Subject5,, 2019-12-02 22:32:35 , reddit post ," Out of curiosity, do you know why it’s considered wrong? I also did a right round off with a left twist for back tumbling. For some reason I twisted to the right for front tumbling. "
eRisk2022-T3_Subject5,, 2019-12-02 17:09:48 , reddit post ," This is exactly why I won’t contribute financially to Avas Demon. I love her comic, but she doesn’t update reliably, even after vastly exceeding her goal on Kickstarter two separate times. I understand life happens, so I don’t fault her for that, but I’m not willing to pay for it either. "
eRisk2022-T3_Subject5,, 2019-12-02 16:37:06 , reddit post ," Add some sugar to the peanut one to lower the freezing point. If you don’t want to use any sugar you can’t try a bit of erythritol.

You’ll probably need to just let it sit out for a bit before eating like most of the commercial low calorie ice creams. "
eRisk2022-T3_Subject5,, 2019-12-02 00:59:17 , reddit post ," Is this the Daring Gourmet recipe? I use the same one and mine turns out red. Definitely a bright red, but it looks like the misir wot I’ve had in restaurants. "
eRisk2022-T3_Subject5,, 2019-12-01 13:06:46 , reddit post , I’ve made Pb and J. It’s so good! 
eRisk2022-T3_Subject5, How long is it safe to age a base? , 2019-11-27 23:38:10 , reddit post ," I cooked up an ice cream base for banana ice cream Monday night. I’m using Dana Crew’s method of infusing the bananas into the base. Unfortunately, I forgot to churn it yesterday and I’m out of town until Sunday afternoon. Will it still be safe to use then, assuming the bananas haven’t done weird things? It will have been 6 days since I made it. I started with ultra-pasteurized milk and cream if that makes a difference. "
eRisk2022-T3_Subject5,, 2019-11-27 06:47:28 , reddit post ," I wouldn’t switch to that gym then, unless your daughter really wants to. Even if they did eventually let her into JO, it seems like it’s not the best environment if they threat her like she’s not good enough. "
eRisk2022-T3_Subject5,, 2019-11-27 03:20:51 , reddit post ," Definitely not too late. I started gymnastics at 6 and didn’t do JO old level 4 (equivalent to today’s level 3) until I was 10. We kept moving so I did pre-team 3 years in a row. And I still made it to college level just fine.

For OP, did they say why she can’t do JO? Would they let her train with the JO team and not compete until next year? "
eRisk2022-T3_Subject5,, 2019-11-20 18:36:57 , reddit post , There’s a [step out version](https://balancebeamsituation.com/back-handspring-stepout-from-side-tousek/) 
eRisk2022-T3_Subject5,, 2019-11-20 06:09:04 , reddit post , Yeah it was a little uncomfortable. I’m glad I got to go a size up instead of a size down. Too small leotard would’ve been really awkward. 
eRisk2022-T3_Subject5,, 2019-11-19 06:32:31 , reddit post ," You wash them after wearing, so no. The laundry service was provided by the school. When I was in club we would use the same leotard for every competition for two years whereas in college we had several different ones we would rotate, so honestly they probably got less use overall. "
eRisk2022-T3_Subject5,, 2019-11-19 05:13:00 , reddit post ," I can’t speak for big programs; the college I went to was a D1 school, but lower tier for gymnastics. They didn’t get all new leos every year. All of ours were the standard GK sizes (XS-L). As a freshman you’d tell the coaches your size and if they had it in stock they’d give it to you, if not you got the next closest size. When you graduated (or otherwise left the team) you’d turn all your leos back in. I walked on to the team at the start of the school year, so some of the stuff fit, but others were a size too big. "
eRisk2022-T3_Subject5,, 2019-11-18 23:33:46 , reddit post ," I don’t use eggs in any of my ice cream, just a personal preference. I’ve seen a lot of lemon ice cream recipes that use eggs, so it shouldn’t matter.

If you don’t use eggs you should consider using an emulsifier. I use lecithin powder. "
eRisk2022-T3_Subject5,, 2019-11-18 02:03:21 , reddit post ," I’ve made lime before. You want to reduce the juice prior to adding it so you get more flavor for less liquid. Also, like the other commenter said, you want to add the juice right before churning.

For my lime ice cream I use 80 g of lime juice, cook it on the stove until it’s reduced to 20 g. I make my base (457 g, about a pint) as usual and refrigerate over night. In the morning I whisk the reduced lime juice into the base and churn. It turns out super limey. "
eRisk2022-T3_Subject5,, 2019-11-14 18:26:39 , reddit post , Apple Fritter ice cream sounds amazing! 
eRisk2022-T3_Subject5,, 2019-11-13 06:42:49 , reddit post ," Pear sorbet is a good fall recipe, provided you can find good very ripe pears.

400 g pear
40 g dextrose
60 g sucrose
1 g citric acid
1 g xanthan gum

Blend everything together. Let sit in fridge overnight then freeze in ice cream maker. If you work fast you can keep the pears from browning, but it’s nbd if it browns. It looks unappetizing as a browned liquid, but it’ll freeze to a golden color instead of white. Taste is the same either way. "
eRisk2022-T3_Subject5,, 2019-11-13 03:28:57 , reddit post ," For the store bought green ones I think it’s maybe a mix. I’ve made peppermint ice cream with dark chocolate flecks at home. It was really good, but distinctly peppermint instead of the general mint flavor. "
eRisk2022-T3_Subject5,, 2019-11-09 16:37:18 , reddit post ," Also the weight should be self-entered. It didn’t have any options under 100lbs. Out of curiosity, what is the purpose of collecting weight? "
eRisk2022-T3_Subject5,, 2019-11-02 06:49:52 , reddit post , I’ll check it out! 
eRisk2022-T3_Subject5,, 2019-11-02 02:08:15 , reddit post ," Yeah the only one I buy is Purina. I have a super picky senior cat who will only eat a specific flavor of their cat food. She won’t eat anything else, even real food like fish. They changed the formula a few years ago so it’s 1/2 old stuff and 1/2 new stuff (you can tell by the color) and she still eats around the newer kibble pieces. "
eRisk2022-T3_Subject5,, 2019-11-02 00:45:13 , reddit post , She could do the thing that’s like a pak 1/2 from front giant. I forget what it’s called. 
eRisk2022-T3_Subject5,, 2019-10-28 20:57:01 , reddit post ," I’m not a fan of recipes that are super high in butterfat. I develop my own recipes are about 11% butterfat for ice creams and about 4.5% butterfat for sherbets (ideal for fresh fruity flavors). I use cookbooks as flavor inspiration instead of full recipes.

The [underbelly blog](https://under-belly.org/how-to-build-an-ice-cream-recipe/) has a ton of good posts with info on how to build and balance an ice cream recipe. The other bonus of making your own recipes is that you can control sweetness and modify firmness to fit your freezer. "
eRisk2022-T3_Subject5,, 2019-10-20 03:57:43 , reddit post ," Yeah, there is a biological component to eating disorders, but not in the way he’s saying. There’s evidence for genetic predisposition and brain changes in relation to eating disorders, but age isn’t the cause. Plenty of older women and men and even young kids (less than 10) have eating disorders, but it’s less diagnosed because of the false image that it’s a disease of adolescent girls. "
eRisk2022-T3_Subject5,, 2019-10-14 02:10:30 , reddit post ," I think she fell on beam in podium training, but that’s it as far as I know. Considering that almost everyone else on the team fell at least once, I don’t think that it’s a big deal. "
eRisk2022-T3_Subject5,, 2019-10-11 21:26:55 , reddit post ," It’s the same dimensions for men and women, about 40’x40’. "
eRisk2022-T3_Subject5,, 2019-10-07 22:02:38 , reddit post , How are you doing vegetarian poke? 
eRisk2022-T3_Subject5,, 2019-10-07 19:35:09 , reddit post ," Couldn’t you pan fry the tofu instead of deep fry? Mushrooms and squash are good, but they aren’t really a protein. While tofu is pretty common as a easy/lazy veggie sub, ramen is one of the dishes where it’s definitely appropriate.

For non-Tofu options you could do tempeh for vegan or egg for vegetarian. You could also offer fresh edamame as a topping for extra protein. "
eRisk2022-T3_Subject5,, 2019-10-06 20:31:30 , reddit post ," Pole is great! But, it’s already an international sport on it’s own, so it couldn’t be added to gymnastics due to IOC and GAISF rules. "
eRisk2022-T3_Subject5,, 2019-10-06 18:12:48 , reddit post ," I like the idea of something upper body. Maybe aerial straps. Examples: [1](https://www.instagram.com/p/BrWbr21Ab5U/?igshid=7vhh40oqkyab) [2](https://www.instagram.com/p/BqbO4dqlgR5/?igshid=kpmr8qs74pj6) [3](https://www.instagram.com/p/BvowKloAPLO/?igshid=1id6ojxlwa1d8). It’s somewhat similar to rings, and requires a ton of core and upper body strength. Plus there’s a lot of variation in what types of stuff you can do, so they could go with either a dance-orientented routine (like beam/floor) or make strict (e.g. always using two arms, no spinning, etc) like bars/rings. "
eRisk2022-T3_Subject5,, 2019-10-06 02:24:25 , reddit post ," Elbow grip is pretty painful until you get used to it. Without seeing what you were doing it’s hard to say if there was something wrong or if you just need time to work up to full elbow grips. Different people have different pain tolerances, especially for different body parts.

For elbow grip I find there’s two things that are painful: 1. The pressure of the pole against your arm (especially if you’re arms are thinner) 2. The feeling of skin pulling.

To ease yourself into elbow grip you can practice in a climb position. Position your legs like you would for a basic climb, extend your legs up and hook your elbow, then bend your knees so that more of your weight is resting in your elbow. You can also put your other hand on the pole to take some of the weight off. "
eRisk2022-T3_Subject5,, 2019-10-04 23:03:55 , reddit post ," They’re the best for macadamia nuts too, at least where I am. "
eRisk2022-T3_Subject5,, 2019-10-02 00:54:13 , reddit post ," In my experience milk doesn’t make a difference. I don’t drink milk, but my boyfriend does, so I use whatever he buys. Usually it’s 2% from Trader Joe’s. Sometimes it’s whole milk or 2% from a fancier store. I don’t notice a difference. On occasion he’s bought 1% which is icy in my normal ice cream (I use a base optimized for whole milk). However, I can get away with 1% if I make high fat and sugar flavors like white chocolate or almond brittle.

For cream I find that the cheaper ones are lower in fat which leads to an icier final product. Some store brands are fine (QFC has a good store brand heavy cream) but you just need to check. "
eRisk2022-T3_Subject5,, 2019-10-01 06:32:42 , reddit post ," I really like the Thai Sweet Chili Veggie Burgers, the 3 grain tempeh, and the fresh edamame. The Chana Masala frozen meal, and soyrizo are really good too. "
eRisk2022-T3_Subject5,, 2019-10-01 05:12:02 , reddit post , I’ve used xanthan gum with great success. 
eRisk2022-T3_Subject5,, 2019-10-01 04:51:05 , reddit post , Me too 
eRisk2022-T3_Subject5,, 2019-09-30 19:57:27 , reddit post ," Yes, unsweetened pb. I use skim milk powder, soy lecithin, and locust bean gum, although the gum is more for ice crystal suppression. "
eRisk2022-T3_Subject5,, 2019-09-30 19:45:30 , reddit post ," I also do an eggless base. I keep the milk/cream ratio the same for peanut butter ice cream, and add a bit more sugar to compensate. However my base ratio is 2:1 milk to cream. "
eRisk2022-T3_Subject5,, 2019-09-26 01:22:24 , reddit post , [Baobab](https://imgur.com/4loAJzh) 
eRisk2022-T3_Subject5,, 2019-09-25 16:31:02 , reddit post , I think it could! The frosting I used it for is basically a custard and it worked great for that. 
eRisk2022-T3_Subject5,, 2019-09-25 16:20:03 , reddit post ," I’ve used it to replace egg yolks in ice cream and German Chocolate frosting. It works great! For egg substitutes in baked goods like muffins I use xanthan gum. I mix 1/4 of water plus 1/4 tsp of gum in a blender (to prevent clumping, it’s hard to whisk by hand) per egg. Soy lecithin doesn’t help with binding, just emulsification, so I imagine it’d be a bit crumbly in baked goods. "
eRisk2022-T3_Subject5,, 2019-09-17 23:48:36 , reddit post ," Hmm I didn’t realize that was common. Where I am (US west coast) people tend to replace with soy, beans/lentils, fake meat, and other plant based options while dairy intake is roughly the same as an omnivore diet. "
eRisk2022-T3_Subject5,, 2019-09-14 18:01:42 , reddit post ," Huh I’ve never found rennet in ice cream, but it’s definitely a problem with cheese. "
eRisk2022-T3_Subject5,, 2019-09-11 20:18:41 , reddit post , Xanthan gum is a great egg substitute for holding baked goods together. 1/4 of water plus 1/4 tsp xanthan gum whipped in a blender replaces 1 egg. 
eRisk2022-T3_Subject5,, 2019-09-10 23:51:11 , reddit post ," Hmm unfortunately I need something by mid October, but I’ll keep them in mind for future purchases. "
eRisk2022-T3_Subject5,, 2019-09-10 20:07:27 , reddit post , 5 weeks including shipping? I’m in the US. 
eRisk2022-T3_Subject5, Opinions on Bandurska Design? , 2019-09-10 18:04:30 , reddit post , I’m looking to buy new pole clothes and they have some really cute sets. Has anyone ordered from them? How is the fit and quality? I saw that they offer custom sizing and colors for no charge which would be nice. 
eRisk2022-T3_Subject5,, 2019-09-10 00:28:42 , reddit post , I take mine a lot. No one has complained about the third “bag” yet. It doesn’t take up any extra space overhead since it fits above my suitcase. 
