ID,WRITING.TITLE,WRITING.DATE,WRITING.INFO,WRITING.TEXT.Element:Text
eRisk2023-T3_Subject4, b' ' , b'2022-09-07 15:28:59' , reddit post ,"For the leangains method: RePT Fitness workout tracker. Does all of the reverse pyramid and progression maths for you, comes preloaded with a decent full body routine with a few accessories, but it's also customisable and its completely free with no ads."
eRisk2023-T3_Subject4, b' ' , b'2022-07-14 23:56:57' , reddit post ,"Is there some kind of nuance that I\'m missing here:   ""This bill requires a designated officer of the Department of Justice to act as the national coordinator of an Active Shooter Alert Communications Network regarding an emergency involving an active shooter.  The bill sets forth duties of the coordinator, including to work with state, tribal, and local governments to encourage coordination of various elements of the network. The coordinator must also encourage federal, state, local, and tribal government agencies to establish procedures for responding to active shooters.  Finally, the bill requires the Government Accountability Office to study and report on state and local responses to active shooters and situations requiring the issuance of a public alert or warning""  On what grounds could anyone possibly object to these requirements?"
eRisk2023-T3_Subject4, b' ' , b'2022-06-29 11:06:36' , reddit post ,"If you connect the app to google fit, you can export all the data as a csv through Google takeout. You have to do a bit of formatting with the results but it's still easier than transcribing.  Religiously hit every workout so I'm a little puzzled on the muscle mass stats. I would have expected maybe a bit of a drop but not that much.  My lift numbers are not great but i have seen some progress:  BP: 60x8>72.5x8 OHP:40x8>52.5x8 Squat: 100x10>110x10 Deadlift:120x6>142.5x6 Chinups: 4>11  One factor is my sleep is total crap so that probably plays a big part."
eRisk2023-T3_Subject4, b' ' , b'2022-06-28 18:54:00' , reddit post ,"It's the EufyLife app that works with the Eufy C1 smart scale.  https://play.google.com/store/apps/details?id=com.oceanwing.smarthome  Good points: weigh yourself every morning and it will automatically add your weight to your phone and you can sync it with apple or Google fit.  Bad points: apart from the weight, everything else is nonsense, there is no way I have lost half a kilo of bone mass and 8kg of muscle tissue. I started using this to try and track down to about 12% body fat. I stuck all the data in a spreadsheet and at my current trajectory, I would have to lose another 25kg (including muscle and bone) to achieve that."
eRisk2023-T3_Subject4, b' ' , b'2022-06-28 18:31:07' , reddit post ,"As long as I've got enough black coffee to get me through the morning, I'm fine until 12 and then get pretty hungry around then. Once I got used to eating within a window, my body eventually capitulated on hunger outside of it. I make sure my meals are as physically big as possible and full of fibre, loads of spinach, mushrooms and broccoli. Shirataki noodles are a constant staple and an excellent low calorie filler. And occasional psyllium husk adds to some satiation. The trickier part is keeping the protein high whilst keeping the total calories low. It's pretty much a cycle of fish, chicken breast and egg whites with the occasional bit of prawns, beef, ham or protein cheese."
eRisk2023-T3_Subject4, b' ' , b'2022-06-28 16:44:04' , reddit post ,"cheers man, yeah it sneaks up on you sometimes."
eRisk2023-T3_Subject4, b' ' , b'2022-06-28 14:21:28' , reddit post ,These scales.  eufy Smart Scale C1. https://amzn.eu/d/jazKiAs  I don't think any of the data outside of the weight and bmi is accurate mind you but I do like to have some kind of data.
eRisk2023-T3_Subject4, b' ' , b'2022-06-28 10:13:06' , reddit post ,"Leangains protocol + Loose Keto\r   1600cals a day, 200g protein, 50g carbs\r   16:8 IF\r   Reverse Pyramid Resistance Training 3x week"
eRisk2023-T3_Subject4, b'M/31/184cm [94.5kg is greater than 76kg = 18.5kg] (6 months)' , b'2022-06-28 10:12:56' , reddit post ,
eRisk2023-T3_Subject4, b' ' , b'2022-04-07 00:48:16' , reddit post ,"Thanks! It's the EufyLife app used with these scales: [URL] My hope and assumption is that they aren't very accurate though as they suggest I've lost 5kg of muscle mass and at the rate of weight to fat percentage loss, I'd need to be 50kg or so before I hit 10%bf. But at least they give a vague idea that things are going in the right direction."
eRisk2023-T3_Subject4, b' ' , b'2022-04-06 15:57:14' , reddit post ,FYI:  1600cals a day. 55% protein 40% fat 5% carbohydrates. 16:8 IF  Reverse pyramid resistance training 3x a week. 10g EAA and 10g Creatine pre-workout.
eRisk2023-T3_Subject4, b'M/31/184cm [94.5kg > 82kg = 12.5kg] (3 months) Let myself go over the covid years and needed to do some damage control.' , b'2022-04-06 15:49:03' , reddit post ,
eRisk2023-T3_Subject4, b' ' , b'2022-01-14 15:16:03' , reddit post ,"I\'m afraid I can\'t see that as a positive: Corporation produces crap. ""Designer sunnies"" for example, unrecyclable plastic lenses that cost them 50p to produce and sell for \xc2\xa3400. They spend resources to freight them to an Amazon warehouse. Customer buys them and doesn\'t like them. Van takes them back to warehouse. Amazon bundles them up into a box of general crap that people didn\'t want, like or need and sells them again. Van takes them to new customer in assumedly an insane amount of Amazon style packaging. Whereupon the new customer packages them up again, and send them in a van to another customer paying another e-commerce platform 12% for the privilege.  1. That is the most inefficient way of providing a resource to a resource user. 2. The intrinsic value of the resource is in no way reflected in the cost imposed on the user. 3. The environmental aspect of the operation is horrendous. 4. The tabloid media being used to market Amazon selling real world loot boxes to a generation of people trained to think with that mentality through live service video games is disgusting. What\'s the likelihood of getting a box of goods where the price paid is consistently lower than the combined value of the goods contained? If it\'s a high likelihood then why wouldn\'t Amazon just resell the products themselves. They like money.  Sorry to rant. I just hate inefficiency."
eRisk2023-T3_Subject4, b' ' , b'2022-01-14 14:47:30' , reddit post ,Why not just take it to it's inevitable conclusion and just constant be shipping pallets of crap we don't want or need to each other so we can repackage them and sell them to the next in line.
eRisk2023-T3_Subject4, b' ' , b'2022-01-14 14:43:33' , reddit post ,Products you have are guaranteed to have no specific need of. Spend large amounts of money to buy stuff that other people didn't want... What stage of capitalism is this...
eRisk2023-T3_Subject4," b""I didn't read the article but the whole premise of it as clickbait made me feel queasy"" ", b'2022-01-14 14:37:45' , reddit post ,
eRisk2023-T3_Subject4, b' ' , b'2022-01-10 16:59:09' , reddit post ,:D Thank you for the vote and kind words.
eRisk2023-T3_Subject4, b' ' , b'2022-01-10 16:58:02' , reddit post ,That was a close one! Thank you for your votes.
eRisk2023-T3_Subject4, b' ' , b'2022-01-09 01:44:01' , reddit post ,I made this from a request for sbubby by u/bigbangbilly but was told you guys might appreciate it
eRisk2023-T3_Subject4," b'Strike Thirst, Strike Half-fat, No Sugar' ", b'2022-01-09 01:43:29' , reddit post ,
eRisk2023-T3_Subject4, b' ' , b'2022-01-08 18:33:42' , reddit post ,"Lol thats funny, when I put it together I saw the X as the eyes, the D as an unhappy mouth, the B as a bra, I as a belt and As as pants"
eRisk2023-T3_Subject4, b' ' , b'2022-01-08 18:26:58' , reddit post ,I absolutely do not understand this request but here's [a thing][URL]
eRisk2023-T3_Subject4," b'Strike Thirst, Strike Half-fat, No Sugar' ", b'2022-01-08 18:25:02' , reddit post ,
eRisk2023-T3_Subject4, b' ' , b'2022-01-05 23:22:20' , reddit post ,"Well... that aged very poorly, very quickly."
eRisk2023-T3_Subject4, b' ' , b'2022-01-05 23:17:45' , reddit post ,Why does the damned news have to be so fast paced.
eRisk2023-T3_Subject4, b' ' , b'2022-01-05 17:51:41' , reddit post ,what in sam hell is a puma?
eRisk2023-T3_Subject4, b' ' , b'2022-01-05 11:49:27' , reddit post ,I'd never heard of it until yesterday so in-case no-one else has:  https://www.game.co.uk/en/hogwarts-legacy-2835863
eRisk2023-T3_Subject4," b'Taxed, Insured and Tested' ", b'2022-01-05 11:45:32' , reddit post ,
eRisk2023-T3_Subject4, b' ' , b'2022-01-04 13:39:30' , reddit post ,[Here you go][URL]
eRisk2023-T3_Subject4, b'50 Roblux per Block' , b'2022-01-04 13:38:35' , reddit post ,
eRisk2023-T3_Subject4," b""Is this the way it's meant to be played?"" ", b'2022-01-04 12:46:06' , reddit post ,
eRisk2023-T3_Subject4, b' ' , b'2021-12-31 14:31:34' , reddit post ,https://youtu.be/8HgejSCHRi8?t=173
eRisk2023-T3_Subject4, b' ' , b'2021-12-31 14:16:44' , reddit post ,Nice! I'll give that a go next time.
eRisk2023-T3_Subject4, b' ' , b'2021-12-31 13:38:47' , reddit post ,":D thanks for noticing!  Yeah I did see that. Seems like a bit of a shame but yeah like you say, it's not great. Not knowing what I was doing, I did try and render the image first and it maxed out all 6 cores on my CPU for the whole time I went to cook dinner (despite telling it to use the GPU)"
eRisk2023-T3_Subject4, b' ' , b'2021-12-31 02:33:57' , reddit post ,Didn't profit [myself][URL] but maybe you'll have better luck.
eRisk2023-T3_Subject4," b""Invest in asking who's asking"" ", b'2021-12-31 02:32:15' , reddit post ,
eRisk2023-T3_Subject4, b' ' , b'2021-12-31 00:46:32' , reddit post ,Thanks! Trying to get 3D extrusion to work properly in Photoshop was a huge pain but a good learning experience.
eRisk2023-T3_Subject4, b'Just give me the ingredients!' , b'2021-12-31 00:11:47' , reddit post ,
eRisk2023-T3_Subject4, b' ' , b'2021-12-30 23:58:59' , reddit post ,[There you go][URL]
eRisk2023-T3_Subject4, b'Cool Story Bro' , b'2021-12-30 23:57:40' , reddit post ,
eRisk2023-T3_Subject4, b'I think it was the guy second from the left' , b'2021-12-30 16:16:32' , reddit post ,
eRisk2023-T3_Subject4, b' ' , b'2021-12-29 17:11:40' , reddit post ,Vs the Dragonborn? Controversial.
eRisk2023-T3_Subject4, b'Norse Force: An open world survival psychological walking sim fighting RPG' , b'2021-12-29 16:55:27' , reddit post ,
eRisk2023-T3_Subject4, b'Drive to the ends of the earth' , b'2021-12-27 18:11:32' , reddit post ,
eRisk2023-T3_Subject4, b' ' , b'2021-12-25 04:17:08' , reddit post ,Had to Google what that is but that sounds like a really cool idea.
eRisk2023-T3_Subject4, b' ' , b'2021-12-25 01:15:53' , reddit post ,I did! Thanks.
eRisk2023-T3_Subject4, b' ' , b'2021-12-24 22:57:35' , reddit post ,That was certainly part of the inspiration. I wanted it to be impossible. Quite nauseating to make actually. :D
eRisk2023-T3_Subject4, b'P\xcc\xb4\xcc\x95\xcc\x97l\xcc\xb4\xcd\x9d\xcd\x9d\xcc\x9da\xcc\xb4\xcd\x83\xcc\xbcy\xcc\xb7\xcd\x8c\xcc\xa4S\xcc\xb6\xcc\xbe\xcd\x8c\xcc\xb1\xcd\x85t\xcc\xb8\xcc\xbf\xcc\xaaa\xcc\xb5\xcd\x8c\xcc\x88\xcc\x9e\xcd\x95t\xcc\xb8\xcd\x84\xcc\x81\xcc\xa0\xcd\x94i\xcc\xb4\xcc\x84\xcc\xa4o\xcc\xb6\xcd\x86\xcc\xb1n\xcc\xb6\xcc\x8e\xcc\xa7' , b'2021-12-24 21:28:36' , reddit post ,
eRisk2023-T3_Subject4, b' ' , b'2021-12-24 18:44:45' , reddit post ,"\xd0\x9d\xd0\xb0\xd0\xb4\xd0\xb5\xd1\x8e\xd1\x81\xd1\x8c, \xd0\xbe\xd0\xbd \xd1\x83\xd0\xb2\xd0\xb8\xd0\xb4\xd0\xb8\xd1\x82 \xd0\xb2\xd0\xb0\xd1\x88\xd1\x83 \xd0\xbf\xd1\x80\xd0\xbe\xd1\x81\xd1\x8c\xd0\xb1\xd1\x83 \xd0\xb8 \xd0\xbf\xd0\xbe\xd0\xb4\xd1\x87\xd0\xb8\xd0\xbd\xd0\xb8\xd1\x82\xd1\x81\xd1\x8f"
eRisk2023-T3_Subject4, b'You-kraine' , b'2021-12-24 13:53:47' , reddit post ,
eRisk2023-T3_Subject4, b' ' , b'2021-12-23 17:33:18' , reddit post ,Here's... [something like that][URL]
eRisk2023-T3_Subject4," b""Come with me, and you'll be, in a world of poor image recreation"" ", b'2021-12-23 17:29:14' , reddit post ,
eRisk2023-T3_Subject4, b' ' , b'2021-12-21 14:54:41' , reddit post ,[Hoom Aloom][URL] \\- Not sure if its Freef enough to Eef but here it is
eRisk2023-T3_Subject4, b'Murry Crustmiss' , b'2021-12-21 14:50:35' , reddit post ,
eRisk2023-T3_Subject4, b' ' , b'2021-12-21 11:20:10' , reddit post ,"lol, there's too much truth here"
eRisk2023-T3_Subject4, b' ' , b'2021-12-21 00:15:40' , reddit post ,"I must say, I haven't played since launch, because of... well, this."
eRisk2023-T3_Subject4, b'I fixed the box' , b'2021-12-20 23:36:04' , reddit post ,
eRisk2023-T3_Subject4," b'From the studio that brought you such hits as ""He must be hacking"" and ""Lucker"":' ", b'2021-12-20 23:32:48' , reddit post ,
eRisk2023-T3_Subject4, b'It feels like T.J Miller would probably still have been there' , b'2021-12-14 20:31:51' , reddit post ,
eRisk2023-T3_Subject4, b' ' , b'2021-11-25 22:49:26' , reddit post ,Thank you!!! This works in 3.15. weird to see it's been an issue for this long.
eRisk2023-T3_Subject4, b' ' , b'2021-06-15 14:26:56' , reddit post ,[this one][URL] from Martin Freeman in Bruiser is my favourite
eRisk2023-T3_Subject4, b' ' , b'2021-05-28 14:36:34' , reddit post ,Thought process:  Is - Was - [Will be] ?  Hat called willby? There's a hat called a trilby? Bird called a trilbont?  ...oh it's a fez.  I need more sleep.
eRisk2023-T3_Subject4, b' ' , b'2021-02-28 18:11:01' , reddit post ,Always seeing that roaming gang of little scrotes about. Whereabouts was that?
eRisk2023-T3_Subject4, b' ' , b'2020-11-16 14:57:42' , reddit post ,You'll get slightly better multicore performance out of the last gen 3700x for the same price. And with the board you could upgrade to a 5800x or similar when prices drop next year to maximise your productivity gains.
eRisk2023-T3_Subject4, b' ' , b'2020-10-25 20:48:43' , reddit post ,If you want a decent CPU for gaming on a budget setup then the i5 9600k is under \xc2\xa3177 on Amazon right now. Pair that with a cheaper z390 board and you're good to go for even the latest games. Can't beat that for price per performance.
eRisk2023-T3_Subject4, b' ' , b'2020-10-09 22:29:08' , reddit post ,Henries class of 2002. We were definitely seeing a decline in teaching standard and even results for our year. I know their decision to take gcse maths from an unrecognised exam board was screwing them in the league tables but results still weren't up to the level of reputation they had.  Seems a real shame to kill off the historical identity elements. That was one of the key selling points.
eRisk2023-T3_Subject4, b' ' , b'2020-09-08 10:02:21' , reddit post ,Earlsdon can be a bit jammed with students depending on what road you're on. Having said that there are quite a few terraces that have gone up for sale lately following a bit of a student exodus. Cheylesmore is a bit closer to the station and perfectly nice. Chapelfields is worth a look too.
eRisk2023-T3_Subject4, b' ' , b'2020-06-15 10:59:27' , reddit post ,Ark with all maps is 160gb. Rivals modern warfare for the SSD domination belt.
eRisk2023-T3_Subject4, b' ' , b'2020-03-31 10:35:35' , reddit post ,"Yaay, thank you. finally I can play this game.   Why on earth is this necessary remains beyond me."
eRisk2023-T3_Subject4, b' ' , b'2020-02-05 10:54:32' , reddit post ,Wouldn't shed a tear if they did that. Thing is a huge eyesore as it stands. God knows we enough of those in this city.
eRisk2023-T3_Subject4, b' ' , b'2020-02-05 10:13:27' , reddit post ,"That's just about vauge enough to convince me it's possible but I'd love to know where exactly these teams/DLR tracks, autonomous pod routes are actually going to fit in. \xc2\xa315 billion sounds like maybe enough money to do it. But the financing sounds very suspiciously PFI-like so I'm also curious how they plan on pricing this.  And 20 years is long enough in the future that it will be difficult to maintain any attention on this long enough to know if they will follow through. Just seems like some finger in the air political nonsense. You could put together the same routes, funding strategy and timeline for any major city in the UK."
eRisk2023-T3_Subject4, b' ' , b'2020-02-04 18:45:38' , reddit post ,"I'm sorry, does one of those videos claim to have been viewed over a billion times !? Who is this guy?"
eRisk2023-T3_Subject4, b'Must be one of those imaginary numbers I read about' , b'2020-02-04 18:36:10' , reddit post ,
eRisk2023-T3_Subject4, b'You already know they are going to turn it into student accommodation' , b'2020-02-04 12:53:20' , reddit post ,
eRisk2023-T3_Subject4, b' ' , b'2020-01-30 15:51:18' , reddit post ,That is a great find. Thank you. I'll order some now.
eRisk2023-T3_Subject4, b' ' , b'2020-01-29 18:58:57' , reddit post ,Sounds delicious. That's exactly what I cooked yesterday and used up the last of my stock.   I've got one more Aldi in my local area that I'm checking now and if they have any I'm getting every last box.
eRisk2023-T3_Subject4, b' ' , b'2020-01-29 18:24:56' , reddit post ,"Thanks, yeah I did see that but it's not the same stuff. 2 or 3 times the amount of carbs and twice the price."
eRisk2023-T3_Subject4, b' ' , b'2020-01-29 17:51:32' , reddit post ,Me too last week. No more this week. They're taking them out now!
eRisk2023-T3_Subject4, b' ' , b'2020-01-29 17:05:18' , reddit post ,Okay thanks. Good to know maybe my local has just run out and needs to restock.   This eBay listing scared me: https://www.ebay.co.uk/itm/174156744058  People paying 4x the price!
eRisk2023-T3_Subject4, b' ' , b'2020-01-29 16:51:58' , reddit post ,I get where you're coming from but these things must have been processed in some way that removes the carbohydrates and leaves protein and fibre. 3.1g of carbs.   I'm also not certain there is any definitive link between soya consumption and thyroid function but I'm interested to know more. https://www.ncbi.nlm.nih.gov/m/pubmed/16571087/
eRisk2023-T3_Subject4, b' ' , b'2020-01-29 16:18:36' , reddit post ,"UPDATE: been to 2 more stores. An employee confirmed they were being sold for a limited time only and will now be discontinued. Get them whilst you still can!  As you may or may not know. Aldi have up until now been stocking the best keto pasta replacement I\'ve ever tasted in 3 varieties of pasta based on soy beans under their ""foodie market"" brand. The pictured is the lowest carb option, the black bean soy spaghetti.  The stocks have been dwindling these past few weeks and today they are all gone. Has anyone noticed this happening in their local stores?   Does anyone know of a potential alternative? I saw that asda have a more expensive, higher carb, worse tasting offering in their free from section but, as described, it\'s crap."
eRisk2023-T3_Subject4, b'Where has Aldi soybean pasta gone?' , b'2020-01-29 16:13:36' , reddit post ,
eRisk2023-T3_Subject4, b' ' , b'2019-12-05 15:35:39' , reddit post ,https://www.aldi.co.uk/p/021470335712001 \xc2\xa34.99 750g / 2 metres of pig in blanket.
eRisk2023-T3_Subject4, b'Anyone thinking about bringing their own food home for Christmas?' , b'2019-12-05 15:34:06' , reddit post ,
eRisk2023-T3_Subject4, b' ' , b'2019-11-21 17:13:50' , reddit post ,I wondered what happened to Seth Green.
eRisk2023-T3_Subject4, b' ' , b'2019-11-14 20:20:57' , reddit post ,Diet tonic water. All the ice. And a slice of citrus squeezed round the rim. You can almost convince yourself it's a G  and T. I've tried looking into non-aspartame alternatives but there aren't any. And I drink about 8 bottles of the stuff a week and it doesn't appear to affect my weight loss.
eRisk2023-T3_Subject4, b' ' , b'2019-09-21 21:31:04' , reddit post ,Ah right. These are made by a company called the foodie market for Aldi. 3 net carbs per cooked 100g
eRisk2023-T3_Subject4, b' ' , b'2019-09-21 11:15:46' , reddit post ,"Oh dear. Don't get me wrong. I get Aldi and Lidl confused all the time, but I'm 100% sure it was Aldi for this one. Who would have thought that Coventry would be pioneering in the gluten-free Aldi world. I hope you have better luck or less grumpy staff next time. Enjoy your Saturday anyway."
eRisk2023-T3_Subject4, b' ' , b'2019-09-21 10:56:15' , reddit post ,:D Any luck?
eRisk2023-T3_Subject4, b' ' , b'2019-09-21 10:13:11' , reddit post ,4.7g net carbs per 50g dry on these. It's 95% soy but there are some slightly lower carb alternatives. These just have a really nice texture.
eRisk2023-T3_Subject4, b' ' , b'2019-09-21 10:10:14' , reddit post ,:D Awesome. It's all about the creamy spinach.
eRisk2023-T3_Subject4, b' ' , b'2019-09-21 00:55:38' , reddit post ,At least you guys got that zero net carb magic bread. Saw a few posts on that and kept hunting only to realise that Aldi was also in the US but had different stuff.
eRisk2023-T3_Subject4, b' ' , b'2019-09-20 23:02:31' , reddit post ,"Hahaha, if it helps, they're only 5% mung bean and they don't smell like death."
eRisk2023-T3_Subject4, b' ' , b'2019-09-20 21:53:55' , reddit post ,Check the gluten free section. :)
eRisk2023-T3_Subject4, b' ' , b'2019-09-20 21:22:25' , reddit post ,Really surprisingly good. The kind of thing you could give to someone and they wouldn't know it wasn't flour-based.
eRisk2023-T3_Subject4, b' ' , b'2019-09-20 21:21:45' , reddit post ,Aldi if you have one near you. I live in the UK. I believe you can get them on Amazon too.
eRisk2023-T3_Subject4, b' ' , b'2019-09-20 21:21:07' , reddit post ,"Haha, sorry yeah the UK"
eRisk2023-T3_Subject4, b' ' , b'2019-09-20 18:54:38' , reddit post ,Thank you for the advice
eRisk2023-T3_Subject4, b' ' , b'2019-09-20 18:49:15' , reddit post ,"Pan fried Salmon fillets and prawns with green beans and capers, with a creamy blue cheese and spinach sauce on a bed of edamame and mung bean fettuccine.  Iceland - Salmon Fillet (Frozen), 240g  Asda Smartprice - Frozen Prawns, 100g  Iceland - Freshly Frozen Whole Leaf Spinach, 100g  Iceland - Frozen Green Beans, 80g  Aldi - Capers, 2 tbs  Aldi - Single cream, 99ml  Philadelphia - Philadelphia, 90g  Asda - English Blue Stilton Cheese, 50g  Aldi - Edamame and Mung Bean Fettuccine, 184g (50g dry)  1. Defrost the fish and prawns in advance. I would normally place in a bag in a bowl of lukewarm water for 20 minutes. 2. Fry up the salmon fillets. Place the hob on a medium high heat, put some oil in a plan and place the fillets in skinside first and flip after 4 minutes. 3. Stick the spinach in the microwave until it's cooked. About 3 minutes on high for an 800W microwave. 4. Bang the fettuccine in a pot with some salt and boiling water. Adjust the hob so the water simmers and cook for 5 minutes. 5. Season another pan with garlic or whatever you fancy, medium heat, plop the cooked spinach in there. At this point you should be about ready to flip the fish. 6. Put the green beans in the microwave for 3 minutes on high. Throw in the cheeses and cream on the spinach. Mix it about a bit and cook until the green beans ding in the microwave. 7. Turn the hob off on the fish and the fettuccine and then drain it. 8. Toss the prawns into the sauce. Mix it about a bit more and cook for another minute. 9. Jam it all on a plate and sprinkle the capers on the fish  1379 calories 122g protein 87g fat 19g carbs  Good for if you've had a light lunch or your stupid car has broken down and you've had to start cycling to work and need to up your intake.  Halve everything for a probably more normal sized meal."
eRisk2023-T3_Subject4, b'Creamy Seafood Extravaganza' , b'2019-09-20 18:49:02' , reddit post ,
eRisk2023-T3_Subject4, b' ' , b'2019-09-20 16:34:53' , reddit post ,"Pan fried Salmon fillets and prawns with green beans and capers, with a creamy blue cheese and spinach sauce on a bed of edamame and mung bean fettuccine.  Iceland - Salmon Fillet (Frozen), 240  Asda Smartprice - Frozen Prawns, 100 g Iceland - Freshly Frozen Whole Leaf Spinach, 100 g Iceland - Frozen Green Beans, 80 g Aldi - Caper (non patrol), 2 tbs Aldi - Single cream, 99 ml Philadelphia - Philadelphia, 90 gr Asda - English Blue Stilton Cheese, 50 g Aldi Foodie Market - Edamame and Mung Bean Fettuccine (Aldi), 184 g  Defrost the fish and prawns in advance. Fry up the salmon fillets. Stick the spinach in the microwave until it's cooked Bang the fettuccine in a pot with some salt and boiling water Season a pan with garlic or whatever Plop the cooked spinach in there Flip the fish Put the green beans in the microwave Throw in the cheeses and cream on the spinach. Mix it about a bit. Green beans out the microwave, turn the hob off on the fish and the fettuccine and then drain it. Toss the prawns into the sauce. Mix it about a bit more until the prawns are warm enough to eat. Jam it all on a plate and sprinkle the capers on the fish  1379 calories 122g protein 87g fat 19g carbs  Good for if you've had a light lunch or your stupid car has broken down and you've had to start cycling to work and need to up your intake."
eRisk2023-T3_Subject4, b'Creamy seafood extravaganza' , b'2019-09-20 16:22:14' , reddit post ,
eRisk2023-T3_Subject4, b' ' , b'2019-09-20 11:16:20' , reddit post ,"Onions and root vegetables are only good in small amounts if you want to keep the carbs down. You'll want to focus on spinach (frozen is best if you don't like the taste, you can microwave it and mix it into anything for a bit of fibre and vitamins), broccoli, cauliflower is great because it's pretty much just water, Brussel sprouts and asparagus with butter and bacon (I'm getting hungry thinking about it). Psyllium husk is a good buy if you're struggling to get the fibre you need and supplement with a multivitamin if you aren't getting enough veg."
eRisk2023-T3_Subject4, b' ' , b'2019-09-20 09:20:37' , reddit post ,"Oh, yeah, so it is. [sad emoticon] Yeah, I've got nothing then."
