ID,WRITING.TITLE,WRITING.DATE,WRITING.INFO,WRITING.TEXT.Element:Text
eRisk2023-T3_Subject17, b' ' , b'2022-10-18 02:10:33' , reddit post ,"I don't experience gender envy actually. I see my gender as intrinsic to me, so it'd be pretty fucked up if I did lol"
eRisk2023-T3_Subject17, b' ' , b'2022-10-18 01:43:20' , reddit post ,"Sorry, I don't really get it. I think we might be coming at it with different understandings of gender. Why would she just look like a woman and not a man dressed like a woman, but he would look like a man dressed like a woman?  I think you'll have a hard time coming off as not straight if you specifically do a couple's costume with 2 people, where one must be femme and one must be masc, and play off each other as a pair, especially if you accentuate differences in your bodies. Those are straight ideals, cues that straight people use to find others like them. Binary centrism that treats femininity as the flipside of masculinity, traits that must be balanced with each other.  Both of my partners are different gender than me, as a nonbinary person, but we treat them like gay, same gender relationships, so when we dress up for cons and stuff like that we emphasize similarity in gender. We have a schoolgirl gang costume that we do and we're also going to dress lolita. I think both of those are also archetyped gender expressions that help an audience go beyond making the connection of femininity > woman.  I liked the other commenter's idea of vaudeville style mixing masc and femme traits in both of you. You can take that idea into any costume you choose. And maybe you can take some inspiration from drag, including techniques that AFAB queens or drag kings use. Or what about gender swapping the characters themselves? He plays female Mario, she plays Prince Peach; she plays Mario, he plays Bowsette, if being a male female character pair is easier for you."
eRisk2023-T3_Subject17, b' ' , b'2022-10-17 06:19:59' , reddit post ,"""Dedicate"" is supposed to be Delicate right?  I was gonna ask about the pigeon question but then I saw."
eRisk2023-T3_Subject17, b' ' , b'2022-10-16 20:18:14' , reddit post ,"I'm sorry, that sounds so difficult. I also grew up with a really open parent and struggled when I met my in-laws who judged me for my class and background, and I felt they blamed me for the way my partner and I lived as adults. Experiencing oppression from within your family is a very different and more vulnerable position than just from general society.  It was very kind of you to offer to come out to your bf's parents before him, so please don't feel guilty for it. Try to look at it like your bf's dad is the one responsible for his own anger and making sure he doesn't bring harm to his family. It isn't your existence or coming out that is the problem.  I also think it's so normal to tell the siblings first before the parents, those siblings are probably your peers and have way less power over the two of you than the father has."
eRisk2023-T3_Subject17, b' ' , b'2022-10-16 19:20:42' , reddit post ,"It sounds religious.   I think subconsciously picking up on gender cues is real, that\'s how humans usually guess other people\'s gender, but the past life and refusal to define ""energy"" stuff is part of a specific spiritual belief. You don\'t have to believe or take her beliefs to heart if you don\'t want to."
eRisk2023-T3_Subject17, b'Cancel passport renewal?' , b'2022-10-16 19:09:58' , reddit post ,"I sent an application for a passport renewal because I only have a card and not a book. What I didn't know is that my mother actually has my passport, valid for 3 more years, and only gave me the card because I was a minor at the time.  I got a letter from the gov saying I need to give them them the current passport if I want a renewed one. But I don't want to renew it anymore now that I have it, and if I send my passport in I may not get the new one in time for my planned travel.  Is there a number I can call to tell them to cancel it and please return my documents? I assume they will keep the money I sent."
eRisk2023-T3_Subject17, b' ' , b'2022-10-16 03:15:39' , reddit post ,"Hey, good luck, I hope you get some good perspectives that are useful to you."
eRisk2023-T3_Subject17, b' ' , b'2022-10-16 03:09:15' , reddit post ,I'm happy for you! Today is the first day of the rest of your life :)
eRisk2023-T3_Subject17, b' ' , b'2022-10-16 02:54:22' , reddit post ,">Any thoughts on how to look hot but also come across as not straight?  Have you considered any same gender characters? It seems like you only named pairs with 1 man, 1 woman"
eRisk2023-T3_Subject17, b' ' , b'2022-10-15 10:48:47' , reddit post ,"Hey I love this one! I didn't realize it was a template at first, it looks finished just like this lol  I don't relate to the one with the heteronormative first pic, thank you for making this :)"
eRisk2023-T3_Subject17, b' ' , b'2022-10-13 23:50:49' , reddit post ,"It can be a difficult transition when your chosen name is another version of your deadname. If this is the first or one of a few times you said you don\'t consider your deadname to be a valid name for you, I think it\'s good to check you\'re both on the same page after any tough feelings about this incident calm down. It could be active disregard or it could be a miscommunication that your partner is happy to clear up.  In addition to that, it concerns me that your partner doesn\'t use your pronouns because he doesn\'t ""like"" them. Your pronouns wouldn\'t normally be someone else\'s choice or open to someone else\'s opinion. This seems a bit like a broader effort to avoid dealing with your transition."
eRisk2023-T3_Subject17, b' ' , b'2022-10-12 01:27:50' , reddit post ,None gender with left masc!  How about proxvir or aporagender?
eRisk2023-T3_Subject17, b' ' , b'2022-10-12 01:24:09' , reddit post ,">The thing that throws me for a loop is when my friends get upset when a service industry worker refers to a group of us as \xe2\x80\x9cladies,\xe2\x80\x9d and they get very upset by the assumption.   >I don't know what they expect from people  This is the hurtful part. You\'re expressing that it\'s natural, normal, and expected that we\'re misgendered, just for dressing and looking how we want to.  If I described my presentation, I would definitely not see it as in-line with my assigned gender at all. I pick specific clothes, I style my body, I behave myself in a way to deliberately express my neutral gender. Yet I have never, ever been mistaken for anything except my assigned gender. I\'m sure that everyone sees my choices as normative, but or me they are purposefully rejecting of my assigned gender.  Is ""femme presenting"" a label that those nonbinary people have chosen for themselves? Or is it an interpretation of their gender that you\'ve put upon them? I find it weird that people label my presentation in direct opposition of my gender. All my presentation is in-line with my gender identity and not my assigned gender, all the time, unless I have to present otherwise for my safety.  I think this is part of what the other commenter wanted to express with ""unlearning the idea that gender, AGAB, and presentation are connected."""
eRisk2023-T3_Subject17, b' ' , b'2022-10-11 22:29:40' , reddit post ,It says I need permission to view
eRisk2023-T3_Subject17, b' ' , b'2022-10-11 02:48:17' , reddit post ,"Nice survey, it seems very thorough. I've completed it, I have no idea how I missed it since I'm active on samplesize too"
eRisk2023-T3_Subject17, b' ' , b'2022-10-11 01:44:01' , reddit post ,You look great! It may not be in the cards for you right now but I'd bet you'd kill at a wedding dressed masc
eRisk2023-T3_Subject17, b' ' , b'2022-10-11 01:00:40' , reddit post ,"It's very common, now that you have a better idea of what you want you're more capable of noticing when the world around you doesn't reflect that.  I'm sorry you're feeling this way, maybe you can balance it out by seeking out more validating experiences? There is a lot of joy in being nonbinary too."
eRisk2023-T3_Subject17, b' ' , b'2022-10-08 01:16:33' , reddit post ,">she is openly a trumper  OOF, there it is. I'm sorry you're in that situation. I did wonder if you just lived in an area where that kind of discrimination was particularly wide-spread.  My skillset allows me to self-employ, which is how I personally make ends meet (plus I am polyamourous and share costs with two partners). I don't know if self employment is viable at all in the education industry, but it's a way I avoid some of the usual restrictions of capitalism.  It certainly isn't fair that we don't have access to things others would take for granted, but I try to see it as doing what l need to do rather than what's nice or good, and that alleviates some of the pain that comes with living as a minority for me, personally. I wish you a lot of luck and I hope you find a way through."
eRisk2023-T3_Subject17, b' ' , b'2022-10-08 01:03:50' , reddit post ,"Your written requirements say that a person must have sexual experience with ""people of the same and different gender identities,"" but your screener only asked about sexual experience with male/masculine people and female/feminine people. That disqualifies people unless they have sexual experience with both *binary* sides of the gender spectrum, plus not having a nonbinary option may cause male and female to be interpreted as the *sex* as opposed to gender of a partner.  The survey goes back and forth on including or excluding nonbinary people throughout the whole thing. There is also one section that just refers to ""partners"" and not sex partners, leaving it ambiguous whether you\'re talking about sexual experience or romantic partnerships. That part coincidentally includes nonbinary partners, and happens to be right before a huge section that only asks about binary genders.  There are questions about sexual assault that specifically ask about men with specific body parts, ignoring any other gender or anybody with any other body part...  You\'re going to have a lot of difficulty drawing conclusions when the data you have is mixed as it is."
eRisk2023-T3_Subject17, b' ' , b'2022-10-07 23:41:08' , reddit post ,"This isn\'t nonbinary specific advice, but, the system isn\'t designed for you, or for anyone, to make a living. That\'s not the point of capitalism, which focuses on scale and business metrics over human lives. It sounds like you\'ve done ok for yourself so far working in good faith, but the system doesn\'t give back good faith.  As a coping mechanism, I would suggest not looking to your job and career of evidence of whether you are ""welcome"" or not. It\'s a natural connection for someone to make, but an employer is not a family or a safe space, they\'re a provider of resources.  I\'m curious kind of bad image your boss thinks you\'re giving the business? Is it just plain old fashioned transphobia, or is it stuff you can work around? Masc presentation on afab people can come off as unprofessional, if you presented more traditionally classy could that change people\'s impression of you? Supposedly you are working with children, is it a concern about how parents will react to you? Everyone acts differently at work than they do in their normal lives, so maybe there are things you can do without giving up your gender presentation.   I have definitely presented in more normative ways to try to be successful at work, but I don\'t think you should do that if it\'s unsustainable or harmful to you. If you haven\'t, it would be a good idea to think about what\'s necessary for you to have in an employer and what can be negotiated. Job searching will always be an act of compromise."
eRisk2023-T3_Subject17, b' ' , b'2022-10-07 08:00:05' , reddit post ,"What?? This literally looks like art of you, you did amazing"
eRisk2023-T3_Subject17, b' ' , b'2022-10-07 01:48:15' , reddit post ,"Have you considered agender, a label that can be under the nonbinary umbrella?  I agree that you don't really have to have a label or even a fully formed gender identity, if you are happy with how you're living now. Also, trans just means you don't identify fully with your assigned gender, it seemed like you might think it means to want to physically transition, but you don't need to have a physical transition to be trans or nonbinary :)"
eRisk2023-T3_Subject17, b' ' , b'2022-10-07 01:09:02' , reddit post ,Very appropriate username for this survey  
eRisk2023-T3_Subject17, b' ' , b'2022-10-07 00:52:20' , reddit post ,">I don't want to lump myself in a group I'm not actually a part of because it often damages members of that group  Hey, it's very kind of you to think of the needs of a group you're not sure you're part of. I just want you to know it's normal to question your gender or be unsure of your label, and you don't need to feel guilty or anything like that if you identify as nonbinary for a while but change your label later. The people who use this fact to oppress us are the problem. you're not doing anything wrong by just trying to figure yourself out.  I can't say that relate to the bulk of your post, but I am synesthetic and I have a color association with gender similar to yours, unfortunate as it may be for me to assign the stereotypical colors of pink for women and blue for men. I feel colorless, but I sense a presence where my gender is, if that makes sense. It has taken me a while but I recently realized that that synesthesia plays a big role in the dysphoria I feel, when I feel dysphoric I'm also sensing a lot of color on me or around me? Basically."
eRisk2023-T3_Subject17, b' ' , b'2022-10-04 22:58:18' , reddit post ,It sounds like you're trying to get me to do your work for you.
eRisk2023-T3_Subject17, b' ' , b'2022-10-04 20:10:37' , reddit post ,Why so many rules about how I'm allowed to contribute? I really can't imagine houseplants being such a high stakes issue.
eRisk2023-T3_Subject17, b' ' , b'2022-10-04 04:09:40' , reddit post ,Sounds like you do a lot of helping others and it's your turn to be listened to. You can tell me about your problems if you feel like it.
eRisk2023-T3_Subject17, b' ' , b'2022-10-01 21:25:24' , reddit post ,"Aw, I was a big fan of Ciabatta. Congrats on the babies!"
eRisk2023-T3_Subject17, b' ' , b'2022-10-01 21:23:59' , reddit post ,"Thanks so much for such a thorough answer! Your setup looks nice, did you make the light stand out of pipes yourself? Did you pick fluorescent over LED for any particular reason?  My monstera is pretty small right now, I'm hoping to keep it alive indoors until it's warm enough to go outside again next year, so I may take the Amazon route. I appreciate you giving a price point as well :)"
eRisk2023-T3_Subject17, b' ' , b'2022-10-01 15:55:34' , reddit post ,"Holy homophobia, batman! OP commented that he is a man."
eRisk2023-T3_Subject17, b' ' , b'2022-10-01 15:20:39' , reddit post ,"Can anyone recommend a grow light for a few houseplants, mostly pothos and monstera? I want a good quality one but I don't understand most of the spec descriptions and don't know where to start."
eRisk2023-T3_Subject17, b' ' , b'2022-10-01 14:59:30' , reddit post ,">you can hear the horn worms making a sort of pulse-scream/clicking  This comment will haunt my nightmares, I love it"
eRisk2023-T3_Subject17, b' ' , b'2022-10-01 14:53:23' , reddit post ,"It's because there are so many different kinds of plants with individual needs and growth patterns, as well as different ranges of variation between individual plants.  Personal experience and finding what works for you in your situation is best, drawing on someone else's personal experience is great too.   The worst thing that can come out of a wrong pot size is a plant that doesn't thrive, the only thing you have to lose is money and opportunity. Don't stress too much on the details. You can repot pretty often if sizing right is important to you."
eRisk2023-T3_Subject17, b' ' , b'2022-10-01 14:16:24' , reddit post ,"I always feel a bit weird about this argument. Who cares if I don\'t have standards, or if my standard aren\'t good enough for other people? They\'re my standards, they\'re my partners. Even though it\'s a very oppressive idea that all m-spec people date indiscriminately, I still don\'t personally choose my partners by checking if they are ""good enough."" I don\'t want to push back on oppression by agreeing with it."
eRisk2023-T3_Subject17, b' ' , b'2022-10-01 13:54:04' , reddit post ,"Hello fellow nonbinary write-ins   there are so many of us!!  OP, I'm attracted to nonbinary and gender non-conforming people first and foremost, so data like mine really isn't comparable to people who were able to select their real preferred gender..."
eRisk2023-T3_Subject17, b' ' , b'2022-10-01 02:46:21' , reddit post ,"I saw a pic, I don't know why it didn't show for you"
eRisk2023-T3_Subject17, b' ' , b'2022-09-30 02:03:53' , reddit post ,"Dahlias like a lot of light. I don't think they can really be grow indoors, but you've also got a screen up in front of the window there.  You can always try again for next season, they can be started indoors then transitioned outside. They're sensitive to overwatering and root rot when they're young, so that might be something else that stunted its growth this year."
eRisk2023-T3_Subject17, b' ' , b'2022-09-28 05:08:12' , reddit post ,"It depends. I have one on my balcony which faces west, but there's another apartment above me and a tree right in front of it so it's not much light lately.  You can sometimes get extreme temperatures on the side of a building too, these plants will do well in consistent 70-80\xc2\xb0 F. They can be acclimated to handle more sun and varying temperature, but I wouldn't try to push it right now since it's stressed. Indoor lights are fine too if the balcony isn't good right now.  Repotting with new soil is a good idea, I would personally wait on it but I think it could probably handle it if you feel like gardening.  Good luck and hope it goes well :)"
eRisk2023-T3_Subject17, b' ' , b'2022-09-28 02:33:56' , reddit post ,"Sure, they like bright indirect light, so put them somewhere like near a window where the sun comes in at an angle. They probably need some time to recover from the last 2 weeks, so check if the soil is dry now, but otherwise not much needs to be done at the moment.  You can give more water when the first couple inches of soil feels dry. Wet the soil all the way through to the bottom until the water drips out the holes in the pot.  If you want to pretty them up you can go through and cut off any leaves and stem parts that are brown or soft and mushy. These are vines so you can also get a support like a moss pole and tie them so they grow vertical, or let them hang down like they are now.  Really, they're easy and don't need much attention, great first plant to have. Good luck :)"
eRisk2023-T3_Subject17, b' ' , b'2022-09-28 02:16:03' , reddit post ,"If the only thing you changed was repotting, maybe it doesn't like the soil? Is it same kind of soil it was in before?"
eRisk2023-T3_Subject17, b' ' , b'2022-09-28 02:12:13' , reddit post ,"These are golden pothos, they're very common and easy to take care of. They are toxic if eaten, so keep pets away."
eRisk2023-T3_Subject17, b' ' , b'2022-09-27 22:12:08' , reddit post ,Nonbinary lol
eRisk2023-T3_Subject17, b' ' , b'2022-09-27 16:14:36' , reddit post ,"Your care routine sounds fine, a swiss cheese plant is also a monstera so doing the same stuff should work.  How exactly do you water it, is there an inlay in the basket so the water can drain or something like that? I can\'t see the holes in the pot too well so I\'m thinking it may be getting too much water. When you say ""dry to the touch"" is it just the top or do you check deep in the pot?  The other thing could be a difference in light, maybe it got more light at its previous home. If you\'d rather have it on the ground you could get a moss pole or other kind of support to tie it up, or you could try propagating some of the longer vines.  A couple weeks also isn\'t much in plant time, it\'s probably still settling in. I got a monstera from a friend too and it was struggling, turned out she had kept in a closet prior to moving. The leaves were a bit bigger than this but it took a month and half to put out a new one.   There\'s a Youtube channel called [Kill This Plant](https://youtube.com/c/KillThisPlant) with a lot of info on monstera specifically, check it out if you feel like it :)"
eRisk2023-T3_Subject17, b' ' , b'2022-09-27 15:39:39' , reddit post ,"I think it's an aesthetic choice, I let the plant do its thing mostly."
eRisk2023-T3_Subject17, b' ' , b'2022-09-27 15:33:21' , reddit post ,"Monstera grow up along trees in the wild, so it's normal for them to need a support pole to stand, even though yours is definitely reaching up for light.  Personally, once it's recovered a bit, I would cut the stems shorter and try to propagate it, unless you're okay with how it looks. Not sure if you're using regular soil right now, but mine has done really well in an even mix of soil, moss, and wood chips, plus I had it outside most of the season under 40% shade cloth."
eRisk2023-T3_Subject17, b' ' , b'2022-09-27 15:14:31' , reddit post ,Did you... leave your house lights on while you were gone? I think he may be missing those more.
eRisk2023-T3_Subject17, b' ' , b'2022-09-27 15:08:56' , reddit post ,"Plants have no mechanism to heal their leaves, they just grow new ones when they need to. The totally dead parts are drying up, so it seems like a normal progession to me, unless it's affecting a wider area or starting to happen on other leaves as well."
eRisk2023-T3_Subject17, b' ' , b'2022-09-27 15:03:43' , reddit post ,"Is it getting the same amount of light as it was before you bought it? New plant, repotted, seems like regular adjustment to me. It's getting rid of leaves it doesn't need"
eRisk2023-T3_Subject17, b' ' , b'2022-09-27 07:49:41' , reddit post ,"I think ignorant people are going to misgender you one way or another, so if you like how you dress and like your current hair, you should keep that stuff and try to find another way to deal with being misgendered.   It sucks that cis ppl won't see us as our real genders, but that's their problem and their fault, and doesn't have anything to do with our validity. Can you increase how much you're gendered correctly in your personal life, by making more trans / nb / ally friends? Can you correct people in a certain way (assertive, or funny, or whatever) to take the stress off of yourself? Can you approach gender in a purposefully confusing way to take control of your experience? Just things to think about that might be another way through for you.  With your hair, what aspects of it look bad short? I notice you have similar bangs in both styles, maybe try a completely different style, or a traditonally masculine one, that could mix people up? I always suggest something like season 2 Dean from Supernatural, that's how my partner does theirs right now."
eRisk2023-T3_Subject17, b' ' , b'2022-09-27 07:28:19' , reddit post ,"People who think outside the gender binary are also likely to question societal prescriptions for food, whether that's meat reduction or otherwise."
eRisk2023-T3_Subject17, b' ' , b'2022-09-26 20:25:26' , reddit post ,"Gender only male and female, no nonbinary option."
eRisk2023-T3_Subject17, b' ' , b'2022-09-26 10:14:21' , reddit post ,"There's a couple forms, I've only used the powder one that you dip the cut end of the stem into. I think it's not meant to be used in water but most of the powder sticks anyway. You can cut a little sliver off the end of yours and do the same, it will also take in water easier through the newly cut part, I guess it's living kind of like a bouquet of flowers rn"
eRisk2023-T3_Subject17, b' ' , b'2022-09-26 05:02:39' , reddit post ,It really looks like dust to me.
eRisk2023-T3_Subject17, b' ' , b'2022-09-26 04:56:48' , reddit post ,When was the last time you repotted?
eRisk2023-T3_Subject17, b' ' , b'2022-09-26 04:48:57' , reddit post ,"First picture looks like hard water spots, traces of minerals left behind when water dries on the leaves. You should be able to just wipe it off if so.  Not sure about the bugs but your plant looks fine, I doubt they are a pest."
eRisk2023-T3_Subject17, b' ' , b'2022-09-26 04:41:06' , reddit post ,"Not much, just put it back to where it's used to being and with time it will bounce back. The damaged leaves won't heal but it will put out new leaves to replace them -- if you want, you can cut them off now, since yellowed leaves aren't doing much for the plant. Looks like it has a lot of still healthy leaves to work for it"
eRisk2023-T3_Subject17, b' ' , b'2022-09-26 04:30:47' , reddit post ,"I can\'t see much in the picture, but I think your seedlings are ""leggy"" due to not getting enough light. Try planting again with a grow light 6 inches or less from them."
eRisk2023-T3_Subject17, b' ' , b'2022-09-26 04:24:12' , reddit post ,"I wouldn't try to save at that point, you're better off replacing. Hopefully you can ID it, maybe on a sub like r/plantidentification?"
eRisk2023-T3_Subject17, b' ' , b'2022-09-26 04:22:15' , reddit post ,Is it getting any light? The picture looks pretty dark.
eRisk2023-T3_Subject17, b' ' , b'2022-09-26 04:16:23' , reddit post ,"My bad, I saw the second pic but thought there was more hiding in the neck of the bottle. I always use root hormone when I start my cuttings, you could try that? I do have some pothos cuts that reacted like yours did, putting out these mini leaves before making many roots."
eRisk2023-T3_Subject17, b' ' , b'2022-09-26 04:07:36' , reddit post ,"Looks fine to me. New soil is delicious for fungi, it doesn't seem to be harming the plant."
