ID,WRITING.TITLE,WRITING.DATE,WRITING.INFO,WRITING.TEXT.Element:Text
eRisk2023-T3_Subject46, b' ' , b'2020-02-01 04:46:24' , reddit post ,"No, this was a different one I'm pretty sure. It seemed to be popular at the time and I have absolutely zero idea about the title."
eRisk2023-T3_Subject46, b' ' , b'2020-01-26 03:52:31' , reddit post ,Mines named Gerald if that's any consolation.
eRisk2023-T3_Subject46, b'Trying to find an old scary story that I think was a creepypasta' , b'2020-01-25 21:09:39' , reddit post ,"There was a story I read a while ago that I think was a creepypasta about someone waking up in their bed, turning over and seeing a red man or a man without his skin or something like that just staring at them and laying next to them. Has anyone else heard this before, I keep thinking about it and trying to find it. Was it even a creepypasta?"
eRisk2023-T3_Subject46, b' ' , b'2020-01-22 06:51:08' , reddit post ,Says the man offended by someone's comment
eRisk2023-T3_Subject46, b' ' , b'2020-01-16 03:29:30' , reddit post ,H3h3
eRisk2023-T3_Subject46, b' ' , b'2020-01-13 01:34:50' , reddit post ,Baby shark
eRisk2023-T3_Subject46, b' ' , b'2020-01-10 03:04:09' , reddit post ,"Oh I know, I came on here to see if it was just me who felt like I was being an asshole, but I ended up really liking some things people told me."
eRisk2023-T3_Subject46, b' ' , b'2020-01-10 02:52:16' , reddit post ,"Yeah I really couldn't tell because some things he said were conflicting. He told me he will definitely tell him in the morning and I think after this if he doesn't, I just need to tell him. I'm glad I could get some advice."
eRisk2023-T3_Subject46, b' ' , b'2020-01-10 02:44:56' , reddit post ,"I'm sorry about the wording, we are stable for right now financially. We just want to move out and want a new car, they aren't necessities. I'll make sure the correct the post"
eRisk2023-T3_Subject46, b' ' , b'2020-01-10 02:39:22' , reddit post ,"The only reason I've waited this long is because every time I ask my brother if he's done it yet he says no but that he will either that day or the next day. I like your suggestion though, I think if he doesn't tell him tomorrow, I'll let him know that I have to tell him myself. Thank you for your input"
eRisk2023-T3_Subject46, b' ' , b'2020-01-08 21:48:47' , reddit post ,My boyfriend has aspergers so helicopter parenting never really worked on him as his experience with autism means he doesn't give a fuck about your problems if he isn't responsible for them. So he can smell bullshit and doesn't care about your sob story. He hasn't talked to his family other than his younger brothers for over six months and his mom keeps texting him hoping hell answer but he won't. Ngl it's pretty satisfying because she's such an asshole.
eRisk2023-T3_Subject46, b' ' , b'2020-01-08 21:36:18' , reddit post ,Watched it the other day and thought the exact same thing.
eRisk2023-T3_Subject46, b' ' , b'2020-01-08 20:21:43' , reddit post ,"No way, my family's Mormon. Nice rolling paper lmao, smoking in the church too?"
eRisk2023-T3_Subject46, b' ' , b'2020-01-08 20:20:06' , reddit post ,"Thank you, genital preference isn't transphobic, not everyone likes certain genitalia sexually. You just have to talk to the person and figure it all out."
eRisk2023-T3_Subject46, b' ' , b'2020-01-08 20:12:19' , reddit post ,"I used to think that women just got pregnant after a certain age. Like, oh 22? You're due to be pregnant. Worth mentioning my family is Mormon so they all got pregnant that young."
eRisk2023-T3_Subject46, b' ' , b'2020-01-08 04:57:06' , reddit post ,Insane
eRisk2023-T3_Subject46, b' ' , b'2020-01-06 02:10:30' , reddit post ,Insane
eRisk2023-T3_Subject46, b' ' , b'2020-01-06 00:21:20' , reddit post ,My English teacher once asked if fish was dairy.
eRisk2023-T3_Subject46, b' ' , b'2020-01-06 00:18:53' , reddit post ,I know you actually have a question but just reading the title by itself is 10/10 hilarious.
eRisk2023-T3_Subject46, b' ' , b'2020-01-06 00:07:56' , reddit post ,Magnum dong
eRisk2023-T3_Subject46, b' ' , b'2020-01-05 23:17:57' , reddit post ,"Idk why people are giving you a hard time, maybe you were harsh or something but she should ask you what she really wants to ask you, not some backwards way. She should respect where you want to go to school and not call you an asshole just cause you didn't understand what she really wanted to know. NTA."
eRisk2023-T3_Subject46, b' ' , b'2020-01-05 21:42:18' , reddit post ,Yeah I guess that is a good point. I did get fucked over a lot working at some places along with my teammates. I think I was thinking about it in terms of people who were on my same level and not with higher ups. I would have definitely been irritated if my boss spouted that 'were a family' stuff when she was the one fucking us all over.
eRisk2023-T3_Subject46, b' ' , b'2020-01-05 21:35:02' , reddit post ,Oh I totally get that but it's not an uncommon thing to say when working in an environment like that
eRisk2023-T3_Subject46, b' ' , b'2020-01-05 20:38:29' , reddit post ,Have you never had a job where everyone is close knit?
eRisk2023-T3_Subject46, b' ' , b'2020-01-05 20:32:20' , reddit post ,You made a validation post about who makes pancakes better. Of course YTA
eRisk2023-T3_Subject46, b' ' , b'2020-01-05 20:24:19' , reddit post ,If only it was that easy
eRisk2023-T3_Subject46, b' ' , b'2020-01-05 20:06:38' , reddit post ,Had an ex say something about a front wedgie I had once and never wanted to change in front of him again. He also frequently made fun of fat people and people with cellulite which I had so that played into it too.
eRisk2023-T3_Subject46, b' ' , b'2020-01-05 20:04:23' , reddit post ,Trans people aren't allowed in
eRisk2023-T3_Subject46, b' ' , b'2020-01-05 19:22:08' , reddit post ,I'm glad someone said something about it. I drive a Toyota Camry and can't stand when someone's lights behind me are on high and in my face. They also always happen to tailgate me too.
eRisk2023-T3_Subject46, b' ' , b'2020-01-05 19:07:12' , reddit post ,Insane
eRisk2023-T3_Subject46, b' ' , b'2020-01-05 19:05:22' , reddit post ,Insane
eRisk2023-T3_Subject46, b' ' , b'2020-01-05 19:05:07' , reddit post ,Insane
eRisk2023-T3_Subject46, b' ' , b'2020-01-05 01:00:24' , reddit post ,"NTA. Parents who think feeding their kid puts them on a pedastol shouldn't be parents. Oh you fed me for 17 years? Good, that was your job. Which she is sort of neglecting now."
eRisk2023-T3_Subject46, b' ' , b'2020-01-05 00:54:19' , reddit post ,"Yeah same with Caitlyn Jenner. I can't stand people who think using the correct pronouns for someone is a privilege to be taken away. It just makes no sense, and with that ideology, every single person you disagree with is at risk for you doing the same to them."
eRisk2023-T3_Subject46, b' ' , b'2020-01-05 00:37:17' , reddit post ,What exactly is a fundamentalist?
eRisk2023-T3_Subject46, b' ' , b'2020-01-05 00:30:07' , reddit post ,My boyfriend's MOM was like this. Disgusting and we would have to clean it up.
eRisk2023-T3_Subject46, b' ' , b'2020-01-05 00:24:51' , reddit post ,I think I've heard abrosexual to define that before but idk. Don't think it's a common thing which is kinda weird since its a listed answer
eRisk2023-T3_Subject46, b' ' , b'2020-01-05 00:16:15' , reddit post ,My boyfriend's family are LGB leave out the T kinda people which is great co soldering me and his little brother are both trans.
eRisk2023-T3_Subject46, b' ' , b'2020-01-05 00:14:14' , reddit post ,When I tried going on subq my doctor gave me the im needles and told me just don't stick it in all the way. Yeah fuck that
eRisk2023-T3_Subject46, b' ' , b'2020-01-05 00:04:55' , reddit post ,I'm way too angry and I'll mess them up
eRisk2023-T3_Subject46, b' ' , b'2020-01-04 23:34:12' , reddit post ,I will always love this picture
eRisk2023-T3_Subject46, b' ' , b'2020-01-04 23:12:16' , reddit post ,"I agree. Also if you want your kids to grow up as normal people, they need to experience things. And it sucks but you have to learn from your mistakes. You have to trust that they can do that themselves sometimes and just be there to help them through it."
eRisk2023-T3_Subject46, b' ' , b'2020-01-04 23:07:20' , reddit post ,Insane
eRisk2023-T3_Subject46, b' ' , b'2020-01-04 22:56:14' , reddit post ,I love this comment because you sound like you're admitting a horrible truth.
eRisk2023-T3_Subject46, b' ' , b'2020-01-04 22:52:20' , reddit post ,Roll them up at the bottom to make a cuff
eRisk2023-T3_Subject46, b' ' , b'2020-01-04 22:49:18' , reddit post ,I come from a Mormon household and my family's huge. My grandpa on my mom's side has 49 grandkids. (Most of which live in Utah lol).
eRisk2023-T3_Subject46, b' ' , b'2020-01-04 22:38:05' , reddit post ,My boyfriend's family talking shit about me behind my back. I confronted his older sister who did most of the shit talking and ended up having to apologize to keep the peace between everyone. More shit happened eventually and now we don't talk to anyone in the family except his younger siblings cause they're actually chill.
eRisk2023-T3_Subject46, b' ' , b'2020-01-04 22:25:37' , reddit post ,Insane
eRisk2023-T3_Subject46, b' ' , b'2020-01-04 22:23:14' , reddit post ,Nuclear being pronounced like newk-yu-ler.
eRisk2023-T3_Subject46, b' ' , b'2020-01-03 21:08:11' , reddit post ,"I used to love doing this. I can't anymore but it used to be one of my favorite things. Sometimes he'd still be asleep too, like sleepwalking. Or sleepfucking I guess, but it was good all the same."
eRisk2023-T3_Subject46, b' ' , b'2020-01-02 07:51:39' , reddit post ,My boyfriend and his brother in law call it the glory shit
eRisk2023-T3_Subject46, b' ' , b'2020-01-02 07:49:18' , reddit post ,Scratching a desperate itch
eRisk2023-T3_Subject46, b' ' , b'2020-01-02 07:41:10' , reddit post ,"That they suck :/ I feel like I have to wear huge shirts and Every time my weight fluctuates my hips get more fat than the rest of me, even on hormones."
eRisk2023-T3_Subject46, b' ' , b'2020-01-02 07:39:30' , reddit post ,Im dealing with it from my sister. Three years and her and two of the older kids still call me she. The youngest one doesn't remember when I was female presenting so he always saw me as a boy but the other kids correct him. Just irritating
eRisk2023-T3_Subject46, b' ' , b'2020-01-02 07:10:29' , reddit post ,I'm afraid to answer.
eRisk2023-T3_Subject46, b' ' , b'2020-01-02 01:04:19' , reddit post ,"Why the fuck is everyone laughing, this kid is obviously traumatized. Who would shave him when he's behaving like that anyways? I thought most places turn you away."
eRisk2023-T3_Subject46, b' ' , b'2020-01-02 00:58:33' , reddit post ,Insane
eRisk2023-T3_Subject46, b' ' , b'2020-01-02 00:47:47' , reddit post ,Yep and my sister still calls me she
eRisk2023-T3_Subject46, b'The universe gave me back my O-ring.' , b'2020-01-02 00:46:27' , reddit post ,[eliminado]
eRisk2023-T3_Subject46, b' ' , b'2020-01-01 20:21:18' , reddit post ,Me and my boyfriend had to move in with my parents due to reasons and it's the same for me. They make him sleep in the living room even though were both adults and have been together for almost five years. It's ridiculous that just cause we aren't married they view us sharing a room as immoral. Irritating as fuck.
eRisk2023-T3_Subject46, b' ' , b'2020-01-01 19:27:49' , reddit post ,YTA. You didn't even explain to her what a moshpit was or how to avoid it?
eRisk2023-T3_Subject46, b' ' , b'2020-01-01 19:17:35' , reddit post ,"I was just thinking the same thing, seems like they already know."
eRisk2023-T3_Subject46, b' ' , b'2020-01-01 19:07:13' , reddit post ,It baffles me how fuckin stupid people can sound and not even hear themselves.
eRisk2023-T3_Subject46, b' ' , b'2020-01-01 19:03:24' , reddit post ,Am I the only one who hates the term baby gay
eRisk2023-T3_Subject46, b' ' , b'2020-01-01 18:56:52' , reddit post ,"Someone asked this to me and before I could reply said, ""don\'t worry people are gonna listen to you in the future, you have big plans I can tell""  What the fuck does that mean?"
eRisk2023-T3_Subject46, b' ' , b'2020-01-01 03:26:04' , reddit post ,You know when you meet other random kids at the park when you're a kid? Was swinging with some girl on the swings and she just randomly tells me that when she was born her mom was 16 and her dad was 12.
eRisk2023-T3_Subject46, b' ' , b'2020-01-01 03:16:36' , reddit post ,This should be on r/rareinsults too
eRisk2023-T3_Subject46, b' ' , b'2020-01-01 03:16:05' , reddit post ,Who would like and retweet the first chicks post. Are people really that shallow
eRisk2023-T3_Subject46, b'Ftm after partial GRS' , b'2019-12-30 22:48:00' , reddit post ,"My question is for people who have had partial phalloplasty or metoidioplasty. Did you notice any long term pain?   It took me a lot longer than 6 to I weeks to heal up, and even now 6-7 months later after I've healed significantly, I'm having pain/discomfort seemingly at random, especially regarding urinating. I still have a short urethra (i dont get the arm graft done until stage 2) and I've had 3 utis in the past 6 months which have gone away easily enough with antibiotics each time. I wash regularly and make sure not to irritate things too much during sex.   The pain has died down from what it used to be, but I still have a burning sensation when using the restroom and can't lay certain ways sometimes. Is this similar to anyone else's experience? I'm afraid I have like interstitial cystitis or something of the like."
eRisk2023-T3_Subject46, b' ' , b'2019-12-30 22:34:39' , reddit post ,"I think he looked on my profile, saw long hair and assumed lol it certainly made my day"
eRisk2023-T3_Subject46, b'Commented on a leelah alcorn post and this guy tried to invalidate me cause he thought I was a transgirl. Accidentally validated me lol' , b'2019-12-30 22:22:15' , reddit post ,
eRisk2023-T3_Subject46, b' ' , b'2019-12-30 03:53:36' , reddit post ,Does he assume her genitalia or has she disclosed that as well?
eRisk2023-T3_Subject46, b' ' , b'2019-12-30 03:41:25' , reddit post ,You have really cute cheeks!
eRisk2023-T3_Subject46, b' ' , b'2019-12-29 21:24:36' , reddit post ,"It is seriously not that big an issue. Yeah it's dumb but literally no one is forcing you to keep in contact with people like that. Just stop talking to them, it's not that deep."
eRisk2023-T3_Subject46, b' ' , b'2019-12-29 20:48:02' , reddit post ,I agree it's stupid to force someone to use a label if they don't want to. And cis people don't feel as strong an attachment to the label like trans people do so expecting them to use it the same way is kinda dumb.
eRisk2023-T3_Subject46, b' ' , b'2019-12-29 20:42:51' , reddit post ,Then don't go? They sound weird
eRisk2023-T3_Subject46, b' ' , b'2019-12-29 19:55:53' , reddit post ,"First time I saw this, it was rage comic style on Facebook"
eRisk2023-T3_Subject46, b' ' , b'2019-12-29 19:31:23' , reddit post ,"Wow that's great, I'm happy for you!"
eRisk2023-T3_Subject46, b' ' , b'2019-12-29 18:57:23' , reddit post ,"Yeah, he would threaten to kill himself and send me pictures of himself cutting. Everyday after school I'd rush home to Skype him and see if he was okay."
eRisk2023-T3_Subject46, b' ' , b'2019-12-29 18:53:31' , reddit post ,It was definitely a bad relationship
eRisk2023-T3_Subject46, b' ' , b'2019-12-29 10:18:58' , reddit post ,I love all the comments in this post. 'Fruit you off' makes me chuckle.
eRisk2023-T3_Subject46, b' ' , b'2019-12-29 09:23:22' , reddit post ,"You didn't go too far with the eating disorder comment, it's true."
eRisk2023-T3_Subject46, b' ' , b'2019-12-29 06:55:22' , reddit post ,"It was my first relationship in person with someone, so this being my first experience it was all I had to base it off of, and there were a lot of things I enjoyed about it. That being said, I definitely knew I was unhappy and felt trapped."
eRisk2023-T3_Subject46, b' ' , b'2019-12-29 06:53:41' , reddit post ,Yeah
eRisk2023-T3_Subject46, b' ' , b'2019-12-29 06:52:27' , reddit post ,I was female
eRisk2023-T3_Subject46, b' ' , b'2019-12-29 05:36:25' , reddit post ,"My mom asked me if I had ever been abused and if that's why I wanted to transition. She didn't mean it in a hurtful way, she was just concerned. It was a bit jarring to hear though. I'm happy you've been able to push on  "
eRisk2023-T3_Subject46, b' ' , b'2019-12-29 05:31:42' , reddit post ,"Oh I see, that's rough. Although I don't know what you've gone through, I've had experiences with stuff like that during a relationship. Being trans myself sometimes I wonder if those experiences influenced how I identify with gender. I never have thoughts like that for long, but do you ever feel like that, too? I always wonder if other people relate to that."
eRisk2023-T3_Subject46, b' ' , b'2019-12-29 05:26:21' , reddit post ,"I feel stupid asking this, what does CSA stand for?"
eRisk2023-T3_Subject46, b' ' , b'2019-12-29 05:16:43' , reddit post ,"I can't find where he says that? All the posts I see, he's saying he has no kids."
eRisk2023-T3_Subject46, b' ' , b'2019-12-29 04:59:06' , reddit post ,"His surroundings could influence his thoughts. If you're around an environment where you learn it's unacceptable to be a certain way, you'll convince yourself your aren't that way. Idk his circumstances but for example, me growing up Mormon definitely played into me pushing down my curiosity cause it would've gone against my beliefs at the time."
eRisk2023-T3_Subject46, b' ' , b'2019-12-29 04:49:39' , reddit post ,I'm sorry you're going through that friend.
eRisk2023-T3_Subject46, b' ' , b'2019-12-29 04:45:04' , reddit post ,"No one\'s forcing you to introduce yourself like ""yes hello, I\'m cis."" I\'m not sure if I just know different people than you, but the only types of people i know that are extreme like that are on the internet and no one really likes them anyways."
eRisk2023-T3_Subject46, b' ' , b'2019-12-29 04:39:25' , reddit post ,"Once I told my coworker I was an introvert and he responded, ""ohhh, don\'t say that!""   Like when did I say anything negative"
eRisk2023-T3_Subject46, b' ' , b'2019-12-27 19:40:16' , reddit post ,"Everyone always tells me raven is hotter, but my little kid brain made its mind up years ago haha"
eRisk2023-T3_Subject46, b' ' , b'2019-12-07 18:50:58' , reddit post ,Transgender isnt a third gender
eRisk2023-T3_Subject46, b' ' , b'2019-12-07 18:32:00' , reddit post ,"Well, I just ask because just being attracted to a trans person doesn't mean you're pansexual. You can still be bi since being female to male or male to female still puts you into either female or male gender."
eRisk2023-T3_Subject46, b' ' , b'2019-12-07 18:27:27' , reddit post ,Do a lot of people automatically assume you're crazy dangerous whenever you tell them about having schizophrenia?
eRisk2023-T3_Subject46, b' ' , b'2019-12-07 18:26:10' , reddit post ,Why call yourself pansexual if you were attracted to someone who turned out to be trans?
eRisk2023-T3_Subject46, b' ' , b'2019-12-07 18:25:18' , reddit post ,"Not trying to sound rude here, how come you don't want to transition? Does dressing as a woman satiate those feelings enough or something?"
eRisk2023-T3_Subject46, b' ' , b'2019-12-07 18:22:59' , reddit post ,Do you ever get any comments about your illness relating to statements like 'just wake up' or to 'stop being dramatic'?
eRisk2023-T3_Subject46, b' ' , b'2019-12-07 18:20:34' , reddit post ,How often do you get comments like the one above? I'm trans too but thankfully haven't had much exposure to assholes or ignorant people which is ironic considering I come from a Mormon household.
eRisk2023-T3_Subject46, b' ' , b'2019-12-07 18:17:30' , reddit post ,Do you ever get called transphobic? I've heard of biphobia revolving around that. I'm trans myself and have never understood why people think being bisexual is like exclusive or something.
eRisk2023-T3_Subject46, b' ' , b'2019-12-07 18:15:40' , reddit post ,How many people do you encounter who tell you to 'just get over' the obsessions/compulsions? I recently watched a clip of Rob Schneider purposely shaking Howie Mandels hand and touching him whilst telling him he needs to get over his OCD about germs.
eRisk2023-T3_Subject46, b' ' , b'2019-12-01 07:55:28' , reddit post ,I read this at first as saying parents instead of partner and I almost died.
eRisk2023-T3_Subject46, b' ' , b'2019-11-16 22:52:55' , reddit post ,I was trying to say there's a lot of transphobes who think just being trans is a disorder not the actual dysphoria. I think that's why some people kinda sweep it under the rug. Idk if that makes more sense.
eRisk2023-T3_Subject46, b' ' , b'2019-11-16 18:14:55' , reddit post ,I feel like one reason trans people specifically will act like it's not a disorder is so assholes don't pull the whole 'trans is a mental illness' shit.
eRisk2023-T3_Subject46, b' ' , b'2019-11-16 17:53:23' , reddit post ,This is fucking metal
eRisk2023-T3_Subject46, b' ' , b'2019-11-16 17:52:30' , reddit post ,"When I first started dating my now boyfriend and started getting to know his family, I realized he has a huge fucking family and they pretty much all go to every party. I had pretty bad social anxiety at the time before I started medication and his family thought I was rude cause I didn't go up to fifty people I didn't know and introduce myself and hug everyone."
eRisk2023-T3_Subject46, b' ' , b'2019-11-10 20:29:57' , reddit post ,"I was never considering going back to him, but i do have therapy this month."
eRisk2023-T3_Subject46, b' ' , b'2019-11-10 19:29:44' , reddit post ,Mines been ongoing since I started on shots again. I used to get some badish acne on the gel but then we found out the gel wasn't being properly absorbed into my body so I had to go back to shots and now it's like 2.5 years on t for me and my acne was getting super bad and now I'm trying Accutane which seems to be starting to help. My dad had super bad acne when he was younger though so I do think it has a thing or two to do with genetics.
eRisk2023-T3_Subject46, b' ' , b'2019-11-10 06:04:01' , reddit post ,Savior the kill by ravenface
eRisk2023-T3_Subject46, b' ' , b'2019-11-10 04:37:14' , reddit post ,What works for me and my partner works for us; doesn't need to be corrected.
eRisk2023-T3_Subject46, b' ' , b'2019-11-10 04:29:43' , reddit post ,Not really looking for advice but I appreciate the sentiment
eRisk2023-T3_Subject46, b' ' , b'2019-11-10 04:19:31' , reddit post ,As someone who's not used to topping I usually used to let my boyfriend take the role. Sure maybe I wasn't planking the whole time but it was still physically taxing to a degree and I could never last long in that same position. Everyone's different.
eRisk2023-T3_Subject46, b' ' , b'2019-11-09 22:59:34' , reddit post ,"Why haven't you had kids yet? Seriously, fuck off you don't know their life and it's none of your business."
eRisk2023-T3_Subject46, b' ' , b'2019-11-09 22:58:11' , reddit post ,I think it'd be weird if they freaked out considering now one fourth of Americans have anxiety in some form
eRisk2023-T3_Subject46, b' ' , b'2019-11-09 22:57:57' , reddit post ,I think it'd be weird if they freaked out considering now one fourth of Americans have anxiety in some form
eRisk2023-T3_Subject46, b' ' , b'2019-11-09 22:55:35' , reddit post ,Not from a customer but my boyfriend's coworker would 'show off' and try and get sympathy for the fact that she witnessed someone die. She was their last moment alive and she would bat her eyes all sad and say how much it fucked her up to all the thirsty guys (she's pretty hot) who got her register. Pretty gross.
eRisk2023-T3_Subject46, b' ' , b'2019-11-09 22:53:35' , reddit post ,"It's easier to kneel than to plank above someone for that long, and I get more control into what I do to make the experience feel even better for both of us. That and my partner really seems to like it and that's a plus for me  "
eRisk2023-T3_Subject46, b' ' , b'2019-11-09 22:50:58' , reddit post ,Who's in charge of it
eRisk2023-T3_Subject46, b' ' , b'2019-11-09 21:15:47' , reddit post ,I just hate how people don't care about bullying until there's physical interaction. He was calling him a faggot but the teacher got mad once there was violence involved. I don't think we should demonize physical fighting as much as we do.
eRisk2023-T3_Subject46, b' ' , b'2019-11-09 20:24:48' , reddit post ,Thanks!
eRisk2023-T3_Subject46, b' ' , b'2019-11-09 20:24:34' , reddit post ,Thats legitimate but also a very basic way to look at it. There are definitely some trans people who aren't crazy or have a lot of mental health issues. I was more under the impression you meant because the fact they were trans you wouldn't date them. I see your viewpoint  
eRisk2023-T3_Subject46, b' ' , b'2019-11-09 20:05:50' , reddit post ,'Ignorance is bliss' is a statement a lot of people live by
eRisk2023-T3_Subject46, b' ' , b'2019-11-09 20:04:37' , reddit post ,I think it's only transphobic if they have the genitals you're into and you still turn them down. like if you didn't know and they told you and you suddenly just want nothing to do with them anymore. Otherwise it's like well sorry for not being attracted to your dick when I'm only into vagina
eRisk2023-T3_Subject46, b' ' , b'2019-11-09 20:01:53' , reddit post ,A lot of times people beat their kids because they don't know how to properly display anger. They just go to the first reaction and it spirals from there. Very unfortunate. Especially when the parent doesn't even realize what they are doing is fucked up. I always heard if your kid is in trouble tell them to go wait in their room for their punishment so you can calm down to avoid yelling at/abusing them
