ID,WRITING.TITLE,WRITING.DATE,WRITING.INFO,WRITING.TEXT.Element:Text
eRisk2023-T3_Subject46, b' ' , b'2019-06-14 17:07:25' , reddit post ,Lol
eRisk2023-T3_Subject46, b' ' , b'2019-06-14 16:47:33' , reddit post ,Why did you ask this question just to argue with every single person who answered it?
eRisk2023-T3_Subject46, b' ' , b'2019-06-14 16:46:09' , reddit post ,They're probably just used to people reacting this way when using the term.
eRisk2023-T3_Subject46, b' ' , b'2019-06-14 16:43:20' , reddit post ,"When we reconnected as friends and he wouldn't shut up about being an alpha male. Cause of that, we aren't friends anymore."
eRisk2023-T3_Subject46, b' ' , b'2019-06-14 16:36:57' , reddit post ,My boyfriend's mother and sister because they were very toxic and constantly talking about me behind my back and whenever I called them out on it they got mad and defensive and I had to be the one to apologize. Not ever again.
eRisk2023-T3_Subject46, b' ' , b'2019-06-14 04:57:53' , reddit post ,Super eight and project almanac
eRisk2023-T3_Subject46, b' ' , b'2019-06-14 04:56:23' , reddit post ,"This kid in our class got in trouble for laughing.   For context, everyone was talking and we were all working on group projects. He laughs at something we say and the teacher gets really mad and tells him to sit outside.   You'd think maybe she's just a hardass but my friend was sitting underneath the table one day yelling at the teacher to stop ringing her stupid bell (she had a bell on her desk) and all she did was laugh at him."
eRisk2023-T3_Subject46, b' ' , b'2019-06-14 04:50:51' , reddit post ,"If someone asks me I usually just say ""I date who I wanna date"" instead of saying I\'m pan cause I feel like the two have different connotations. Everyone I\'ve told doesn\'t really care tbh one of my coworkers thought I was cool after that saying ""oh dude you\'re one of those like miley cyrus?"" Edit: although one person I told said \'I just call that bisexual.\' Bye queen"
eRisk2023-T3_Subject46, b' ' , b'2019-06-13 21:32:49' , reddit post ,Yeah
eRisk2023-T3_Subject46, b' ' , b'2019-06-13 07:03:16' , reddit post ,Transgirls and nonbinary people have it way worse than transguys in my opinion
eRisk2023-T3_Subject46, b' ' , b'2019-06-13 07:02:42' , reddit post ,I agree
eRisk2023-T3_Subject46, b' ' , b'2019-06-13 07:01:00' , reddit post ,The stress of everyday life coupled with not being able to get a sense of satisfaction since most people work a job they hate.
eRisk2023-T3_Subject46, b' ' , b'2019-06-13 06:41:54' , reddit post ,I went through a period of time where anytime my boyfriend waa gone for longer than he should be I immediately thought he had died and would have nightmares a lot about him dying. It took me a while to realize I just needed to work on calming down. Talking yourself through things is a great way to stay sane and at the same time I made sure to have my boyfriend tell me if he was gonna be a little late that way I wouldn't be so prone to freaking out. Mayne you could apply calming self reassurance and a communication system somehow?
eRisk2023-T3_Subject46, b' ' , b'2019-06-13 05:35:55' , reddit post ,I'm estranged by my in-laws but not my immediate family
eRisk2023-T3_Subject46, b' ' , b'2019-06-13 04:57:51' , reddit post ,The fact that had the strength to end a relationship
eRisk2023-T3_Subject46, b' ' , b'2019-06-12 23:23:11' , reddit post ,Freeway with Reese Witherspoon
eRisk2023-T3_Subject46, b' ' , b'2019-06-12 23:22:59' , reddit post ,Freeway with Reese Witherspoon
eRisk2023-T3_Subject46, b' ' , b'2019-06-12 23:22:14' , reddit post ,Kissing on the lips
eRisk2023-T3_Subject46, b' ' , b'2019-06-12 21:35:00' , reddit post ,"This reminds me of a girl who worked with us and my friend said she overheard her in the bathroom saying ""I\'m pregnant you can\'t hit me anymore"" and then she stopped showing up about two weeks later without a notice or anything. I think about her from time to time."
eRisk2023-T3_Subject46, b' ' , b'2019-06-12 21:28:13' , reddit post ,"For gender, perhaps you're androgynous, gender fluid, or some variation of nonbinary?  For sexuality, maybe you're panromantic (meaning you can be romanticly involved with anyone) but polysexual (meaning you can be sexual with several genders but still have a line that you can't cross)?"
eRisk2023-T3_Subject46, b' ' , b'2019-06-12 21:16:15' , reddit post ,Magic treehouse I brought all 25 books I had to a read in day in like first grade. Past third grade I got really into the warriorcats series
eRisk2023-T3_Subject46, b' ' , b'2019-06-12 20:48:08' , reddit post ,Thanks haha it's all relative
eRisk2023-T3_Subject46, b' ' , b'2019-06-12 20:41:51' , reddit post ,My sister also makes fun of me when i get upset about it.
eRisk2023-T3_Subject46, b' ' , b'2019-06-12 20:40:08' , reddit post ,My sister is like that and it irritates me
eRisk2023-T3_Subject46, b' ' , b'2019-06-12 20:31:46' , reddit post ,Yeah haha I'm used to it by now. He's pretty trippy sometimes
eRisk2023-T3_Subject46, b' ' , b'2019-06-12 20:24:07' , reddit post ,"My boyfriend's autistic and has several rituals. At our old house he'd have to go to the bathroom, brush his teeth, come back to the room and change, go downstairs and check every lock four times, make sure the windows were closed, feed the cats, come back up and lock the door, turn the door knob four times to make sure it's locked, close the closet and push against it four times again to make sure it's closed, check every alarm he has four times, check and put away his fitbit, then finally go to bed."
eRisk2023-T3_Subject46, b' ' , b'2019-06-12 20:10:41' , reddit post ,Oh I found someone just tired of being so tiny lol
eRisk2023-T3_Subject46, b' ' , b'2019-06-12 19:31:54' , reddit post ,Penny
eRisk2023-T3_Subject46, b' ' , b'2019-06-12 19:30:03' , reddit post ,Had a substitute when in middle school once who got fired for being creepy with the girl students.  Edit: also in high school my boyfriend's soccer coach got arrested for sleeping with a senior.
eRisk2023-T3_Subject46, b' ' , b'2019-06-12 19:28:40' , reddit post ,An I love you happy lazy drunk
eRisk2023-T3_Subject46, b' ' , b'2019-06-12 19:24:26' , reddit post ,You only live once by suicide silence
eRisk2023-T3_Subject46, b' ' , b'2019-06-12 19:23:05' , reddit post ,Speeding in a nice car
eRisk2023-T3_Subject46, b' ' , b'2019-06-12 19:16:29' , reddit post ,Boyfriend accidentally dislocated my knee while at a Halloween party
eRisk2023-T3_Subject46, b' ' , b'2019-06-12 19:04:41' , reddit post ,"Taller. Only 5\'5"" and all these memes out here talking about how 5\'7"" is small. Smh"
eRisk2023-T3_Subject46, b' ' , b'2019-06-12 19:03:14' , reddit post ,I would definitely agree. Just so much of a hassle to tell everyone and what are you supposed to do for people you used to talk to in like middle school or high school and now you have to tell them this big thing about yourself. Just awkward.
eRisk2023-T3_Subject46, b' ' , b'2019-06-12 19:02:07' , reddit post ,I feel like this is so important to realize
eRisk2023-T3_Subject46, b' ' , b'2019-06-12 18:58:07' , reddit post ,I started hormones 16 months after coming out and have been on them for two years. Things are slow going not at all what I thought transitioning would be like. Everyone I see has made much more progress than me thus far but that's part of the journey. That's the only thing I'm disappointed in is just I'm not where I wanna be yet. Just had surgery and feel much more affirmed as of now so I'm heading the right direction.  I wanted to start hormones right as soon as I came out to everyone but I wasn't able to since I wasn't eighteen yet but honestly I'm kind of glad I had to wait. It made me realize I was sure about who I was and even though I was nervous to start hormones it made me happy when I did. Same with surgery.
eRisk2023-T3_Subject46, b' ' , b'2019-06-12 18:52:36' , reddit post ,Brother by Falling in Reverse
eRisk2023-T3_Subject46, b' ' , b'2019-06-12 18:51:52' , reddit post ,"I have a cat who has six toes on his front paws and my friends found him but I'm housing him now since they couldn't. They named him digit but at first wanted to find a baseball related name since his front paws look like baseball mitts. I'm severely disappointed they didn't name him Jackie Robinson, cause he's all black pretty much everywhere."
eRisk2023-T3_Subject46, b' ' , b'2019-06-12 18:47:59' , reddit post ,There will still be changes though most likely that would go noticed
eRisk2023-T3_Subject46, b' ' , b'2019-06-12 18:46:34' , reddit post ,We didn't cause it but in my junior year there was a police chase that passed by our high school and as the car in question is driving he clips the sidewalk and pops his tire so he gets out of the car to run on foot into the school parking lot. We were in the middle of lunch sitting maybe 50 feet away and saw all of that happen before lockdown was called.
eRisk2023-T3_Subject46, b' ' , b'2019-06-12 18:46:22' , reddit post ,We didn't cause it but in my junior year there was a police chase that passed by our high school and as the car in question is driving he clips the sidewalk and pops his tire so he gets out of the car to run on foot into the school parking lot. We were in the middle of lunch sitting maybe 50 feet away and saw all of that happen before lockdown was called.
eRisk2023-T3_Subject46, b' ' , b'2019-06-12 18:41:39' , reddit post ,I would love to follow a page like that on ig! Send me the name when you make it  
eRisk2023-T3_Subject46, b' ' , b'2019-06-12 18:40:03' , reddit post ,You should be asking people who only have a Facebook how they keep up
eRisk2023-T3_Subject46, b' ' , b'2019-06-12 18:39:22' , reddit post ,I though I was the only one who hated that
eRisk2023-T3_Subject46, b' ' , b'2019-06-12 18:38:57' , reddit post ,Just woke up lol
eRisk2023-T3_Subject46, b' ' , b'2019-06-12 18:38:36' , reddit post ,"Yeah that sucks /: if i were you id bring up the fact that having depression is very common among trans people as gender dysphoria is usually linked to depression in some way, and that not being authentically you can substantially relate to depression getting worse."
eRisk2023-T3_Subject46, b' ' , b'2019-06-12 18:36:51' , reddit post ,After having surgery three weeks ago my boyfriend's been helping me out with things that I need 24/7. I don't need a lot and I can walk by myself but stay laying down since the pain comes back if I get up for too long. He bitches and moans while doing it (he always does this with any chore he has and he thinks its funny to do) but hasn't gotten actually mad at me or anything which surprised me cause I thought he would.
eRisk2023-T3_Subject46, b' ' , b'2019-06-12 18:34:14' , reddit post ,"Oh I think I get it. One of my sister's is like that. She's the first one in my family I came out too and she was cool about it she pretty much already knew but she forced me to tell my mom (who is cool too btw) when I wasn't ready to come out to her yet, not mentally prepared so I had to just do that and cope. When they mean well but are actually overbearing."
eRisk2023-T3_Subject46, b' ' , b'2019-06-12 18:32:25' , reddit post ,I thought so
eRisk2023-T3_Subject46, b' ' , b'2019-06-12 18:30:34' , reddit post ,Last night whilst under my blankets.
eRisk2023-T3_Subject46, b' ' , b'2019-06-12 18:28:46' , reddit post ,I know at first my mom thought I had gotten sexually assaulted or molested and that was the reason why I was trans. Idk how your mom told you all of this but mine was genuinely concerned and let it go after I answered. Sometimes people who aren't educated about this stuff get genuinely concerned but I'm not sure how your mom acts with this particular thing.
eRisk2023-T3_Subject46, b' ' , b'2019-06-12 18:24:55' , reddit post ,Ronaldo
eRisk2023-T3_Subject46, b' ' , b'2019-06-12 18:24:38' , reddit post ,If think it was ironic
eRisk2023-T3_Subject46, b' ' , b'2019-06-12 18:21:58' , reddit post ,Leap for joy
eRisk2023-T3_Subject46, b' ' , b'2019-06-12 18:21:32' , reddit post ,Exactly. Same narrative over and over again just with different people.
eRisk2023-T3_Subject46, b' ' , b'2019-06-12 18:20:58' , reddit post ,I was gonna say him too. I also don't like messi.
eRisk2023-T3_Subject46, b' ' , b'2019-06-12 08:21:46' , reddit post ,Once our fourth grade teacher started crying cause someone stole her phone and asking who did it.
eRisk2023-T3_Subject46, b' ' , b'2019-06-12 08:20:40' , reddit post ,I felt relieved once I found out what was wrong with me. It did affect my everyday life cause now I was actually able to help myself but no one around me acted differently.
eRisk2023-T3_Subject46, b' ' , b'2019-06-12 03:56:45' , reddit post ,"I always told him to think about the reason he hasn't left yet and why right now is suddenly the right time. What does he have to live for any responsibilities? Anyone to take care of, family members or pets? I would keep throwing sentimentality at him including memories we'd shared together.  Sometimes when he was intent on acting on it in the moment I just threw all of this at him and prepared to call the cops if I had to. But it luckily it works."
eRisk2023-T3_Subject46, b' ' , b'2019-06-12 03:52:27' , reddit post ,"""I never said that!"""
eRisk2023-T3_Subject46, b' ' , b'2019-06-12 03:43:43' , reddit post ,"I had a phone interview for an autism center for kids and they asked me about my reasons for wanting to help out and I start talking about my older brother and boyfriend who both have autism. I had been using the term \'higher functioning"" a lot and felt like it was getting too redundant because I\'m an anxious piece of shit and proceeded to say,""...and my boyfriend is... I don\'t wanna say...better....? But..."" and the lady on the other end said""higher functioning?"" And I died inside. Thought way too much throughout that one."
eRisk2023-T3_Subject46, b' ' , b'2019-06-12 03:37:56' , reddit post ,I like to think so too. I identify agnostic but I still believe in a heaven of sorts.
eRisk2023-T3_Subject46, b' ' , b'2019-06-12 03:36:44' , reddit post ,I'm not sure where you live but in California you can get shots or a gel that you apply everyday. Some people it will work for but others like me the gel doesn't absorb into your body properly and you're left with a low t level. Others I've heard it works very well with though.  I'm very certain pills in the US have been outlawed as they cause liver damage. There's not really a good time to go on t just when you feel you're ready. I don't know how long I would have taken to decide when to start t if I had been in control about it (my mom wouldn't let me until I was eighteen and I found out three months before my 17th birthday). I think waiting helped me prepare for it but I also really wanted to start t as soon as I could. That decision is all up to you. It's normal to feel nervous or apprehensive about starting t because it's a big change but if you feel it goes beyond that then I would wait.
eRisk2023-T3_Subject46, b' ' , b'2019-06-12 03:30:03' , reddit post ,I also think it was her because a little kid on her side of the family had a dream that she came to him and said goodbye like the night she died.
eRisk2023-T3_Subject46, b' ' , b'2019-06-12 03:28:14' , reddit post ,I also think it was her because a little kid on her side of the family had a dream that she came to him and said goodbye like the night she died.
eRisk2023-T3_Subject46, b' ' , b'2019-06-12 03:27:58' , reddit post ,I also think it was her because a little kid on her side of the family had a dream that she came to him and said goodbye like the night she died.
eRisk2023-T3_Subject46, b' ' , b'2019-06-12 02:50:36' , reddit post ,It was a good sandwich too
eRisk2023-T3_Subject46, b' ' , b'2019-06-12 02:48:13' , reddit post ,It was when I was in like middle school and someone had an app for truth or dare on their phone lol
eRisk2023-T3_Subject46, b' ' , b'2019-06-12 02:45:46' , reddit post ,Put jelly on one armpit and peanut butter on the other then wipe it off with two slices of bread make it a sandwich and eat it.
eRisk2023-T3_Subject46, b'I think my grandma told me goodbye after she died.' , b'2019-06-12 02:07:40' , reddit post ,"So when my grandma died she was living with us. She had been admitted to the hospital however for breast cancer. She also had very weak lungs since she had smoked since she was like twenty. While in hospital her lungs couldn't handle the chemo and filled up with fluid and she ended up dying shortly later. I start sleeping with a blanket she made me and about a week later I start smelling stale cigarette smoked coming through my air vent and I stand there a little weirded out cause not only was she the only smoker in the house, she always smoked outside so there wasn't any lingering scent anywhere except her room. Then I feel something like fingers brush against my pinky fingertip and I get a really warm calm feeling. I'm fairly sure this was her saying her final goodbye to me."
eRisk2023-T3_Subject46, b' ' , b'2019-06-12 02:01:21' , reddit post ,Sucked someone off in a church parking lot before.
eRisk2023-T3_Subject46, b' ' , b'2019-06-12 02:00:05' , reddit post ,"When we go to the store, he always has to look at everything even if we have a list of what we need. Every time I wanna make a quick trip to the store he has to window shop. He has adhd so I get it but it's still annoying."
eRisk2023-T3_Subject46, b' ' , b'2019-06-11 01:51:19' , reddit post ,Hate speech
eRisk2023-T3_Subject46, b' ' , b'2019-06-11 01:04:47' , reddit post ,It sounds like the rapey one might be a succubus
eRisk2023-T3_Subject46, b' ' , b'2019-06-11 00:15:02' , reddit post ,And they were roommates
eRisk2023-T3_Subject46, b' ' , b'2019-06-10 23:54:58' , reddit post ,Hey thanks that's really nice of you!
eRisk2023-T3_Subject46, b'Surgery recooperation' , b'2019-06-10 23:53:47' , reddit post ,Anyone else smoke to help with pain after surgery? Not smoking for three months before surgery hella lowered my tolerance and man it helps so well for pain. So glad I can smoke again.
eRisk2023-T3_Subject46, b' ' , b'2019-06-10 23:31:06' , reddit post ,I go through the same thing. The thing that made the biggest difference was retraining my brain to be like wait no I'm fine I didn't do anything. It took me a long time though. I hope seeing your therapist makes things easier. Stay strong!
eRisk2023-T3_Subject46, b' ' , b'2019-06-10 22:54:59' , reddit post ,Also reassuring yourself is great too. Every time you have any guilty thoughts remind yourself that you aren't doing anything wrong.
eRisk2023-T3_Subject46, b' ' , b'2019-06-10 00:19:44' , reddit post ,Indeed they do
eRisk2023-T3_Subject46, b' ' , b'2019-06-10 00:06:59' , reddit post ,"My boyfriend said he was hungry and to be cute I told him ""you could eat me"" and sent it before I realized"
eRisk2023-T3_Subject46, b' ' , b'2019-06-09 23:47:24' , reddit post ,"I\'m a guy and I\'ve gotten that.  ""Excuse me sir!"" Turn around. ""Oh sorry ma\'am."" Kms"
eRisk2023-T3_Subject46, b' ' , b'2019-06-09 23:42:29' , reddit post ,Its definitely a trip and a hard thing to get over once the whole honeymoon phase happiness goes away. The important thing to do is normalize it because it is perfectly okay to have happen. It sucks but it happens and if your girlfriend is feeling guilty about it I would reassure her every chance you get because reassurance feels great especially when you're not expecting it.
eRisk2023-T3_Subject46, b' ' , b'2019-06-09 23:09:30' , reddit post ,Yep doctors told me everything looks cool so that's a relief lol
eRisk2023-T3_Subject46, b' ' , b'2019-06-09 23:01:03' , reddit post ,Just recently underwent surgery for my transition (female to male) and even though it's only been like three weeks and i need three more surgeries for it to be complete I'm so much happier already. I'm sure it annoyed my boyfriend since he had to take care of me lol
eRisk2023-T3_Subject46, b' ' , b'2019-06-09 20:57:12' , reddit post ,I feel attacked
eRisk2023-T3_Subject46, b' ' , b'2019-06-09 08:15:25' , reddit post ,Exactly.
eRisk2023-T3_Subject46, b' ' , b'2019-06-09 08:14:49' , reddit post ,"Not me but my buddy got sexually harassed by this chick who worked with us. Would constantly come onto him even though he told her he has a girlfriend, make insinuating comments, grab his junk grab his ass all the while in front of cameras and when he finally reported it they told him he probably asked for it and almost fired him. Two weeks later the bitch has a promotion."
eRisk2023-T3_Subject46, b' ' , b'2019-06-09 08:12:18' , reddit post ,Referring to yourself as an alpha male is cringe and doesn't make you a great guy. Also stop trying to come onto me after 4 years please.
eRisk2023-T3_Subject46, b' ' , b'2019-06-09 08:10:42' , reddit post ,A repressed traumatic memory coming up randomly and realizing that shit happened.
eRisk2023-T3_Subject46, b' ' , b'2019-06-09 08:08:03' , reddit post ,Got really angry in traffic one day and popped one but I was still angry so it just made me more irritated. Kinda funny though
eRisk2023-T3_Subject46, b' ' , b'2019-06-09 08:05:53' , reddit post ,Honestly don't even remember somehow I just kinda new but idk how I found out
eRisk2023-T3_Subject46, b' ' , b'2019-06-09 08:02:45' , reddit post ,Get high
eRisk2023-T3_Subject46, b' ' , b'2019-06-09 08:02:01' , reddit post ,Trans isn't it's own gender
eRisk2023-T3_Subject46, b' ' , b'2019-06-07 21:11:31' , reddit post ,"If the friend in question is super judgmental, not just of me but of other people (people we both know, my other friends, random strangers, literally anyone) and they get pissy or defensive at me when i call them out on it that's just a deal breaker for me."
eRisk2023-T3_Subject46, b' ' , b'2019-06-07 20:51:15' , reddit post ,Couldn't  give a fuck about life or death but THE OXFORD COMMA IS MY BOY
eRisk2023-T3_Subject46, b' ' , b'2019-06-07 20:51:02' , reddit post ,Couldn't  give a fuck about life or death but THE OXFORD COMMA IS MY BOY
eRisk2023-T3_Subject46, b' ' , b'2019-06-07 20:43:51' , reddit post ,We always she's the ABC game where you just each go through the alphabet naming off letters in order when you see them on like signs and shit
eRisk2023-T3_Subject46, b' ' , b'2019-06-07 20:23:04' , reddit post ,Regardless of this stupid argument I think non black people should just stay away from it because there's ultimately some black people who are fine with it and some who aren't. Better to always assume it will offend people and be safe than assuming you're in the clear with someone in my opinion
eRisk2023-T3_Subject46, b' ' , b'2019-06-07 19:34:19' , reddit post ,"When I was like nine my dad and I went on a walk and we happened to walk underneath this tree which had some sort of olive like thing growing on it. Bees loved this fucking thing and right as we were underneath it, a bee kamikazed into my fucking neck and stung me. It's worth mentioning I'm terrified of bees so at this young age that's all I could fucking thing of and just to get away from it (while crying and with my eyes closed shut from the sting) I ran sideways into a 40 mph busy street and luckily there were no cars"
eRisk2023-T3_Subject46, b' ' , b'2019-06-07 19:16:08' , reddit post ,No cause I'm an anxious person already and knowing my date I know is try and prepare for it which would just drive me insane cause there's no way you can prepare for that
eRisk2023-T3_Subject46, b' ' , b'2019-06-07 19:15:50' , reddit post ,No cause I'm an anxious person already and knowing my date I know is try and prepare for it which would just drive me insane cause there's no way you can prepare for that
eRisk2023-T3_Subject46, b' ' , b'2019-06-07 19:01:33' , reddit post ,"Have a decently quick learning curve. Takes me a while to get into the swing of things and become good at them. I attribute this to me being a perfectionist however because once I do get something I have to go all in. I only play three video games but I am really good at them now, just one example."
eRisk2023-T3_Subject46, b'Fixing humanity 101' , b'2019-06-07 16:51:39' , reddit post ,
eRisk2023-T3_Subject46, b' ' , b'2019-06-06 08:17:56' , reddit post ,Stretch marks they look like lightning on your body and I think it looks cool
eRisk2023-T3_Subject46, b' ' , b'2019-06-06 08:13:08' , reddit post ,My boyfriend at the time fucked me and it triggered a cyst I had to pop so I told my parents I had been running a lot
eRisk2023-T3_Subject46, b' ' , b'2019-06-06 02:06:18' , reddit post ,He tried when we left but they just kinda spat in his face pretty much. I also forgot to mention his mom told him that if his little brother had done anything it would've been his fault.
eRisk2023-T3_Subject46, b' ' , b'2019-06-05 10:12:05' , reddit post ,"It amazes me that people are actually like this. I don't mean to offend you but your mom sounds like she is ignorant to this type of problem. While I'm not female I went through my share of anorexic tendencies in high school and was thankfully able to pull myself out of it like you. I think a lot of people don't know that it isn't just a little phase and you're done with it. It stays with you even after you're doing better. And to constantly hear these comments could very easily make someone relapse. I think you should sit down with her and have a conversation about it. Keep everything cool and stand up for yourself if she gets angry at you for explaining things to her, as I think she might considering what you've said about her. Mainly just reassure her you're not mad or trying to demonize her, just that youre trying to explain your point of view and what you're going through. And if that doesn't work I would suggest having her speak to a counselor or therapist about the topic of body issues and eating disorders to help her better understand. I'm sorry you're going through this, stay strong [heart emoticon]"
