ID,WRITING.TITLE,WRITING.DATE,WRITING.INFO,WRITING.TEXT.Element:Text
eRisk2023-T3_Subject3, b' ' , b'2022-10-18 01:52:00' , reddit post ,"You don't need any certification up until you start working with H motors. Within that range, the most you'll ever spend on a rocket is probably $350, and most of that money would be spent on the motor case and avionics systems, which are reusable and can easily be moved between different rockets."
eRisk2023-T3_Subject3, b' ' , b'2022-10-16 01:34:12' , reddit post ,"In OpenRocket, there is a rocket optimization feature that can do that."
eRisk2023-T3_Subject3, b' ' , b'2022-10-14 06:01:30' , reddit post ,https://en.wikipedia.org/wiki/Mars_Climate_Orbiter
eRisk2023-T3_Subject3, b' ' , b'2022-10-13 13:40:35' , reddit post ,"Good to know. I already made some modifications, so the rocket should be stable as long as it has fins.  I haven't been able to get a result from FinSim, so I'm probably doing something wrong. I might just model the fins based on Additive Aerospace's design, since they've been proven to work up to Mach 2."
eRisk2023-T3_Subject3, b' ' , b'2022-10-11 01:59:18' , reddit post ,[This is the fiberglass I ordered](https://www.buyrocketmotors.com/38mm-filament-wound-fiberglass-airframes-standard/)  The engine block will most likely be necessary due to the amount of force being exerted on the airframe. It should help distribute it a little more evenly.
eRisk2023-T3_Subject3, b' ' , b'2022-10-10 14:01:18' , reddit post ,"The fins are polycarbonate, not fiberglass."
eRisk2023-T3_Subject3, b' ' , b'2022-10-10 08:56:40' , reddit post ,"How conservative should I be with the fin dimensions to avoid flutter? I've tried using FinSim, but I can't get a result."
eRisk2023-T3_Subject3, b' ' , b'2022-10-10 08:49:48' , reddit post ,"I haven't even started building the rocket yet. I made a fin can, but I don't plan on using it for anything more than test flights (testing the computer, not the rocket itself)"
eRisk2023-T3_Subject3, b' ' , b'2022-10-10 08:18:41' , reddit post ,"I checked in both OpenRocket and RASAero, and the stability should increase with speed, due to both base drag and the changes in the CG."
eRisk2023-T3_Subject3, b' ' , b'2022-10-10 08:10:05' , reddit post ,"I'll print a polycarbonate fin can, and the airframe may become longer depending on the amount of space required for the parachute and computer.  Edit: The airframe became longer. The new plan is to do both my L1 and L2 on the same rocket, then fly it on an I1299 to celebrate."
eRisk2023-T3_Subject3, b' ' , b'2022-10-10 07:16:24' , reddit post ,"> First, your stability is questionable, especially since rockets get less stable past mach 1.  Doesn't base drag increase stability?"
eRisk2023-T3_Subject3," b""Will my rocket be able to handle >200G acceleration if it's made of fiberglass?"" ", b'2022-10-10 02:45:17' , reddit post ,"I'm designing an L1/L2 rocket, and I plan on doing a launch with an I1299. The structure will be made of two standard thickness 38mm body tubes, one \\~350mm long, and one 310mm long. I've asked multiple people with more experience than me, but I've had conflicting answers.  ​  [Overview of the OpenRocket design][URL]  Edit:   [Updated design w\\/ better stability and longer airframe capable of fitting a J425 for an L2 flight][URL]"
eRisk2023-T3_Subject3, b' ' , b'2022-10-09 10:28:36' , reddit post ,"How much acceleration can a Pi Zero handle? I'm designing a rocket that will use one as a flight computer, and it'll probably exceed 200G acceleration."
eRisk2023-T3_Subject3, b' ' , b'2022-08-25 05:48:34' , reddit post ,"[FinSim](http://www.aerorocket.com/finsim.html) is more accurate, but it unfortunately doesn't allow for metric units either"
eRisk2023-T3_Subject3, b' ' , b'2022-08-18 01:13:23' , reddit post ,How?
eRisk2023-T3_Subject3, b' ' , b'2022-08-17 09:20:25' , reddit post ,"I'm trying to get it to go to at least 300. My current firmware allows for 260, but I'm getting some problems with underextrusion and weak parts because I can't set the hotend to the correct temperature."
eRisk2023-T3_Subject3, b'Is there any Ender 3 V2 firmware with a higher temperature limit?' , b'2022-08-17 03:30:59' , reddit post ,"I got an all-metal hotend so I can print polycarbonate, but I can't find any working firmware with the temperature range I need, and I unsuccessfully tried to compile it myself"
eRisk2023-T3_Subject3, b'Would it be better to just use a small parachute (or just find a way to ditch it entirely)?' , b'2022-07-09 10:24:23' , reddit post ,"I attempted my first dual deployment flight (drogueless) and the parachute didn't deploy, but the descent rate was only 11 m/s - definitely higher than ideal, but lower than I expected. Some parts of the structure were damaged, but I think it may have been avoidable with stronger materials (PC/ABS instead of PLA and thin PETG fins) or a tiny parachute to slow it down a bit more. There would be some benefits to reducing the size of the parachute, so is it worth a shot?  The rocket's structure is 100% 3D printed, its dry mass was approximately 285g, and the cross-sectional area was approximately 0.02986m^2. This means the drag coefficient was around 1.63."
eRisk2023-T3_Subject3, b' ' , b'2022-05-29 11:32:59' , reddit post ,"How would I do it, though? I've never worked on a kit rocket before, and the bulkhead is too deep in there for me to access it."
eRisk2023-T3_Subject3, b' ' , b'2022-05-15 10:24:01' , reddit post ,"It threw me off, too. I ended up researching the actual sounding rocket instead of the scale model."
eRisk2023-T3_Subject3," b'I found this really old rocket, but I couldn\xe2\x80\x99t find much information on it. Can anyone here identify it?' ", b'2022-05-14 23:05:37' , reddit post ,
eRisk2023-T3_Subject3, b' ' , b'2022-01-18 07:01:22' , reddit post ,"Not enough thrust. A Space Shuttle SRB would have 12MN maximum thrust ASL, but 9 Merlin engines combined would only have 7.6MN of thrust. Whether or not Starship works out, this definitely won't."
eRisk2023-T3_Subject3, b' ' , b'2022-01-17 07:20:31' , reddit post ,"It looks like the rocket was in the air for more than 5 seconds after burnout, but the 5 second mark was a little bit later than apogee, and I didn't see any sign of the ejection charge going off. I don't know what would cause that."
eRisk2023-T3_Subject3, b' ' , b'2022-01-16 23:12:32' , reddit post ,"I've launched a rocket with similar mass on the same motor, and it was a perfect flight every time, at least until I tried adding a booster and it hit the ground at well over 100mph.  What caused the chute to not deploy?"
eRisk2023-T3_Subject3, b' ' , b'2022-01-16 21:43:18' , reddit post ,What motor?
eRisk2023-T3_Subject3, b' ' , b'2022-01-14 15:53:19' , reddit post ,"I'll be doing a lot of launches with the same rocket and a variety of different parts pretty soon, so I can let you know how it goes."
