ID,WRITING.TITLE,WRITING.DATE,WRITING.INFO,WRITING.TEXT.Element:Text
eRisk2023-T3_Subject46, b' ' , b'2022-06-18 08:06:03' , reddit post ,I have this one too! Mainly comes out when I'm in social settings
eRisk2023-T3_Subject46, b' ' , b'2022-06-18 07:59:36' , reddit post ,I've tried looking into this before but came up with no results. What does the procedure look like?
eRisk2023-T3_Subject46, b' ' , b'2022-06-14 01:04:25' , reddit post ,"Thanks, I've heard good things about Guanfacine and yeah my doctor said that we could try meds but they can be a bit extreme. That's really great that you include him in the choice of medication!"
eRisk2023-T3_Subject46, b' ' , b'2022-06-13 09:04:20' , reddit post ,"I don't have an accurate answer cause I was on a bunch of other things as well and I felt tired literally all the time cause it was right after I had surgery lol. I can't complain, so I'd say it was fine?"
eRisk2023-T3_Subject46, b' ' , b'2022-06-13 08:57:39' , reddit post ,Oh interesting I had to take gabapentin for a while but it wasn't prescribed for my tics.
eRisk2023-T3_Subject46, b' ' , b'2022-06-13 08:52:32' , reddit post ,"I'm not sure of the names she said, I think one was risperdone"
eRisk2023-T3_Subject46, b'Worst Side Effects from Medication' , b'2022-06-13 07:27:33' , reddit post ,"Im about to ask my doctor to start me on medication for my tics but I'm wondering what everyone's experience with any meds is like, particularly what the worst side effect you've experienced was?"
eRisk2023-T3_Subject46, b'DAE get hyperactive when they quit smoking weed?' , b'2022-06-04 00:53:57' , reddit post ,[eliminado]
eRisk2023-T3_Subject46, b' ' , b'2022-05-24 04:51:59' , reddit post ,The sp catheter was the worst part for me as well
eRisk2023-T3_Subject46, b' ' , b'2022-03-09 04:04:16' , reddit post ,Bacon
eRisk2023-T3_Subject46, b' ' , b'2022-03-08 12:36:08' , reddit post ,"""Men, what do women need to know about penis?""  ""Whats something men need to know about women?"" ""What would you do as the opposite sex for a day?"""
eRisk2023-T3_Subject46, b'Why do you smoke cigarettes like \xe2\x9c\x8c but joints like \xf0\x9f\x91\x8c?' , b'2022-03-08 11:35:25' , reddit post ,
eRisk2023-T3_Subject46, b'Has anyone had phalloplasty with Dr. Ali Salim at SF through Kaiser?' , b'2022-03-07 11:56:49' , reddit post ,Just wondering what everyone's experience who had him as their surgeon was like.
eRisk2023-T3_Subject46, b'Voice changes 5+ years on T' , b'2022-03-07 11:49:54' , reddit post ,"Is it very likely that my voice would continue to drop after 5 years of being on T? I know it would be miniscule and subtle if the answer is yes, but was just curious to see what people had to say here."
eRisk2023-T3_Subject46, b' ' , b'2022-03-04 05:18:42' , reddit post ,Would you happen to know what kaisers new guy is called?
eRisk2023-T3_Subject46, b' ' , b'2022-03-03 23:25:12' , reddit post ,That I was a trans woman and I detransitioned. The girl I was talking to didn't even know trans men were a thing
eRisk2023-T3_Subject46, b' ' , b'2022-03-03 12:51:43' , reddit post ,Cotard's Solution by Will Wood and the Tapeworms
eRisk2023-T3_Subject46, b'What masculinizing effects did you see from top surgery?' , b'2022-03-02 09:35:06' , reddit post ,I hear people talk about how getting top surgery or a hysto can give you more effects than just being on T alone. What are some of those that you experienced? My roommate says he got chest hair after top surgery
eRisk2023-T3_Subject46, b' ' , b'2022-02-28 22:13:30' , reddit post ,'I've found out that over 60% of people who watch aren't subscribed!! Please subscribe and like'
eRisk2023-T3_Subject46, b' ' , b'2022-02-27 22:54:59' , reddit post ,"I always think this! Why do people hate so much on them, they're amazing"
eRisk2023-T3_Subject46, b' ' , b'2022-02-24 10:42:12' , reddit post ,"""Can I see your dick after you get surgery?""  ""But you don\'t have a penis though, right?""  ""How old are you?""   ""Wow, really?! I thought you were 12!""  ""Are you a boy or a girl?""    *says \'oh never mind\' and leaves after I start talking*"
eRisk2023-T3_Subject46, b'Anyone have any issues with loss of hunger cues after starting prozac?' , b'2022-02-21 10:06:57' , reddit post ,Ive been eating absurd amounts whenever I eat because I just keep feeling the need to eat. I also don't really get hungry but once I start eating I just wanna keep tasting stuff. I feel like it's ironic because I have bulimia and prozac is used to treat it because it can suppress appetite and help with binging I thought lol.
eRisk2023-T3_Subject46, b' ' , b'2022-02-21 07:58:58' , reddit post ,My first reaction to it was like bro why do we always need to bring this up.
eRisk2023-T3_Subject46, b' ' , b'2022-02-19 06:54:39' , reddit post ,Good luck \xe2\x9c\x8c
eRisk2023-T3_Subject46, b' ' , b'2022-02-19 06:42:37' , reddit post ,Ugh thank God. The SP was a fuckin nightmare for me lol I didn't think it would make sense to have one just for scrotoplasty
eRisk2023-T3_Subject46, b'Scrotoplasty after metoidioplasty' , b'2022-02-19 05:49:41' , reddit post ,"I got metoidioplasty with hysterectomy vaginectomy and urethral lengthening in 2019. The surgeon said he'd try to do scrotoplasty at the same time if he was able to and he ended up not being able to. I'm still looking into scrotoplasty for the future, but I'm wondering if anyone knows if I'll need a suprapubic catheter if I'm getting just a scrotoplasty?"
eRisk2023-T3_Subject46, b'Does anyone have any experience with these surgeries?' , b'2022-02-19 02:10:58' , reddit post ,"I got metoidioplasty with hysterectomy vaginectomy and urethral lengthening. The surgeon said he'd try to do scrotoplasty at the same time if he was able to and he ended up not being able to. I'm still looking into scrotoplasty for the future, but I'm wondering if anyone knows if I'll need a suprapubic catheter if I'm getting just a scrotoplasty?"
eRisk2023-T3_Subject46, b'Severe bottom dysphoria' , b'2022-02-12 09:06:39' , reddit post ,"Idk why but randomly lately I've had near constant bottom dysphoria. Just seeing a guy in public, hearing about genitals, or even for no reason I just get this intense crushing feeling like that will never be me.. I've already had some surgery and that helped immensely- still considering more in the future but does anyone have any advice about how to get over cis penis envy?"
eRisk2023-T3_Subject46, b' ' , b'2022-02-11 04:17:58' , reddit post ,Yeah sometimes I have that tic too
eRisk2023-T3_Subject46, b'Is this a vocal tic or a motor tic?' , b'2022-02-10 12:43:08' , reddit post ,"I swish my saliva around in my mouth so it feels and sounds a certain way. I've heard that any noise you make with your mouth is a vocal tic, but I've never heard anyone mention this specific tic so idk."
eRisk2023-T3_Subject46, b'Anyone have any advice for itchy testosterone patches?' , b'2022-02-08 21:44:27' , reddit post ,"Started using t patches about a month and a half ago, but the only downside is that they itch towards the end of their usage and afterwards. Is there anything to be done about that or not really?"
eRisk2023-T3_Subject46, b' ' , b'2022-02-08 21:14:55' , reddit post ,I think Intrusive thoughts are usually negatively themed and cause distress whereas mental tics are more random and can be anything. They might still cause distress but in a more annoyed way vs feeling scared from an Intrusive thought
eRisk2023-T3_Subject46, b' ' , b'2022-02-06 09:10:01' , reddit post ,"It doesn't make me not tic at all, but when I play a video game I'm hyperfocused on, they significantly reduce. And it's kinda funny sometimes that I'll end up dying cause I keep blinking, occasionally"
eRisk2023-T3_Subject46, b' ' , b'2022-02-05 07:19:49' , reddit post ,Yes and the worst is when you get stuck trying to doing it just right and it doesn't come out right so you have to keep doing it and it always just gets stuck like bro we could figure this out in 5 seconds if you let me have control lol
eRisk2023-T3_Subject46, b' ' , b'2022-02-04 10:53:12' , reddit post ,Relatable
eRisk2023-T3_Subject46, b' ' , b'2022-02-04 05:24:52' , reddit post ,"When I used to have vocal tics, it felt like my body would go into a pause and get a little stuck and I felt an almost pressure rising in my chest and then whatever the tic was would kinda just force itself out"
eRisk2023-T3_Subject46, b' ' , b'2022-02-04 00:02:08' , reddit post ,"I feel like maybe her having some kind of sensory aid would work well, if she's open to it"
eRisk2023-T3_Subject46, b' ' , b'2022-02-03 22:34:34' , reddit post ,Is she embarrassed by having her tics set off or is it the other people in the club who are uncomfortable?
eRisk2023-T3_Subject46, b' ' , b'2022-02-03 12:27:05' , reddit post ,"Right? Even if I hear or see someone doing something uncommon, if they keep doing it, I'm like oh okay they just do that, whatevs."
eRisk2023-T3_Subject46, b' ' , b'2022-02-02 08:43:51' , reddit post ,Yes my eye blinking is pretty constant throughout the day and my eyes feel tired a lot
eRisk2023-T3_Subject46, b' ' , b'2022-02-02 00:22:30' , reddit post ,"I think those are called sensory tics, I usually hear it described as the premonitory urge without the tic ever coming out."
eRisk2023-T3_Subject46, b' ' , b'2022-02-01 23:40:55' , reddit post ,Yes and I'll start the tic but get stuck midway through
eRisk2023-T3_Subject46, b' ' , b'2022-02-01 17:09:46' , reddit post ,"Yes it always frustrates me and I just wanna hit something or whatever, ESPECIALLY when I end up not being able to complete the tic. Sorry this happens to you too, but it is nice knowing I'm not the odd one out lol."
eRisk2023-T3_Subject46, b'Getting stuck trying to tic' , b'2022-02-01 16:01:29' , reddit post ,Does anyone else experience moments where you get stuck while ticcing? With one of my tics (it only ever happens with this one) I get stuck and have to try and will my body to finish the tic. It's extremely uncomfortable and sometimes I can't can't finish the tic because the sensation of being stuck is so off-putting.
eRisk2023-T3_Subject46," b""Feel like I'm getting nowhere"" ", b'2022-02-01 03:16:48' , reddit post ,"My anxiety, depression and dissociation are getting steadily worse. I\'m switching from zoloft to Prozac to see if it helps because the zoloft has been giving me very vivid dreams/nightmares every time I sleep. The vividness of the dreams doesn\'t help my derealization and I feel like sometimes its borderline delusional. I\'m sort of hopeful about my doctors but idk if they\'ll really be able to help. I just want concrete answers about what\'s wrong so I can work harder to fix it. I just feel really hopeless right now. I feel so out of place and disconnected from everything else. I get sort of panicky once I pop back into reality and think things like ""is this really my boyfriend? Who is he? Why do I have cats?"" I know the answers to these logically I guess. I know what the answer is supposed to be but it doesn\'t feel right. None of this is mine. My memories are from another life another world."
eRisk2023-T3_Subject46, b' ' , b'2022-01-31 04:30:12' , reddit post ,:)
eRisk2023-T3_Subject46, b' ' , b'2022-01-30 21:28:13' , reddit post ,A Serbian Film
eRisk2023-T3_Subject46, b'Is Tourettic OCD not really recognized in psychiatry?' , b'2022-01-28 00:51:47' , reddit post ,"I had thought my tics mostly line up with Tourettic OCD with a few exceptions but when I explained about it, my doctor said no its not OCD, because you don't have Intrusive thoughts. But Tourettic OCD is described as OCD without Intrusive thoughts and physical sensations replace them. I can control them but feel overwhelming urges to tic. I can not do them if I really don't want to. Sometimes the feeling just is too much to handle so I tic to get rid of it. Now I'm confused though, cause wouldn't the treatment for tics and compulsive tics be different? Edit: wow how have I been so misinformed for this long, thanks for all the replies!"
eRisk2023-T3_Subject46, b' ' , b'2022-01-20 06:49:51' , reddit post ,Serenity
eRisk2023-T3_Subject46, b' ' , b'2022-01-08 20:35:19' , reddit post ,Yeah thats new. I'll admit I did mess up my sleep over the past two weeks cause my boyfriend had work off the whole time so we wanted to just do whatever and I've done that before without consequence so I'm not sure why it's happening now. I also don't really drink anything with caffeine in it.
eRisk2023-T3_Subject46, b'Bizarre and vivid stress-dreams' , b'2022-01-08 11:30:30' , reddit post ,"I came to this subreddit to try and see if this was a common side effect and the first two posts I see are talking about crazy zoloft dreams lol. Pretty sure I have insomnia now too, I keep sleeping around 3-4 hours with like 6-8 hours in between. Hope this goes away soon. I also started sleep sweating along with this which is the cherry on top. I'm on 200mg and finally started to feel a decrease in anxiety but at this point because of my dreams, every time I wake up I feel anxious or depressed. They aren't bad enough to be nightmares, but the stress is so prolonged while I'm dreaming that it might as well be. I already sent my psychiatrist a message, but seeing as it's the weekend, I'm not looking forward to the next 3 nights/sleeps. Anyone have any advice?"
eRisk2023-T3_Subject46, b' ' , b'2021-11-15 19:11:07' , reddit post ,What?
eRisk2023-T3_Subject46, b' ' , b'2021-11-15 18:56:35' , reddit post ,Buffalo wheat thins
eRisk2023-T3_Subject46, b' ' , b'2021-11-15 18:34:38' , reddit post ,"The only thing that stops me is that she deals with mental issues as well including severe depression and I'm like one of her 2 friends so I'm concerned that if I cut her out, she's gonna kill herself."
eRisk2023-T3_Subject46, b' ' , b'2021-10-11 02:28:05' , reddit post ,"I grew up with my mom being pretty sick and in and out of hospitals. My dad would work til the evenings most days and I never really had a super emotional relationship or support from him, my mom was the one for that and with her always sick, my dad would tell me to take care of her don't bother her let her sleep. I also asked my dad at one point jokingly if he loved my mom more than me and he just said 'yes, I do' adamantly and with a serious face. I think both of those things plus a bunch of relationship abuse really made me wary of people. I grew up really naive."
eRisk2023-T3_Subject46, b' ' , b'2021-10-07 20:44:39' , reddit post ,"Speaking as an autistic person, I have a tendency to react to people talking in movies or shows as if they were talking to me (ex: making a face and shrugging as an answer to what they said) especially if I'm very invested and i don't realize I did anything weird until just after I do it. This happens with animated stuff for me too."
eRisk2023-T3_Subject46," b""People who've been banned from a country, how did it happen?"" ", b'2021-10-04 23:43:53' , reddit post ,
eRisk2023-T3_Subject46, b' ' , b'2021-10-03 08:47:13' , reddit post ,Yes I'm extremely easy to gaslight for this reason which is not great
eRisk2023-T3_Subject46, b' ' , b'2021-10-03 08:43:32' , reddit post ,"I grew up with my mom being pretty sick and in and out of hospitals. My dad would work til the evenings most days and I never really had a super emotional relationship or support from him, my mom was the one for that and with her always sick, my dad would tell me to take care of her don't bother her let her sleep. I also asked my dad at one point jokingly if he loved my mom more than me and he just said 'yes, I do' adamantly and with a serious face. I think both of those things plus a bunch of relationship abuse really made me wary of people. I grew up really naive."
eRisk2023-T3_Subject46, b' ' , b'2021-10-03 08:29:24' , reddit post ,I say the truth. I do feel really ashamed of it and I hate when people bring it up but I'm not that good a liar honestly so I just have to bite the bullet and pretend I'm not bothered by it as much as I am.
eRisk2023-T3_Subject46, b' ' , b'2021-09-29 00:59:52' , reddit post ,I had to do that the other day and I had my boyfriend talk to the lady to get her info cause I was too panicky
eRisk2023-T3_Subject46, b'The turning point in realizing I had a personality disorder' , b'2021-09-28 12:30:28' , reddit post ,"I have driving anxiety not because I'm afraid of getting in an accident or dying or anything but because if my car breaks down or I get into a wreck, I'll have to talk to other people."
eRisk2023-T3_Subject46," b""To anyone who has actually been stung by insects like the velvet ant, bullet ant, tarantula hawk, etc: How much do you relate to Coyote Peterson's experiences/reactions to getting stung?"" ", b'2021-05-14 09:28:40' , reddit post ,
eRisk2023-T3_Subject46, b' ' , b'2021-04-24 02:39:11' , reddit post ,You can be friends with black people and still be a racist; just like you can be friends with gay people and still be a homophobe
eRisk2023-T3_Subject46, b' ' , b'2021-04-18 10:00:57' , reddit post ,"Whats the reason mainly young Asian woman are diagnosed with it, if you know?"
eRisk2023-T3_Subject46, b'Should I worry about possibly damaging my teeth?' , b'2021-04-17 10:19:56' , reddit post ,"I've had a steady increase in the amount that I have to chomp my teeth, and its starting to get in the way of my life. I've ended up putting myself in a shutdown because of the emotional overwhelm that happens when I just can't bring myself to stop. Its more compulsive than involuntary and my teeth are starting to feel sensitive because of it. The chewelry i have doesn't seem to help because I need the sensation of hard clicking against my teeth.  I probably do it at least 100 times if not more on bad days which are becoming more frequent. I have to really chomp down hard and I'm worried that I might be doing damage? Or is it not that high of a chance?"
eRisk2023-T3_Subject46, b' ' , b'2021-04-15 01:01:49' , reddit post ,I've heard this called sensory tics where basically you feel the premonitory urge but nothing will come out.
eRisk2023-T3_Subject46," b""Any chewlery that doesn't squeak if you chew it really hard?"" ", b'2021-04-15 01:00:27' , reddit post ,I've bought two different chew necklaces for when my teeth chomping becomes too much and they both squeak so much when I chew on them that I'd honestly rather deal with the tic than the sound because it drives me crazy. I need the hard continuous pressure to satisfy the feeling so chewing lightly or briefly won't help. Are there any options out there that don't really squeak if you chew on them continuously?
eRisk2023-T3_Subject46, b' ' , b'2021-04-08 23:47:51' , reddit post ,From the title I thought you were starting some new medication trying to be introduced lol
eRisk2023-T3_Subject46, b' ' , b'2021-04-08 06:36:27' , reddit post ,Mormons haven't practiced bigamy in a really long time
eRisk2023-T3_Subject46, b' ' , b'2021-04-08 04:38:21' , reddit post ,"I don't understand why some people think their reaction was normal. Its a sexual orientation just like being gay and I don't get why they were so heartbroken over the possibility of you guys not having sex? Why should they care? I don't think its wrong of them to be curious, but it would weird me out too if people in my family started crying because there was a possibility I wouldn't be having sex with their son anymore. Weird.  NTA"
eRisk2023-T3_Subject46, b' ' , b'2021-04-07 02:44:46' , reddit post ,"My parents thought I was autistic from a young age but I have an older brother who needed more support than I did growing up so I think they already knew how to help me so didn\'t see a need in a diagnosis. It was never like a ""he\'ll be weird if he gets a diagnosis"" but I still kinda wish they did, as now I\'m trying to get one in adulthood since I don\'t have the same support anymore."
eRisk2023-T3_Subject46, b' ' , b'2021-04-06 22:15:42' , reddit post ,"I think its probably the same reason you yawn while seeing others yawn, sympathetic response maybe?"
eRisk2023-T3_Subject46, b' ' , b'2021-04-06 03:41:00' , reddit post ,Confusing people when they look at me lol
eRisk2023-T3_Subject46, b' ' , b'2021-04-06 03:40:19' , reddit post ,I think the name was changed due to people mistakenly thinking its a personality disorder and not a dissociative disorder
eRisk2023-T3_Subject46, b' ' , b'2021-04-06 03:26:20' , reddit post ,"They weren't able to even get it into my bladder apparently because I've got polyps (growths of some sort) in the way which could possibly be causing a stricture, or a narrowing of the urethra. So that was kind of a bummer. He said he'd refer me to a different specialist since I've had work done by him and he knows my anatomy better, but most likely ill have to have some sort of surgery to correct it which sucks."
eRisk2023-T3_Subject46, b' ' , b'2021-04-06 03:23:16' , reddit post ,"Its a procedure used to look into the bladder via the urethra, so they put a scope (camera) up there to take a look around."
eRisk2023-T3_Subject46, b' ' , b'2021-04-05 20:30:55' , reddit post ,Unrelated but who else was scared shitless by this episode? Am I just a pussy? Lol
eRisk2023-T3_Subject46, b' ' , b'2021-04-05 20:25:05' , reddit post ,Eyebrow man
eRisk2023-T3_Subject46, b' ' , b'2021-04-04 10:28:38' , reddit post ,Ever seen anything shitty done by one of the employees? I hear a lot of people complain about misconduct and harassment when staying in a psych ward.
eRisk2023-T3_Subject46, b' ' , b'2021-04-04 10:18:32' , reddit post ,My boyfriend once ejaculated into my eye on accident. I guess I wasn't so much embarrassed as in pain and he felt bad lol. We still bring it up sometimes as a joke
eRisk2023-T3_Subject46, b' ' , b'2021-04-03 06:08:37' , reddit post ,"Thats awesome, I'm glad you two are friends :)"
eRisk2023-T3_Subject46, b' ' , b'2021-04-03 05:57:50' , reddit post ,How does your ODD impact you? I don't really hear much representation or first hand experiences about it.
eRisk2023-T3_Subject46, b' ' , b'2021-04-03 05:55:01' , reddit post ,"What impact has this had on her life? I remember watching a video done by SBSK on YouTube where he interviewed a woman who was an abortion survivor, and she had a few conditions that arose because of it."
eRisk2023-T3_Subject46, b' ' , b'2021-04-03 05:47:37' , reddit post ,"Yeah its fine for you to use, intrusive thoughts happen in a lot of different mental health issues, including cptsd"
eRisk2023-T3_Subject46, b' ' , b'2021-04-03 02:34:44' , reddit post ,"Gender can be confusing and the reasons someone says they feel they fit better into one gender can differ vastly from others in the same gender or like you said you relate to a lot of what he says but you don't think of yourself as nb. Its more about individual feeling I guess.   I would say that his 'reasoning' behind it doesn't matter as much as how connected he feels to gender. Some people like me still enjoy femininity or masculinity while not feeling connected to female or male labels.   Me personally, I was assigned female at birth and even though I love dressing feminine and stereotypical girl interests, I still feel heavily disconnected from she/her pronouns and labeling myself a girl, so thats why I feel more connected to nb as a label.   It can get really gray and everyone's reasoning can be different, but if he says he feels nb, id be inclined to believe him and ask how I could help during his time contemplating this. I hope this helps!"
eRisk2023-T3_Subject46, b' ' , b'2021-04-03 01:09:28' , reddit post ,There's a distinction because symptoms of personality disorders can occur outside of other disorders and the symptoms are either to a lesser or different degree.
eRisk2023-T3_Subject46, b' ' , b'2021-04-03 01:06:52' , reddit post ,3 year old me sitting on the couch in the morning watching PB and J on TV. All I remember about that shows is it was about otters.
eRisk2023-T3_Subject46, b' ' , b'2021-04-03 01:05:16' , reddit post ,Mania can present as aggression/agitation or high anxiety and there can be symptoms of psychosis with bipolar as well
eRisk2023-T3_Subject46, b' ' , b'2021-04-02 10:27:07' , reddit post ,Could be a mental tic
eRisk2023-T3_Subject46, b' ' , b'2021-04-01 22:13:28' , reddit post ,Thats what I thought. A lot of electronics have the option to reduce blue light as well
eRisk2023-T3_Subject46, b' ' , b'2021-04-01 22:07:44' , reddit post ,Most fruits
eRisk2023-T3_Subject46, b' ' , b'2021-04-01 21:41:14' , reddit post ,"Thanks, that's a good idea!"
eRisk2023-T3_Subject46, b'Any tips on discerning between hypomania in bipolar and hyperactivity in ADHD?' , b'2021-04-01 21:30:12' , reddit post ,"I have a close friend who's suspecting he has both and he asked if there was any way to tell between the two since the symptoms overlap a lot. Does anyone have any tips for this? One thing we've concluded is:  ADHD symptoms are constant even if they can fluctuate in intensity, while mania/hypomania is episodic.  He's scheduled to meet with his psychiatrist to talk about it but he's a bit anxious about not knowing how to articulate why he suspects that he has bipolar. I was gonna try and help him compile a list so he doesn't forget any symptoms, but we realized its really hard to differentiate between the two."
eRisk2023-T3_Subject46, b' ' , b'2021-04-01 21:26:54' , reddit post ,"I know with autism, a lot of people have what are called special interests that they hyperfixate on for a prolonged amount of time. It ranges from person to person but I feel the same way a lot of the time where I'm worried I'm making them my whole personality.   I'll go on and on if someone let's me about psychology/mental illness. I've only ever played like 4 video games but I have no desire to try new ones, thats how much I love them- I can play them forever.   Thats just my 2 cents as someone getting evaluated for autism."
