ID,WRITING.TITLE,WRITING.DATE,WRITING.INFO,WRITING.TEXT.Element:Text
eRisk2023-T3_Subject17, b' ' , b'2022-06-09 20:44:43' , reddit post ,">As I don't believe being a man or woman means being male or female respectively, I don't see how saying someone is male or female would be saying they're a man or woman.  That\'s what I\'m trying to get across to you. Your personal belief and opinion about what these words mean doesn\'t change what they practically convey to other people.  I don\'t understand having a belief that a word means something besides what dictionaries, governments, English speakers in general, and you and I understand them to mean. What makes a word have a meaning to you, besides the meaning that you intuitively understand from it? Since you can decide that male and female only mean sex and not gender, what stops me from deciding the opposite, that all four only mean gender, and we don\'t need a word for sex? Who\'s got the authority to decide that that collection of sounds and letters in that order means anything?  >It's uncommon to hear someone refer to a group of woman as \xe2\x80\x9cfemales,\xe2\x80\x9d for example, and when it does happen it tends to be off-putting.   You gave evidence of a collection of people who use female to mean woman and they are understood by the general population, well enough to critique the usage. Just because it is off putting to you doesn\'t mean that you don\'t understand the meaning. It isn\'t like they called the group ""pokies"" and that\'s the first time you saw that and you have no reference for what that means. You intuited that they were referring to a group of people all of the same gender which was woman. To me, that\'s what shows that ""female"" does mean woman, and that makes it inappropriate to use those words to refer to somehow whose gender does not match.  When people are assigned ""male"" or ""female"" at birth, the intention is very much that that is our sex AND our gender. That is why when someone comes out as binary trans they may choose to change their document marker to show the other choice. Would you tell them that they\'re not really ""female"" or ""male"" unless they get a medical procedure? When someone\'s legal gender is recorded that way, why can\'t they also refer to it that way? To say that they\'re not actually male or female, just a man or woman, comes off as denying the reality of the world. More precise language is needed to avoid that implication and what could be experienced as misgendering for many people. That\'s what I said in my original comment.  >it's not appropriate to be referring to people as being male or female in casual conversation anyway,  It feels like a dirty secret. Like everyone knows I\'m really ""male"" or ""female"" but they\'ll just whisper about it, like it\'s humoring me to respect my identity, or the identity of others who use male or female as their gender. We still can\'t change our chromosomes, which to many people are the main determiner of sex, a concept that humans made up. No matter what procedure I could get there will always be people who say I\'m really my assigned sex / gender based on that. It doesn\'t feel any different when another trans person is saying it."
eRisk2023-T3_Subject17, b' ' , b'2022-06-09 19:46:03' , reddit post ,"I\'m in the same boat as the other commenter, where condoms are not relevant to my sex life.  It was really weird to see questions about my partner being queer next to questions about using drugs before sex or having sex with people whose safe sex practices you don\'t know. Then in the next section there is a question about whether I feel bad about my sexuality. Well, if I didn\'t before, then I sure do now!  In that same section, there were multiple ""slightly agree"" options for each question. I assume one was meant to say ""slight disagree."""
eRisk2023-T3_Subject17, b' ' , b'2022-06-09 19:03:55' , reddit post ,"I think people choose to refer to themselves as nonbinary because of a specific philosophy, but it\'s not one and the same.  I encourage anybody who feels that they ""are"" nonbinary, who feels like the words nonbinary honestly helps and describes them, to use it. If an otherwise binary woman honestly feels that their gender ideology pushes them so far outside of the norm of womanhood that they\'re unable to be in a group with them, it\'s not my place to tell them that they\'re not a real nonbinary person like us. If I did, it would have terrible implications for the validity of all identities and who has the authority to decide.  Additionally, the processes of identity are subjective and largely subconscious and not everybody experiences it the same way. People post all the time saying that they don\'t understand what identification or gender really is. Maybe what that person experiences as a philosophy would be understood as an identity by someone else. The nonbinary community is diverse and it takes all sorts.  This topic gets a lot of backlash here because it\'s a viewpoint that is used to oppress us sometimes, saying that nonbinary people only have a different ideology, and that our experiences of identification and self-evaluation are not real. I think if that oppressive force were gone we would be more free to talk about it without the pressure of having to meet cis ideals of being ""nonbinary enough."""
eRisk2023-T3_Subject17, b' ' , b'2022-06-09 18:45:53' , reddit post ,">Saying \xe2\x80\x9cmale\xe2\x80\x9d defines \xe2\x80\x9cman\xe2\x80\x9d sounds like calling me a man because I am male. I am not a man.  I will agree to disagree, but what I\'m asking is for you to understand the other side. You saying my sex is male / female is also calling me a man / woman because that\'s what those words mean, and I am not a man or woman. Neither you nor I have the natural authority or practical ability to control how words are used -- when you say you are right and that it\'s objectively true that non-intersex people are ""male"" or ""female,"" and must physically transition if they don\'t want to be, that sounds exactly like saying gender and sex are connected, because those words mean genders as well as sexes.  >I think those definitions are outdated.  The dictionaries I referenced are all descriptive dictionaries. They are not guides to how words are supposed to be used or the right or wrong way to use them, they only describe how the words are actuallly used by real speakers of English. As long as people use the words this way, it will be defined that way. That\'s how words get their meaning, not from someone claiming authority to dictate the meaning from on high. You and other redditors understood what the original commenter meant when they used ""male"" in that way, even if you didn\'t agree with how it was used. It\'s clear that in the present day, male and female can be said and understood to refer to the binary genders man and woman.  ""Male"" and ""female"" do not have to be the words we use to distinguish the sexes, the 2 general packages of sex traits that occur in humans. There is no reason why we have to continue using the words in instances when they are so deeply intertwined with gender, causing harm and confusion.  I\'m also genuinely surprised that you don\'t consider sex more complicated than that, since you are a trans person with a background in biology. What you\'re saying seems outdated to me. What exactly are you referring to when you say male or female? Someone\'s chromosomes, an immutable characteristic? The cell that someone contributes in reproduction, which has implications for those who are infertile? Someone\'s genitals or dominant hormone, in which case why not simply name the specific thing rather than saying male or female? The idea that these traits, all of which can be construed as making up someone\'s sex, can be packaged neatly together or are even determined for sure in every single person, seems old and not up to date with the current science. Any of us who hasn\'t had specific testing could be found to not have the full package of ""male"" or ""female"" traits. It\'s possible to find out you are intersex way, way late in life, and sex is legally determined in many jurisdictions by only a glance at genitals, when there are many other equally relevant sex characteristics. What counts as intersex is not objectively defined, it\'s a standard set by humans with cissexist prejudices, and that standard is constantly evolving. Why should I be called a gendered term that purports to refer to my sex, when that term is as best an assumption that was made about me decades ago, and that\'s the case for many, many people? If you mean something specific you can always name that trait specifically.  >I very firmly believe it's best not to intertwine the concepts of gender and sex  I\'m not the one intertwining them, I was born into a society of humans who intertwine them. I firmly believe it\'s best not to deny that these words are used to misgender and harm trans people even when they\'re referring to ""sex,"" and to claim authority to redefine them for the entire English-speaking population is only enabling that harm."
eRisk2023-T3_Subject17, b' ' , b'2022-06-09 02:14:36' , reddit post ,">I just strongly disagree with saying male and female are genders, as it's not accurate and I think it's harmful to blur that line.  >male and man do mean completely different things.  I say this as a nonbinary who has a degree in linguistics. It simply is not true that these words are completely separate from each other and never mean the same thing. Just because there are two separate concepts doesn\'t change the fact that the concepts overlap in these pairs of words.  Nobody has a natural authority to control how words are used, including you or I, but by looking at various instances of these words we can see that English speakers do not use the words this way. Merriam-Webster, Cambridge, and Macmillan dictionaries all use the words male and man circularly to define each other. A male is generally defined as a man and a man is generally defined as a male, among other uses. There are explicit references to male being a gender identity. If you look at Wikipedia, you can see the same thing... a man is described as a male and the page for male even has the sentence, ""In humans, the word male can also be used to refer to gender.""   It may not be easy or clean or convenient, but English speakers know that these words mean each other. There is no line being blurred, there\'s a line that people are trying to put up, unsuccessfully, because historically both these words have been used to describe the same thing and it\'s extremely difficult to purposely change a language all at once in all of its speakers. There is always an implication of the other concept. When someone on the street misgenders me it\'s because they have guessed at my genitals, when a doctor sees my biological sex they no longer have doubt about what gender I am, because to them it\'s the same thing. That\'s why I would never allow someone to call me male or female, because I am neither of those -- for someone to insist that I really am one of those genders/sexes would be oppressive, would be purposeful misgendering in the barest sense, using a gendered word to describe someone it does not apply to."
eRisk2023-T3_Subject17, b' ' , b'2022-06-08 22:02:48' , reddit post ,">It's best to divorce terms referring to sex and gender for that reason.  A lot of people do identify with male or female as gender terms, including trans people, and a lot of people feel misgendered by having male or female used to describe their sex, because they are also used as gender terms. I think the solution to the issue won't be as simple as saying male/man and female/woman mean completely different things."
eRisk2023-T3_Subject17, b' ' , b'2022-06-06 16:55:30' , reddit post ,When another nonbinary sees me as a woman or a man: haha what the fuck
eRisk2023-T3_Subject17, b' ' , b'2022-06-04 16:02:11' , reddit post ,"I found this:  ""Phosphorus deficiency  You\'ve got this if the leaf veins are purple and overall sport a purplish tint. ""Recognizing Tomato Problems - Colorado State University"". Most likely if there are no insects around, it\'s early in the season and you\'re bathing the plant in cool temperatures or the soil itself is too wet. The bedding may also be passing its own phosphorous deficiency to the plant. This can usually be fixed by putting the plant in a warmer area and letting that soil dry out a bit. If you want to give it a boost, throw some bone meal around for that extra kick and help with the phosphorous."""
eRisk2023-T3_Subject17, b' ' , b'2022-06-01 03:43:05' , reddit post ,"Being nonbinary feels that way to me! I'm so glad I don't have to be a man or a woman, and if I did, it would just feel like faking it. So it looks like you've found your true identity."
eRisk2023-T3_Subject17, b' ' , b'2022-05-31 19:35:52' , reddit post ,My partner getting a slightly different shaped set of the same genitals lmao
eRisk2023-T3_Subject17, b' ' , b'2022-05-31 00:38:13' , reddit post ,"NBLM, Achillean, masc4masc, queer, androsexual, masc-attracted?  My personal sexuality is omnigay / pansexual / omnisexual but I was thinking that wouldn't be useful info"
eRisk2023-T3_Subject17, b' ' , b'2022-05-30 14:57:45' , reddit post ,"I'm not in couples therapy and did not do your previous studies, to my knowledge."
eRisk2023-T3_Subject17, b' ' , b'2022-05-30 12:24:44' , reddit post ,"I'm 20+ years old and in a relationship, but it looks like there are some hidden criteria as I was told I'm not eligible."
eRisk2023-T3_Subject17, b' ' , b'2022-05-29 14:41:31' , reddit post ,"Attractive, hot, easy on the eyes, captivating, gorgeous, statuesque, stunning?"
eRisk2023-T3_Subject17, b' ' , b'2022-05-28 17:44:11' , reddit post ,"I don\'t really feel ""loved."" I would feel weird having an emotion just because other people have emotions for me. Especially as an aromantic person in the context of romantic relationships, it really wouldn\'t mean anything to me if someone were to ""love"" me and that, to them, referred to a romantic feeling.  Do I think that the people around me have the appropriate emotions or attitudes to respect me and help meet my needs, though? Yea, for the most part."
eRisk2023-T3_Subject17, b' ' , b'2022-05-27 03:13:56' , reddit post ,They look good! What's inside as stuffing?
eRisk2023-T3_Subject17, b' ' , b'2022-05-25 22:52:04' , reddit post ,"Dry socket prevention is more about leaving the wound alone to heal. Your body knows what to do after your teeth are removed, so just follow the dentist instructions and try not to bother it too much.  Also, my partner had a sinus communication during surgery (common complication where there is a hole between the mouth and sinus) which can make it take longer to get back to normal, but didn't require any special care."
eRisk2023-T3_Subject17, b' ' , b'2022-05-24 23:22:07' , reddit post ,"Yeah, I was gonna say confederate but I chickened out cuz I was so sure I was wrong. Right era tho."
eRisk2023-T3_Subject17, b' ' , b'2022-05-24 00:56:44' , reddit post ,"That's a shame. I hope they don't let their prejudices get in the way of seeing the real you, I'm rooting for this to turn out well"
eRisk2023-T3_Subject17, b' ' , b'2022-05-20 18:20:45' , reddit post ,"Are you looking for people with these specific identities or just this experience? I have ancestry from 2 races and I'm attracted to multiple genders, but I've never used the terms biracial or bisexual in particular."
eRisk2023-T3_Subject17, b' ' , b'2022-05-19 21:28:14' , reddit post ,"I actually don't really get why your partner had responded that way after receiving aunt's advice, I thought aunt's message was well thought out. Some of the stuff she said reminded me of when I have to overlook racism or ableism I experience in the world in order to get along or reach success. I wouldn't tell others that they must do so, but I also wouldn't lie and say that I fight back every time.  Could we flip it a bit and get some insight on why your partner wrote their second response in that way?"
eRisk2023-T3_Subject17, b' ' , b'2022-05-18 17:01:44' , reddit post ,"As much as I love the letters N and B together on literally anything, there\'s been some controversy with this company and a certain anti-lgbtq former US president... ""Owner and Chairman Davis donated almost $400,000... in September 2016."" From the wikipedia"
eRisk2023-T3_Subject17, b' ' , b'2022-05-18 13:00:46' , reddit post ,"How does one judge whether someone is allowed to say a slur? There\'s not exactly a council that votes on it.  I consider a couple criteria when I\'m deciding whether it\'s appropriate for someone to use a slur.  1) Are they describing themselves or others? 2) Are they using it due to an honest identification with it? 3) Is there something they stand to gain or lose by using the term? Are they using it to get leverage or a position over others? 4) Is it my place, personally, to correct them on it? Is there knowledge that they have about the term or social situation that I might not have?  I think that ""allowed"" is the wrong angle to look at it. I try not to police others\' speech while validating that it\'s ok to have a reaction to it."
eRisk2023-T3_Subject17, b' ' , b'2022-05-18 06:21:48' , reddit post ,My parents taught me wrong
eRisk2023-T3_Subject17, b' ' , b'2022-05-18 06:07:40' , reddit post ,"Nobody really understands my gender, even after I've explained to them. I'd rather they get it wrong on purpose by choosing not to ask or care about my real gender, than get it wrong on accident when they show due consideration but still don't even know they're fucking it up.  Knowing that they've given an honest try and still can't get it makes me feel like there's something wrong with me even when I know there isn't."
eRisk2023-T3_Subject17, b' ' , b'2022-05-18 06:03:01' , reddit post ,[Omnistraight?](https://www.lgbtqia.wiki/wiki/Omnistraight)
eRisk2023-T3_Subject17, b' ' , b'2022-05-16 04:11:22' , reddit post ,Gender only male and female.
eRisk2023-T3_Subject17, b' ' , b'2022-05-15 06:35:33' , reddit post ,"It makes it clear for people who aren\'t familiar with the word that they are talking about gender, as opposed to any of the other characteristics of a person.  Linguistically it is a bit weird, I guess it\'s using the reverse pattern with noun first then adjective. But there\'s also ambiguity if they use the phrase ""a nonbinary gender,"" so whatever. It\'s a words thing."
eRisk2023-T3_Subject17, b' ' , b'2022-05-14 17:26:01' , reddit post ,"You did what you had to do to survive -- you didn't owe them an opportunity to discriminate against you.  From the other side, I saw one of my exes come out a few years after we dated. I just figured it took them time to figure out their identity and they waited for a good time to share that with others. People won't jump to blaming you for lying to them about your gender unless they're not good people in the first place."
eRisk2023-T3_Subject17, b' ' , b'2022-05-14 14:18:44' , reddit post ,What food is best for my cat?
eRisk2023-T3_Subject17, b' ' , b'2022-05-14 14:17:20' , reddit post ,"Right click on the friend, then click 'obtain' from the drop-down menu that appears"
eRisk2023-T3_Subject17, b' ' , b'2022-05-14 14:10:59' , reddit post ,You can be whatever you want to be. I'm happy for you understanding your identity better now :)
eRisk2023-T3_Subject17, b' ' , b'2022-05-14 12:14:08' , reddit post ,I'm not comfortable discussing this with you. I only commented to explain the comic.
eRisk2023-T3_Subject17, b' ' , b'2022-05-14 12:10:37' , reddit post ,"Well, it's not on me to decide what others identify as."
eRisk2023-T3_Subject17, b' ' , b'2022-05-14 03:35:13' , reddit post ,"Someone who identifies with the phrase ""trans man"" but not ""man"" by itself. Seems like they were told that trans man can\'t be a separate identity from man, causing them to question their gender"
eRisk2023-T3_Subject17, b' ' , b'2022-05-13 10:11:23' , reddit post ,"You may have problems with selection bias since you don't have any questions that control for people who are previously educated on bpd, have bpd, or know others with bpd."
eRisk2023-T3_Subject17, b' ' , b'2022-05-11 01:12:37' , reddit post ,"I assume that the point of the survey is not whether you'd be happier with 52k than 40k, but how your happiness changes when you're on the high or low end of payment for your company.  12k might not be a meaningful difference to you, but plenty of people would find it a meaningful difference between equally proficient people doing the same work at the same company, and there might be differences in how people interpret that at different real world incomes."
eRisk2023-T3_Subject17, b' ' , b'2022-05-10 05:49:20' , reddit post ,"We love you, we're here with you."
eRisk2023-T3_Subject17, b' ' , b'2022-05-10 02:29:46' , reddit post ,"""This will be a series of short questions about your personal experience as a person of mixed ethnicity, and your views on mixed Asian culture.""  Looks like it\'s for mixed Asians, specifically."
eRisk2023-T3_Subject17, b' ' , b'2022-05-08 06:18:46' , reddit post ,"Are there enough repeat survey posters on the sub that it would make a difference in the landscape of surveys posted? Are the people who gloss over sub guidelines the same people who would access this resource and learn and grow from it?  I'd still love for this resource to be made and I'd watch / read / idk how Talk works. I get the feeling that the majority of participants on the sub are survey takers though, that would just be more educated about while the experience of taking surveys on the sub doesn't change much."
eRisk2023-T3_Subject17, b' ' , b'2022-05-08 05:53:06' , reddit post ,Those people aren't right about you just because they happen to be close to you. I'm glad you reached out today and I hope you keep on having the courage to seek other opinions
eRisk2023-T3_Subject17, b' ' , b'2022-05-08 05:46:10' , reddit post ,"I wear a swim t shirt and board shorts to the beach, with a speedo underneath to get in the water. I feel like a get a kind of gender neutral surfer vibe out of it. The t shirt I have has sun protection, so if anyone bothered me about it -- which they don't and would be weird to do at a public beach -- I can say it's to save on sunscreen or whatever.  >most trunks tend to be too long  Any luck looking for trunks specifically with a short inseam? Probably expensive specialty stores but just checking. Also maybe you can get a regular pair shortened by a tailor or a friend with a sewing machine, or do kind of a diy project on it.  Never been to a hot spring, but if it's the beach also you can swim in whatever you feel like, I don't think anyone will arrest you for getting in the water with shorts that aren't made for swimming. Your comfort is important."
eRisk2023-T3_Subject17, b' ' , b'2022-05-06 16:34:48' , reddit post ,"The common phrase I see is ""you can\'t pick and choose the effects of hormones."" I definitely wouldn\'t recommend going on T if you don\'t want the general effects.  So, as for how to validate your identity in regards to crying, some questions to hopefully illuminate some options. Is there any way you can reconceptualize crying, is it inherently feminine / non manly, or can it be masculine to be secure in your gender while crying? Can you train yourself to cry in a different manner, can you do a ""manly cry"" or ""single man tear""? Can you change how you look at your emotions, would seeing emotions as secondary to ""what needs to be done"" help you focus on action in the moment? Can you change how and when you express emotions -- many men have the idea of emotional privacy, having agency in expressing their emotions only when alone. What situations cause you to cry, can you desensitize yourself to them so they stop causing a strong reaction?"
eRisk2023-T3_Subject17, b' ' , b'2022-05-04 04:26:58' , reddit post ,I came to say a very similar thing. I'm glad to know there's others who see it that way.
eRisk2023-T3_Subject17, b' ' , b'2022-05-03 23:20:18' , reddit post ,">Other: A small percentage  9%, in fact!"
eRisk2023-T3_Subject17, b' ' , b'2022-05-01 23:49:44' , reddit post ,It's ok to not have a fairy tale experience with a name. No utterance could possibly encapsulate all that describes a human being. A nonbinary person by any other name would still be themselves
eRisk2023-T3_Subject17, b' ' , b'2022-05-01 00:23:54' , reddit post ,"Don't take this the wrong way, but uh, you look 19  "
eRisk2023-T3_Subject17, b' ' , b'2022-04-29 03:05:33' , reddit post ,"Am I being dramatic? Is this a normal response for a partner to have?  It doesn't seem like you're being dramatic, and it's weird that this was his response to you. Personally I think my partners should be a bit dramatic about their needs and how we can fulfill them together. If the conversation was too much for me I would try to communicate that differently, without putting a label on them.  This isn't normal, in the sense that it's not good and happy and loving, but unfortunately it is normal, in the sense that it's common and often to be expected, even partners that are accepting are a little terrible in the beginning. I think cis dudes especially have a misunderstanding about the work that's required to have a mutually beneficial relationship -- historically it was only the job of women to compromise and accommodate and look after the happiness of both partners which usually meant only cis dudes were happy.  There's still time for him to learn and grow, but in the meantime, try not to take his opinion about gender too personally, and also try to look at your relationship objectively for its good and bad parts, and think about what you're willing and not willing to put up with. I'm rooting for you [heart emoticon]"
