ID,WRITING.TITLE,WRITING.DATE,WRITING.INFO,WRITING.TEXT.Element:Text
eRisk2023-T3_Subject46, b' ' , b'2021-03-17 01:11:57' , reddit post ,Most times if it's too bright for me (so every time I go somewhere during the day) I have to bring sunglasses or it really starts to hurt my eyes. The last 2 times I've taken out the trash I didn't bring glass cause it takes like 30 seconds but my eyes start watering. Usually I can look at the ground when that happens but sometimes even the ground is too bright to look at
eRisk2023-T3_Subject46, b' ' , b'2021-03-16 19:01:37' , reddit post ,This is ultimately why I kept my mouth shut and just nervous chuckled lol
eRisk2023-T3_Subject46, b' ' , b'2021-03-16 18:57:53' , reddit post ,"Some lady at my apartment complex who always seems to be doing laundry came in while I was using the room, and as we were both waiting asked me how I was so skinny and going on about how weight was like back in her day (?) And in my head I'm just like... should I tell her I have an eating disorder? It's so annoying. My mom gets this comment a lot too because she's I'll and can't physically gain weight."
eRisk2023-T3_Subject46, b' ' , b'2021-03-16 18:51:49' , reddit post ,"How does fibromyalgia affect your life? I was friends with someone in high school who started having very severe joint and nerve pain and doing basically anything became very painful for him, they ended up diagnosing him with fibromyalgia. What exactly is it?"
eRisk2023-T3_Subject46, b' ' , b'2021-03-16 07:42:29' , reddit post ,Do you have an opinion about the stigma around type B personality disorders like ASPD?
eRisk2023-T3_Subject46, b' ' , b'2021-03-15 09:00:46' , reddit post ,"Why did I start dissociating more recently, years after anything related to my PTSD has happened to me?"
eRisk2023-T3_Subject46, b' ' , b'2021-03-14 21:46:13' , reddit post ,That's exactly what I said! I think some people choose health care because they know a lot of patients won't fight back against abuse
eRisk2023-T3_Subject46, b' ' , b'2021-03-14 21:35:03' , reddit post ,"I got stung by a bee on my neck when I was 10 and I have a big fear of bees so I just sorta panicked and started crying while running into the street. In my mind I just needed to get away from it and that was pretty much the only way so I just acted. Luckily, there wasn't any traffic on this usually busy road, and my dad was out walking with me and was able to chase after me and bring me back to the sidewalk."
eRisk2023-T3_Subject46, b' ' , b'2021-03-14 21:31:58' , reddit post ,"I'm so glad it's not mandatory; the way people treat it, I'm not surprised you'd expect that. It's wayyy too overrated in my opinion, but I get that it's like a traditional thing I guess"
eRisk2023-T3_Subject46, b' ' , b'2021-03-14 21:28:55' , reddit post ,"My mom is chronically ill and has needed a lot of care. You would not believe how some of the nurses treat patients. They would gaslight her, try and give her the wrong dose of medication when she knew how it would mess with her, they would get mad when she tried to advocate for herself, one nurse wouldn't bathe my mom and scolded her for crying, another one injected something into her muscle instead of her vein causing her upper arm around her bicep to turn black, etc."
eRisk2023-T3_Subject46, b' ' , b'2021-03-14 20:31:37' , reddit post ,"I was learning to ride a bike around like 6 years old in a parking lot with my dad and I panicked as I was riding towards one of those concrete parking trapezoids and just froze, didn't turn and ran into it and fell off my bike lol. Starting screaming and the only other dude in the parking lot was just looking at me the whole time. Thought I would throw up because it hurt so much but I don't actually remember the pain. My mom didn't think I was that hurt so she didn't take me to the doctors until the next day and they said I broke my arm"
eRisk2023-T3_Subject46, b' ' , b'2021-03-14 20:29:32' , reddit post ,What made you wear your cut glove on the other hand?
eRisk2023-T3_Subject46, b' ' , b'2021-03-14 20:25:28' , reddit post ,Try not to obsess over a diagnosis and always move towards overcoming your problems instead of avoiding them
eRisk2023-T3_Subject46, b' ' , b'2021-03-14 20:22:46' , reddit post ,Stimming?
eRisk2023-T3_Subject46, b' ' , b'2021-03-14 19:35:56' , reddit post ,When I came out my dad basically told me he was going to ignore it and he wouldn't ever respect my name or pronouns. That was really hard to hear because he made this big nerve racking moment for me feel like a waste.
eRisk2023-T3_Subject46, b' ' , b'2021-03-14 13:00:59' , reddit post ,"House on Haunted Hill, the black and white version"
eRisk2023-T3_Subject46, b' ' , b'2021-03-14 12:58:27' , reddit post ,Porn
eRisk2023-T3_Subject46, b' ' , b'2021-03-14 12:57:11' , reddit post ,"I used to work with someone who said his cousin was the drummer for maroon 5. Apparently he said Adam Levine was a dick, which I guess doesn't really surprise me"
eRisk2023-T3_Subject46, b' ' , b'2021-03-14 12:53:30' , reddit post ,"To my knowledge, it's the ability to read exceptionally well at a very young age, accompanied with a fascination with letters or numbers but you they don't necessarily understand what they're reading. I also read that social skills don't match up and people can exhibit 'autistic-like' behaviors that fade away over time. Although you can be autistic and hyperlexic."
eRisk2023-T3_Subject46, b' ' , b'2021-03-14 12:38:01' , reddit post ,I've had dreams where I feel pain when something happens. One time I dreamt someone broke my ribs and I woke up with lasting sensations from it. Another time I had a dream where I died and woke up in a different reality and that was really weird feeling.
eRisk2023-T3_Subject46, b' ' , b'2021-03-14 10:32:36' , reddit post ,"Dude with the things being too disturbing, that sucks too because after a while of being on social media I get so anxious cause I feel like sometimes I don't know who to believe on what topics and there's just too much shit going on in the world"
eRisk2023-T3_Subject46, b' ' , b'2021-03-14 10:19:53' , reddit post ,Stuff they show me like a YouTube video or a song
eRisk2023-T3_Subject46, b'DAE get bothered/overwhelmed by how empathetic they are?' , b'2021-03-14 10:17:28' , reddit post ,"I've always been naturally empathetic and compassionate and not until I was around 19 did I really start to be able to turn that off. I still can't control my emotions a lot but I've gotten a good enough handle on my empathy where I can tune into it if I want to or ignore it (usually).   I still like to feel things deeply like that sometimes, so whenever I decide I want to be in that hyperfocused empathy mindset, I'll watch a movie by myself or listen to music by myself so im not thinking about being normal. Listening to just music will make me cry sometimes and pair that with good acting, it's even more.   But even then when I let myself feel everything I always by the end of it feel so sad that it's over that I almost regret seeking it out in the first place. Like as I drag myself back into who I am I just feel so depressed until I get used to it again. Or if I listen to music I'll get sad that I can't sing cause I live with people and feel weird singing when others can hear me. It also sucks too because if someone's showing me something, I can't fully invest myself into it so sometimes I just come off like I hate it."
eRisk2023-T3_Subject46, b' ' , b'2021-03-14 10:08:49' , reddit post ,"Not my first experience but still when I was new to it. I had the feeling like it was starting so I went to put something on and found out I already bled through my tan pants so I kinda just gave up on that day and told the nurse I had to go home and she was nice so that was cool.   But after that, like even in the same hour of that happening, one of my classmates started like harassing me, every time he saw me would ask if I loved him, would tell me he loved me, or when are we going to date? And would not leave me alone whenever he started talking to me; even started creepily grabbing at my leg with his feet from across the table. Hope he's having a stupid day."
eRisk2023-T3_Subject46, b' ' , b'2021-03-14 09:56:26' , reddit post ,It's not a false portrayal so much as an overused cliche as representation. They tend to only show one type of personality or only white/able-bodied/young/etc. people as being gay or trans or whatever
eRisk2023-T3_Subject46, b' ' , b'2021-03-14 09:50:24' , reddit post ,Super Bad Cum
eRisk2023-T3_Subject46, b' ' , b'2021-03-14 00:58:55' , reddit post ,Sorry I forgot what I said and thought I put 'light skinned' in my comment but I was never trying to insinuate that people who are only white can be POC. I meant that light skinned POC exist outside the stereotype of having dark skin to be POC
eRisk2023-T3_Subject46, b' ' , b'2021-03-14 00:56:09' , reddit post ,I said lightskinned not white. You can be a light skinned Mexican or black person
eRisk2023-T3_Subject46, b' ' , b'2021-03-14 00:12:28' , reddit post ,"Stereotypes are real. It only becomes an issue when you generalize everyone to that exact stereotype. For example, it's a stereotype for POC to have darker skin than white people, but not all of them do."
eRisk2023-T3_Subject46, b' ' , b'2021-03-13 23:46:16' , reddit post ,Well that's good to hear that it's usually not a hassle. When did you guys become aware that you were all part of a system?
eRisk2023-T3_Subject46, b' ' , b'2021-03-13 23:35:20' , reddit post ,How does switching work within your system? I know some don't switch hardly at all while others have a problem with rapid switching.
eRisk2023-T3_Subject46, b' ' , b'2021-03-13 22:15:20' , reddit post ,Yeah he's a dumbass in every sense so it wasn't as surprising as it could have been to hear that but it's shocking sometimes how people can be so stupid
eRisk2023-T3_Subject46, b' ' , b'2021-03-13 20:26:56' , reddit post ,"Yeah, the other person just wanted to let others know that it isn't just a matter of being annoyed for the people who think that. I'm sure we all know that people can be dicks. They weren't trying to address how to deal with it, they were trying to call out to the people who would do that type of thing."
eRisk2023-T3_Subject46, b' ' , b'2021-03-13 20:14:37' , reddit post ,Jorts?
eRisk2023-T3_Subject46, b' ' , b'2021-03-13 20:03:55' , reddit post ,What about if it's your neighbors? Or someone at your job? I know a lot of people who live in college dorm rooms have issues with their neighbors playing loud music or being too loud when they're trying to sleep or study
eRisk2023-T3_Subject46, b' ' , b'2021-03-13 20:02:32' , reddit post ,"That \'autistic\' isn\'t synonymous with stupid or worthless. A lot of times if you tell someone you\'re autistic, there\'s a tone shift in the conversation where they either start stigmatizing you, romanticizing you, or infantolizing you.   However, if you just tell someone ""I have some sound sensitivities"" or ""I\'m a pretty anxious person"" they tend to be more understanding. Don\'t just assume autistic people are incapable or all the same as each other."
eRisk2023-T3_Subject46, b' ' , b'2021-03-13 19:57:33' , reddit post ,"My friend had been assaulted and when she told her parents they didn\'t believe her. She asked her step dad if he\'d believe his biological daughter (who\'s a lesbian) and that\'s when he said, ""Lesbians can\'t get r*ped because they\'re into women, not men,"" and proceeded to still not believe her"
eRisk2023-T3_Subject46, b' ' , b'2021-03-13 19:51:03' , reddit post ,Honestly a lot of parents get diagnosed when their kid does. I'm in the process of getting a diagnosis and my brother already had one years ago but because I'm looking into it he started thinking 'hmm both of my kids have this and I relate a lot to it as well' but just like you said adults are better at coping than kids and often go overlooked. I think it would be wise to ask for an assessment
eRisk2023-T3_Subject46, b' ' , b'2021-03-13 19:47:36' , reddit post ,"It's always annoying to have to go to what's seemingly a half added doctor who's just going through the motions and repeating back what you say to them. I just recently got a new one for myself and it makes a big difference when you can have someone who actually clicks with you, I wish you the best!"
eRisk2023-T3_Subject46, b' ' , b'2021-03-13 19:41:56' , reddit post ,"I've had this problem before too, I think y ou should tell them that you'd prefer advice on how to cope with/stop the paranoid thoughts instead of validation and vague statements"
eRisk2023-T3_Subject46, b' ' , b'2021-03-13 19:36:06' , reddit post ,"My friend told me his friend was talking about how she's down for a threesome and he asked if she'd be down to do it with him and one of her friends. They both said yes and then later on, one of the girls other friends asked to join as well, so he had a foursome scheduled"
eRisk2023-T3_Subject46, b' ' , b'2021-03-13 05:20:30' , reddit post ,Harry potter and the prisoner of Azkaban lol
eRisk2023-T3_Subject46, b' ' , b'2021-03-13 05:18:50' , reddit post ,Most of them didn't really care cause I was pretty good at academics. My mom also just knew I was a little 'quirky' and would preemptively tell my teachers about some stuff that could help me do better in class
eRisk2023-T3_Subject46, b' ' , b'2021-03-13 00:13:56' , reddit post ,I feel like it would be the eyelashes people put on the lights
eRisk2023-T3_Subject46, b' ' , b'2021-03-12 20:18:58' , reddit post ,The poop chills
eRisk2023-T3_Subject46, b' ' , b'2021-03-12 18:52:21' , reddit post ,"Yeah it took me a little bit to unmask as well and it feels really weird just a heads up lol. At least for me, it felt like maybe I was faking or something but it's just cause I was so used to not being myself. I hope you get the answers you need, friend!"
eRisk2023-T3_Subject46, b' ' , b'2021-03-12 18:40:01' , reddit post ,"If you have a tendency to automatically mask in front of people, I would recommend going to the interview or assessment as authentically as possible and try to take off the mask. A lot of times that's easier said than done but it could make diagnosing you easier"
eRisk2023-T3_Subject46, b' ' , b'2021-03-12 18:32:06' , reddit post ,"No you aren't, it's a pretty common symptom but everyone is so embarrassed to talk about it that it gets stigmatized. I also used to have a huge fear of toilets when I was little which always made me feel super pathetic so I get where you're coming from, but just know a lot more people than you think probably deal with that 'hidden' symptom"
eRisk2023-T3_Subject46, b' ' , b'2021-03-12 18:26:36' , reddit post ,Lol yeah sometimes it's really annoying cause sometimes when that happens I'm like walking home or like away from the bathroom lol
eRisk2023-T3_Subject46, b' ' , b'2021-03-12 18:04:08' , reddit post ,"It's complex ptsd which just means that it's formed by multiple events or ongoing/longterm trauma instead of one event, and includes some extra symptoms such as chronic low self image and more dissociation.  It's super hard honestly. I haven't been working for the past year while I try and figure out everything going on with me. I'm lucky to have a very supportive partner who didn't mind that I needed time off."
eRisk2023-T3_Subject46, b' ' , b'2021-03-12 17:56:44' , reddit post ,Thats interesting; what was it like getting tested for autism and adhd?
eRisk2023-T3_Subject46, b' ' , b'2021-03-12 17:50:13' , reddit post ,"I would think it's pretty likely, but if possible I would seek out a therapist or doctor or even just public spaces for DID/OSDD systems. I know the rings system and alexandrite system have discord servers and there's some really good accounts related to DID/OSDD"
eRisk2023-T3_Subject46, b' ' , b'2021-03-12 17:36:14' , reddit post ,How is your psychosis different from your schizoaffective?
eRisk2023-T3_Subject46, b' ' , b'2021-03-12 17:28:54' , reddit post ,I was able to stay home from work or other things to work on my mental health and focus on therapy
eRisk2023-T3_Subject46, b' ' , b'2021-03-12 17:25:30' , reddit post ,"I mean having one mental illness increases your chances of having more, plus genetics can make you more likely to get certain mental disorders. Then factoring in trauma can definitely make you more susceptible. Some people just get the short end of the stick. But I'm sure there's also doctors who potentially overdiagnose"
eRisk2023-T3_Subject46, b' ' , b'2021-03-12 06:11:42' , reddit post ,Yeah I didn't know because I was raised Mormon and effectively sheltered away from LGBTQ+ topics
eRisk2023-T3_Subject46, b' ' , b'2021-03-12 02:32:05' , reddit post ,How were you diagnosed with both major depressive disorder and dysthymia?
eRisk2023-T3_Subject46, b' ' , b'2021-03-11 13:28:29' , reddit post ,"I'm on a waiting list for mine as well and I feel the same way, so ready for it to happen"
eRisk2023-T3_Subject46, b' ' , b'2021-03-11 13:06:39' , reddit post ,"Right, when I heard that I felt so on edge"
eRisk2023-T3_Subject46, b' ' , b'2021-03-11 12:03:02' , reddit post ,"I stim by rubbing my fingers together roughly if I'm stressed out in public or around people, but I'm also getting tested for autism and ADHD so I don't know if my response helps lol"
eRisk2023-T3_Subject46, b' ' , b'2021-03-11 11:59:48' , reddit post ,"I know how you feel as I have been there and it's the worst feeling in the world. For me I had to really just nail into my mind that they are an animal and literally can't help it- plus getting mad could make it worse. It took a while for me and the more I worked on other life things bothering me as well, the easier it was to control my anger towards my pet.   For me, if I felt myself about to get super angry, I'd walk over to my cat and instead of yelling or doing something that would ultimately scare or hurt him, I'd do something positive like pet him or just play with him for a second. After a while I trained myself to respond to his needs that annoyed me with calmness and positivity and it comes natural to me now. It did used to scare me when I'd fly off the handle and just not know how to handle it properly, so I hope this helps you too!"
eRisk2023-T3_Subject46, b' ' , b'2021-03-11 11:49:05' , reddit post ,Yessss I love air writing with my finger it feels good lol
eRisk2023-T3_Subject46, b' ' , b'2021-03-09 09:21:06' , reddit post ,"No you're not just being silly; it's a confusing and stressful situation to be in. If you feel comfortable enough and feel that you need someone else's take on it, I would recommend talking about it to someone you trust. Could be a therapist or a close friend, etc. But if you feel awkward about it or uncomfortable, self speculation can be great, too.   When I was first really beginning to question, something I did was just try out new pronouns or start letting myself identify with how I thought I was feeling, and see how it felt. And in my case, it turned out I was transgender"
eRisk2023-T3_Subject46, b' ' , b'2021-03-06 06:12:37' , reddit post ,Drake and Josh
eRisk2023-T3_Subject46, b' ' , b'2021-03-04 03:42:33' , reddit post ,What do you mean it jusy happens?
eRisk2023-T3_Subject46, b' ' , b'2021-03-04 03:38:23' , reddit post ,What is paraparesis?
eRisk2023-T3_Subject46, b' ' , b'2021-03-02 03:55:19' , reddit post ,Did your doctor run any tests? Being physically unable to eat is different than an eating disorder
eRisk2023-T3_Subject46, b' ' , b'2021-03-01 23:58:23' , reddit post ,Ugh I was friends with someone who would use OCD as an adjective like that. It bothers the hell out of me too
eRisk2023-T3_Subject46, b' ' , b'2021-03-01 23:51:03' , reddit post ,"Hate people who always think they need to give their opinion on something you do. If I ask for it, cool but like this? NTA, your 'friend' sucks and is not body positive at all"
eRisk2023-T3_Subject46, b' ' , b'2021-03-01 09:20:48' , reddit post ,I needed to hear this
eRisk2023-T3_Subject46, b' ' , b'2021-02-28 02:35:39' , reddit post ,"Has the culture difference I guess you would call it been weird? I was raised Mormon and when I left and kinda distanced myself from all of the practices, I felt sorta weird/out of touch being around my family and stuff sometimes haha."
eRisk2023-T3_Subject46, b' ' , b'2021-02-28 02:31:29' , reddit post ,Are you still in touch with your family/friends that are Mormon?
eRisk2023-T3_Subject46, b'Ironic telephone waiting music' , b'2021-02-27 23:03:47' , reddit post ,"I was on hold with the doctors for an unrelated reason, but the hold music suddenly stopped and there was an automated voice talking about ways to keep healthy. One of the things she said was something like ""keep track of your calorie intake"" and I was like ..really lol."
eRisk2023-T3_Subject46, b' ' , b'2021-02-27 22:12:32' , reddit post ,Heroes of Might and Magic III
eRisk2023-T3_Subject46, b' ' , b'2021-02-27 22:02:21' , reddit post ,"Brought up my traumatic relationship with an older guy when I was around 13 and he said, ""wow really? Don\'t you think that\'s a little weird?""  He also tried to dissuade me from self harming by saying, ""Oh you know when you do that too much, your arm will start to look all gross, like leather."" Thanks dude, I\'m all better now."
eRisk2023-T3_Subject46, b' ' , b'2021-02-26 15:08:24' , reddit post ,Ugh that sounds so annoying. It's amazing that people think gender is so inherently connected with sexuality. Not to mention the double standards about domestic abuse
eRisk2023-T3_Subject46, b' ' , b'2021-02-26 14:15:38' , reddit post ,"Yeah their videos are really just the bare minimum you need to know about something, very black and white, and often come off sounding stupid to me. I know in their eating disorder video, they listed 'wannarexia' as a legitimate eating disorder described as simply wanting to be anorexic. I was like... Okay sure that's how it works."
eRisk2023-T3_Subject46, b' ' , b'2021-02-26 14:09:18' , reddit post ,"I'm not sure I understand what you mean. I realized I was trans, so that's when I came out to everyone; I wasn't like already aware of it and just decided to tell his family about it. For a lot of people it's a huge part of their identity and affects a lot about who they are as a person so that's why people share it. I only don't share that I'm trans if I get the feeling people will behave negatively around me afterwards"
eRisk2023-T3_Subject46, b' ' , b'2021-02-26 13:58:24' , reddit post ,"After I came out, my boyfriend's sister frequently talked behind my back to the family and him about how I was stringing him along and 'forcing him to be gay.' I came out 6 months into our relationship and we've been together for 5 and a half years."
eRisk2023-T3_Subject46," b'People who have/had a romantic relationship with a trans person, what is the most ignorant thing someone has said to you about it?' ", b'2021-02-26 13:57:05' , reddit post ,
eRisk2023-T3_Subject46, b' ' , b'2021-02-25 04:32:51' , reddit post ,Oh they patronize you and stuff? That sucks :/
eRisk2023-T3_Subject46, b' ' , b'2021-02-25 04:03:50' , reddit post ,What's the most annoying reaction people give when you tell them your diagnosis?
eRisk2023-T3_Subject46, b' ' , b'2021-02-25 03:44:03' , reddit post ,"As someone with an eating disorder, I can say she's in the wrong here. She needs to learn how to desensitize herself from her trigger foods, not avoid them. NTA, eat whatever you want"
eRisk2023-T3_Subject46, b' ' , b'2021-02-24 19:43:04' , reddit post ,"Yes, I think that's quite common. Once your body gets used to a restrictive eating style it can then cause your body to switch to feeling satisfied or relieved when feeling hunger cues instead of feeling full."
eRisk2023-T3_Subject46, b' ' , b'2021-02-24 16:28:35' , reddit post ,Thanks for allowing people to educate themselves about this topic! I always like hearing about people's lives experience with things like this.
eRisk2023-T3_Subject46, b' ' , b'2021-02-24 15:30:39' , reddit post ,Don't answer if you aren't comfortable but what of your symptoms differentiated the diagnosis to bipolar 1 and not bipolar 2?
eRisk2023-T3_Subject46, b' ' , b'2021-02-24 15:26:37' , reddit post ,Schizoaffective is schizophrenia and a mood disorder together
eRisk2023-T3_Subject46, b' ' , b'2021-02-23 23:50:37' , reddit post ,"I think for me it was a combination of genetics and trauma (it didn't involve food, but I think I cope with the ED behaviors)"
eRisk2023-T3_Subject46, b' ' , b'2021-02-23 23:45:57' , reddit post ,"I won't call that stupid, I can relate to a lot of what you said. I think what I would tell myself in that situation is 'they probably don't remember anything about me if I've only been there two times over the course of five years'. Lack of motivation and drive is a big problem that so many people just label as laziness. I hope you're able to talk things out with your therapist!"
eRisk2023-T3_Subject46, b' ' , b'2021-02-23 12:37:06' , reddit post ,"I think it's because a lot of guys who use the word female to describe a girl are salty that she won't date them? And they usually tend to do and say shitty stuff to or about the girl cause of it. I don't really understand either, but that's my general knowledge. I guess I just haven't had as much experience with that as other people, but when I hear female I'm like you, I just hear like a descriptor."
