ID,WRITING.TITLE,WRITING.DATE,WRITING.INFO,WRITING.TEXT.Element:Text
eRisk2023-T3_Subject17, b' ' , b'2021-11-17 11:40:50' , reddit post ,"What does enjoying Thanksgiving mean to you? Does it mean doing specific actions for example, or being in the company of certain people, or would you be just as happy doing something not traditionally Thanksgiving that you otherwise enjoy? That\'s where I would start, by thinking about or even making a list of things that\'s either personally necessary for a good Thanksgiving, or not necessary but preferable.  Then if you know what symptoms you might be having that day, you can make a plan of coping strategies you can use ahead of time, or what activities you\'ll be doing instead if you think you can\'t continue.   Specifically, I tend to get overstimulated in places with a lot of people, so it really helps to have a spot you can go to be by yourself or with a trusted person, away from noise to collect yourself (I would consider this kind of mandatory). I have heard of people also having like a Holiday buddy, a specific person they can count on that knows about their issues, to do things like check in on them at specific times or make excuses to family when you need a break. For your example with making a specific dish, if that\'s still an issue today, can you make a new tradition with another dish? Or another activity like wearing a specific outfit?  And if it still doesn\'t go too well, I\'ll share this quote (though maybe you have seen it before): ""\xe2\x80\x9cCourage doesn\'t always roar. Sometimes courage is the little voice at the end of the day that says I\'ll try again tomorrow.\xe2\x80\x9d Mary Anne Radmacher"
eRisk2023-T3_Subject17, b' ' , b'2021-11-17 11:11:57' , reddit post ,I don't have much to say but I do want you to know someone is listening and cares. I'm proud of you for pursuing medical care again even though it's difficult.
eRisk2023-T3_Subject17, b' ' , b'2021-11-17 11:05:30' , reddit post ,"Do you like singing? Can you sing along to something on the stereo or listen to music that gets you feeling involved?  Driving time is particularly hard because it causes us to rely on a lot of muscle memory and subconscious knowledge, the consciously thinking brain is free to roam, but you also can\'t distract it too much because you have to pay attention to the road. Can you verbalize what you\'re doing on the road? I\'ll say stuff like ""green light, I\'m turning left""   Congratulations on learning to drive by the way! Feel free to tell me if this was useful or not"
eRisk2023-T3_Subject17, b' ' , b'2021-11-17 10:54:38' , reddit post ,">Does anyone else resonate with this?  Yes, very much. You're not alone.  >How do I deal with it?  One thing that has helped for me, changing the context of being naked. It used to be that having no clothes could only mean an assault was happening. Now the assault is over. I might take my clothes off (inside my own house) because I'm hot during the day. It might be because I've just washed the bedsheets and they feel really good on my skin. Or I'm gonna do laundry in the morning I swear but all my clothes are stinky right now   whatever the situation I want to re establish that wearing whatever amount of clothes I want to wear is just about my comfort.   Some people are more comfortable being clothed too! It was also a step in my journey to exercise my right to be clothed, even overly dressed when I want to be.  Good luck my friend, I believe in you."
eRisk2023-T3_Subject17, b' ' , b'2021-11-17 10:35:18' , reddit post ,Same on brushing teeth. It's gotten much better for me in the last couple years. You deserve healthcare that helps you care for your teeth my friend \xe2\x9d\xa4
eRisk2023-T3_Subject17, b' ' , b'2021-11-17 10:30:57' , reddit post ,"Right! ""Trigger"" doesn\'t mean something that is bad, it\'s a neutral word for something that triggers symptoms. Anything can be a trigger if it\'s associated with trauma for you, there\'s no more or less valid trigger. I love everyone and send them strength in dealing with theirs.  A somewhat well-known comic that discusses one ""ridiculous"" trigger (TW for sexual assault):  https://medium.com/the-nib/trigger-warning-breakfast-c6cdeec070e6"
eRisk2023-T3_Subject17, b' ' , b'2021-11-17 08:47:48' , reddit post ,"This survey is really not as inclusive as you think it is. Placing the onus on nonbinary people to exclude themselves from something that chooses to be cissexist, stating that inducing dysphoria is an acceptable risk -- it's painful."
eRisk2023-T3_Subject17, b' ' , b'2021-11-17 08:41:31' , reddit post ,"I don\'t think that I am that much different from people of the other political association. As a person I am particularly mercurial, strict, unforgiving, selfish, traits that are usually associated with the other side. In fact my mother and I disagree on many political issues, even though almost all the traits that I value in me came from her.  I think the folly is that ""not being different"" is inherently good or meaningful. There comes a time when it\'s time to put away our feelings of liking others, feelings of friendship or personal enjoyment, and do what\'s good for humans as a whole. I don\'t support abusers just because I find them funny. I don\'t support policies just because I can understand why somebody wants them.   Disagreement and conflict and difference is necessary."
eRisk2023-T3_Subject17, b' ' , b'2021-11-16 07:27:36' , reddit post ,"You miiiiight want to record things like sexual / romantic orientation. My answer to ""we could establish a romantic relationship"" doesn\'t reflect my opinion about the hypothetical person, it reflects my opinion about romance in general."
eRisk2023-T3_Subject17, b' ' , b'2021-11-15 05:22:59' , reddit post ,Gender only male and female. Need nonbinary option
eRisk2023-T3_Subject17, b' ' , b'2021-11-14 10:03:45' , reddit post ,"I read somewhere that for trauma to be survivable, it must be seen by the victim as predictable, controllable, and meaningful.  For the fruitcakes who say this, it ticks their meaningful box -- they use religion as the source of all meaning in the world. For the rest of us, it prevents us from having a basic sense of control over our experience, something that's especially hard when you're leaving a situation that involves external control."
eRisk2023-T3_Subject17, b' ' , b'2021-11-14 07:25:30' , reddit post ,This survey isn't about handedness.
eRisk2023-T3_Subject17, b' ' , b'2021-11-14 03:15:44' , reddit post ,Gender only male and female.
eRisk2023-T3_Subject17, b' ' , b'2021-11-13 09:57:56' , reddit post ,It's not a zero sum game. Both groups need to be recognized.
eRisk2023-T3_Subject17, b' ' , b'2021-11-10 02:25:08' , reddit post ,"What's the point of using scales that marginalize bisexual and other multigender attracted people, on a survey about sexuality?"
eRisk2023-T3_Subject17, b' ' , b'2021-11-08 13:59:33' , reddit post ,That makes it a lot more obvious lol. Thanks for answering
eRisk2023-T3_Subject17, b' ' , b'2021-11-08 13:47:17' , reddit post ,Assuming you meant actual genetic chimerism... is there some way you know for sure you aren't a chimera? Congrats on your different hair colors.
eRisk2023-T3_Subject17, b' ' , b'2021-11-05 00:31:13' , reddit post ,"""We are researchers affiliated with Syracuse University who are interested in better understanding sexual minority ***women's*** mental health. We are recruiting folks who identify with diverse sexual identities (e.g., queer, same gender-loving) and ***gender identities (e.g., trans, nonbinary).***""  Unclear, are you looking for women only or nonbinary people and trans men as well? Or any adult from the US as the title says?"
eRisk2023-T3_Subject17, b' ' , b'2021-11-04 02:10:42' , reddit post ,"Not sure what the reasoning is, but since I don\'t trust people in general, isn\'t the response I gave for ""it\'s best not to trust women"" useless?"
eRisk2023-T3_Subject17, b' ' , b'2021-11-03 15:25:17' , reddit post ,"Not just you. I definitely feel an opportunity was missed by not allowing survey takers to write in music genres. Of course I can sort my tastes into these broader categories, but I feel very differently about my connection to emo music, for example, than rock or punk, the genres I selected."
eRisk2023-T3_Subject17, b' ' , b'2021-11-03 10:52:43' , reddit post ,"Still unsure, I'll rephrase it. Are mixed people who are the specified races allowed to take the survey, or do you want people ONLY latinx and ONLY white?  I am a mixed person who is both Asian and white, and my partner is hispanic."
eRisk2023-T3_Subject17, b' ' , b'2021-11-03 02:37:17' , reddit post ,Did you mean to leave a link?
eRisk2023-T3_Subject17, b' ' , b'2021-11-03 02:36:43' , reddit post ,It says I need permission to view
eRisk2023-T3_Subject17, b' ' , b'2021-11-03 02:27:31' , reddit post ,"Are you looking for mono racial people, or are people who are latinx as well as another race / white as well as another race included?  I did preview the survey though, and I wasn't sure how to approach the first set of questions that references a conversation. Is it referring to some specific conversation, or speaking with your partnerx or speaking to others in general maybe?"
eRisk2023-T3_Subject17, b' ' , b'2021-11-03 02:22:59' , reddit post ,You're gonna get a lot of people saying no because they were never taught about Moses at all.
eRisk2023-T3_Subject17, b' ' , b'2021-11-02 22:43:32' , reddit post ,It says I need permission to view
eRisk2023-T3_Subject17, b' ' , b'2021-11-02 22:06:18' , reddit post ,Think you forgot the link
eRisk2023-T3_Subject17, b' ' , b'2021-11-02 09:52:23' , reddit post ,I'm just surprised how honest you are about that. I'll help you out.
eRisk2023-T3_Subject17, b' ' , b'2021-11-01 15:59:01' , reddit post ,"Location of the survey taker might be something to take into account. I live in a very different climate than Tennessee, and it\'s hard not to make connections such as ""this plant does well in tennessee, meaning it can\'t survive where I live..."" and ""this plant doesn\'t look like the ones that grow native here"" when rating whether I would grow it personally."
eRisk2023-T3_Subject17, b' ' , b'2021-10-22 18:03:22' , reddit post ,"Being totally honest: as a louder queer / nonbinary person, I have had plenty of people question or change their identity after becoming friends with or dating me, and I absolutely hate, hate, hate it. But that's a me problem, it's never the fault of the person who is only exploring their identity as anyone does.  Most people question their identity in this situation because that's the normal thing to do when you encounter a new social situation to navigate, and new information to navigate it with. Maybe you never seriously considered a different gender identity because there wasn't space or time to. Now that you have a date mate who's raised the topic, who's open to or even welcoming of you not being cisgender, it makes tons of sense to explore new possibilities. Don't let preemptions of your friends' judgements ruin that for you.  >I've never met or heard of anyone who just dropped their gender because other members' behavior made them uncomfortable. Like I feel like just finding some mens' behavior off-putting is a flimsy excuse.  I find that most gendered behaviours by other people make me uncomfortable. It's not really that far out that someone connecting such an evil act with an identity that you hold would cause you to question it. As you continue to understand yourself, you can figure out if you totally agree with that assertion and whether your identity even has anything to do with that at all. You don't really need an excuse to explore your identity, if something caused you to think about gender differently, it just did, that's neither good nor bad.  All in all, totally normal and valid reaction. Gender is an inherently social experience, one that I think necessarily takes time and interactions with others to figure out. Take care of yourself and good luck with your bugs."
eRisk2023-T3_Subject17, b' ' , b'2021-10-22 16:52:20' , reddit post ,Worked for me -- I'm on android for reference
eRisk2023-T3_Subject17, b' ' , b'2021-10-22 16:49:04' , reddit post ,"OP, you can just identify as nonbinary if you want to!"
eRisk2023-T3_Subject17, b' ' , b'2021-10-22 16:48:44' , reddit post ,">I've always thought that if I was trans or non-binary, that there would have been more signs or I would've realized by now.  Gender norms have changed a lot in a short amount of time, within our lifetimes. Maybe with how you are now vs the current gender environment you're in, it makes sense to identify as nonbinary, whereas it wouldn't have made sense for you when you were younger. Gender is an inherently social experience, you and your social environment have both matured with age.  Some people also feel like their gender has in fact changed over their life. I sure feel like I was actually my assigned gender when I was a preteen, and that changed in my early teens!"
eRisk2023-T3_Subject17, b' ' , b'2021-10-22 14:38:29' , reddit post ,"After doing the task in the app, the survey is over right? I don't have to do something to connect the data or anything like that?"
eRisk2023-T3_Subject17, b' ' , b'2021-10-22 13:19:49' , reddit post ,"Gender only male and female. If you want to capture all of this generation, put a nonbinary option."
eRisk2023-T3_Subject17, b' ' , b'2021-10-21 06:43:26' , reddit post ,Are... are pop and punk similar enough genres to be listed together?
eRisk2023-T3_Subject17, b' ' , b'2021-10-20 22:01:03' , reddit post ,"Well, I do consider my relationships gay! But I think that\'s a different question from whether it\'s straight or gay presenting, like I think the problem is with ""presenting"" as a concept. You\'d have to get so excessively specific to replace it. So I only marked the poly option    I\'m more of the ""third gender"" kind of nonbinary, neither male nor female, so having a separate option can sometimes be totally validating and wanted, but you\'re right that people\'s opinions differ. Thanks for the care you put into it!"
eRisk2023-T3_Subject17, b' ' , b'2021-10-20 21:19:55' , reddit post ,"Hi! Good survey, I\'m so happy to see someone looking into multisexuality as a whole, without prioritizing one label or the other :) I love this community and organizing with ppl like me under the multisexual label gives me pure queer joy.  Just a couple notes --  On the question about split attraction, that asks whether your romantic orientation is different from your sexual orientation, while it\'s true for me as an aromantic pansexual that I\'m attracted to ""different"" groups of people romantically and sexually, I personally consider my attraction a package deal. When someone attracts my sexual attention they also attract my lack of romantic attention, to put it another way, these two orientations don\'t conflict at all for me. The broader term is a non-SAM aro or non-SAM ace, the SAM being split attraction model  As a nonbinary person as well, the question about whether your relationship is hetero-presenting or homo-presenting was hard to navigate, I wasn\'t sure how I should answer. I wonder if this question could be better served by ""I\'m a woman in a relationship with a man"" ""I\'m a woman in a relationship with a woman"" and so on, depending on the information you\'re trying to get? For nbs and for many binary trans ppl, how our gender is understood by others can vary widely (and I\'ve also heard from some people that they feel these labels require them to misgender themselves). And while I\'m sure my relationships are understood either as straight or as gay depending on the circumstances, a lot of the time we\'re also seen as cousins, siblings, or friends because of the aromanticity    Anyway, thank you and good luck with your survey!"
eRisk2023-T3_Subject17, b' ' , b'2021-10-19 10:37:53' , reddit post ,Only for people from the UK.
eRisk2023-T3_Subject17, b' ' , b'2021-10-16 15:04:41' , reddit post ,"I\'ve seen gender options like ""man, including trans man"" or ""woman (cis or trans)"" to that point. It does complicate data if some trans people pick the transgender option and others pick a binary gender choice."
eRisk2023-T3_Subject17, b' ' , b'2021-10-14 17:02:40' , reddit post ,"Sorry, it was too repetitive, I couldn't get through it"
eRisk2023-T3_Subject17, b' ' , b'2021-10-13 11:29:21' , reddit post ,"It's not required though, people outside the US can skip it."
eRisk2023-T3_Subject17, b' ' , b'2021-10-12 22:48:24' , reddit post ,There's a mandatory question about what college you attend -- is it just for college students?
eRisk2023-T3_Subject17, b' ' , b'2021-10-12 22:32:45' , reddit post ,It says anyone is welcome to take it because they're just testing.
eRisk2023-T3_Subject17, b' ' , b'2021-10-08 13:39:30' , reddit post ,The link to enter the raffle didn't work.
eRisk2023-T3_Subject17, b' ' , b'2021-10-01 05:29:10' , reddit post ,"Just to let you know -- some of the descriptions are way more difficult to read than others, due to the redactions next to quotes, parentheticals, and so on. One of the descriptions did leave in a gendered pronoun, I read ""his heritage."""
eRisk2023-T3_Subject17, b' ' , b'2021-09-29 03:26:47' , reddit post ,The single responses for sake and soju. I see you!
eRisk2023-T3_Subject17, b' ' , b'2021-09-29 02:12:01' , reddit post ,"Interesting topic, I hadn't heard this word before. I wonder if people have different opinions based on whether their disability is highly visible or not  "
eRisk2023-T3_Subject17, b' ' , b'2021-09-28 07:44:12' , reddit post ,"While it\'s important for people to be able to seek education, especially in a community they consider their own, I feel that the way you phrased your questions could be incredibly hurtful, and many people have the experience of being asked those exact questions purposely in an attempt to invalidate them.   For example when you said, ""Doesn\'t ANY use of binary \'he/him\' or \'she/her\' pronouns completely defeat the very definition of being nonbinary?"" It could be understood as a rhetorical question, simply intending to tell us the last part of the sentence. Another of your questions, ""does it make sense to still identify as nonbinary?"" could be understood as telling this group that they shouldn\'t identify as nonbinary, thus the gatekeeping. Some alternative ways to ask these might be like, ""Could you explain how he/him or she/her don\'t contradict with being nonbinary?"" ""How do he/him or she/her fit into your identity?"" etc.  I\'ve seen other people ask about this situation but plenty of them manage to ask without bringing the validity of anyone\'s identity into question, or using phrasing that\'s reminiscent of transphobia.  It\'s very difficult to see you quote a dictionary to defend your words -- I have had people quote dictionaries to me about sex and gender to tell me that being nonbinary isn\'t real. I wish we could build a community where people\'s personal experiences were believed without having to get some higher authority to verify them.  (For more info on how ""asking questions"" isn\'t always in good faith and completely innocent, you could look up sealioning)"
eRisk2023-T3_Subject17, b' ' , b'2021-09-28 03:49:26' , reddit post ,"""This survey is designed for people who are attracted to members of the opposite gender (e.g., people who are heterosexual or bisexual)."""
eRisk2023-T3_Subject17, b' ' , b'2021-09-28 03:48:38' , reddit post ,"Is it part of the experiment to sometimes not be able to read the ""words""? I\'m sure the combination of grey and lilac was chosen on purpose, but even with full brightness I couldn\'t tell with the low contrast, and I started to experience an afterimage, blurring the letters"
eRisk2023-T3_Subject17, b' ' , b'2021-09-28 03:29:14' , reddit post ,"It looks like all countries are welcome, is there something you saw that showed otherwise?"
eRisk2023-T3_Subject17, b' ' , b'2021-09-27 00:46:48' , reddit post ,"To be clear it looks like it's only for women, and just cis women judging by the other posts."
eRisk2023-T3_Subject17, b' ' , b'2021-09-26 23:31:51' , reddit post ,"""women who have experienced rape and sexual coercion as adults""  So is it all welcome or is it only for this group?"
eRisk2023-T3_Subject17, b' ' , b'2021-09-25 12:23:57' , reddit post ,"Yeah, there were tons of different approaches to nb inclusion! There wasn't exactly a bisexual decision board we could consult. Personally, I love all the different labels in the community, variety is the spice of life lol  As well as pansexual I do consider myself gay, in that I'm always attracted to the aspects of a person's gender that are like mine. I have seen 1-2 nbs use gay/homosexual to mean exclusively nb-attracted, but I think there are some other terms that got more popular?"
eRisk2023-T3_Subject17, b' ' , b'2021-09-25 12:12:33' , reddit post ,"Because there\'s a large community that already organized under the term bisexual for several decades, and many people have presented themselves using that label for just as long, developed a self-image with it, gotten (rightfully) attached to it, faced discrimination under it. All words evolve in meaning over time, it\'s normal for bisexual to evolve to mean something other than ""both"" genders, and I think it\'s good for bisexual people to get to keep the label and the community they built."
eRisk2023-T3_Subject17, b' ' , b'2021-09-25 03:51:08' , reddit post ,Hello fellow enby! Welcome home :)
eRisk2023-T3_Subject17, b' ' , b'2021-09-25 03:38:21' , reddit post ,"No, I clicked out because it looked like you were asking which gender was behaviorally dominant, which would have been creepy.  I'm sorry people have criticized you, but I'm one person, not every single person you feel has criticized you, and casually stating that a question was changed is not a criticism."
eRisk2023-T3_Subject17, b' ' , b'2021-09-25 01:00:26' , reddit post ,Sorry that that upset you.
eRisk2023-T3_Subject17, b' ' , b'2021-09-24 23:29:12' , reddit post ,"I think it said ""dominant"" before. I clicked out because of that."
eRisk2023-T3_Subject17, b' ' , b'2021-09-24 18:48:11' , reddit post ,I vaguely remember the question about gender being worded differently than it is now  
eRisk2023-T3_Subject17, b' ' , b'2021-09-24 18:45:49' , reddit post ,"It\'s really weird for OP to have #19 on a ""general trivia"" quiz in the first place, considering it\'s something that lgbt people themselves disagree on  I\'m inclined to agree with you, I see gender and sexuality as a self-image, an identity you develop, rather than an objective fact encoded in your genes."
eRisk2023-T3_Subject17, b' ' , b'2021-09-24 18:24:20' , reddit post ,"Hey friend, I think this sub won't really have an answer for you, maybe you could try on a sub for writing resources, or like r/askspain or an ethiopian or senegalese sub  Good luck with naming your character!"
eRisk2023-T3_Subject17, b' ' , b'2021-09-24 14:55:46' , reddit post ,"Isn't it more convenient and efficient to use a neopronoun to express someone's gender at a subconscious level, rather than explain it in words or some other social process? If someone uses xe/xer (for example) there's a vibe you get off of that that you won't get from using a default they/them. You might as well go around asking why we have the words desktop or laptop when we could just call both of them computers."
eRisk2023-T3_Subject17, b' ' , b'2021-09-23 19:50:19' , reddit post ,"What! That's the animatic that hooked me on the song, getting me to watch the movie. Crazy remembering that things exist to other people"
eRisk2023-T3_Subject17, b' ' , b'2021-09-23 19:45:41' , reddit post ,"I also want to get some socks and that was a good pep talk. Thanks, hope you have a nice day :)"
eRisk2023-T3_Subject17, b' ' , b'2021-09-23 18:39:35' , reddit post ,"Wow, I was told to stay away from almonds because they\'re sugary compared to other nuts. It was basically ""anything that tastes good is bad for you."""
eRisk2023-T3_Subject17, b' ' , b'2021-09-23 07:08:57' , reddit post ,"I also thought you were looking for the term spouse, lol. I was going to suggest ""marriage candidate""  You could always go for a fun euphemism, instead of bridesmaids / groomsmen something like wedding helpers?"
eRisk2023-T3_Subject17, b' ' , b'2021-09-23 07:02:52' , reddit post ,"I think it\'s important to remember that no gender, especially ones used by a really small group, has any kind of objective definition. It\'s really difficult to explain something as nebulous and socially contructed and subconsciously experienced as gender in a way that other people understand and can identify with, and it\'s totally normal to make a decision about a term based on your own interpretation of it. There are plenty of microlabels that are defined solely by a single page or paragraph by the person who created it.  The only one of these terms I have seen before is lunarian, and my understanding of it is that it\'s more of an alignment than a gender. As someone who doesn\'t personally use alignment terminology my best description of it would be like a way to say you\'re ""one of them,"" like if the gym teacher separated students by gender, you\'d go to the side with the girls, even though you may not be a girl yourself.  Good luck on your gender journey my friend, I hope you can find a way to describe yourself that makes you happy :)"
eRisk2023-T3_Subject17, b' ' , b'2021-09-23 06:16:48' , reddit post ,"I see that racial minorities are explicitly mentioned, are gender and sexuality or religious minorities part of your interest for this project as well?  I also see that the survey might be US exclusive, plenty of references to the US in required questions."
