ID,WRITING.TITLE,WRITING.DATE,WRITING.INFO,WRITING.TEXT.Element:Text
eRisk2023-T3_Subject17, b' ' , b'2019-07-31 20:14:48' , reddit post ,"The mother did guide her. It seems to me all OP cares about is ensuring his daughter has the hair he wants, rather than ensuring the safety of her own choices. He already knew she had been dying it and had time to truly investigate how it was done, and rainbow dye isn't much different than a single colour. Plenty of other commenters have pointed out how uninformed he is about the hair dying process and he himself said the ex already told him the process is safe.  Parents have a say inherently but they shouldn't assert authority for its own sake. Children are still people and we should have real, informed reasons for the limits we set on their behaviour."
eRisk2023-T3_Subject17, b' ' , b'2019-07-31 19:53:09' , reddit post ,"If the daughter wants her hair to be buzzed, everything is fine. No one, not the parents or us commenters or anyone, has any say on how she does her hair. You're missing the point here that the kid's hair isn't and shouldn't be within the father's control."
eRisk2023-T3_Subject17, b' ' , b'2019-07-31 17:56:48' , reddit post ,"You really need an option for doing less time to maintain the language. 1 to 2 hours a day is serious work, I only brush up on French maybe once in two weeks."
eRisk2023-T3_Subject17, b' ' , b'2019-07-30 22:13:40' , reddit post ,"This is really good, we always talk about self-reflection but it's incredibly hard for people who haven't been taught to even begin.  Here's some of mine:  When do you feel like you're being yourself authentically? How (if at all) does that relate to gender?  What would you say to a friend who was experiencing the same thing as you?"
eRisk2023-T3_Subject17, b' ' , b'2019-07-30 21:52:26' , reddit post ,"I don\'t think that acknowledging the current system, however uncomfortable that is, is a ""pissing contest."" I\'m concerned about people\'s instinct to explicitly define the white male experience as normal and compare everything to that, and what happens when we ignore the realities of the system because those at the top don\'t like to talk about it.  There\'s nothing less valid or worthful about a life led on ""easy mode,"" it\'s simply a critique of the system that involves race and gender when choosing which people get to play."
eRisk2023-T3_Subject17, b' ' , b'2019-07-30 21:38:26' , reddit post ,I already helped you. You're supposed to tag reposts as [repost] so people don't click through and do it multiple times.
eRisk2023-T3_Subject17, b' ' , b'2019-07-30 21:36:57' , reddit post ,"Would have liked to say why I do or don't support each one. The Haagen-Dazs campaign can't possibly be sending out appropriate local plants for each region, who know what seeds are in there and if they're invasive, and I already plant flowers at home so it's safer to continue doing what I do. The Coke campaign directly ties support of the cause with buying their product within the ad, they have an extra profit motive that shows they don't truly support the cause but are interested in the money it can bring to them. As a billion dollar company I know they can afford a bigger outreach, and supporting Coke does worse things to the economy than the good I'm supposedly putting in by helping polar bears."
eRisk2023-T3_Subject17, b' ' , b'2019-07-30 21:13:11' , reddit post ,Repost
eRisk2023-T3_Subject17, b' ' , b'2019-07-30 21:09:57' , reddit post ,This is not results. This is recruitment for a survey.
eRisk2023-T3_Subject17, b' ' , b'2019-07-30 08:30:38' , reddit post ,"I can rest easy knowing my problems are valid, but still have the context to see how unfair it is for others.  I think the whole issue is the idea that someone who\'s playing ""easy mode"" can\'t also have this perspective. You can still fail on easy mode. The metaphor aptly describes the shame and indignation involved when people do, and that there is positive discrimination involved towards men and white people, not just negative discrimination against minorities."
eRisk2023-T3_Subject17, b' ' , b'2019-07-30 08:09:47' , reddit post ,"100% agree with every point. I never tell anyone my agab and I think we should move away from focusing on it. It creates this secondary binary where afab nbs are all assumed to be more masc than cis women, amab nbs are all assumed to be more feminine than cis men when the whole point of nb as a category is recognizing the issues with a binary system."
eRisk2023-T3_Subject17, b' ' , b'2019-07-30 07:08:01' , reddit post ,"Need a nonbinary gender option. The survey isn\'t for ""everyone"""
eRisk2023-T3_Subject17, b' ' , b'2019-07-30 07:07:01' , reddit post ,It says I need permission to view
eRisk2023-T3_Subject17, b' ' , b'2019-07-29 19:51:34' , reddit post ,Sent me to an error page
eRisk2023-T3_Subject17, b' ' , b'2019-07-29 02:28:12' , reddit post ,"Hi, I'm poly, let's be friends so I can tell you this is absolute crap gatekeeping bullshit. You can't experiment in a relationship just by having sex with someone, why let your partner have other relationships if you're not going to allow any actual relationships?"
eRisk2023-T3_Subject17, b' ' , b'2019-07-29 02:14:09' , reddit post ,"I saw this one shared on another sub, the comment they highlighted was ""having a vagina."" Big agree."
eRisk2023-T3_Subject17, b' ' , b'2019-07-29 02:02:54' , reddit post ,So... what's up with only allowing one choice for what excites a person?
eRisk2023-T3_Subject17, b' ' , b'2019-07-27 18:01:05' , reddit post ,The link sent me to an MBTI test?
eRisk2023-T3_Subject17, b' ' , b'2019-07-27 17:54:28' , reddit post ,"I use ze/zir/zirs with my partners, my close friends, and in accepting lgbtq circles. I use they/them with anyone else (and it's also ok when anyone from the first group uses they, it's just not optimal). It's ok to have 2 different sets of pronouns too if that helps you, you can use the ae set with some people and she with others."
eRisk2023-T3_Subject17, b' ' , b'2019-07-27 13:59:15' , reddit post ,">""Our supply of natural resources is limited because the non-whites kept the best land for themselves!""  That\'s what I\'m most worried about. White supremacists don\'t want to land or resources for themselves, they want to make sure no other race can have those things. And they definitely won\'t respect rules or laws peaceably made by a racially diverse authority.  Doing this would only further organize and empower them."
eRisk2023-T3_Subject17, b' ' , b'2019-07-27 13:53:21' , reddit post ,"Although it didn't crash totally after the second game for me, it did lag and returned an error page. When I refreshed it worked though."
eRisk2023-T3_Subject17, b' ' , b'2019-07-27 11:31:56' , reddit post ,"I can't imagine how this data will be in any way useful to you, but I gave it a shot"
eRisk2023-T3_Subject17, b' ' , b'2019-07-27 11:21:55' , reddit post ,"You don\'t have an option for ""I\'m not out to my parents."""
eRisk2023-T3_Subject17, b' ' , b'2019-07-27 11:18:10' , reddit post ,I think it's a ridiculous thing to argue about.
eRisk2023-T3_Subject17, b' ' , b'2019-07-26 05:49:03' , reddit post ,"Sorry, so are you defining first generation student as a student whose parents have had no college education whatsoever? My mother did some classes but had no degree and some people will count me as a first gen student."
eRisk2023-T3_Subject17, b' ' , b'2019-07-25 17:22:34' , reddit post ,"It actually looks interesting, I\'m really excited about breaking the binary of sex toys too.  I do think there\'s some merit to the criticism of it trying to be useful to everyone and ending up useful to no one. But I don\'t think that it is for everyone. Cis people don\'t need toys that are designed this way, and there\'s so many that are designed specifically for cis people already. I think this is for nonbinary or other nonconforming people and they just need to market it as ""for everyone."""
eRisk2023-T3_Subject17, b' ' , b'2019-07-24 17:51:02' , reddit post ,"Reality isn\'t simple. As a linguistic grad, words are meant to serve us and I\'m here delineating all the reasons why the meanings you propose only serve cis people.  Plenty of animals have completely different sex determination systems, many which break the male/female binary. What about birds and reptiles? What about fish? What about the millions of trans and intersex people in the US alone?  Personally I find ""it\'s too hard, let\'s not try"" to be an indefensible position."
eRisk2023-T3_Subject17, b' ' , b'2019-07-24 09:51:02' , reddit post ,"I like it, I'd totally play a sequel or similar style level if you make more"
eRisk2023-T3_Subject17, b' ' , b'2019-07-24 09:44:00' , reddit post ,"I love that first comment that just says ""im a boy get rekt"""
eRisk2023-T3_Subject17, b' ' , b'2019-07-24 09:40:13' , reddit post ,"Reupload to fix some issues and because I just didn't notice my clear condition was missing completely:  Beetle Infestation! XYK KK1 1SG  Oh no, there's a buzzy beetle infestation in the mushroom kingdom! Team up with Yoshi to clear as many of them as you can, and defeat the queen beetle so the colony dies out. Normal difficulty. You can respond with your courses if you'd like :o"
eRisk2023-T3_Subject17, b' ' , b'2019-07-24 09:24:15' , reddit post ,">Is it your preference that the words ""gender"" and ""sex"" be used interchangeably to refer to the same construct?   No, that\'s definitely not what I want. If there\'s a part that can be cleared up please say so, it\'s very difficult to say what I want to say when more precise words don\'t exist.  Male and female are used today to mean sex and gender together. Sometimes the sex meaning is more relevant, sometimes the gender meaning is more relevant, but outside of trans discourse, society doesn\'t recognize these as separate meanings because they don\'t realize there can be a separation in the first place.  More personally, I do see my sex as nonbinary because I don\'t identify with the sex and gender package expressed by either of those words. I\'m happy to identify the relevant parts of my sex when needed, but it\'s not as relevant as people think.  >those who have transitioned... adopt the congruent gender and sex labels because they\'re aligned  The issue I have is the idea that there objectively *is* a congruence. That\'s socially imposed, not inherent. As more people become familiar with the concept of sex and gender being separate, we have more and more trans people who are no transition / never transition, and they are equally valid with the ones who do need a transition. My genitals and sex characteristics have literally nothing to do with my gender at all, they are completely and totally separate. I shouldn\'t have to undergo surgery or change my body to be recognized as my true gender, that\'s like telling me I have to cut off my hand to be recognized as an adult and not a child.  >they feel that their identities are congruent after transitioning and thus they are no longer ""trans"".  I see the community moving away from this understanding of transness. Nowadays I see trans being defined as having your true identity differ from the sex and gender you were assigned at birth, which is something that stays with you through transition. I really feel that the concept of transness you described is based on suffering being intertwined with transness, which is too long of an issue for me to get into here but it\'s harmful to say the least.  >...the most helpful and respectful way to handle the data without allowing it to become unwieldy...  Most people don\'t know for sure that all the aspects of their sex align with male or female, they can only assume based on their birth assignment and experiences. We can avoid reifying the sex/gender binary by asking the exact thing we mean, in this case birth assignment, which is based on genitals at birth, by which we assume all the other sex characteristics of a person. Then whether they are intersex, have undergone physical transition, or whatever else is relevant like ovary removal and so on.  But for most things, imho, sex just isn\'t as relevant as people think it is (compared to gender), and researchers who want to investigate physical sex without acknowledging the different aspects of sex and the many assumptions and correlations with sex are running the risk of having shoddy data, all in the name of convenience."
eRisk2023-T3_Subject17, b' ' , b'2019-07-24 07:31:22' , reddit post ,Feeling this big time. LET ME SAY NONBINARY !!
eRisk2023-T3_Subject17, b' ' , b'2019-07-24 07:18:24' , reddit post ,"I\'m nonbinary and I don\'t agree with using male/female only to mean sex. These are gendered words, used as genders in society. They are the words that are used to assign gender at birth. They\'ve been inextricably intertwined with gender since probably the terms even existed, the idea of gender even being separate from sex only got popular in the 50\'s.   It only causes me dysphoria and pain to hear from apparent allies that male/female is just a sex [read: ""you *really are* male/female!""], ignoring the decades of experience I and other trans people have had, and every cis person also, having these words mean sex and gender together at the same time. One of the big things trans people face is this idea their sex is somehow incongruent with their body, that for example their gender may be female (said ""woman"") but their body is ""male,"" and that\'s total bullshit, because there\'s nothing at all discrepant about a woman with a penis/testosterone-based body/XY chromosomes etc. Not to mention that many people, cis and trans alike, identify with male or female as their gender. We\'re not going to get anywhere redefining those words to take that gender experience from them. People can *feel* maleness, femaleness just as deeply in their gender as they feel like a man or woman.  Upholding the binary understanding of sex also doesn\'t serve intersex people or trans people who physically transition, it treats us/them as outliers and literally others us, because the sex choices acceptable in society are often male, female, and *other*. It doesn\'t help cis people to rework their understanding of sex (and thus gender), because the concept of gender identity separate from sex isn\'t fully entrenched in society yet.   I see the usefulness of the shorthand for describing sex traits that generally go together, but we don\'t have a gender neutral term yet. What we have now is saying what we mean when we mean it. If you want to talk about what genitals someone has, say that. If you want to say what their chromosomes are, say that. If you want to say if they menstruate, produce sperm, what their dominant hormone is, say that. Because otherwise we\'re just perpetuating a binary view of sex and gender out of laziness"
eRisk2023-T3_Subject17, b' ' , b'2019-07-23 10:53:42' , reddit post ,"I normally try a lot of the levels here just a couple times each, I gave up trying to get to the claw between the spikes. I'm not very persistent haha sorry"
eRisk2023-T3_Subject17, b' ' , b'2019-07-23 10:32:01' , reddit post ,"Thanks friend. I remember I tested that bit with Mario but not Yoshi, my bad lol"
eRisk2023-T3_Subject17, b' ' , b'2019-07-23 10:29:17' , reddit post ,"No, the person just before me got the only clear :o"
eRisk2023-T3_Subject17, b' ' , b'2019-07-23 09:53:57' , reddit post ,"Mind blown, never even imagined parts could be used like that. Thanks for sharing!"
eRisk2023-T3_Subject17, b' ' , b'2019-07-23 09:44:16' , reddit post ,That less than 2% clear rate haunts me... I gave it a shot though!
eRisk2023-T3_Subject17, b' ' , b'2019-07-23 09:39:04' , reddit post ,"Oh no, there's a buzzy beetle infestation in the mushroom kingdom! Team up with Yoshi to clear as many of them as you can, and defeat the queen beetle so the colony dies out:  4YR 1M4 21H  Just uploaded so there's a chance on first clear! Probably normal difficulty, but I'm not good at telling which recently :o"
eRisk2023-T3_Subject17, b' ' , b'2019-07-23 06:50:44' , reddit post ,It's so baffling that you commented this in a thread about time out not being a punishment...
eRisk2023-T3_Subject17, b' ' , b'2019-07-23 00:25:54' , reddit post ,"You can play around with the wording / sentence structure too like ""I know (family friend) through my mother"" ""I was referred to you by (family friend), who knows my mother"" and so on"
eRisk2023-T3_Subject17, b' ' , b'2019-07-22 20:12:41' , reddit post ,For science
eRisk2023-T3_Subject17, b' ' , b'2019-07-22 12:52:44' , reddit post ,"I love the concept, to be totally honest I wish I'd thought of it :v Gave you a like!"
eRisk2023-T3_Subject17, b' ' , b'2019-07-22 12:36:51' , reddit post ,"Hello friends, I'd like to welcome you to Lazy Lift Canyon!  8CF 3LK NXG  It's my first course designed with speedrun in mind, and I'd love feedback on whether whether it's easy or normal difficulty and if the time is set right :)"
eRisk2023-T3_Subject17, b' ' , b'2019-07-22 07:14:43' , reddit post ,"I see, then my rebuttal is ""aesthetic genders aren\'t bad, you guys are just doing respectability politics"""
eRisk2023-T3_Subject17, b' ' , b'2019-07-21 22:32:58' , reddit post ,"If the economy can be broken by natural progression of technology, the problem is the economy, not the technology"
eRisk2023-T3_Subject17, b' ' , b'2019-07-21 19:23:18' , reddit post ,"Hey, just to let you know, cis doesn't need to be capitalized. It's a shortening of cisgender, the capitalized version is computer information systems :)"
eRisk2023-T3_Subject17, b' ' , b'2019-07-21 05:47:54' , reddit post ,This is not results   This is a survey
eRisk2023-T3_Subject17, b' ' , b'2019-07-21 01:27:40' , reddit post ,"Gave you a like, it was really cohesive as a level and the design was varied and interesting without being cluttered :) took me 3 minute tho I'm not a speedrunner at all xp"
eRisk2023-T3_Subject17, b' ' , b'2019-07-21 01:11:50' , reddit post ,"Hello friends, please play my level Free the Turtles !!!  BK3 HMM XXF  We're not PETA, we just care about koopa rights. This was my first level, I just wanted to try out some of the parts :) I tried posting this yesterday but accidentally posted part 2, lol"
eRisk2023-T3_Subject17, b' ' , b'2019-07-20 21:29:17' , reddit post ,"I really, heavily doubt the credentials of any professional using that term, there's basically no consensus on what it means and it's never been a diagnosis in either the ICD or DSM. It's basically a boogeyman, I only ever see it used to dehumanize neurodivergent people"
eRisk2023-T3_Subject17, b' ' , b'2019-07-20 21:10:32' , reddit post ,It says link not found
eRisk2023-T3_Subject17, b' ' , b'2019-07-20 10:20:33' , reddit post ,"Took me a second too friend, there's a very small slope where you can slide into him and kill him. If you find out how to pass the gap with the coin after the piranha plants, get back to me lol"
eRisk2023-T3_Subject17, b' ' , b'2019-07-20 10:07:15' , reddit post ,"I'm not super good at solving puzzles, but I don't even really know what to do on the first one :( I've seen some people put hints in the form of comments as a compromise, maybe you can do that?"
eRisk2023-T3_Subject17, b' ' , b'2019-07-20 09:46:10' , reddit post ,"FBR FLR NNF -- Dig Maze  Maze using coin clear condition and using a lot of wall jumps, any feedback is appreciated :)"
eRisk2023-T3_Subject17, b' ' , b'2019-07-20 09:33:25' , reddit post ,"This is super elitist bruh. Reminds me of my music teacher who would call all the popular music ""crap."" Like Taylor Swift is worth a quarter of a billion and you\'re teaching 14 yos so who\'s really in a position to judge"
eRisk2023-T3_Subject17, b' ' , b'2019-07-20 09:20:18' , reddit post ,"I was just looking at this level because my partner had the time record for it (knock on wood) so I thought I'd give it a try myself. Like the other players I struggled a bit, but I think normal difficulty is accurate because it's not as punishing as other levels, most of the areas that are challenging can be retried over and over. I enjoyed it more as a series of executions than a traditional puzzle solver, if that makes sense.   I'm actually totally stuck now because I can't figure out where to go with the fire flower? Maybe I'm dumb though lol. I would have appreciated a little more direction, I was always just going wherever trying to find the next thing and it sucks to have to give up  The part with the dry bones is skippable also. I guess you're supposed to drop them down and jump on them, but you can use the red blocks as a platform for jumping over instead :o"
eRisk2023-T3_Subject17, b' ' , b'2019-07-20 07:09:06' , reddit post ,Hello! Play this level I made called Fish Pipe Pond! Theres a secret boss fight some where in here!! See if you can find it.  9NR 8KC M4G
eRisk2023-T3_Subject17, b' ' , b'2019-07-20 07:05:32' , reddit post ,"I always prefer simple themed levels like this, I almost cried when the samurai popped up because I thought I'd died  It's my favourite out of everything I've played tonight"
eRisk2023-T3_Subject17, b' ' , b'2019-07-20 06:51:28' , reddit post ,I don't think they were talking about the employees though?
eRisk2023-T3_Subject17, b' ' , b'2019-07-20 06:20:22' , reddit post ,"I like it but I sure couldn't beat it, lol"
eRisk2023-T3_Subject17, b' ' , b'2019-07-20 06:15:25' , reddit post ,"Really fun, I got stuck at the check point for soo long tho"
eRisk2023-T3_Subject17, b' ' , b'2019-07-20 06:01:08' , reddit post ,"This is a sweet level, I love the design!"
eRisk2023-T3_Subject17, b' ' , b'2019-07-20 05:53:49' , reddit post ,"I honestly can't figure out how to do this, hint?"
eRisk2023-T3_Subject17, b' ' , b'2019-07-20 05:42:22' , reddit post ,"Free the Turtles !!!  0NT SMX Y6G  We're not PETA, we just care about koopa rights, lmao. Edit: apparently I posted pt 2 but that's still good!"
eRisk2023-T3_Subject17, b' ' , b'2019-07-20 05:25:17' , reddit post ,"I'm confused. Mogai is an alternate term for lgbt, are you saying demigenders aren't valid or they are?"
eRisk2023-T3_Subject17, b' ' , b'2019-07-20 05:21:42' , reddit post ,"I took the survey but I don't remember, was the other gender a write in choice or was it literally other/prefer not to answer together? You can't exactly conclude anything from prefer not to answer."
eRisk2023-T3_Subject17, b' ' , b'2019-07-19 17:45:10' , reddit post ,"No offense but if you have a 15yo who's that dependent it's almost certainly a product of environment. A teenager doesn't need you to be living his life for him, he needs you to be teaching him how to do it himself."
eRisk2023-T3_Subject17, b' ' , b'2019-07-19 17:35:30' , reddit post ,Intersex isn't a gender.....
eRisk2023-T3_Subject17, b' ' , b'2019-07-19 17:30:09' , reddit post ,"That's [intimate partner violence](https://en.m.wikipedia.org/wiki/Intimate_partner_violence), not domestic violence. Domestic violence is commonly understood to be broader abuse that happens in a home setting, and it's also defined as such in many legal codes."
eRisk2023-T3_Subject17, b' ' , b'2019-07-19 05:42:16' , reddit post ,"Are you defining domestic violence as only between people in a relationship? Survey only asks me about what I witnessed in childhood, not what I experienced personally."
eRisk2023-T3_Subject17, b' ' , b'2019-07-19 05:09:06' , reddit post ,Hardly any of these questions can be answered fairly. If you're forcing people to indicate a bias just to participate you're not collecting reliable and valid data
eRisk2023-T3_Subject17, b' ' , b'2019-07-18 21:14:55' , reddit post ,"[This comment][URL] discusses something I've been thinking about for a while, I've always been surprised at the discussions about sex I even see here, in a progressive men's space. It's *always* about PIV. What happens in women's spaces is a person doesn't enjoy PIV, so we change the discussion to center different types of sex and different ways to be sexual.  But what I see even here is that if someone with a penis can't orgasm from PIV, the discussion never shifts in that way. We pin the problems on porn, we talk about abstaining from other sex to better perform PIV, we lessen the focus on orgasm but never suggest that PIV shouldn't be the main course. I think we should talk more about PIV not being the ideal it's upheld as, it's literally just how we developed to make babies. Once we get past that focus we can start having fuller and more inclusice sexual lives."
eRisk2023-T3_Subject17, b' ' , b'2019-07-17 04:05:29' , reddit post ,Was there meant to be a link?
eRisk2023-T3_Subject17, b' ' , b'2019-07-16 22:23:09' , reddit post ,"Aromantic isn't a sexual orientation guys, it's a romantic orientation :v"
eRisk2023-T3_Subject17, b' ' , b'2019-07-16 07:52:35' , reddit post ,"Parts of the survey still say ""handsome"" and ""attracted to men"""
eRisk2023-T3_Subject17, b' ' , b'2019-07-15 19:16:43' , reddit post ,"Congrats, you're unable to look beyond your legal experience into the ways that people successfully and meaningfully employ this concept outside of law.   This isn't a legal context, and you're using and imposing jargon when everyone else is using general speech."
eRisk2023-T3_Subject17, b' ' , b'2019-07-15 19:10:11' , reddit post ,">You can argue that water is such a basic necessity that every human should be able to obtain it when needed, and that there should be a certain entitlement towards it.  That\'s exactly what right means in this context. I think you\'re being purposely obtuse, inflexible, and pedantic as to how words are used and what ""right"" can refer to. Have a good day"
